number,value,state,params_add_group_dummies,params_family,params_feature_subset,params_isotonic,params_lgbm_alpha,params_lgbm_colsample,params_lgbm_lambda,params_lgbm_lr,params_lgbm_max_depth,params_lgbm_min_child,params_lgbm_n_estimators,params_lgbm_num_leaves,params_lgbm_subsample,params_lr_C,params_lr_class_weight_balanced,params_lr_penalty,params_scaler,params_xgb_alpha,params_xgb_colsample,params_xgb_gamma,params_xgb_lambda,params_xgb_lr,params_xgb_max_depth,params_xgb_min_child,params_xgb_n_estimators,params_xgb_subsample,user_attrs_elapsed_sec,user_attrs_n_features,user_attrs_pooled_auroc,user_attrs_pruned_reason,user_attrs_weighted_auroc
1868,0.7776747333887881,COMPLETE,True,lr,oof+hand,False,,,,,,,,,,0.04210019264792556,False,l1,robust,,,,,,,,,,0.1217036247253418,34,0.8053302818790846,,0.7776747333887881
1869,0.7753869524894356,COMPLETE,True,lr,oof+hand,False,,,,,,,,,,0.052766924627505055,False,l2,robust,,,,,,,,,,0.20632529258728027,34,0.8038964577971666,,0.7753869524894356
1870,0.7771420503336381,COMPLETE,True,lr,oof+hand,False,,,,,,,,,,0.026666400747375047,False,l1,robust,,,,,,,,,,0.10148429870605469,34,0.8044320596906319,,0.7771420503336381
1871,0.7776063666019399,COMPLETE,True,lr,oof+hand,False,,,,,,,,,,0.036503426177919795,False,l1,robust,,,,,,,,,,0.11321091651916504,34,0.8051586664779213,,0.7776063666019399
1872,0.777083467052402,COMPLETE,True,lr,oof+hand,False,,,,,,,,,,0.10894812600575048,False,l1,robust,,,,,,,,,,0.2548215389251709,34,0.8052389042971425,,0.777083467052402
1873,0.7775368556610249,COMPLETE,True,lr,oof+hand,False,,,,,,,,,,0.07039551465354615,False,l1,robust,,,,,,,,,,0.188201904296875,34,0.8054432033417607,,0.7775368556610249
1874,0.7777064148691915,COMPLETE,True,lr,oof+hand,False,,,,,,,,,,0.04792111854378236,False,l1,robust,,,,,,,,,,0.1319739818572998,34,0.8054104146062047,,0.7777064148691915
1875,0.7776519106075204,COMPLETE,True,lr,oof+hand,False,,,,,,,,,,0.05777155768921383,False,l1,robust,,,,,,,,,,0.1530442237854004,34,0.8054609113608029,,0.7776519106075204
1876,0.7738679673784784,COMPLETE,True,lr,oof+hand,False,,,,,,,,,,83.3903760205775,False,l1,robust,,,,,,,,,,0.7735626697540283,34,0.8030233526208866,,0.7738679673784784
1877,0.7773999785090461,COMPLETE,True,lr,oof+hand,False,,,,,,,,,,0.03213539638980866,False,l1,robust,,,,,,,,,,0.10589838027954102,34,0.804946538071768,,0.7773999785090461
1878,0.7742126020512263,COMPLETE,True,lr,oof+hand,True,,,,,,,,,,0.05203909687094054,False,l1,robust,,,,,,,,,,0.2915308475494385,34,0.8026082388213795,,0.7742126020512263
1879,0.7776879127342297,COMPLETE,True,lr,oof+hand,False,,,,,,,,,,0.041627841450004185,False,l1,robust,,,,,,,,,,0.11756229400634766,34,0.8053234508925105,,0.7776879127342297
1880,0.7772415423732446,COMPLETE,True,lr,oof+hand,False,,,,,,,,,,0.08539815889395226,False,l1,robust,,,,,,,,,,0.21129298210144043,34,0.8053672742986862,,0.7772415423732446
1881,0.7776153204221524,COMPLETE,True,lr,oof+hand,False,,,,,,,,,,0.06402671637536947,False,l1,robust,,,,,,,,,,0.16123318672180176,34,0.8054753615247098,,0.7776153204221524
1882,0.7115570061699601,COMPLETE,True,lr,oof+hand,False,,,,,,,,,,0.002003263663129117,False,l1,robust,,,,,,,,,,0.07660698890686035,34,0.7250512140081885,,0.7115570061699601
1883,0.7775995429931286,COMPLETE,True,lr,oof+hand,False,,,,,,,,,,0.03603503613715765,False,l1,robust,,,,,,,,,,0.11067700386047363,34,0.8051441112219132,,0.7775995429931286
1884,0.7767893774878105,COMPLETE,True,lr,oof+hand,False,,,,,,,,,,0.022368768255921684,False,l1,robust,,,,,,,,,,0.10039496421813965,34,0.8036367752152469,,0.7767893774878105
1885,0.7729942313802747,COMPLETE,True,lgbm,oof+hand,False,3.4727026170968034,0.6927815886651236,0.9120290439689198,0.0016374936147878596,11.0,38.0,381.0,160.0,0.9606297214857226,,,,robust,,,,,,,,,,1.8949575424194336,34,0.8018277723322553,,0.7729942313802747
1886,0.7777056276996465,COMPLETE,True,lr,oof+hand,False,,,,,,,,,,0.04795312404590087,False,l1,robust,,,,,,,,,,0.13739752769470215,34,0.8054093636851933,,0.7777056276996465
1887,0.77743298179824,COMPLETE,True,lr,oof+hand,False,,,,,,,,,,0.07423271055120739,False,l1,robust,,,,,,,,,,0.20289087295532227,34,0.8054272293423872,,0.77743298179824
1888,0.7776840749945984,COMPLETE,True,lr,oof+hand,False,,,,,,,,,,0.05548342251468081,False,l1,robust,,,,,,,,,,0.1605837345123291,34,0.8054519259861553,,0.7776840749945984
1889,0.7756339226252994,COMPLETE,True,lr,oof+hand,False,,,,,,,,,,0.03083081186659264,False,l2,robust,,,,,,,,,,0.1855924129486084,34,0.8038962476129643,,0.7756339226252994
1890,0.7777091959700834,COMPLETE,True,lr,oof+hand,False,,,,,,,,,,0.04812128230847108,False,l1,robust,,,,,,,,,,0.1372520923614502,34,0.805414040283694,,0.7777091959700834
1891,0.7776877858425858,COMPLETE,True,lr,oof+hand,False,,,,,,,,,,0.041863291770166275,False,l1,robust,,,,,,,,,,0.12264275550842285,34,0.805325710372685,,0.7776877858425858
1892,0.7776323063811409,COMPLETE,True,lr,oof+hand,False,,,,,,,,,,0.06314497577445417,False,l1,robust,,,,,,,,,,0.16042685508728027,34,0.8054763073536202,,0.7776323063811409
1893,0.777179744253622,COMPLETE,True,lr,oof+hand,False,,,,,,,,,,0.08840579940391936,False,l1,robust,,,,,,,,,,0.22160053253173828,34,0.8053508273848577,,0.777179744253622
1894,0.7776113582582572,COMPLETE,True,lr,oof+hand,False,,,,,,,,,,0.03660435344685913,False,l1,robust,,,,,,,,,,0.11284971237182617,34,0.8051593495765788,,0.7776113582582572
1895,0.7777015481255087,COMPLETE,True,lr,oof+hand,False,,,,,,,,,,0.049509819691257596,False,l1,robust,,,,,,,,,,0.13522028923034668,34,0.8054191372505994,,0.7777015481255087
1896,0.7772279678904452,COMPLETE,True,lr,oof+hand,False,,,,,,,,,,0.027702945783994848,False,l1,robust,,,,,,,,,,0.10390472412109375,34,0.8045688370602672,,0.7772279678904452
1897,0.7734980496928501,COMPLETE,True,lr,oof+hand,True,,,,,,,,,,0.06759443556301575,False,l1,robust,,,,,,,,,,0.37454986572265625,34,0.8022175063893371,,0.7734980496928501
1898,0.7776655857800974,COMPLETE,True,lr,oof+hand,False,,,,,,,,,,0.042305146201670835,False,l1,robust,,,,,,,,,,0.12430310249328613,34,0.8053354839380912,,0.7776655857800974
1899,0.7776784748450339,COMPLETE,True,lr,oof+hand,False,,,,,,,,,,0.05536506715053936,False,l1,robust,,,,,,,,,,0.1503283977508545,34,0.8054511903414474,,0.7776784748450339
1900,0.7774969550192199,COMPLETE,True,lr,oof+hand,False,,,,,,,,,,0.03370551030041998,False,l1,robust,,,,,,,,,,0.11235499382019043,34,0.8050359714498391,,0.7774969550192199
1901,0.7770831385606295,COMPLETE,True,lr,oof+hand,False,,,,,,,,,,0.10958788954677204,False,l1,robust,,,,,,,,,,0.2818946838378906,34,0.8052343853367935,,0.7770831385606295
1902,0.7776900377863226,COMPLETE,True,lr,oof+hand,False,,,,,,,,,,0.04460619090156303,False,l1,robust,,,,,,,,,,0.1257174015045166,34,0.8053787293377106,,0.7776900377863226
1903,0.7773639842236736,COMPLETE,True,lr,oof+hand,False,,,,,,,,,,0.0771191536745438,False,l1,robust,,,,,,,,,,0.2079010009765625,34,0.8054222900136336,,0.7773639842236736
1904,0.7776912997422253,COMPLETE,True,lr,oof+hand,False,,,,,,,,,,0.05460666421058866,False,l1,robust,,,,,,,,,,0.154313325881958,34,0.8054456204600868,,0.7776912997422253
1905,0.7775933773224402,COMPLETE,True,lr,oof+hand,False,,,,,,,,,,0.035821785144316554,False,l1,robust,,,,,,,,,,0.11523890495300293,34,0.8051313950776751,,0.7775933773224402
1906,0.7595836759385375,COMPLETE,True,lgbm,oof+hand,False,0.004443584539991667,0.6224291724886147,0.02966624844715035,0.08129622427605981,12.0,77.0,101.0,76.0,0.6414457456599895,,,,robust,,,,,,,,,,0.6164722442626953,34,0.7908128590274587,,0.7595836759385375
1907,0.776983266298513,COMPLETE,True,lr,oof+hand,False,,,,,,,,,,0.024925246031570245,False,l1,robust,,,,,,,,,,0.09998273849487305,34,0.8041802064702473,,0.776983266298513
1908,0.7775637428864116,COMPLETE,True,lr,oof+hand,False,,,,,,,,,,0.06598929680344347,False,l1,robust,,,,,,,,,,0.16214895248413086,34,0.8054620148278648,,0.7775637428864116
1909,0.7777035908822366,COMPLETE,True,lr,oof+hand,False,,,,,,,,,,0.047910170630428975,False,l1,robust,,,,,,,,,,0.13468694686889648,34,0.8054093111391427,,0.7777035908822366
1910,0.7756403417355157,COMPLETE,True,lr,oof+hand,False,,,,,,,,,,0.01954522086275447,False,l2,robust,,,,,,,,,,0.1763780117034912,34,0.8037347210535105,,0.7756403417355157
1911,0.7776733544675138,COMPLETE,True,lr,oof+hand,False,,,,,,,,,,0.04012736507360807,False,l1,robust,,,,,,,,,,0.1208348274230957,34,0.8052876144860213,,0.7776733544675138
1912,0.7776777249242426,COMPLETE,True,lr,oof+hand,False,,,,,,,,,,0.059292562749279284,False,l1,robust,,,,,,,,,,0.15891242027282715,34,0.8054706323801585,,0.7776777249242426
1913,0.7772715539805548,COMPLETE,True,lr,oof+hand,False,,,,,,,,,,0.028415577081793993,False,l1,robust,,,,,,,,,,0.10663795471191406,34,0.8046540667542925,,0.7772715539805548
1914,0.7772730037414566,COMPLETE,True,lr,oof+hand,False,,,,,,,,,,0.08326663400042766,False,l1,robust,,,,,,,,,,0.21683096885681152,34,0.8053799378968738,,0.7772730037414566
1915,0.7777014401503364,COMPLETE,True,lr,oof+hand,False,,,,,,,,,,0.04668911062059766,False,l1,robust,,,,,,,,,,0.12501931190490723,34,0.8053918133043027,,0.7777014401503364
1916,0.7744747300856712,COMPLETE,True,lr,oof+hand,True,,,,,,,,,,0.035883413177559026,False,l1,robust,,,,,,,,,,0.22887253761291504,34,0.8027933585575394,,0.7744747300856712
1917,0.7776324462584606,COMPLETE,True,lr,oof+hand,False,,,,,,,,,,0.061782553705810546,False,l1,robust,,,,,,,,,,0.14943194389343262,34,0.8054716307551194,,0.7776324462584606
1918,0.7777091067791319,COMPLETE,True,lr,oof+hand,False,,,,,,,,,,0.05220957872005482,False,l1,robust,,,,,,,,,,0.14258909225463867,34,0.805433745052658,,0.7777091067791319
1919,0.7776759862404874,COMPLETE,True,lr,oof+hand,False,,,,,,,,,,0.04192348447525058,False,l1,robust,,,,,,,,,,0.1166071891784668,34,0.8053267087476458,,0.7776759862404874
1920,0.7773561234943063,COMPLETE,True,lr,oof+hand,False,,,,,,,,,,0.03095150478470617,False,l1,robust,,,,,,,,,,0.10660839080810547,34,0.8048629898513608,,0.7773561234943063
1921,0.7771477854165592,COMPLETE,True,lr,oof+hand,False,,,,,,,,,,0.10164020098229931,False,l1,robust,,,,,,,,,,0.2575247287750244,34,0.8052866161110606,,0.7771477854165592
1922,0.7774480316164599,COMPLETE,True,lr,oof+hand,False,,,,,,,,,,0.07263629803028533,False,l1,robust,,,,,,,,,,0.18073439598083496,34,0.8054296464607134,,0.7774480316164599
1923,0.7776577025488521,COMPLETE,True,lr,oof+hand,False,,,,,,,,,,0.057362935012552276,False,l1,robust,,,,,,,,,,0.1528165340423584,34,0.8054616995515615,,0.7776577025488521
1924,0.7776668607836584,COMPLETE,True,lr,oof+hand,False,,,,,,,,,,0.040615866177482245,False,l1,robust,,,,,,,,,,0.118011474609375,34,0.80530038317631,,0.7776668607836584
1925,0.7683283102736895,COMPLETE,True,lr,oof+hand,False,,,,,,,,,,0.0037307241640844413,False,l1,robust,,,,,,,,,,0.07876706123352051,34,0.7895841747269682,,0.7683283102736895
1926,0.7777115551715094,COMPLETE,True,lr,oof+hand,False,,,,,,,,,,0.051368744842311596,False,l1,robust,,,,,,,,,,0.13727617263793945,34,0.8054315381185341,,0.7777115551715094
1927,0.7774365281708361,COMPLETE,True,lr,oof+hand,False,,,,,,,,,,0.032511991410026454,False,l1,robust,,,,,,,,,,0.10870218276977539,34,0.8049731263733567,,0.7774365281708361
1928,0.7426733705670902,COMPLETE,True,lgbm,oof+hand,False,0.04126474616142547,0.9327485392145385,2.091000091902416,0.13406055069615372,-1.0,71.0,642.0,135.0,0.5493787515104893,,,,robust,,,,,,,,,,4.5824363231658936,34,0.7728872467897779,,0.7426733705670902
1929,0.7774608655509071,COMPLETE,True,lr,oof+hand,False,,,,,,,,,,0.07188606353005733,False,l1,robust,,,,,,,,,,0.18290328979492188,34,0.805430802473826,,0.7774608655509071
1930,0.7776740820639767,COMPLETE,True,lr,oof+hand,False,,,,,,,,,,0.056851310530530975,False,l1,robust,,,,,,,,,,0.14306020736694336,34,0.8054639590317358,,0.7776740820639767
1931,0.7756623666908558,COMPLETE,True,lr,oof+hand,False,,,,,,,,,,0.024077971159844166,False,l2,robust,,,,,,,,,,0.16437411308288574,34,0.8038159572476925,,0.7756623666908558
1932,0.7776970780648204,COMPLETE,True,lr,oof+hand,False,,,,,,,,,,0.04286687017474208,False,l1,robust,,,,,,,,,,0.12075972557067871,34,0.8053454151416488,,0.7776970780648204
1933,0.7772622066089131,COMPLETE,True,lr,oof+hand,False,,,,,,,,,,0.08175863630464761,False,l1,robust,,,,,,,,,,0.1979968547821045,34,0.8053758918509798,,0.7772622066089131
1934,0.7777075305245948,COMPLETE,True,lr,oof+hand,False,,,,,,,,,,0.05078025949805444,False,l1,robust,,,,,,,,,,0.1399397850036621,34,0.805433377230304,,0.7777075305245948
1935,0.7738135964352475,COMPLETE,True,lr,oof+hand,True,,,,,,,,,,0.06292091314307473,False,l1,robust,,,,,,,,,,0.353701114654541,34,0.8025684089150469,,0.7738135964352475
1936,0.7774654498570054,COMPLETE,True,lr,oof+hand,False,,,,,,,,,,0.03338768691982902,False,l1,robust,,,,,,,,,,0.10788345336914062,34,0.8050229400292976,,0.7774654498570054
1937,0.7777018079077449,COMPLETE,True,lr,oof+hand,False,,,,,,,,,,0.04889995147018726,False,l1,robust,,,,,,,,,,0.12621212005615234,34,0.8054127266324298,,0.7777018079077449
1938,0.7771633831979347,COMPLETE,True,lr,oof+hand,False,,,,,,,,,,0.10055132129222655,False,l1,robust,,,,,,,,,,0.23941779136657715,34,0.805292553814775,,0.7771633831979347
1939,0.7775999003046471,COMPLETE,True,lr,oof+hand,False,,,,,,,,,,0.03774216809891806,False,l1,robust,,,,,,,,,,0.11556148529052734,34,0.8051920857660841,,0.7775999003046471
1940,0.7775708666435549,COMPLETE,True,lr,oof+hand,False,,,,,,,,,,0.06563514181468326,False,l1,robust,,,,,,,,,,0.16164731979370117,34,0.805461384275258,,0.7775708666435549
1941,0.7772369362378625,COMPLETE,True,lr,oof+hand,False,,,,,,,,,,0.027903731504633867,False,l1,robust,,,,,,,,,,0.09822559356689453,34,0.8045948999013499,,0.7772369362378625
1942,0.777671886036596,COMPLETE,True,lr,oof+hand,False,,,,,,,,,,0.05371628034906048,False,l1,robust,,,,,,,,,,0.14716601371765137,34,0.8054394200261196,,0.777671886036596
1943,0.7776728484756562,COMPLETE,True,lr,oof+hand,False,,,,,,,,,,0.04198366063610435,False,l1,robust,,,,,,,,,,0.1182413101196289,34,0.8053271291160504,,0.7776728484756562
1944,0.7772579466248364,COMPLETE,True,lr,oof+hand,False,,,,,,,,,,0.08280051912777131,False,l1,robust,,,,,,,,,,0.1919879913330078,34,0.8053742629234122,,0.7772579466248364
1945,0.7776642166516742,COMPLETE,True,lr,oof+hand,False,,,,,,,,,,0.058267790895020516,False,l1,robust,,,,,,,,,,0.15411090850830078,34,0.8054645370382923,,0.7776642166516742
1946,0.777613315320803,COMPLETE,True,lr,oof+hand,False,,,,,,,,,,0.036638976858835576,False,l1,robust,,,,,,,,,,0.11507225036621094,34,0.805161871787006,,0.777613315320803
1947,0.7777141074820442,COMPLETE,True,lr,oof+hand,False,,,,,,,,,,0.045879957051870056,False,l1,robust,,,,,,,,,,0.12338781356811523,34,0.8053829855678069,,0.7777141074820442
1948,0.777127365353625,COMPLETE,True,lr,oof+hand,False,,,,,,,,,,0.02637116833846461,False,l1,robust,,,,,,,,,,0.10376191139221191,34,0.8043972742051544,,0.777127365353625
1949,0.7707746382120667,COMPLETE,True,lgbm,oof+hand,False,1.6462138908616906,0.9035191450576332,9.868087925486137,0.0025079248810726085,6.0,82.0,504.0,25.0,0.817340325194971,,,,robust,,,,,,,,,,1.542492151260376,34,0.7998588192713271,,0.7707746382120667
1950,0.7775360287631219,COMPLETE,True,lr,oof+hand,False,,,,,,,,,,0.07036068241598868,False,l1,robust,,,,,,,,,,0.18083500862121582,34,0.8054446746311766,,0.7775360287631219
1951,0.7774613385265206,COMPLETE,True,lr,oof+hand,False,,,,,,,,,,0.03325750224203933,False,l1,robust,,,,,,,,,,0.10571956634521484,34,0.8050175803321393,,0.7774613385265206
1952,0.7754981648587067,COMPLETE,True,lr,oof+hand,False,,,,,,,,,,0.043735723753639905,False,l2,robust,,,,,,,,,,0.18920040130615234,34,0.8039229410066541,,0.7754981648587067
1953,0.7776758189876476,COMPLETE,True,lr,oof+hand,False,,,,,,,,,,0.0541527295831495,False,l1,robust,,,,,,,,,,0.14883685111999512,34,0.8054407336773839,,0.7776758189876476
1954,0.7741310792469248,COMPLETE,True,lr,oof+hand,True,,,,,,,,,,0.03971641030952691,False,l1,robust,,,,,,,,,,0.2313065528869629,34,0.80274275671084,,0.7741310792469248
1955,0.7776226019920081,COMPLETE,True,lr,oof+hand,False,,,,,,,,,,0.06383077065536098,False,l1,robust,,,,,,,,,,0.1576695442199707,34,0.8054765175378223,,0.7776226019920081
1956,0.7764351151329792,COMPLETE,True,lr,oof+hand,False,,,,,,,,,,0.019184790325297556,False,l1,robust,,,,,,,,,,0.09885001182556152,34,0.8026533758788196,,0.7764351151329792
1957,0.7773227309978681,COMPLETE,True,lr,oof+hand,False,,,,,,,,,,0.08044129127122518,False,l1,robust,,,,,,,,,,0.19340729713439941,34,0.8054016919618099,,0.7773227309978681
1958,0.7772848971066442,COMPLETE,True,lr,oof+hand,False,,,,,,,,,,0.02937363920912339,False,l1,robust,,,,,,,,,,0.10479235649108887,34,0.8047368793299916,,0.7772848971066442
1959,0.7777200057525957,COMPLETE,True,lr,oof+hand,False,,,,,,,,,,0.049779688450982414,False,l1,robust,,,,,,,,,,0.12942123413085938,34,0.8054254953227185,,0.7777200057525957
1960,0.7776854768295783,COMPLETE,True,lr,oof+hand,False,,,,,,,,,,0.05630887089227707,False,l1,robust,,,,,,,,,,0.15374374389648438,34,0.8054600706239938,,0.7776854768295783
1961,0.777185833181587,COMPLETE,True,lr,oof+hand,False,,,,,,,,,,0.09681537632761399,False,l1,robust,,,,,,,,,,0.24474406242370605,34,0.8053241339911679,,0.777185833181587
1962,0.7776248937978751,COMPLETE,True,lr,oof+hand,False,,,,,,,,,,0.038145918219932545,False,l1,robust,,,,,,,,,,0.11671924591064453,34,0.8052118430810986,,0.7776248937978751
1963,0.7775714280240855,COMPLETE,True,lr,oof+hand,False,,,,,,,,,,0.06863657032541942,False,l1,robust,,,,,,,,,,0.17314386367797852,34,0.8054565500386056,,0.7775714280240855
1964,0.7777076818858725,COMPLETE,True,lr,oof+hand,False,,,,,,,,,,0.048274311157826405,False,l1,robust,,,,,,,,,,0.1299147605895996,34,0.805416615040172,,0.7777076818858725
1965,0.7774016902489799,COMPLETE,True,lr,oof+hand,False,,,,,,,,,,0.03214747531898029,False,l1,robust,,,,,,,,,,0.10750913619995117,34,0.8049474839006783,,0.7774016902489799
1966,0.7776754135531467,COMPLETE,True,lr,oof+hand,False,,,,,,,,,,0.04265782455287952,False,l1,robust,,,,,,,,,,0.12074613571166992,34,0.8053417894641596,,0.7776754135531467
1967,0.7776865163337081,COMPLETE,True,lr,oof+hand,False,,,,,,,,,,0.05917366603351274,False,l1,robust,,,,,,,,,,0.14721202850341797,34,0.8054693712749448,,0.7776865163337081
1968,0.7776050158503598,COMPLETE,True,lr,oof+hand,False,,,,,,,,,,0.03653894332279081,False,l1,robust,,,,,,,,,,0.11135244369506836,34,0.8051579308332132,,0.7776050158503598
1969,0.7398223045701977,COMPLETE,True,lgbm,oof+hand,False,0.43929840642584195,0.9990295455347198,0.15242400737402317,0.18167542761270367,10.0,68.0,675.0,220.0,0.9809169961339207,,,,robust,,,,,,,,,,2.8919010162353516,34,0.7687956434700025,,0.7398223045701977
1970,0.7767955793931707,COMPLETE,True,lr,oof+hand,False,,,,,,,,,,0.022582764917549618,False,l1,robust,,,,,,,,,,0.09938240051269531,34,0.8036854328580754,,0.7767955793931707
1971,0.7754199951094363,COMPLETE,True,lr,oof+hand,False,,,,,,,,,,0.04791618947069717,False,l2,robust,,,,,,,,,,0.2054128646850586,34,0.8038980341786838,,0.7754199951094363
1972,0.7773172378151544,COMPLETE,True,lr,oof+hand,False,,,,,,,,,,0.08030192890514709,False,l1,robust,,,,,,,,,,0.19913339614868164,34,0.8053989595671802,,0.7773172378151544
1973,0.7742401974172318,COMPLETE,True,lr,oof+hand,True,,,,,,,,,,0.029475813493382595,False,l1,robust,,,,,,,,,,0.21846771240234375,34,0.8025478634092739,,0.7742401974172318
1974,0.7776351819310537,COMPLETE,True,lr,oof+hand,False,,,,,,,,,,0.0627429546455909,False,l1,robust,,,,,,,,,,0.16384434700012207,34,0.805476937906227,,0.7776351819310537
1975,0.7776726089613387,COMPLETE,True,lr,oof+hand,False,,,,,,,,,,0.044361268379734704,False,l1,robust,,,,,,,,,,0.1274256706237793,34,0.8053724763576927,,0.7776726089613387
1976,0.7776989221580146,COMPLETE,True,lr,oof+hand,False,,,,,,,,,,0.052785875799195865,False,l1,robust,,,,,,,,,,0.1507265567779541,34,0.8054347959736695,,0.7776989221580146
1977,0.7776524591685311,COMPLETE,True,lr,oof+hand,False,,,,,,,,,,0.03995045150353517,False,l1,robust,,,,,,,,,,0.11845612525939941,34,0.8052857228282008,,0.7776524591685311
1978,0.7774863448984896,COMPLETE,True,lr,oof+hand,False,,,,,,,,,,0.07136953805050572,False,l1,robust,,,,,,,,,,0.1770009994506836,34,0.8054329568618994,,0.7774863448984896
1979,0.777463982211425,COMPLETE,True,lr,oof+hand,False,,,,,,,,,,0.03336147576115646,False,l1,robust,,,,,,,,,,0.10783672332763672,34,0.8050227298450953,,0.777463982211425
1980,0.7777058737665732,COMPLETE,True,lr,oof+hand,False,,,,,,,,,,0.05097716694532614,False,l1,robust,,,,,,,,,,0.12871479988098145,34,0.8054316432106351,,0.7777058737665732
1981,0.7771160982164335,COMPLETE,True,lr,oof+hand,False,,,,,,,,,,0.1070452597409007,False,l1,robust,,,,,,,,,,0.26824402809143066,34,0.8052548257504653,,0.7771160982164335
1982,0.7770563368682478,COMPLETE,True,lr,oof+hand,False,,,,,,,,,,0.025768408943065955,False,l1,robust,,,,,,,,,,0.10077047348022461,34,0.8043211349778776,,0.7770563368682478
1983,0.7776746116929969,COMPLETE,True,lr,oof+hand,False,,,,,,,,,,0.04209108150901612,False,l1,robust,,,,,,,,,,0.12012052536010742,34,0.8053300191488317,,0.7776746116929969
1984,0.7776820534224342,COMPLETE,True,lr,oof+hand,False,,,,,,,,,,0.0601038610087055,False,l1,robust,,,,,,,,,,0.16492509841918945,34,0.8054729969524341,,0.7776820534224342
1985,0.777353492110064,COMPLETE,True,lr,oof+hand,False,,,,,,,,,,0.0782364057286543,False,l1,robust,,,,,,,,,,0.1981816291809082,34,0.805410992612761,,0.777353492110064
1986,0.7774638093478512,COMPLETE,True,lr,oof+hand,False,,,,,,,,,,0.033356906195579954,False,l1,robust,,,,,,,,,,0.10596704483032227,34,0.8050220992924885,,0.7774638093478512
1987,0.7776972165075584,COMPLETE,True,lr,oof+hand,False,,,,,,,,,,0.046884319266326004,False,l1,robust,,,,,,,,,,0.12737464904785156,34,0.8053953864357415,,0.7776972165075584
1988,0.7776779521112933,COMPLETE,True,lr,oof+hand,False,,,,,,,,,,0.059778665449304005,False,l1,robust,,,,,,,,,,0.15525388717651367,34,0.8054756768010132,,0.7776779521112933
