number,value,state,params_add_group_dummies,params_family,params_feature_subset,params_isotonic,params_lgbm_alpha,params_lgbm_colsample,params_lgbm_lambda,params_lgbm_lr,params_lgbm_max_depth,params_lgbm_min_child,params_lgbm_n_estimators,params_lgbm_num_leaves,params_lgbm_subsample,params_lr_C,params_lr_class_weight_balanced,params_lr_penalty,params_scaler,params_xgb_alpha,params_xgb_colsample,params_xgb_gamma,params_xgb_lambda,params_xgb_lr,params_xgb_max_depth,params_xgb_min_child,params_xgb_n_estimators,params_xgb_subsample,user_attrs_elapsed_sec,user_attrs_n_features,user_attrs_pooled_auroc,user_attrs_pruned_reason,user_attrs_weighted_auroc
711,0.7761280856162684,COMPLETE,False,xgb,oof+timing,False,,,,,,,,,,,,,standard,0.004295508708180382,0.5652992552684217,0.3106755205353018,0.0014565526648699985,0.021747563986961437,3.0,1.0,182.0,0.9074896003813306,0.3578641414642334,52,0.8039167931187374,,0.7761280856162684
712,0.7754590694505802,COMPLETE,True,xgb,oof+timing,False,,,,,,,,,,,,,standard,0.0036787778606679564,0.5861746222272648,0.5636718060168513,0.0020924164861799485,0.018102455835888917,3.0,3.0,202.0,0.9393124625996081,0.41358113288879395,52,0.8051564595437973,,0.7754590694505802
713,0.7756689552842184,COMPLETE,False,xgb,all,False,,,,,,,,,,,,,standard,0.0015638629408100688,0.5242061905044009,0.43897003123826417,0.0033365406759701933,0.01617010529004866,3.0,1.0,167.0,0.9574652255477344,1.3351690769195557,362,0.8028621413377363,,0.7756689552842184
714,0.7752445633946885,COMPLETE,False,xgb,oof+timing,False,,,,,,,,,,,,,standard,0.007050833491767241,0.603029145770618,1.104167347670918,0.0016984298572552473,0.00872170686992705,3.0,2.0,150.0,0.9176201139714245,0.3211047649383545,52,0.8021627534046425,,0.7752445633946885
715,0.7757484247216483,COMPLETE,False,xgb,oof+timing,False,,,,,,,,,,,,,standard,0.00243934983515565,0.5530621240633136,0.11867253864530528,0.0012411441598909104,0.010381253648290267,3.0,1.0,100.0,0.9279775430957368,0.23185229301452637,52,0.8020479402841459,,0.7757484247216483
716,0.7760030510476429,COMPLETE,False,xgb,oof+timing,False,,,,,,,,,,,,,standard,0.0019140474245374702,0.5723880073589412,2.630428027960095,0.002225421825295471,0.019893299480687,3.0,3.0,190.0,0.9456501167901205,0.37177133560180664,52,0.8038492714437542,,0.7760030510476429
717,0.7742145600621437,COMPLETE,False,xgb,oof+timing,False,,,,,,,,,,,,,standard,0.004791354373206712,0.5870362106309104,2.0374228358184374,0.0015890920153228624,0.012322960102344727,4.0,1.0,164.0,0.933159560123803,0.45949411392211914,52,0.8017806385248937,,0.7742145600621437
718,0.7746182098573349,COMPLETE,False,xgb,oof+timing,False,,,,,,,,,,,,,standard,0.00596330111208531,0.7604556107337337,0.22098655708484338,0.002679633886879889,0.006061407978845492,3.0,2.0,180.0,0.9605723832502084,0.38346362113952637,52,0.8014666758727348,,0.7746182098573349
719,0.7760356127531479,COMPLETE,False,xgb,oof+timing,False,,,,,,,,,,,,,standard,0.0012893449310255975,0.5019528607466043,0.34796131937223,0.02467685550626857,0.014133932854678137,3.0,1.0,145.0,0.922211485622549,0.3003981113433838,52,0.8027924127286292,,0.7760356127531479
720,0.7493899137102901,COMPLETE,True,xgb,oof_minus_roberta,False,,,,,,,,,,,,,standard,0.002956247263373374,0.6527559745468294,0.6632373656940478,0.001875577935380171,0.015829104875656183,3.0,1.0,160.0,0.9403362419369033,0.19129085540771484,5,0.7805411570619318,,0.7493899137102901
721,0.7740451116536029,COMPLETE,False,xgb,oof+ph,False,,,,,,,,,,,,,standard,0.00206504962448166,0.5439362899023379,2.302604414310086,0.0014374029863074556,0.017280849226788606,3.0,1.0,202.0,0.950307218205836,0.37432384490966797,42,0.8020831461380282,,0.7740451116536029
722,0.7757143149885403,COMPLETE,False,xgb,oof+timing,False,,,,,,,,,,,,,standard,0.327950022153546,0.6217848934867121,0.49044159192768016,0.0023723461683254395,0.013711507513265374,3.0,2.0,176.0,0.907994775046441,0.35768675804138184,52,0.8025416104292561,,0.7757143149885403
723,0.7618154826448638,COMPLETE,False,lgbm,oof+timing,False,0.17434577767515472,0.3493879519611239,0.007310597902273763,0.03243962432218494,5.0,61.0,756.0,61.0,0.7026851959474222,,,,none,,,,,,,,,,1.7642359733581543,52,0.7909380762659683,,0.7618154826448638
724,0.772368672409464,COMPLETE,False,xgb,all_minus_ng,True,,,,,,,,,,,,,standard,0.015122818836783684,0.5960774053867562,0.6071433122435663,0.003912781134754386,0.0036088570500466184,3.0,1.0,135.0,0.9286618996498447,1.9654896259307861,131,0.798309393878154,,0.772368672409464
725,0.7756305103005182,COMPLETE,False,xgb,oof+timing,False,,,,,,,,,,,,,standard,0.003616454355009004,0.5664463534795203,0.856320105958664,0.0018980024880005022,0.020197355030572187,3.0,3.0,214.0,0.9178928327459682,0.40429234504699707,52,0.8037641993878806,,0.7756305103005182
726,0.7757566616786952,COMPLETE,False,xgb,oof+timing,False,,,,,,,,,,,,,standard,0.002561389132360554,0.5192769599067086,0.2504334342962888,0.0012673954992187936,0.011363348168246,3.0,2.0,170.0,0.9367205003501263,0.34578824043273926,52,0.8026126001435768,,0.7757566616786952
727,0.774379670847043,COMPLETE,False,xgb,oof+timing,False,,,,,,,,,,,,,standard,0.39919602018250333,0.3573945992376305,0.7721322981737007,0.002239109892137208,0.015528708482361146,3.0,4.0,154.0,0.9469428402898414,0.2979426383972168,52,0.8009962836280273,,0.774379670847043
728,0.7755472570181291,COMPLETE,True,xgb,oof+timing,False,,,,,,,,,,,,,standard,0.004905583756259939,0.5799844645049151,0.4026551868504717,0.0030811044555339308,0.01802919931796489,3.0,7.0,191.0,0.9278310207740516,0.3932163715362549,52,0.8050120629968295,,0.7755472570181291
729,0.7725969284649219,COMPLETE,False,lr,oof+timing,False,,,,,,,,,,0.17198756252051414,True,l1,standard,,,,,,,,,,0.35068416595458984,52,0.7993350402392401,,0.7725969284649219
730,0.775372681620966,COMPLETE,False,xgb,oof+timing,False,,,,,,,,,,,,,standard,0.0029877108991578556,0.5509588856393101,0.11234825865221586,0.0016336824232898763,0.013930379147135406,3.0,1.0,123.0,0.5219095542783673,0.2716188430786133,52,0.8020936553481424,,0.775372681620966
731,0.7702002676414718,COMPLETE,False,xgb,oof+hand+graph,False,,,,,,,,,,,,,standard,0.0016097148099724723,0.6079748317725879,0.0018821690755398135,0.0019482285166120864,0.05757171467296306,3.0,1.0,178.0,0.9024053434510492,0.318739652633667,49,0.800497516516012,,0.7702002676414718
732,0.7734918921178432,COMPLETE,False,xgb,oof_only,False,,,,,,,,,,,,,standard,0.002158243295145332,0.5292615788239429,0.5296599940629736,0.0013587408494632933,0.02204594070614617,3.0,2.0,160.0,0.7501997496129941,0.16256308555603027,6,0.8010747874275798,,0.7734918921178432
733,0.7760803410644511,COMPLETE,False,xgb,oof+timing,False,,,,,,,,,,,,,standard,0.003923585973807791,0.5604650596116159,0.2997013493280142,0.0011559252539634303,0.016029914064989378,3.0,5.0,140.0,0.9166313776221947,0.29220056533813477,52,0.802957249689269,,0.7760803410644511
734,0.7761359773809373,COMPLETE,False,xgb,oof+timing,False,,,,,,,,,,,,,standard,0.0012046228904887834,0.5923445693720735,0.7154307836751747,0.00261018345489992,0.019496454040600648,3.0,1.0,199.0,0.937765594036823,0.3880922794342041,52,0.8038497443582094,,0.7761359773809373
735,0.7751573530895065,COMPLETE,False,xgb,oof+ng,False,,,,,,,,,,,,,standard,0.0031449192052122213,0.6428588643324101,0.42543135440252006,0.0015820357760598868,0.017820719838605295,3.0,1.0,182.0,0.9612618236421756,0.8138999938964844,237,0.8028318748126076,,0.7751573530895065
736,0.7762106060467178,COMPLETE,True,xgb,oof+timing,False,,,,,,,,,,,,,standard,0.009223191435340969,0.5389882229938033,0.2286783669144881,0.0022450637979173687,0.012548562194806878,3.0,3.0,168.0,0.923647933096025,0.34564852714538574,52,0.8048795418572905,,0.7762106060467178
737,0.7762872273567738,COMPLETE,False,xgb,oof+timing,False,,,,,,,,,,,,,standard,0.005316140196159108,0.5749286903042722,0.9560461474452941,0.001766045316258211,0.014557023608978996,3.0,1.0,150.0,0.943367489087966,0.31077003479003906,52,0.8032956988009938,,0.7762872273567738
738,0.7749993973364029,COMPLETE,False,xgb,oof+timing,False,,,,,,,,,,,,,standard,0.0024482803859327933,0.6298194350342237,0.5438136065627612,0.003274390551996599,0.024966413890946212,3.0,2.0,195.0,0.9304868202911016,0.373276948928833,52,0.8035141327332154,,0.7749993973364029
739,0.7742160652879053,COMPLETE,False,xgb,oof+timing,False,,,,,,,,,,,,,standard,0.27774901798421586,0.6044899208535037,0.33706882011328865,0.002067116363938807,0.016415946920664323,4.0,1.0,215.0,0.9514985969201722,0.5825521945953369,52,0.802592895374613,,0.7742160652879053
740,0.7727517926654528,COMPLETE,False,xgb,oof+timing,False,,,,,,,,,,,,,standard,0.0018863496054567052,0.5625987177461482,0.62440656591099,0.0027739175074405834,0.015063277382547284,5.0,1.0,170.0,0.9148756835832546,0.6141331195831299,52,0.8011508215627553,,0.7727517926654528
741,0.7763247568491279,COMPLETE,False,xgb,oof+timing,False,,,,,,,,,,,,,standard,0.006356247495829527,0.4659850438356822,0.4552176261130502,0.001021256950162458,0.01880925239792013,3.0,2.0,186.0,0.9351116720296735,0.3520946502685547,52,0.8036241116170595,,0.7763247568491279
742,0.7749445390904405,COMPLETE,False,xgb,oof+hand,False,,,,,,,,,,,,,standard,0.5040434378467851,0.5848881060514066,0.19449042163399788,0.00436203132878529,0.012619012179278376,3.0,1.0,157.0,0.9092524467453523,0.2727031707763672,34,0.8021377940306215,,0.7749445390904405
743,0.7746254951778551,COMPLETE,False,xgb,oof+timing,True,,,,,,,,,,,,,standard,0.004387409935321836,0.5481569620517975,2.441068883070734,0.001440170198236088,0.02265033864252964,3.0,1.0,239.0,0.9252782962485632,1.5105161666870117,52,0.8037092887650342,,0.7746254951778551
744,0.7759258159063078,COMPLETE,False,xgb,oof+timing,False,,,,,,,,,,,,,standard,0.0035965957268557867,0.6171153482837564,0.31951138377489563,0.0017611067404710175,0.017384064133057604,3.0,1.0,138.0,0.806243301884543,0.2867119312286377,52,0.8032335893692194,,0.7759258159063078
745,0.7698111044399427,COMPLETE,True,lgbm,all,False,0.022944125720746347,0.8755415591559883,0.28244866172097327,0.0029232451375722033,1.0,36.0,652.0,212.0,0.9764848280436043,,,,standard,,,,,,,,,,1.5129544734954834,362,0.7916777670198496,,0.7698111044399427
746,0.776411399549083,COMPLETE,False,xgb,oof+timing,False,,,,,,,,,,,,,standard,0.0016409370772639106,0.5091986941745107,0.7058335513191586,0.0024961098833500926,0.014064589567667277,3.0,3.0,175.0,0.950121152846146,0.3588271141052246,52,0.8032970124522579,,0.776411399549083
747,0.7760426787012997,COMPLETE,False,xgb,oof+timing,False,,,,,,,,,,,,,none,0.00257301627045295,0.5715532176705127,0.877153934035573,0.0021328141270196494,0.01990590658331334,3.0,2.0,162.0,0.8954251385739936,0.3199601173400879,52,0.8036628906023805,,0.7760426787012997
748,0.7752576883947947,COMPLETE,False,xgb,oof+timing,False,,,,,,,,,,,,,standard,1.865046001078856,0.5913233670290847,0.12238241346304737,0.0013174551257592196,0.011223061281916248,3.0,1.0,189.0,0.9388794908393329,0.37949109077453613,52,0.8024615827942371,,0.7752576883947947
749,0.7762144311593655,COMPLETE,False,xgb,oof+timing,False,,,,,,,,,,,,,standard,0.007446743225924973,0.5323747018586826,0.4980385176125133,0.0016379143857233032,0.015933967947633975,3.0,2.0,150.0,0.9206472184294592,0.3349754810333252,52,0.8030038054900746,,0.7762144311593655
750,0.7753221754088842,COMPLETE,False,xgb,oof+timing,False,,,,,,,,,,,,,standard,0.0021169840501684134,0.5534229468131876,0.3516937025585778,0.0033441232666915123,0.028079005308074764,3.0,1.0,176.0,0.932062525870357,0.3605833053588867,52,0.8036724014375338,,0.7753221754088842
751,0.7702402961998525,COMPLETE,False,lr,oof+timing,False,,,,,,,,,,4.040582157029012,False,l1,standard,,,,,,,,,,1.3109419345855713,52,0.7973360308373854,,0.7702402961998525
752,0.7475795271882518,COMPLETE,False,xgb,oof_minus_roberta,False,,,,,,,,,,,,,standard,0.0030511201581893952,0.5808922144810487,0.6251211852737898,0.0018989221144530475,0.01741171152376994,3.0,1.0,309.0,0.9667665151133021,0.31869029998779297,5,0.7748593000676898,,0.7475795271882518
753,0.773494717521623,COMPLETE,True,xgb,oof+timing,False,,,,,,,,,,,,,standard,0.001422653171293892,0.6022709170531649,0.810793966312469,0.0026341282235010236,0.040749256824940336,3.0,3.0,120.0,0.946466853973152,0.2789943218231201,52,0.8042227162251591,,0.773494717521623
754,0.7731777330732519,COMPLETE,False,xgb,oof+ph,False,,,,,,,,,,,,,standard,0.0054219930940987305,0.5668433296151127,0.3999186627189197,0.11360714441596091,0.013251080613262398,3.0,1.0,330.0,0.9579735527298191,0.5999743938446045,42,0.8016952511927165,,0.7731777330732519
755,0.7739608631844289,COMPLETE,False,xgb,oof+timing,False,,,,,,,,,,,,,standard,0.3498055604121349,0.5457731979420898,0.23958883026902814,0.0011640479971928256,0.014575457073262356,3.0,9.0,424.0,0.9120205575720506,0.7419703006744385,52,0.8028900958366398,,0.7739608631844289
756,0.7675635205282525,COMPLETE,False,xgb,oof+timing,False,,,,,,,,,,,,,standard,0.003822582676286114,0.6130954032901728,1.0499602845129121,0.00148431240333895,0.020723164964102675,8.0,1.0,200.0,0.9336926797477018,1.738135814666748,52,0.7967507203800803,,0.7675635205282525
757,0.7736361194948872,COMPLETE,False,xgb,all_minus_ng,False,,,,,,,,,,,,,standard,0.011805405818306783,0.5190242535729791,0.5123903176577878,0.0021395560147925725,0.016037007325910204,4.0,2.0,165.0,0.9227128940203527,0.9420211315155029,131,0.8015194846535582,,0.7736361194948872
758,0.7760638572849203,COMPLETE,False,xgb,oof+timing,False,,,,,,,,,,,,,standard,0.0026144855664767858,0.5935826600474183,0.6212610236459227,0.0017298525196333436,0.018936513869124413,3.0,1.0,137.0,0.9444664751856864,0.3011324405670166,52,0.8032179306461493,,0.7760638572849203
759,0.775899578444392,COMPLETE,False,xgb,oof+timing,False,,,,,,,,,,,,,standard,0.0019407714206626998,0.5597994177234393,0.16270899934635588,0.0023601889471773748,0.01017155688675953,3.0,1.0,186.0,0.9333939003422447,0.37186336517333984,52,0.8024974717467768,,0.775899578444392
760,0.7755460702374339,COMPLETE,False,xgb,oof+timing,False,,,,,,,,,,,,,standard,0.003306389415962377,0.49225901704166375,1.160479701093518,0.0028680502966283348,0.012269418588690604,3.0,3.0,210.0,0.9008616098453016,0.42641329765319824,52,0.802585538927533,,0.7755460702374339
761,0.7756012095278941,COMPLETE,True,xgb,oof+hand+graph,False,,,,,,,,,,,,,standard,0.004487293148634447,0.5752317713683679,0.4167645225880251,0.0013613169275707019,0.015169596374288972,3.0,4.0,151.0,0.9190937119985532,0.3218207359313965,49,0.8043781999887973,,0.7756012095278941
762,0.7734610464853736,COMPLETE,False,xgb,oof+timing,False,,,,,,,,,,,,,standard,0.0022870298298987967,0.5353367727171501,0.2927268450148679,0.0019526714498664707,0.017214636364414716,3.0,2.0,566.0,0.941459793609761,0.9305758476257324,52,0.8026248433733597,,0.7734610464853736
763,0.7730258804626131,COMPLETE,False,xgb,oof+timing,True,,,,,,,,,,,,,none,0.0011994145856029457,0.6239764352659849,3.4466783976334536,0.0015437312538141648,0.023235616822168716,3.0,1.0,173.0,0.9565950018277877,1.2121145725250244,52,0.8016645642991833,,0.7730258804626131
764,0.7704386681057228,COMPLETE,False,xgb,oof_only,False,,,,,,,,,,,,,standard,0.27243910636553165,0.44000251192175655,0.7228057802184698,0.0035887833920968722,0.013648642201826803,3.0,6.0,158.0,0.9270347064737042,0.15961122512817383,6,0.7967964879901273,,0.7704386681057228
765,0.7759525827190482,COMPLETE,False,xgb,oof+timing,False,,,,,,,,,,,,,standard,0.007897467823670613,0.5822341004687742,0.5652229205888047,0.0023203021232820987,0.017766829824011943,3.0,2.0,184.0,0.908663249789558,0.37794065475463867,52,0.8032504566514524,,0.7759525827190482
766,0.7754620698892932,COMPLETE,False,xgb,oof+ng,False,,,,,,,,,,,,,standard,0.002903211345763587,0.5585473088284806,0.08826784647526031,0.0011398935236090868,0.015372490810003506,3.0,1.0,164.0,0.939026852027978,0.8011562824249268,237,0.8023193406353427,,0.7754620698892932
767,0.7582878941962816,COMPLETE,False,lgbm,oof+timing,False,0.007400859649086456,0.9517431999204379,0.0425487725663314,0.0011109256006141116,12.0,29.0,490.0,118.0,0.80543058444671,,,,standard,,,,,,,,,,7.812803745269775,52,0.7880534557277981,,0.7582878941962816
768,0.7754825619110806,COMPLETE,False,xgb,oof+timing,False,,,,,,,,,,,,,standard,0.001687167459113334,0.6083741420689411,0.43320872937117366,0.001804738803263727,0.020738250080119765,3.0,1.0,223.0,0.9265399543165025,0.43816685676574707,52,0.8037249474881044,,0.7754825619110806
769,0.7760124691177339,COMPLETE,True,xgb,oof+timing,False,,,,,,,,,,,,,standard,0.005721743586663076,0.5988043995232273,0.2668343449298123,0.0021341721757545083,0.0188453081626507,3.0,1.0,131.0,0.9509710950353815,0.3017606735229492,52,0.8045435624099426,,0.7760124691177339
770,0.7751829252706537,COMPLETE,False,xgb,oof+timing,False,,,,,,,,,,,,,standard,0.004110688715956793,0.5451102735543576,0.9435862863316575,0.001548088447101922,0.0010026360804882774,3.0,2.0,194.0,0.9178575299685857,0.3843355178833008,52,0.800630615662107,,0.7751829252706537
771,0.7756576716689014,COMPLETE,False,xgb,oof+timing,False,,,,,,,,,,,,,standard,0.0021446133522400033,0.5674696367577154,0.4957571247618465,0.002890497894827972,0.011792535201703721,3.0,1.0,144.0,0.9387685199037551,0.3186981678009033,52,0.802597414334962,,0.7756576716689014
772,0.7747380314789183,COMPLETE,False,xgb,oof+timing,False,,,,,,,,,,,,,standard,0.033417106033135274,0.5871975210941754,0.7822246073867286,0.0010045330055079042,0.01630168114315465,3.0,2.0,397.0,0.9318663819090658,0.7058529853820801,52,0.8034466636042829,,0.7747380314789183
773,0.7720137050791884,COMPLETE,False,lr,oof+hand,False,,,,,,,,,,0.001006573158560715,True,l2,standard,,,,,,,,,,0.04401731491088867,34,0.7951993507830359,,0.7720137050791884
774,0.7713217523845287,COMPLETE,False,xgb,oof+timing,False,,,,,,,,,,,,,standard,0.0034047264294308644,0.5252010271519885,0.3819741187480131,0.0013101551943598092,0.01419003260067137,7.0,1.0,176.0,0.9140151625973453,1.2288939952850342,52,0.7996898311726923,,0.7713217523845287
775,0.7758974050120467,COMPLETE,False,xgb,oof+timing,False,,,,,,,,,,,,,standard,0.0014443285107379545,0.6409247843797317,0.2152111955454215,0.0018386444797770397,0.01301949532168697,3.0,3.0,205.0,0.5726923486995713,0.43303680419921875,52,0.8031436305306425,,0.7758974050120467
776,0.7744514777840741,COMPLETE,False,xgb,oof+timing,False,,,,,,,,,,,,,standard,0.010027521193741387,0.8502966658520107,0.6309860287875901,0.002603044257839334,0.017499383586323768,3.0,1.0,115.0,0.949028546132264,0.27379345893859863,52,0.8013292679504929,,0.7744514777840741
777,0.7766344751110753,COMPLETE,True,xgb,oof+timing,False,,,,,,,,,,,,,standard,0.002499511451796121,0.5802188386210897,0.3396932814384571,0.0020770904105135908,0.015593955996855313,3.0,2.0,163.0,0.8624741498141006,0.3772149085998535,52,0.8053117331232331,,0.7766344751110753
778,0.7751143361937483,COMPLETE,True,xgb,all,False,,,,,,,,,,,,,standard,0.39835145447306297,0.5534131843384783,0.4866663104307624,0.005793276778377173,0.01451528308260003,3.0,2.0,149.0,0.8820426800444204,1.2907941341400146,362,0.8039225731843003,,0.7751143361937483
779,0.77601757632418,COMPLETE,True,xgb,oof+timing,False,,,,,,,,,,,,,standard,0.0027826609825378945,0.5724824728934582,0.3646093094124934,0.0030679363280568753,0.011878523082289559,3.0,2.0,160.0,0.8961569983364489,0.35251688957214355,52,0.8046539091161408,,0.77601757632418
780,0.7730803704297349,COMPLETE,True,xgb,oof+timing,True,,,,,,,,,,,,,robust,0.29233895896998713,0.5063519326521592,0.5441488937116274,0.0024691568405550033,0.013065892385070095,3.0,2.0,130.0,0.9682449859486667,0.9994049072265625,52,0.8023420405291891,,0.7730803704297349
781,0.7762106379999127,COMPLETE,True,xgb,oof+timing,False,,,,,,,,,,,,,standard,0.00188434050362115,0.5390810794323968,3.6289072762484107,0.0040187506767328,0.015079507568606895,3.0,2.0,179.0,0.9611557366516079,0.3654484748840332,52,0.8050185261610496,,0.7762106379999127
782,0.7438638210404417,COMPLETE,True,xgb,oof+timing,False,,,,,,,,,,,,,standard,0.00483137525637887,0.5723884081073914,0.41161191218761944,0.002078024661837232,0.16396318337081145,9.0,2.0,165.0,0.8490103338145328,1.0328521728515625,52,0.7750340682318874,,0.7438638210404417
783,0.7486687193635558,COMPLETE,True,xgb,oof_minus_roberta,False,,,,,,,,,,,,,standard,0.0068149712589268465,0.5573554096756822,0.3069742888989736,0.0023019232928314453,0.004576046046554436,3.0,2.0,147.0,0.8547071136330359,0.17781758308410645,5,0.7773395787467199,,0.7486687193635558
784,0.7754793907793912,COMPLETE,True,xgb,oof+ph,False,,,,,,,,,,,,,standard,0.0034402990445290063,0.5832090697891903,4.105938292615502,0.003374716595114912,0.016314353131159524,3.0,2.0,186.0,0.9051707077541372,0.38768887519836426,42,0.8046755055429252,,0.7754793907793912
785,0.7720423903766415,COMPLETE,True,xgb,oof+timing,False,,,,,,,,,,,,,none,0.0023752688731874436,0.5400895589136886,0.7017406762449958,0.0015751982757298466,0.0109573540991336,6.0,2.0,171.0,0.8839016128054488,0.8276126384735107,52,0.802456696011534,,0.7720423903766415
786,0.7732625206916156,COMPLETE,True,xgb,oof+timing,False,,,,,,,,,,,,,standard,0.00287696963036611,0.5957040054648932,0.5565388128600068,0.0018760003028202063,0.013883972656301926,3.0,2.0,783.0,0.7824083904298754,1.335097312927246,52,0.8035349409692415,,0.7732625206916156
787,0.7743446128596622,COMPLETE,True,xgb,oof+timing,False,,,,,,,,,,,,,standard,0.003872993828933069,0.563635687260227,0.41137900042966347,0.0026929016435441613,0.015663502741857183,4.0,2.0,196.0,0.9239308137404647,0.5529587268829346,52,0.8042774692098535,,0.7743446128596622
788,0.7734772433164754,COMPLETE,True,xgb,all_minus_ng,False,,,,,,,,,,,,,standard,0.2412211934562954,0.6213013260420145,2.16813954379951,0.0021193781711685623,0.013345531508879072,3.0,2.0,628.0,0.8665005051583902,2.226043224334717,131,0.8037597329735822,,0.7734772433164754
789,0.7759230148653459,COMPLETE,True,xgb,oof+timing,False,,,,,,,,,,,,,standard,0.005172137790510539,0.5777879838693706,0.32883711448093855,0.0013433441471911703,0.018954225537438023,3.0,3.0,153.0,0.9442674472658436,0.3544042110443115,52,0.805078060836346,,0.7759230148653459
