number,value,state,params_add_group_dummies,params_family,params_feature_subset,params_isotonic,params_lgbm_alpha,params_lgbm_colsample,params_lgbm_lambda,params_lgbm_lr,params_lgbm_max_depth,params_lgbm_min_child,params_lgbm_n_estimators,params_lgbm_num_leaves,params_lgbm_subsample,params_lr_C,params_lr_class_weight_balanced,params_lr_penalty,params_scaler,params_xgb_alpha,params_xgb_colsample,params_xgb_gamma,params_xgb_lambda,params_xgb_lr,params_xgb_max_depth,params_xgb_min_child,params_xgb_n_estimators,params_xgb_subsample,user_attrs_elapsed_sec,user_attrs_n_features,user_attrs_pooled_auroc,user_attrs_pruned_reason,user_attrs_weighted_auroc
1248,0.7768169912951045,COMPLETE,True,lr,oof_only,False,,,,,,,,,,0.8147014477939027,True,l1,none,,,,,,,,,,0.15371108055114746,6,0.8053309124316914,,0.7768169912951045
1249,0.7768732899251352,COMPLETE,True,lr,oof_only,False,,,,,,,,,,0.5964236648236197,True,l1,none,,,,,,,,,,0.1427767276763916,6,0.8053629129764889,,0.7768732899251352
1250,0.772891373791409,COMPLETE,True,lr,oof_only,True,,,,,,,,,,1.0212695588594138,True,l1,none,,,,,,,,,,0.4730415344238281,6,0.8026128628738296,,0.772891373791409
1251,0.7768654150231383,COMPLETE,True,lr,oof_only,False,,,,,,,,,,0.5316227948734995,True,l1,none,,,,,,,,,,0.14311671257019043,6,0.8053749460220695,,0.7768654150231383
1252,0.7768791405019453,COMPLETE,True,lr,oof_only,False,,,,,,,,,,0.6894269584545264,True,l1,none,,,,,,,,,,0.16298246383666992,6,0.8053654351869162,,0.7768791405019453
1253,0.7768572904846364,COMPLETE,True,lr,oof_only,False,,,,,,,,,,0.4825815299332467,True,l1,none,,,,,,,,,,0.14710211753845215,6,0.8053803057192277,,0.7768572904846364
1254,0.7767992944066492,COMPLETE,True,lr,oof_only,False,,,,,,,,,,0.782632554508661,False,l1,none,,,,,,,,,,0.1464672088623047,6,0.805435951986782,,0.7767992944066492
1255,0.776871033467562,COMPLETE,True,lr,oof_only,False,,,,,,,,,,0.5950093460477883,True,l1,none,,,,,,,,,,0.14661383628845215,6,0.8053614416870729,,0.776871033467562
1256,0.7768288096548194,COMPLETE,True,lr,oof_only,False,,,,,,,,,,0.9481002929890654,True,l2,none,,,,,,,,,,0.10959839820861816,6,0.8052219844688587,,0.7768288096548194
1257,0.7768668025727558,COMPLETE,True,lr,oof_only,False,,,,,,,,,,0.4929610852602513,True,l1,none,,,,,,,,,,0.12818455696105957,6,0.8053859281466388,,0.7768668025727558
1258,0.7768852435592656,COMPLETE,True,lr,oof_only,False,,,,,,,,,,0.6710763275831098,True,l1,none,,,,,,,,,,0.14827680587768555,6,0.8053650148185117,,0.7768852435592656
1259,0.7768647900962016,COMPLETE,True,lr,oof_only,False,,,,,,,,,,0.7482901920113787,True,l1,none,,,,,,,,,,0.16228532791137695,6,0.8053517732137679,,0.7768647900962016
1260,0.7767099219686413,COMPLETE,True,lr,oof_only,False,,,,,,,,,,0.22984567600281255,True,l1,none,,,,,,,,,,0.08940005302429199,6,0.8052389042971424,,0.7767099219686413
1261,0.776870752424103,COMPLETE,True,lr,oof_only,False,,,,,,,,,,0.5912119497710486,True,l1,none,,,,,,,,,,0.13621115684509277,6,0.8053683777657481,,0.776870752424103
1262,0.7768142061339183,COMPLETE,True,lr,oof_only,False,,,,,,,,,,1.0242541414217847,True,l1,none,,,,,,,,,,0.18572497367858887,6,0.8052964947685677,,0.7768142061339183
1263,0.7768756322645364,COMPLETE,True,lr,oof_only,False,,,,,,,,,,0.33238206643018753,True,l1,none,,,,,,,,,,0.10014843940734863,6,0.8053434709377778,,0.7768756322645364
1264,0.7759941880867749,COMPLETE,True,lr,oof_only,False,,,,,,,,,,0.15961149944466055,True,l1,none,,,,,,,,,,0.07245945930480957,6,0.8049118576783915,,0.7759941880867749
1265,0.7768881209195867,COMPLETE,True,lr,oof_only,False,,,,,,,,,,0.3330481388016886,True,l1,none,,,,,,,,,,0.1031806468963623,6,0.8053469389771155,,0.7768881209195867
1266,0.7768791392260794,COMPLETE,True,lr,oof_only,False,,,,,,,,,,0.3225198836292019,True,l1,none,,,,,,,,,,0.10085368156433105,6,0.8053403181747435,,0.7768791392260794
1267,0.7767721883495734,COMPLETE,True,lr,oof_only,False,,,,,,,,,,0.2467078182889546,True,l1,none,,,,,,,,,,0.08331561088562012,6,0.8052673842565518,,0.7767721883495734
1268,0.7768831577450165,COMPLETE,True,lr,oof_only,False,,,,,,,,,,0.33003321817476244,True,l1,none,,,,,,,,,,0.10484051704406738,6,0.805343576029879,,0.7768831577450165
1269,0.7768904579192482,COMPLETE,True,lr,oof_only,False,,,,,,,,,,0.3345628485395878,True,l1,none,,,,,,,,,,0.09644222259521484,6,0.8053486204507337,,0.7768904579192482
1270,0.7720307775564993,COMPLETE,True,lr,oof_only,True,,,,,,,,,,0.1980643187846435,True,l1,none,,,,,,,,,,0.20051288604736328,6,0.8018596677849519,,0.7720307775564993
1271,0.776891051058916,COMPLETE,True,lr,oof_only,False,,,,,,,,,,0.34529041315002684,True,l1,none,,,,,,,,,,0.10827255249023438,6,0.8053576583714318,,0.776891051058916
1272,0.7768852277566367,COMPLETE,True,lr,oof_only,False,,,,,,,,,,0.3430705911166074,True,l1,none,,,,,,,,,,0.11520695686340332,6,0.8053558192596618,,0.7768852277566367
1273,0.7768836844664899,COMPLETE,True,lr,oof_only,False,,,,,,,,,,0.34283603864271994,True,l1,none,,,,,,,,,,0.11342287063598633,6,0.8053551361610045,,0.7768836844664899
1274,0.776731035805528,COMPLETE,True,lr,oof_only,False,,,,,,,,,,0.2778618459988721,True,l1,none,,,,,,,,,,0.09604239463806152,6,0.8052872466636672,,0.776731035805528
1275,0.7766757965482493,COMPLETE,True,lr,oof_only,False,,,,,,,,,,0.3119373468166668,False,l2,none,,,,,,,,,,0.048494577407836914,6,0.8053258154647861,,0.7766757965482493
1276,0.7766857269911658,COMPLETE,True,lr,oof_only,False,,,,,,,,,,0.22504123381874405,True,l1,none,,,,,,,,,,0.08487057685852051,6,0.8052267136134099,,0.7766857269911658
1277,0.7768874589833616,COMPLETE,True,lr,oof_only,False,,,,,,,,,,0.34789417063509087,True,l1,none,,,,,,,,,,0.1118614673614502,6,0.8053557667136113,,0.7768874589833616
1278,0.7768764435873394,COMPLETE,True,lr,oof_only,False,,,,,,,,,,0.3394537794239143,True,l1,none,,,,,,,,,,0.10959100723266602,6,0.8053452575034972,,0.7768764435873394
1279,0.776380365401272,COMPLETE,True,lr,oof_only,False,,,,,,,,,,0.1891521248708212,True,l1,none,,,,,,,,,,0.08421063423156738,6,0.805095453579085,,0.776380365401272
1280,0.7767635687817671,COMPLETE,True,lr,oof_only,False,,,,,,,,,,0.2538077953072151,True,l1,none,,,,,,,,,,0.08913254737854004,6,0.8052731643221145,,0.7767635687817671
1281,0.7768512673236629,COMPLETE,True,lr,oof_only,False,,,,,,,,,,0.4331621470333381,True,l1,none,,,,,,,,,,0.1260223388671875,6,0.805364594450107,,0.7768512673236629
1282,0.7768673609707527,COMPLETE,True,lr,oof_only,False,,,,,,,,,,0.36586524115271946,True,l1,none,,,,,,,,,,0.11661362648010254,6,0.805358866930595,,0.7768673609707527
1283,0.7767910186237864,COMPLETE,True,lr,oof_only,False,,,,,,,,,,0.25874072615063687,True,l1,none,,,,,,,,,,0.09334659576416016,6,0.805282517519116,,0.7767910186237864
1284,0.77491404088739,COMPLETE,True,lr,oof_only,False,,,,,,,,,,0.08331283458909272,True,l1,none,,,,,,,,,,0.06080365180969238,6,0.8041074827362579,,0.77491404088739
1285,0.7768558120225442,COMPLETE,True,lr,oof_only,False,,,,,,,,,,0.4388336102642985,True,l1,none,,,,,,,,,,0.1336500644683838,6,0.8053686930420516,,0.7768558120225442
1286,0.7768869955349968,COMPLETE,True,lr,oof_only,False,,,,,,,,,,0.34153612090448626,True,l1,none,,,,,,,,,,0.1125636100769043,6,0.8053531394110828,,0.7768869955349968
1287,0.7768932546792434,COMPLETE,True,lr,oof_only,False,,,,,,,,,,0.3352568513800104,True,l1,none,,,,,,,,,,0.11197829246520996,6,0.8053485153586326,,0.7768932546792434
1288,0.7720792128863486,COMPLETE,True,lr,oof_only,True,,,,,,,,,,0.344380597428024,True,l1,none,,,,,,,,,,0.2743654251098633,6,0.8021273899126087,,0.7720792128863486
1289,0.7767703649858483,COMPLETE,True,lr,oof_only,False,,,,,,,,,,0.2638755212774025,True,l1,none,,,,,,,,,,0.09236264228820801,6,0.8052837786243296,,0.7767703649858483
1290,0.7761055085531092,COMPLETE,True,lr,oof_only,False,,,,,,,,,,0.16733978715065428,True,l1,none,,,,,,,,,,0.08091306686401367,6,0.8049703939787272,,0.7761055085531092
1291,0.7768755345929446,COMPLETE,True,lr,oof_only,False,,,,,,,,,,0.3394025216588528,True,l1,none,,,,,,,,,,0.11035394668579102,6,0.8053447320429915,,0.7768755345929446
1292,0.7767717925709642,COMPLETE,True,lr,oof_only,False,,,,,,,,,,0.26397714172093445,True,l1,none,,,,,,,,,,0.09250926971435547,6,0.8052837786243296,,0.7767717925709642
1293,0.7766667757391367,COMPLETE,True,lr,oof_only,False,,,,,,,,,,0.2219519051164686,True,l1,none,,,,,,,,,,0.08661341667175293,6,0.8052261881529044,,0.7766667757391367
1294,0.7768548771116615,COMPLETE,True,lr,oof_only,False,,,,,,,,,,0.4308430402551885,True,l1,none,,,,,,,,,,0.12311458587646484,6,0.8053642266277532,,0.7768548771116615
1295,0.7767729777656688,COMPLETE,True,lr,oof_only,False,,,,,,,,,,0.34213028216591557,False,l1,none,,,,,,,,,,0.09588789939880371,6,0.8053411589115527,,0.7767729777656688
1296,0.7768738024220058,COMPLETE,True,lr,oof_only,False,,,,,,,,,,0.4156621207539798,True,l1,none,,,,,,,,,,0.12755775451660156,6,0.8053687981341529,,0.7768738024220058
1297,0.7766756198982541,COMPLETE,True,lr,oof_only,False,,,,,,,,,,0.18939795813915022,True,l2,none,,,,,,,,,,0.05282855033874512,6,0.8052033831669567,,0.7766756198982541
1298,0.7757544440024212,COMPLETE,True,lr,oof_only,False,,,,,,,,,,0.13898029979588902,True,l1,none,,,,,,,,,,0.07787823677062988,6,0.8047265277580291,,0.7757544440024212
1299,0.7768590634456934,COMPLETE,True,lr,oof_only,False,,,,,,,,,,0.3061963087093976,True,l1,none,,,,,,,,,,0.10104775428771973,6,0.8053291784120226,,0.7768590634456934
1300,0.7768519431826886,COMPLETE,True,lr,oof_only,False,,,,,,,,,,0.4211971568902124,True,l1,none,,,,,,,,,,0.12890195846557617,6,0.8053587092924432,,0.7768519431826886
1301,0.7767580671861731,COMPLETE,True,lr,oof_only,False,,,,,,,,,,0.2662136654250744,True,l1,none,,,,,,,,,,0.09144711494445801,6,0.8052891383214879,,0.7767580671861731
1302,0.7768722737000787,COMPLETE,True,lr,oof_only,False,,,,,,,,,,0.35748937407354986,True,l1,none,,,,,,,,,,0.1206808090209961,6,0.8053559768978135,,0.7768722737000787
1303,0.7767426738654647,COMPLETE,True,lr,oof_only,False,,,,,,,,,,0.2408998735758654,True,l1,none,,,,,,,,,,0.08987903594970703,6,0.8052607109081292,,0.7767426738654647
1304,0.776853871182362,COMPLETE,True,lr,oof_only,False,,,,,,,,,,0.4636461276565137,True,l1,none,,,,,,,,,,0.12918829917907715,6,0.805373790008957,,0.776853871182362
1305,0.7768923438028551,COMPLETE,True,lr,oof_only,False,,,,,,,,,,0.3159868911604216,True,l1,none,,,,,,,,,,0.10448217391967773,6,0.8053348533854843,,0.7768923438028551
1306,0.776851786751715,COMPLETE,True,lr,oof_only,False,,,,,,,,,,0.3032099759335299,True,l1,none,,,,,,,,,,0.09930992126464844,6,0.805325342550331,,0.776851786751715
1307,0.7717628176430412,COMPLETE,True,lr,oof_only,True,,,,,,,,,,0.20743740815973397,True,l1,none,,,,,,,,,,0.21037650108337402,6,0.8017805334327925,,0.7717628176430412
1308,0.7768473353427534,COMPLETE,True,lr,oof_only,False,,,,,,,,,,0.43227911838171645,True,l1,none,,,,,,,,,,0.13342881202697754,6,0.8053648046343094,,0.7768473353427534
1309,0.7767886439184138,COMPLETE,True,lr,oof_only,False,,,,,,,,,,0.2927325871749349,True,l1,none,,,,,,,,,,0.09708786010742188,6,0.8053154113467733,,0.7767886439184138
1310,0.776630183946133,COMPLETE,True,lr,oof_only,False,,,,,,,,,,0.21934844670060735,True,l1,none,,,,,,,,,,0.08524680137634277,6,0.8052172553243074,,0.776630183946133
1311,0.7768754075035634,COMPLETE,True,lr,oof_only,False,,,,,,,,,,0.4901271275433827,True,l1,none,,,,,,,,,,0.1347031593322754,6,0.8053850874098296,,0.7768754075035634
1312,0.776867437257222,COMPLETE,True,lr,oof_only,False,,,,,,,,,,0.3527095764224821,True,l1,none,,,,,,,,,,0.11596369743347168,6,0.8053574481872297,,0.776867437257222
1313,0.7760340197353158,COMPLETE,True,lr,oof_only,False,,,,,,,,,,0.16241074441720707,True,l1,none,,,,,,,,,,0.08062505722045898,6,0.8049327710065186,,0.7760340197353158
1314,0.776731035805528,COMPLETE,True,lr,oof_only,False,,,,,,,,,,0.2778357991330556,True,l1,none,,,,,,,,,,0.09551215171813965,6,0.8052869313873638,,0.776731035805528
1315,0.776817431792013,COMPLETE,True,lr,oof_only,False,,,,,,,,,,0.4802917161152934,False,l2,none,,,,,,,,,,0.0512239933013916,6,0.805440470947131,,0.776817431792013
1316,0.7768731090489298,COMPLETE,True,lr,oof_only,False,,,,,,,,,,0.3559124410029648,True,l1,none,,,,,,,,,,0.12098860740661621,6,0.805355924351763,,0.7768731090489298
1317,0.7765421144776933,COMPLETE,True,lr,oof_only,False,,,,,,,,,,0.20505813243682053,True,l1,none,,,,,,,,,,0.08830380439758301,6,0.8051679145828217,,0.7765421144776933
1318,0.7767304112546006,COMPLETE,True,lr,oof_only,False,,,,,,,,,,0.2831512740203498,True,l1,none,,,,,,,,,,0.0942220687866211,6,0.8052956540317586,,0.7767304112546006
1319,0.776863853928637,COMPLETE,True,lr,oof_only,False,,,,,,,,,,0.4521562201381254,True,l1,none,,,,,,,,,,0.13561272621154785,6,0.8053711101603779,,0.776863853928637
1320,0.7768539779898478,COMPLETE,True,lr,oof_only,False,,,,,,,,,,0.3749953676120105,True,l1,none,,,,,,,,,,0.12548232078552246,6,0.8053541903320942,,0.7768539779898478
1321,0.7768740639689373,COMPLETE,True,lr,oof_only,False,,,,,,,,,,0.546263160311678,True,l1,none,,,,,,,,,,0.14435338973999023,6,0.8053728441800467,,0.7768740639689373
1322,0.776754988139179,COMPLETE,True,lr,oof_only,False,,,,,,,,,,0.2429211285366694,True,l1,none,,,,,,,,,,0.09026050567626953,6,0.8052584514279547,,0.776754988139179
1323,0.7768861174073479,COMPLETE,True,lr,oof_only,False,,,,,,,,,,0.3250434308885487,True,l1,none,,,,,,,,,,0.11012816429138184,6,0.8053411589115527,,0.7768861174073479
1324,0.7768705875144502,COMPLETE,True,lr,oof_only,False,,,,,,,,,,0.4603821244605154,True,l1,none,,,,,,,,,,0.13684821128845215,6,0.805371215252479,,0.7768705875144502
1325,0.7768738387015184,COMPLETE,True,lr,oof_only,False,,,,,,,,,,0.34995462923113424,True,l1,none,,,,,,,,,,0.11324191093444824,6,0.8053554514373078,,0.7768738387015184
1326,0.7768740323964091,COMPLETE,True,lr,oof_only,False,,,,,,,,,,0.5640733730484175,True,l1,none,,,,,,,,,,0.14446234703063965,6,0.8053724763576928,,0.7768740323964091
1327,0.7762240730219663,COMPLETE,True,lr,oof_only,False,,,,,,,,,,0.1757093809336944,True,l1,none,,,,,,,,,,0.08377981185913086,6,0.8050183159768474,,0.7762240730219663
1328,0.7717046993636638,COMPLETE,True,lr,oof_only,True,,,,,,,,,,0.2850216435039844,True,l1,none,,,,,,,,,,0.23720169067382812,6,0.8019265589073281,,0.7717046993636638
1329,0.7768280236682569,COMPLETE,True,lr,oof_only,False,,,,,,,,,,0.8260940441426738,True,l1,none,,,,,,,,,,0.1636946201324463,6,0.8053304395172364,,0.7768280236682569
1330,0.7768658650030907,COMPLETE,True,lr,oof_only,False,,,,,,,,,,0.3672196521758444,True,l1,none,,,,,,,,,,0.12297701835632324,6,0.8053599703976569,,0.7768658650030907
1331,0.7766791798205721,COMPLETE,True,lr,oof_only,False,,,,,,,,,,0.22305678022262226,True,l1,none,,,,,,,,,,0.0852506160736084,6,0.8052248219555895,,0.7766791798205721
1332,0.7768636712683843,COMPLETE,True,lr,oof_only,False,,,,,,,,,,0.43742357574882895,True,l1,none,,,,,,,,,,0.13068294525146484,6,0.8053676421210402,,0.7768636712683843
1333,0.7768763938234795,COMPLETE,True,lr,oof_only,False,,,,,,,,,,0.5602310128878193,True,l1,none,,,,,,,,,,0.13880348205566406,6,0.8053721610813893,,0.7768763938234795
1334,0.7766228629016396,COMPLETE,True,lr,oof_only,False,,,,,,,,,,0.284388268432278,False,l1,none,,,,,,,,,,0.08412384986877441,6,0.8052431079811881,,0.7766228629016396
1335,0.7768690168129863,COMPLETE,True,lr,oof_only,False,,,,,,,,,,0.3683969132999844,True,l1,none,,,,,,,,,,0.1192467212677002,6,0.8053557667136113,,0.7768690168129863
1336,0.7765996259581179,COMPLETE,True,lr,oof_only,False,,,,,,,,,,0.14704949374903084,True,l2,none,,,,,,,,,,0.053627729415893555,6,0.8051324459986865,,0.7765996259581179
1337,0.776746904585394,COMPLETE,True,lr,oof_only,False,,,,,,,,,,0.23919769362994212,True,l1,none,,,,,,,,,,0.08675312995910645,6,0.8052528815465942,,0.776746904585394
1338,0.7768575459669599,COMPLETE,True,lr,oof_only,False,,,,,,,,,,0.4806170310713448,True,l1,none,,,,,,,,,,0.13850808143615723,6,0.805379885350823,,0.7768575459669599
1339,0.7768907893557556,COMPLETE,True,lr,oof_only,False,,,,,,,,,,0.320533131633772,True,l1,none,,,,,,,,,,0.1081228256225586,6,0.8053395825300356,,0.7768907893557556
1340,0.7768057912790607,COMPLETE,True,lr,oof_only,False,,,,,,,,,,0.9160687461380976,True,l1,none,,,,,,,,,,0.17792534828186035,6,0.805309316004907,,0.7768057912790607
1341,0.7764998216211737,COMPLETE,True,lr,oof_only,False,,,,,,,,,,0.1990185990656193,True,l1,none,,,,,,,,,,0.0854644775390625,6,0.8051520982215999,,0.7764998216211737
1342,0.776889002885287,COMPLETE,True,lr,oof_only,False,,,,,,,,,,0.619406565919899,True,l1,none,,,,,,,,,,0.14986300468444824,6,0.8053660657395232,,0.776889002885287
1343,0.7768655849611997,COMPLETE,True,lr,oof_only,False,,,,,,,,,,0.6530155019958149,True,l1,none,,,,,,,,,,0.15508580207824707,6,0.8053619671475787,,0.7768655849611997
1344,0.7768661013207526,COMPLETE,True,lr,oof_only,False,,,,,,,,,,0.7534277212999927,True,l1,none,,,,,,,,,,0.16648030281066895,6,0.805350301924352,,0.7768661013207526
1345,0.7729419326786011,COMPLETE,True,lr,oof_only,True,,,,,,,,,,1.110137513412497,True,l1,none,,,,,,,,,,0.5017409324645996,6,0.8025771841054923,,0.7729419326786011
1346,0.776875812092604,COMPLETE,True,lr,oof_only,False,,,,,,,,,,0.568866264476958,True,l1,none,,,,,,,,,,0.14612650871276855,6,0.8053732120024008,,0.776875812092604
1347,0.7768496307184745,COMPLETE,True,lr,oof_only,False,,,,,,,,,,0.39205570011737945,True,l1,none,,,,,,,,,,0.12203192710876465,6,0.8053576583714318,,0.7768496307184745
1348,0.7768505032911108,COMPLETE,True,lr,oof_only,False,,,,,,,,,,0.46647672394522466,True,l1,none,,,,,,,,,,0.13760900497436523,6,0.8053717407129847,,0.7768505032911108
1349,0.7768341593593422,COMPLETE,True,lr,oof_only,False,,,,,,,,,,0.7893553697494625,True,l1,none,,,,,,,,,,0.16597890853881836,6,0.8053395825300357,,0.7768341593593422
1350,0.7768666850750426,COMPLETE,True,lr,oof_only,False,,,,,,,,,,0.5865348642331507,True,l1,none,,,,,,,,,,0.13918495178222656,6,0.8053701117854171,,0.7768666850750426
1351,0.7767529204560735,COMPLETE,True,lr,oof_only,False,,,,,,,,,,0.2677724410748304,True,l1,none,,,,,,,,,,0.09323310852050781,6,0.8052879823083754,,0.7767529204560735
1352,0.776848547533259,COMPLETE,True,lr,oof_only,False,,,,,,,,,,0.4268263552309006,True,l1,none,,,,,,,,,,0.12921690940856934,6,0.805362545154135,,0.776848547533259
1353,0.7768789347455696,COMPLETE,True,lr,oof_only,False,,,,,,,,,,0.31120474211027144,True,l1,none,,,,,,,,,,0.10216593742370605,6,0.8053323311750569,,0.7768789347455696
1354,0.7724169770031575,COMPLETE,True,lr,oof_only,False,,,,,,,,,,0.010033283501941857,True,l1,none,,,,,,,,,,0.04833507537841797,6,0.7990450911321919,,0.7724169770031575
1355,0.7767698767641087,COMPLETE,True,lr,oof_only,False,,,,,,,,,,61.53774677944292,True,l1,none,,,,,,,,,,2.8732337951660156,6,0.8051845716808526,,0.7767698767641087
1356,0.77684277842689,COMPLETE,True,lr,oof_only,False,,,,,,,,,,0.5321778645510067,False,l2,none,,,,,,,,,,0.049794912338256836,6,0.8054179812374869,,0.77684277842689
1357,0.7768668145214834,COMPLETE,True,lr,oof_only,False,,,,,,,,,,0.4070727268810471,True,l1,none,,,,,,,,,,0.12451910972595215,6,0.805367537028939,,0.7768668145214834
1358,0.7768188284237795,COMPLETE,True,lr,oof_only,False,,,,,,,,,,0.9300167624710791,True,l1,none,,,,,,,,,,0.18720316886901855,6,0.8053070565247324,,0.7768188284237795
1359,0.7767549528866752,COMPLETE,True,lr,oof_only,False,,,,,,,,,,0.2419829049042775,True,l1,none,,,,,,,,,,0.08960986137390137,6,0.805258661612157,,0.7767549528866752
1360,0.7768762451334396,COMPLETE,True,lr,oof_only,False,,,,,,,,,,0.3498055733253333,True,l1,none,,,,,,,,,,0.11308073997497559,6,0.8053554514373079,,0.7768762451334396
1361,0.7768723519910691,COMPLETE,True,lr,oof_only,False,,,,,,,,,,0.6958596505983575,True,l1,none,,,,,,,,,,0.1572551727294922,6,0.8053604433121121,,0.7768723519910691
1362,0.7752921451957433,COMPLETE,True,lr,oof_only,False,,,,,,,,,,0.11723494918333262,True,l1,none,,,,,,,,,,0.06996655464172363,6,0.8043955401854855,,0.7752921451957433
1363,0.7709683031199,COMPLETE,True,lr,oof_only,True,,,,,,,,,,0.030956254115820626,True,l1,none,,,,,,,,,,0.1342906951904297,6,0.7993596843369576,,0.7709683031199
1364,0.7768628002139725,COMPLETE,True,lr,oof_only,False,,,,,,,,,,0.49134307654604836,True,l1,none,,,,,,,,,,0.13534045219421387,6,0.805383090659908,,0.7768628002139725
1365,0.7768740975996739,COMPLETE,True,lr,oof_only,False,,,,,,,,,,0.3097745082262575,True,l1,none,,,,,,,,,,0.10088515281677246,6,0.8053304395172363,,0.7768740975996739
1366,0.776408652105247,COMPLETE,True,lr,oof_only,False,,,,,,,,,,0.1920868100876612,True,l1,none,,,,,,,,,,0.08209443092346191,6,0.805114159973088,,0.776408652105247
1367,0.7768757777400198,COMPLETE,True,lr,oof_only,False,,,,,,,,,,0.6610789839706509,True,l1,none,,,,,,,,,,0.1595757007598877,6,0.8053630706146406,,0.7768757777400198
1368,0.7768693248886578,COMPLETE,True,lr,oof_only,False,,,,,,,,,,0.39481077388544583,True,l1,none,,,,,,,,,,0.11707258224487305,6,0.805360706042365,,0.7768693248886578
1369,0.7767691751643363,COMPLETE,True,lr,oof_only,False,,,,,,,,,,0.24543548876353244,True,l1,none,,,,,,,,,,0.0817105770111084,6,0.8052598176252695,,0.7767691751643363
1370,0.7768523834419425,COMPLETE,True,lr,oof_only,False,,,,,,,,,,0.525912117275419,True,l1,none,,,,,,,,,,0.1325373649597168,6,0.8053736849168559,,0.7768523834419425
1371,0.7768834290175753,COMPLETE,True,lr,oof_only,False,,,,,,,,,,0.32687761871460763,True,l1,none,,,,,,,,,,0.09755539894104004,6,0.8053419996483617,,0.7768834290175753
1372,0.7768534314007394,COMPLETE,True,lr,oof_only,False,,,,,,,,,,0.46087099738832404,True,l1,none,,,,,,,,,,0.12037873268127441,6,0.8053707948840745,,0.7768534314007394
1373,0.7758827710941327,COMPLETE,True,lr,oof_only,False,,,,,,,,,,0.1799169205043981,False,l1,none,,,,,,,,,,0.06365776062011719,6,0.8048264703462142,,0.7758827710941327
1374,0.7766995719849789,COMPLETE,True,lr,oof_only,False,,,,,,,,,,0.26722024088293556,True,l2,none,,,,,,,,,,0.23015308380126953,6,0.8052044340879682,,0.7766995719849789
1375,0.7768272616041775,COMPLETE,True,lr,oof_only,False,,,,,,,,,,0.8301995798771844,True,l1,none,,,,,,,,,,0.1579883098602295,6,0.8053284427673146,,0.7768272616041775
