number,value,state,params_add_group_dummies,params_family,params_feature_subset,params_isotonic,params_lgbm_alpha,params_lgbm_colsample,params_lgbm_lambda,params_lgbm_lr,params_lgbm_max_depth,params_lgbm_min_child,params_lgbm_n_estimators,params_lgbm_num_leaves,params_lgbm_subsample,params_lr_C,params_lr_class_weight_balanced,params_lr_penalty,params_scaler,params_xgb_alpha,params_xgb_colsample,params_xgb_gamma,params_xgb_lambda,params_xgb_lr,params_xgb_max_depth,params_xgb_min_child,params_xgb_n_estimators,params_xgb_subsample,user_attrs_elapsed_sec,user_attrs_n_features,user_attrs_pooled_auroc,user_attrs_pruned_reason,user_attrs_weighted_auroc
1027,0.7679473167366206,COMPLETE,False,xgb,oof+timing,False,,,,,,,,,,,,,none,0.20311080889308955,0.5877850349621776,0.07604857647091665,0.039427829131725906,0.011544179571131899,10.0,3.0,177.0,0.9776811364288172,2.358783483505249,52,0.7965251927310315,,0.7679473167366206
1028,0.7723760465645504,COMPLETE,False,xgb,oof+timing,True,,,,,,,,,,,,,none,0.23813310719896993,0.37294987249121175,0.40828761291355586,0.0022845233029679802,0.015551675359885744,3.0,3.0,155.0,0.9109149998378193,1.219757080078125,52,0.7994709768720659,,0.7723760465645504
1029,0.7743930584962183,COMPLETE,False,xgb,oof+hand,False,,,,,,,,,,,,,none,0.33486560299949275,0.5627774200998767,0.17668671633868444,0.03267054330448183,0.026527041138832835,3.0,3.0,193.0,0.9443700955553256,0.34049248695373535,34,0.8033020568731127,,0.7743930584962183
1030,0.7762277345925602,COMPLETE,False,xgb,oof+timing,False,,,,,,,,,,,,,none,0.14728504244125085,0.5818092102946885,0.620239276430858,0.0024737232481131166,0.01901427133517708,3.0,3.0,217.0,0.9259203654127504,0.4694397449493408,52,0.8041474177346914,,0.7762277345925602
1031,0.7748749163787058,COMPLETE,False,xgb,oof+timing,False,,,,,,,,,,,,,none,0.25676660284562275,0.6177783100191268,0.3557453431104466,0.4798896516701781,0.002273872577522773,3.0,3.0,171.0,0.9590640188665892,0.38743042945861816,52,0.8007337110133264,,0.7748749163787058
1032,0.7745224912069042,COMPLETE,False,xgb,oof+timing,False,,,,,,,,,,,,,standard,0.11234548507269103,0.598568325680278,0.51163887857575,0.0030974436259312865,0.017308286849516456,3.0,3.0,265.0,0.8413972325249366,0.5664315223693848,52,0.8030978629205956,,0.7745224912069042
1033,0.7727464310283088,COMPLETE,False,xgb,oof+timing,False,,,,,,,,,,,,,standard,0.170546742897437,0.5674622149348997,0.23277112320803472,0.17098187189785086,0.01378643696848636,5.0,3.0,142.0,0.9336187525143347,0.5852634906768799,52,0.8012399922105735,,0.7727464310283088
1034,0.7522773713832952,COMPLETE,True,lgbm,all,False,0.08089178391363742,0.8405855534153132,0.11626204152145672,0.06627964392634736,7.0,28.0,573.0,202.0,0.6757667896844108,,,,none,,,,,,,,,,7.2631707191467285,362,0.7828578598855358,,0.7522773713832952
1035,0.775186330109754,COMPLETE,False,xgb,oof+timing,False,,,,,,,,,,,,,none,0.2891551967711442,0.5825025966493147,0.31677536979379084,0.0024608643631294997,0.022307442970379045,3.0,4.0,187.0,0.9204489292694789,0.42029500007629395,52,0.8035152887463279,,0.775186330109754
1036,0.7763774525511437,COMPLETE,False,xgb,oof+timing,False,,,,,,,,,,,,,none,0.22934910141652792,0.6060657615640455,0.4880315478514903,0.003721298860172826,0.015980767121365057,3.0,3.0,203.0,0.9464129584087175,0.47109532356262207,52,0.8039988700497286,,0.7763774525511437
1037,0.7753041489611827,COMPLETE,False,xgb,oof+timing,False,,,,,,,,,,,,,none,0.19845198777726225,0.5908868901401174,0.09165244272750736,1.0918107236172239,0.01213050664116326,3.0,3.0,158.0,0.906986534610288,0.38616013526916504,52,0.8022542886247364,,0.7753041489611827
1038,0.7735880948524753,COMPLETE,False,xgb,oof+timing,False,,,,,,,,,,,,,none,0.31329071865772123,0.5640018359531149,0.6425949241934137,0.0028050402370684473,0.019013577276703587,4.0,4.0,176.0,0.9303575311778374,0.5454652309417725,52,0.8019371732095433,,0.7735880948524753
1039,0.7498066996987617,COMPLETE,False,xgb,oof_minus_roberta,False,,,,,,,,,,,,,standard,0.4341454831648254,0.6234763884166022,0.3960289105141889,0.004530031070289219,0.015329405914677173,3.0,1.0,163.0,0.8951310765239632,0.20909881591796875,5,0.7773955402905774,,0.7498066996987617
1040,0.7745418732544036,COMPLETE,False,xgb,oof+ph,False,,,,,,,,,,,,,none,0.34589571616949394,0.5799518121943374,0.2672276576972271,0.0022831704919591238,0.016933643658515903,3.0,1.0,189.0,0.9410028888105969,0.42653393745422363,42,0.8024787653527736,,0.7745418732544036
1041,0.7738264700011045,COMPLETE,False,xgb,oof+timing,False,,,,,,,,,,,,,standard,0.15119779096036032,0.5975480038798714,0.45266062602270063,0.003154336374369285,0.04988858849039757,3.0,3.0,145.0,0.9217314090304916,0.3453714847564697,52,0.8029106413424129,,0.7738264700011045
1042,0.7719042266117292,COMPLETE,True,lr,oof+timing,False,,,,,,,,,,99.49945996678734,True,l1,standard,,,,,,,,,,1.845670461654663,52,0.8009276584859822,,0.7719042266117292
1043,0.7761466684742141,COMPLETE,False,xgb,oof+timing,False,,,,,,,,,,,,,standard,0.2561123358854458,0.5511607401671424,0.5489821170680085,0.002196578994746608,0.01356485953677146,3.0,1.0,172.0,0.9519158857503531,0.40504002571105957,52,0.803022827160381,,0.7761466684742141
1044,0.7751761530306778,COMPLETE,False,xgb,oof+timing,False,,,,,,,,,,,,,standard,0.21338866264323342,0.6366658987904894,0.16847519299099334,0.0026590483514437684,0.020689656767207524,3.0,3.0,210.0,0.9338982005446607,0.5160136222839355,52,0.8035668889679882,,0.7751761530306778
1045,0.7761263849003048,COMPLETE,False,xgb,oof+timing,False,,,,,,,,,,,,,standard,0.18374312992111402,0.5717218800674612,0.3191393295468832,0.002165556700077624,0.014564655592295172,3.0,1.0,184.0,0.9631275333795808,0.41132068634033203,52,0.8032932816826674,,0.7761263849003048
1046,0.7756571546373684,COMPLETE,False,xgb,oof+timing,False,,,,,,,,,,,,,standard,0.3760934021069194,0.611915208453709,0.004028244405647308,0.005518238276468387,0.01779698928156444,3.0,1.0,155.0,0.9127834739645366,0.3645944595336914,52,0.8028713368965861,,0.7756571546373684
1047,0.7736338205357431,COMPLETE,False,xgb,all_minus_ng,False,,,,,,,,,,,,,standard,0.2799917454970834,0.5921181649769122,0.4201577652777828,0.003849235810501345,0.015939885216676258,4.0,3.0,200.0,0.9251723392575998,1.135676622390747,131,0.8020815172104605,,0.7736338205357431
1048,0.7731869220009212,COMPLETE,False,xgb,oof+timing,True,,,,,,,,,,,,,standard,0.22427390437640918,0.5598688992002006,0.6367864488513657,0.0032270167502011864,0.01279302993850395,3.0,1.0,170.0,0.9382229259779672,1.3907830715179443,52,0.8004192229006618,,0.7731869220009212
1049,0.7750768994877472,COMPLETE,False,xgb,oof+hand+graph,False,,,,,,,,,,,,,none,0.3314788329845107,0.5781292458470253,0.22514652107060792,0.002443007659039162,0.01923350855710253,3.0,3.0,140.0,0.9417218156609326,0.30942344665527344,49,0.802582596348701,,0.7750768994877472
1050,0.775398238470529,COMPLETE,True,xgb,oof+timing,False,,,,,,,,,,,,,standard,0.4442619015940322,0.6070467570696185,0.5369042451352726,0.0021047355427668917,0.007612779382866573,3.0,1.0,183.0,0.9525073621077733,0.4553182125091553,52,0.8038079177019551,,0.775398238470529
1051,0.7746912199221673,COMPLETE,False,xgb,oof_only,False,,,,,,,,,,,,,standard,0.004686719227854014,0.553457852473487,0.36505246036999,0.0027932209870597377,0.010866455823222739,3.0,4.0,155.0,0.5182287561080341,0.19706130027770996,6,0.8014410334000563,,0.7746912199221673
1052,0.7761663017501156,COMPLETE,False,xgb,oof+timing,False,,,,,,,,,,,,,standard,0.24824322314241937,0.5922862003809537,0.2870015637265468,0.004352676432245132,0.014421267482669274,3.0,1.0,195.0,0.9190162689605209,0.44770002365112305,52,0.803162179286494,,0.7761663017501156
1053,0.7751464557503117,COMPLETE,False,xgb,oof+timing,False,,,,,,,,,,,,,standard,0.17553238246866476,0.41074617125891966,0.6810847380404651,0.0020740748114267426,0.01667293720013781,3.0,5.0,168.0,0.9284833112660708,0.3879101276397705,52,0.8019445822026736,,0.7751464557503117
1054,0.7753673651115375,COMPLETE,False,xgb,oof+ng,False,,,,,,,,,,,,,standard,0.2981334624713024,0.5710427883219531,0.46429133897851826,0.0033786924715970674,0.023352302465613567,3.0,1.0,134.0,0.9042500030825597,0.6851880550384521,237,0.8028327155494168,,0.7753673651115375
1055,0.775999676642954,COMPLETE,False,xgb,oof+timing,False,,,,,,,,,,,,,standard,0.003962139870929868,0.6288761446431611,0.165185488370697,0.0024853978089307443,0.012745334022218049,3.0,1.0,177.0,0.945495154661289,0.40125131607055664,52,0.8028342393848833,,0.775999676642954
1056,0.7737258369979741,COMPLETE,False,lgbm,oof+timing,False,0.03359637129292714,0.5754301842960151,0.035624545907094164,0.002478631822287137,12.0,95.0,515.0,181.0,0.8345125657013839,,,,standard,,,,,,,,,,3.7270267009735107,52,0.8017373405792234,,0.7737258369979741
1057,0.776469542820334,COMPLETE,False,xgb,oof+timing,False,,,,,,,,,,,,,standard,0.24263211251130282,0.6104330717199982,0.5837982057084419,0.002051291018999063,0.018380902370666384,3.0,3.0,156.0,0.9302120325919012,0.3767552375793457,52,0.8035954740194986,,0.776469542820334
1058,0.7740508134188717,COMPLETE,False,xgb,oof+timing,False,,,,,,,,,,,,,none,0.055790943219637894,0.5823044877685599,0.36925587583793135,0.0028210941186382504,0.021019262688550908,3.0,1.0,342.0,0.9167068573657821,0.6958174705505371,52,0.8031116825318958,,0.7740508134188717
1059,0.7750899370026139,COMPLETE,True,xgb,oof+timing,False,,,,,,,,,,,,,standard,0.12561497845396805,0.5990102399118488,0.26927012233769376,6.241260249695193,0.015420364257488564,3.0,1.0,216.0,0.937307552858892,0.5143029689788818,52,0.8045968441052211,,0.7750899370026139
1060,0.7762600217381581,COMPLETE,False,xgb,oof+timing,False,,,,,,,,,,,,,standard,0.5677005911985965,0.5662996160122712,0.46157287901461136,0.0024091972005114226,0.01392942240175742,3.0,3.0,181.0,0.9633172367035812,0.41839170455932617,52,0.8032833504791097,,0.7762600217381581
1061,0.7688346294273559,COMPLETE,False,xgb,oof+hand,False,,,,,,,,,,,,,standard,0.004816913325928092,0.5482028369291119,0.11166946309412554,0.0019318119518107251,0.016868487454796757,4.0,9.0,606.0,0.9492605468140278,1.2343318462371826,34,0.7988547693370254,,0.7688346294273559
1062,0.775802557834606,COMPLETE,False,xgb,oof+timing,False,,,,,,,,,,,,,standard,0.1515257610258625,0.616320618202488,0.3560589205245463,0.013819189839942814,0.011925224098927495,3.0,1.0,196.0,0.9260158335802575,0.4538414478302002,52,0.8026498552934314,,0.775802557834606
1063,0.7760168904237768,COMPLETE,False,xgb,oof+timing,False,,,,,,,,,,,,,standard,0.1988689225406877,0.5855459190938211,0.5351120428407922,0.019521649499713557,0.019741237933171677,3.0,3.0,163.0,0.9093083367815528,0.39061975479125977,52,0.8034725162611636,,0.7760168904237768
1064,0.7719765424046662,COMPLETE,False,lr,oof+timing,False,,,,,,,,,,0.042265718052239054,False,l2,standard,,,,,,,,,,0.0742495059967041,52,0.7986582996539422,,0.7719765424046662
1065,0.775713564390836,COMPLETE,False,xgb,all,False,,,,,,,,,,,,,standard,0.10246471750968625,0.5597535638416256,0.22674936603451196,0.0034248901356949087,0.015628990394968633,3.0,5.0,147.0,0.9375566829289635,1.304727554321289,362,0.802764773506029,,0.775713564390836
1066,0.7760249195715963,COMPLETE,False,xgb,oof+timing,False,,,,,,,,,,,,,standard,0.2985338245832916,0.597927122445735,0.40252438049638667,0.0028574416811084397,0.01771720046234898,3.0,1.0,170.0,0.9198040516364716,0.401824951171875,52,0.80330363325463,,0.7760249195715963
1067,0.7759357127236919,COMPLETE,True,xgb,oof+timing,False,,,,,,,,,,,,,none,0.0034661126469147483,0.5735869400820415,0.6266307879607143,0.0047639102289625266,0.013790795258544472,3.0,6.0,188.0,0.9308574492025331,0.4455084800720215,52,0.8049503213874091,,0.7759357127236919
1068,0.7734943031559955,COMPLETE,False,xgb,oof+timing,True,,,,,,,,,,,,,standard,0.41478589240609637,0.712325621319452,0.47903617770954104,0.0020118994872112875,0.015065609433708613,3.0,3.0,127.0,0.9551684724825756,1.1459805965423584,52,0.8008939239215158,,0.7734943031559955
1069,0.770197292526811,COMPLETE,False,xgb,oof+timing,False,,,,,,,,,,,,,standard,1.6076209568485818,0.5824330951143935,0.28730767992204304,0.002400431104545061,0.01748663922543328,6.0,1.0,205.0,0.8972559954412718,1.1491174697875977,52,0.7995698159931892,,0.770197292526811
1070,0.7756227529099781,COMPLETE,False,xgb,oof+timing,False,,,,,,,,,,,,,standard,0.2152125506616275,0.6200402627483816,0.5573312358654736,0.00381902739769101,0.020659513763106995,3.0,1.0,176.0,0.9448911752994679,0.40532994270324707,52,0.803398794152213,,0.7756227529099781
1071,0.7496206454524679,COMPLETE,False,xgb,oof_minus_roberta,False,,,,,,,,,,,,,standard,0.004077323897505404,0.6020940831133648,0.6953050448534,0.0019200928633320727,0.012734652757170029,3.0,1.0,233.0,0.9732405583304214,0.25896334648132324,5,0.7772689043087027,,0.7496206454524679
1072,0.7746370023863071,COMPLETE,False,xgb,oof+ph,False,,,,,,,,,,,,,standard,0.3447498866453733,0.5467467434173375,0.11309970789772916,0.0029100840262935423,0.009831536510345393,3.0,3.0,148.0,0.9210758738287199,0.3145744800567627,42,0.8012559662099468,,0.7746370023863071
1073,0.7751710483569062,COMPLETE,False,xgb,oof+timing,False,,,,,,,,,,,,,standard,2.6710096361406475,0.5896082616549416,0.4005549298595603,0.0024203374351429684,0.015959623882883453,3.0,1.0,162.0,0.9091240956300954,0.3910849094390869,52,0.8024066721713909,,0.7751710483569062
1074,0.7752055619575218,COMPLETE,False,xgb,oof+timing,False,,,,,,,,,,,,,standard,0.002908330208884072,0.6362997275619137,0.23124708864392587,0.0018462700659056248,0.024039830900198768,3.0,1.0,191.0,0.9355491847168971,0.4276456832885742,52,0.803421178769756,,0.7752055619575218
1075,0.7757200981579855,COMPLETE,True,xgb,oof+timing,False,,,,,,,,,,,,,none,0.16306814036375028,0.5648878842940434,0.33226028776930006,0.0021790030201927287,0.018830625502219187,3.0,3.0,180.0,0.9291491133860666,0.42049622535705566,52,0.8052508847966726,,0.7757200981579855
1076,0.7755817512990469,COMPLETE,False,xgb,oof+timing,False,,,,,,,,,,,,,standard,0.28422423335194885,0.6977789523863901,0.49138936840452674,0.003223177267032136,0.014199815331981598,3.0,1.0,215.0,0.9495004651761741,0.49054932594299316,52,0.8029965015890451,,0.7755817512990469
1077,0.7754674736732929,COMPLETE,False,xgb,oof+timing,False,,,,,,,,,,,,,standard,0.005762724065168644,0.576297269527153,0.20011679298868967,0.05579614680153491,0.011751825412394886,3.0,4.0,168.0,0.9393486018160581,0.39935755729675293,52,0.8025345692584797,,0.7754674736732929
1078,0.7415800649704929,COMPLETE,False,lgbm,all_minus_ng,False,0.24424884526579302,0.40738528500966176,0.333468721352172,0.2124352739330442,3.0,39.0,454.0,165.0,0.7465218193371088,,,,standard,,,,,,,,,,1.038764238357544,131,0.7713892639801132,,0.7415800649704929
1079,0.7752408725595592,COMPLETE,False,xgb,oof+hand+graph,False,,,,,,,,,,,,,standard,0.23190112373509442,0.6076399843368492,0.42980626287459095,0.002577616934909905,0.017025839172674966,3.0,1.0,198.0,0.9170918982249454,0.42202162742614746,49,0.8030742697438895,,0.7752408725595592
1080,0.7731140797917327,COMPLETE,False,xgb,oof+timing,False,,,,,,,,,,,,,standard,0.04056715267197957,0.5565767948337038,0.07029632977226324,0.0017007472178074883,0.01506086842375904,5.0,3.0,152.0,0.7116040383094937,0.5965750217437744,52,0.8013703064159883,,0.7731140797917327
1081,0.775438486292435,COMPLETE,False,xgb,oof+timing,False,,,,,,,,,,,,,standard,0.024741456614415458,0.5932403388015804,0.3160459221212266,0.0021619697839029674,0.021742374814387247,3.0,1.0,183.0,0.9623968873519474,0.40474748611450195,52,0.8035930569011723,,0.775438486292435
1082,0.7761754171955504,COMPLETE,False,xgb,oof+timing,False,,,,,,,,,,,,,standard,0.003074733048898158,0.543981142325579,0.5806518660029079,0.10399750909352355,0.018090965613345836,3.0,1.0,138.0,0.9302869974083362,0.3410806655883789,52,0.803185930101352,,0.7761754171955504
1083,0.7769426850903195,COMPLETE,True,lr,oof_only,False,,,,,,,,,,0.2195894870939366,True,l1,standard,,,,,,,,,,0.04372453689575195,6,0.8053692185025574,,0.7769426850903195
1084,0.773015102292293,COMPLETE,True,lr,oof+ng,False,,,,,,,,,,0.10776432422202198,True,l1,none,,,,,,,,,,1.8319065570831299,237,0.8019486807946181,,0.773015102292293
1085,0.7730864320394528,COMPLETE,True,lr,oof_only,True,,,,,,,,,,0.20663938124385392,True,l1,standard,,,,,,,,,,0.1054227352142334,6,0.8026721348188732,,0.7730864320394528
1086,0.774089214365516,COMPLETE,True,lr,oof+ph,False,,,,,,,,,,1.0313234624119327,True,l1,standard,,,,,,,,,,0.1297590732574463,42,0.8028629820745454,,0.774089214365516
1087,0.7570203320280517,COMPLETE,False,lgbm,oof_only,False,0.01804439158068404,0.36492912693995216,0.0144870491915453,0.04176915679127596,10.0,87.0,402.0,219.0,0.9362427319883546,,,,standard,,,,,,,,,,0.913121223449707,6,0.7850623768911718,,0.7570203320280517
1088,0.7768013915081592,COMPLETE,True,lr,oof_only,False,,,,,,,,,,5.43939755100931,True,l1,standard,,,,,,,,,,0.06437516212463379,6,0.8051870938912798,,0.7768013915081592
1089,0.7768060038194525,COMPLETE,True,lr,oof_only,False,,,,,,,,,,2.3016214794907754,True,l1,standard,,,,,,,,,,0.05304551124572754,6,0.8051971827329895,,0.7768060038194525
1090,0.7768007302864546,COMPLETE,True,lr,oof_only,False,,,,,,,,,,2.4915100603978524,True,l1,standard,,,,,,,,,,0.05559277534484863,6,0.8051931366870955,,0.7768007302864546
1091,0.7767990995554741,COMPLETE,True,lr,oof_only,False,,,,,,,,,,4.891426957403205,True,l1,standard,,,,,,,,,,0.06436300277709961,6,0.8051874091675834,,0.7767990995554741
1092,0.7767988750839495,COMPLETE,True,lr,oof_only,False,,,,,,,,,,5.365901069733299,True,l1,standard,,,,,,,,,,0.0647587776184082,6,0.8051873040754821,,0.7767988750839495
1093,0.7767988084692318,COMPLETE,True,lr,oof_only,False,,,,,,,,,,4.872225141548331,True,l1,standard,,,,,,,,,,0.06357026100158691,6,0.805187934628089,,0.7767988084692318
1094,0.7768008530898708,COMPLETE,True,lr,oof_only,False,,,,,,,,,,5.4230007563203015,True,l1,standard,,,,,,,,,,0.06594514846801758,6,0.8051867786149765,,0.7768008530898708
1095,0.776805469923371,COMPLETE,True,lr,oof_only,False,,,,,,,,,,5.072986609152511,True,l1,none,,,,,,,,,,0.5324738025665283,6,0.8052312325737592,,0.776805469923371
1096,0.7767973486195919,COMPLETE,True,lr,oof_only,False,,,,,,,,,,5.100641026850709,True,l1,none,,,,,,,,,,0.5348000526428223,6,0.8052270288897134,,0.7767973486195919
1097,0.7768231080421808,COMPLETE,True,lr,oof_only,False,,,,,,,,,,5.635965291053311,True,l1,none,,,,,,,,,,0.5811164379119873,6,0.805228184902826,,0.7768231080421808
1098,0.7768131722701445,COMPLETE,True,lr,oof_only,False,,,,,,,,,,4.833945856759296,True,l1,none,,,,,,,,,,0.5088930130004883,6,0.8052279747186237,,0.7768131722701445
1099,0.7768040336887834,COMPLETE,True,lr,oof_only,False,,,,,,,,,,4.843336328127011,True,l1,none,,,,,,,,,,0.5029373168945312,6,0.8052288154554329,,0.7768040336887834
1100,0.7768025808252539,COMPLETE,True,lr,oof_only,False,,,,,,,,,,4.937122066959125,True,l1,none,,,,,,,,,,0.5085892677307129,6,0.8052280272646745,,0.7768025808252539
1101,0.7768126445228994,COMPLETE,True,lr,oof_only,False,,,,,,,,,,4.942664028370063,True,l1,none,,,,,,,,,,0.5064835548400879,6,0.8052332293236809,,0.7768126445228994
1102,0.7768067361822427,COMPLETE,True,lr,oof_only,False,,,,,,,,,,4.786687722557769,True,l1,none,,,,,,,,,,0.5030815601348877,6,0.8052304969290511,,0.7768067361822427
1103,0.7768110662032565,COMPLETE,True,lr,oof_only,False,,,,,,,,,,5.08660652946823,True,l1,none,,,,,,,,,,0.531707763671875,6,0.805232598771074,,0.7768110662032565
1104,0.7768081753827617,COMPLETE,True,lr,oof_only,False,,,,,,,,,,4.910000735334605,True,l1,none,,,,,,,,,,0.514474630355835,6,0.8052309172974557,,0.7768081753827617
1105,0.7768139799625644,COMPLETE,True,lr,oof_only,False,,,,,,,,,,5.020868349143158,True,l1,none,,,,,,,,,,0.5240309238433838,6,0.8052329140473774,,0.7768139799625644
1106,0.7768222763009729,COMPLETE,True,lr,oof_only,False,,,,,,,,,,4.251842500713039,True,l1,none,,,,,,,,,,0.4537196159362793,6,0.8052337547841866,,0.7768222763009729
1107,0.7768118397548772,COMPLETE,True,lr,oof_only,False,,,,,,,,,,4.696990515233132,True,l1,none,,,,,,,,,,0.49353599548339844,6,0.8052337547841866,,0.7768118397548772
1108,0.7768129503943207,COMPLETE,True,lr,oof_only,False,,,,,,,,,,5.057964028767069,True,l1,none,,,,,,,,,,0.5345494747161865,6,0.80523039183695,,0.7768129503943207
1109,0.7768078914476874,COMPLETE,True,lr,oof_only,False,,,,,,,,,,4.9855745029317005,True,l1,none,,,,,,,,,,0.523970365524292,6,0.8052298663764443,,0.7768078914476874
1110,0.7768053981992749,COMPLETE,True,lr,oof_only,False,,,,,,,,,,5.061167954228116,True,l1,none,,,,,,,,,,0.5284645557403564,6,0.8052290256396352,,0.7768053981992749
1111,0.7768050636287386,COMPLETE,True,lr,oof_only,False,,,,,,,,,,4.92516835764834,True,l1,none,,,,,,,,,,0.5163846015930176,6,0.8052283425409777,,0.7768050636287386
1112,0.7768074771772125,COMPLETE,True,lr,oof_only,False,,,,,,,,,,5.17914826544303,True,l1,none,,,,,,,,,,0.5395781993865967,6,0.8052293409159386,,0.7768074771772125
1113,0.7767936705846568,COMPLETE,True,lr,oof_only,False,,,,,,,,,,7.879610272989782,True,l1,none,,,,,,,,,,0.7825796604156494,6,0.8052108447061377,,0.7767936705846568
1114,0.776815714774155,COMPLETE,True,lr,oof_only,False,,,,,,,,,,2.857031536010094,True,l1,none,,,,,,,,,,0.32939910888671875,6,0.8052457352837166,,0.776815714774155
1115,0.7768279237081818,COMPLETE,True,lr,oof_only,False,,,,,,,,,,2.609733585034704,True,l1,none,,,,,,,,,,0.3063356876373291,6,0.8052554037570216,,0.7768279237081818
1116,0.7729064351968433,COMPLETE,True,lr,oof_only,True,,,,,,,,,,2.7047049757859476,True,l1,none,,,,,,,,,,0.801436185836792,6,0.8025980448875687,,0.7729064351968433
1117,0.7768268746000314,COMPLETE,True,lr,oof_only,False,,,,,,,,,,2.6899709641021636,True,l1,none,,,,,,,,,,0.31406617164611816,6,0.8052509898887736,,0.7768268746000314
1118,0.7768198598424695,COMPLETE,True,lr,oof_only,False,,,,,,,,,,3.4949335167272753,True,l1,none,,,,,,,,,,0.3868288993835449,6,0.8052393246655472,,0.7768198598424695
1119,0.7768154992098251,COMPLETE,True,lr,oof_only,False,,,,,,,,,,3.3606436597139595,True,l1,none,,,,,,,,,,0.37387514114379883,6,0.8052414265075698,,0.7768154992098251
