number,value,state,params_add_group_dummies,params_family,params_feature_subset,params_isotonic,params_lgbm_alpha,params_lgbm_colsample,params_lgbm_lambda,params_lgbm_lr,params_lgbm_max_depth,params_lgbm_min_child,params_lgbm_n_estimators,params_lgbm_num_leaves,params_lgbm_subsample,params_lr_C,params_lr_class_weight_balanced,params_lr_penalty,params_scaler,params_xgb_alpha,params_xgb_colsample,params_xgb_gamma,params_xgb_lambda,params_xgb_lr,params_xgb_max_depth,params_xgb_min_child,params_xgb_n_estimators,params_xgb_subsample,user_attrs_elapsed_sec,user_attrs_n_features,user_attrs_pooled_auroc,user_attrs_pruned_reason,user_attrs_weighted_auroc
869,0.7761175596349443,COMPLETE,False,xgb,oof+timing,False,,,,,,,,,,,,,standard,0.0020208580117641486,0.5728738124163345,0.49112353958975297,0.07062607410601006,0.010615736446012955,3.0,3.0,176.0,0.9374084390125431,0.40671467781066895,52,0.8027816407882622,,0.7761175596349443
870,0.7758750171314328,COMPLETE,False,xgb,oof+hand,False,,,,,,,,,,,,,standard,0.0018389543911692043,0.6039495600351485,0.3645907309028813,0.02314363484159989,0.017785533658299872,3.0,6.0,191.0,0.9461663665976876,0.3429749011993408,34,0.8038493765358554,,0.7758750171314328
871,0.7758272066722651,COMPLETE,False,xgb,oof+timing,False,,,,,,,,,,,,,standard,0.0020109021664082597,0.616338048223303,0.07273516670271449,0.003926087998000204,0.014112087770982606,3.0,5.0,156.0,0.9237848987217692,0.35971546173095703,52,0.8027972469652817,,0.7758272066722651
872,0.7763078406665108,COMPLETE,False,xgb,oof+timing,False,,,,,,,,,,,,,standard,0.0016031218547496958,0.5743542829732995,0.16307526106372344,0.001005187682922533,0.018404919334012074,3.0,3.0,173.0,0.9331440119481602,0.39008307456970215,52,0.8036115531109732,,0.7763078406665108
873,0.7754070354557389,COMPLETE,False,xgb,all,False,,,,,,,,,,,,,standard,0.0010004369753035902,0.5948544280118594,0.4476922302008412,0.26501217758389,0.015889278565063655,3.0,8.0,142.0,0.8950878380198433,1.268341302871704,362,0.8025760280923797,,0.7754070354557389
874,0.7755128841127945,COMPLETE,False,xgb,oof+timing,False,,,,,,,,,,,,,standard,0.2952501779495017,0.5849057280669021,2.675680903645822,0.014331819637049192,0.012324303461382883,3.0,3.0,231.0,0.9124293766757169,0.4993290901184082,52,0.802650748576291,,0.7755128841127945
875,0.776262244475236,COMPLETE,False,xgb,oof+timing,False,,,,,,,,,,,,,standard,0.0019129856702913743,0.5673214680447393,0.6011030669516131,0.0014359254970508506,0.014024830248097097,3.0,2.0,203.0,0.9442673152809116,0.44431519508361816,52,0.8034726213532646,,0.776262244475236
876,0.7764959875026579,COMPLETE,False,xgb,oof+timing,False,,,,,,,,,,,,,standard,0.2119377175693635,0.6107297787275292,0.2661458815513625,0.07180357379292965,0.016217618147881637,3.0,2.0,187.0,0.9291583233128259,0.42049694061279297,52,0.8035638412970552,,0.7764959875026579
877,0.7728993103801519,COMPLETE,False,xgb,oof+timing,True,,,,,,,,,,,,,standard,0.1531308504259377,0.6336381873545736,2.951109488995825,0.21047147284205953,0.018760181772297522,3.0,2.0,216.0,0.915206091494732,1.6536264419555664,52,0.8020499895801182,,0.7728993103801519
878,0.775129760089004,COMPLETE,False,lgbm,oof+timing,False,1.4366787964471996,0.6086679828195125,0.021703404653903635,0.01197920374606024,1.0,8.0,423.0,107.0,0.702732966021207,,,,standard,,,,,,,,,,0.3579394817352295,52,0.8011427294709674,,0.775129760089004
879,0.7484492590134857,COMPLETE,False,xgb,oof_minus_roberta,False,,,,,,,,,,,,,standard,0.20161319757177323,0.6450091851117281,4.25469337399915,5.123491865599453,0.016736347345040824,4.0,2.0,195.0,0.9567905066995588,0.2579007148742676,5,0.7768310380692984,,0.7484492590134857
880,0.7745276300220415,COMPLETE,False,xgb,oof+ph,False,,,,,,,,,,,,,standard,0.26865705549819463,0.6187434254054339,0.3483306258849669,1.2677201281543347,0.018674066279677527,3.0,2.0,189.0,0.920603999016298,0.39794445037841797,42,0.8024765584186497,,0.7745276300220415
881,0.775686950482953,COMPLETE,False,xgb,oof+timing,False,,,,,,,,,,,,,standard,0.23380904203343714,0.6092992641663556,0.47781283637071215,0.1267148063573256,0.013350232321121787,3.0,2.0,203.0,0.8876111562391938,0.4700767993927002,52,0.8029416435122495,,0.775686950482953
882,0.7763711679476085,COMPLETE,False,xgb,oof+timing,False,,,,,,,,,,,,,standard,0.17461865806657162,0.6283592950960477,0.5596606044558379,0.06891902057048152,0.015780320601942274,3.0,2.0,181.0,0.9263184330920775,0.4084031581878662,52,0.8033960617575833,,0.7763711679476085
883,0.7758992048888741,COMPLETE,False,xgb,oof+timing,False,,,,,,,,,,,,,standard,0.20006900313996362,0.6127538466205315,0.2780019206467286,0.09021929712735982,0.019785689820553107,3.0,2.0,208.0,0.9442028245383712,0.4562039375305176,52,0.8040202037462602,,0.7758992048888741
884,0.7675581894439764,COMPLETE,False,lr,all_minus_ng,False,,,,,,,,,,7.249813976157871,False,l2,standard,,,,,,,,,,63.396151065826416,131,0.7935371615653385,,0.7675581894439764
885,0.7739712517002146,COMPLETE,False,xgb,oof+timing,False,,,,,,,,,,,,,standard,0.2241730253840074,0.6391883230219799,0.4149754869831172,0.0027992644984896594,0.011597033383488737,3.0,2.0,662.0,0.9363387738127863,1.2686340808868408,52,0.8030863553355208,,0.7739712517002146
886,0.7757659382648747,COMPLETE,False,xgb,oof+timing,False,,,,,,,,,,,,,standard,0.14018908363784297,0.5801769532956791,0.33889393717297706,0.6742378934877941,0.014609651359706634,3.0,2.0,188.0,0.906267217837421,0.41869401931762695,52,0.8028235725366175,,0.7757659382648747
887,0.7717669169049036,COMPLETE,False,xgb,oof+timing,False,,,,,,,,,,,,,none,0.27351753057364486,0.6012386884296728,0.6381251961093857,0.4205090437014383,0.017278140884916138,3.0,2.0,699.0,0.9666472897630636,1.27189040184021,52,0.8012725182158766,,0.7717669169049036
888,0.7746884037496123,COMPLETE,False,xgb,oof+hand+graph,False,,,,,,,,,,,,,standard,0.3813116085273261,0.574085288856331,0.4998942263664748,0.001849635585248157,0.01648614878586551,3.0,2.0,174.0,0.9529968795514707,0.37536001205444336,49,0.8024489717421003,,0.7746884037496123
889,0.7755927289259915,COMPLETE,False,xgb,oof+timing,False,,,,,,,,,,,,,standard,0.3071571645314505,0.5882631339127301,0.24282551074001793,1.7136713795701595,0.012956756200709883,3.0,2.0,193.0,0.9230811663028166,0.4278578758239746,52,0.8026457567014869,,0.7755927289259915
890,0.7745975418505446,COMPLETE,False,xgb,oof+timing,False,,,,,,,,,,,,,standard,0.16611695905858592,0.5654275092311135,0.4085260802316453,0.4395912399415472,0.00840184588534298,3.0,2.0,587.0,0.8355719307103172,1.1877520084381104,52,0.8032664306508259,,0.7745975418505446
891,0.7748013906257444,COMPLETE,False,xgb,oof_only,False,,,,,,,,,,,,,standard,0.21594419343339494,0.6159534034696614,0.5647763232846005,0.13803202223049632,0.01846814138564837,3.0,2.0,170.0,0.9326932720441616,0.19151806831359863,6,0.802279668367162,,0.7748013906257444
892,0.7750391538065246,COMPLETE,False,xgb,oof+timing,False,,,,,,,,,,,,,standard,0.24833904866649534,0.5592507450752543,0.31364195599320954,0.0031416975213907922,0.014637541152432343,3.0,2.0,219.0,0.5929620010217302,0.47936487197875977,52,0.8028994490336414,,0.7750391538065246
893,0.7747000697806221,COMPLETE,False,xgb,oof+timing,False,,,,,,,,,,,,,standard,0.12482108800233728,0.6057252642846715,0.6984876807655065,0.0022912540202122615,0.015920834978912977,4.0,3.0,155.0,0.942773949352736,0.49113893508911133,52,0.8025511738104599,,0.7747000697806221
894,0.7753252419963937,COMPLETE,False,xgb,oof+ng,False,,,,,,,,,,,,,standard,0.009253290262639624,0.5872802786488291,3.2605176944729006,0.05722128798755853,0.020257690844880532,3.0,2.0,181.0,0.9133468755144691,0.8561210632324219,237,0.8030247188182015,,0.7753252419963937
895,0.7721240655678041,COMPLETE,False,xgb,oof+timing,True,,,,,,,,,,,,,standard,0.3231040547332485,0.3213759244769537,0.464036192695885,4.042586102664425,0.013636207222952949,3.0,2.0,167.0,0.9270934905551637,1.2298634052276611,52,0.7987379594666071,,0.7721240655678041
896,0.776091148903973,COMPLETE,False,xgb,oof+timing,False,,,,,,,,,,,,,standard,0.4686213277391789,0.5730877580929908,3.7033274091348494,0.011838873055834472,0.01766396092801691,3.0,4.0,192.0,0.9511687897109734,0.4374537467956543,52,0.8038376062205276,,0.776091148903973
897,0.7743905575508878,COMPLETE,False,xgb,oof+timing,False,,,,,,,,,,,,,standard,0.0022581973859906557,0.59640162029064,0.23762989731369763,8.670601589631648,0.011371119099052807,3.0,3.0,536.0,0.8994353606003566,1.08274245262146,52,0.8032404203557935,,0.7743905575508878
898,0.7697781799079524,COMPLETE,False,xgb,oof+timing,False,,,,,,,,,,,,,standard,0.18167811586169272,0.6258796963411464,0.3808256222314236,0.00156533806498861,0.015408339889597887,7.0,2.0,151.0,0.563771173021798,1.0325794219970703,52,0.7985158473108455,,0.7697781799079524
899,0.775776316976032,COMPLETE,False,xgb,oof+timing,False,,,,,,,,,,,,,standard,0.2643013205977782,0.5553778614773507,0.5787441867170714,0.01006113313416684,0.020323950215818475,3.0,2.0,202.0,0.9370622614503212,0.45926690101623535,52,0.8038708678705387,,0.775776316976032
900,0.7763884872810414,COMPLETE,False,xgb,oof+timing,False,,,,,,,,,,,,,standard,0.01215525697068126,0.5679245961837431,0.4777329402128933,0.1790881009875242,0.012785192052350172,3.0,3.0,179.0,0.9186520931632745,0.4114680290222168,52,0.8030881944472906,,0.7763884872810414
901,0.774814415926792,COMPLETE,False,xgb,oof+hand,False,,,,,,,,,,,,,standard,0.015688031484344014,0.5831197514209671,0.693659917309488,0.5765146469207857,0.017196947752643493,3.0,2.0,137.0,0.9297766471391531,0.2698657512664795,34,0.8022201336918655,,0.774814415926792
902,0.775598702501562,COMPLETE,False,xgb,oof+timing,False,,,,,,,,,,,,,standard,0.7313678142541435,0.6543915290484067,0.31842265381209167,0.001233644972863237,0.013962413220216142,3.0,3.0,160.0,0.962167917335682,0.3924117088317871,52,0.802775177624042,,0.775598702501562
903,0.7730700882034391,COMPLETE,False,lgbm,oof+timing,False,0.5304649593010976,0.5220726003510556,0.008940634867537534,0.004963711841399927,6.0,80.0,314.0,28.0,0.7835983051902616,,,,standard,,,,,,,,,,1.4081628322601318,52,0.8012302711912179,,0.7730700882034391
904,0.7758893178693931,COMPLETE,False,xgb,oof+timing,False,,,,,,,,,,,,,standard,0.002459109514458121,0.6074021802295433,0.17195650523379374,0.0018834809996037718,0.015433859304807876,3.0,3.0,237.0,0.943360546100922,0.5465898513793945,52,0.8037728169401741,,0.7758893178693931
905,0.7761882907904708,COMPLETE,False,xgb,oof+timing,False,,,,,,,,,,,,,standard,0.2193062882058132,0.633684542894568,0.4023782407046571,0.4061050676288891,0.01837310184385043,3.0,2.0,181.0,0.923352509735138,0.41773462295532227,52,0.803684854851519,,0.7761882907904708
906,0.7729790761710015,COMPLETE,False,lr,all,False,,,,,,,,,,0.0018582046899941868,True,l1,standard,,,,,,,,,,0.26331377029418945,362,0.7947285907159747,,0.7729790761710015
907,0.7762865465590041,COMPLETE,False,xgb,oof+timing,False,,,,,,,,,,,,,standard,0.0022582984813151723,0.5894969115088755,4.568994544191801,0.0014067013205382368,0.016383085114434044,3.0,2.0,167.0,0.9747841574230806,0.3653237819671631,52,0.8033073114781698,,0.7762865465590041
908,0.7762907766716373,COMPLETE,False,xgb,oof+timing,False,,,,,,,,,,,,,none,0.002185070123671162,0.5522959250438794,0.5390894661803768,0.0023828214495477344,0.020983522978972994,3.0,2.0,148.0,0.9067663023357453,0.3238036632537842,52,0.8035950011050434,,0.7762907766716373
909,0.7762477246478998,COMPLETE,False,xgb,oof+timing,False,,,,,,,,,,,,,standard,0.007539500422484686,0.5734978552000318,0.27367323046207437,0.017213305036463927,0.012386391800737235,3.0,2.0,189.0,0.9371658467721005,0.4066426753997803,52,0.8031874539368185,,0.7762477246478998
910,0.7756787731441304,COMPLETE,False,xgb,oof+timing,False,,,,,,,,,,,,,standard,0.4062291104118354,0.6159653177502104,2.2203128123344413,0.0035675585825640896,0.010426243562639324,3.0,4.0,209.0,0.9518517299636408,0.4487624168395996,52,0.8027615681969442,,0.7756787731441304
911,0.7487344422022139,COMPLETE,False,xgb,oof_minus_roberta,False,,,,,,,,,,,,,standard,0.3545982362930379,0.5998436286459888,0.6213606797843464,0.004449145147018196,0.014183579817438658,3.0,3.0,170.0,0.9127913645092673,0.18183398246765137,5,0.7754671002346392,,0.7487344422022139
912,0.7745404700118175,COMPLETE,False,xgb,oof+ph,False,,,,,,,,,,,,,standard,0.14419096891903097,0.578448264792008,0.4353252936346931,0.002105959371564585,0.018947764737992995,3.0,2.0,156.0,0.9315359518314017,0.32311010360717773,42,0.8022149316328591,,0.7745404700118175
913,0.7754704785277344,COMPLETE,False,xgb,oof+timing,True,,,,,,,,,,,,,standard,0.04343392721901793,0.5615973344917815,1.2570632220952473,0.0017021023064439792,0.014902058978135084,3.0,3.0,179.0,0.9442210673760246,1.3887088298797607,52,0.8026586830299272,,0.7754704785277344
914,0.7740332444621467,COMPLETE,False,xgb,oof+timing,False,,,,,,,,,,,,,standard,0.001748544500322243,0.5463398484485672,0.09199855555311533,0.026436860379123975,0.01666159486191832,4.0,1.0,200.0,0.9215899778449239,0.6079363822937012,52,0.8022517138682583,,0.7740332444621467
915,0.7759152415798658,COMPLETE,False,xgb,oof+timing,False,,,,,,,,,,,,,standard,0.30721052440555885,0.5932729193845101,0.7566158509613672,0.0027343039760017126,0.012805501907755801,3.0,2.0,141.0,0.9348510243758615,0.32467126846313477,52,0.8027893125116456,,0.7759152415798658
916,0.7756339413177983,COMPLETE,False,xgb,all_minus_ng,False,,,,,,,,,,,,,standard,0.5638002584173645,0.5652455855912398,2.7989659172742085,0.0014887082330522867,0.017829512198607133,3.0,1.0,167.0,0.9585949724527449,0.7007091045379639,131,0.8030736917373331,,0.7756339413177983
917,0.7726776726796805,COMPLETE,False,xgb,oof+timing,False,,,,,,,,,,,,,standard,0.008441011356871045,0.6200154699575599,0.3356067792745795,0.00196484642074902,0.014750625700983946,5.0,2.0,188.0,0.9268237571768267,0.724794864654541,52,0.8012250165861609,,0.7726776726796805
918,0.7750203157058406,COMPLETE,False,xgb,oof+timing,False,,,,,,,,,,,,,standard,0.0062009587521562855,0.9294598271796768,0.49172087677187165,0.5273870860083734,0.020128162797340355,3.0,1.0,129.0,0.9482747862349714,0.3204183578491211,52,0.8022927523337541,,0.7750203157058406
919,0.7757945536138314,COMPLETE,False,xgb,oof+hand+graph,False,,,,,,,,,,,,,standard,0.0022250063643570726,0.5046732086429274,0.17409979839555006,0.0012598080019314334,0.011593649775130038,3.0,1.0,157.0,0.7206456531085363,0.33570289611816406,49,0.8023000036887329,,0.7757945536138314
920,0.7758837309032578,COMPLETE,False,xgb,oof+timing,False,,,,,,,,,,,,,standard,0.2456536508807798,0.5875590980534118,1.556591039967211,0.0023922592456968503,0.01651146305580584,3.0,3.0,177.0,0.9034453102478132,0.4007885456085205,52,0.8030856722368633,,0.7758837309032578
921,0.7760342621953289,COMPLETE,False,xgb,oof+timing,False,,,,,,,,,,,,,standard,0.19904948103590206,0.6066989576521299,1.7488954754835984,0.0016062448111540356,0.013754145905422979,3.0,2.0,195.0,0.9153627842003303,0.4269754886627197,52,0.8031528786355431,,0.7760342621953289
922,0.7378218334552692,COMPLETE,False,lgbm,oof+timing,False,0.13621585001878037,0.4641273629928009,1.7837569152762758,0.12681118708773625,11.0,67.0,604.0,169.0,0.97166927575968,,,,standard,,,,,,,,,,2.989666223526001,52,0.7667087770715939,,0.7378218334552692
923,0.7735883309428871,COMPLETE,False,xgb,oof_only,False,,,,,,,,,,,,,standard,0.00270365957243894,0.5332488678492058,0.2389768923842374,0.0030286294300544323,0.02203046662352804,3.0,1.0,218.0,0.939227691910069,0.2333695888519287,6,0.8015632029676327,,0.7735883309428871
924,0.7746945777829878,COMPLETE,False,xgb,oof+timing,False,,,,,,,,,,,,,standard,1.147104050732521,0.5512707078356109,0.5873892213668521,0.0011299315738669735,0.01821714723626978,3.0,2.0,152.0,0.6319056094697988,0.347531795501709,52,0.8023818178894712,,0.7746945777829878
925,0.7759942604657905,COMPLETE,False,xgb,oof+timing,False,,,,,,,,,,,,,standard,0.0018313299426029595,0.639369919217678,0.3565094479796673,0.0018446091093257354,0.016055091272211944,3.0,1.0,171.0,0.9240244679661445,0.3889338970184326,52,0.8029648163205512,,0.7759942604657905
926,0.7754279224718365,COMPLETE,False,xgb,oof+ng,False,,,,,,,,,,,,,standard,0.16274249071738522,0.57618772874941,2.09366161988768,0.0021640024890695417,0.014866897856586089,3.0,3.0,183.0,0.9333848970010465,0.824634313583374,237,0.8025839099999653,,0.7754279224718365
927,0.7736321225202124,COMPLETE,False,xgb,oof+timing,False,,,,,,,,,,,,,standard,0.010503372269056437,0.6014882664681315,0.6858607217539727,2.32850671340148,0.012795070778310132,4.0,1.0,163.0,0.9488981507225202,0.5221710205078125,52,0.801394582691352,,0.7736321225202124
928,0.773319062268001,COMPLETE,False,lr,oof+timing,False,,,,,,,,,,0.005269548215105417,False,l2,standard,,,,,,,,,,1.0873794555664062,52,0.7987558776698516,,0.773319062268001
929,0.7754679340796119,COMPLETE,False,xgb,oof+timing,False,,,,,,,,,,,,,none,0.0019658085745381196,0.49124105901183995,0.4510944138338542,0.8936357554466687,0.018361652233050006,3.0,2.0,207.0,0.9125307804076396,0.42774200439453125,52,0.8028829495737622,,0.7754679340796119
930,0.7763654337379973,COMPLETE,False,xgb,oof+timing,False,,,,,,,,,,,,,standard,0.0025731157758176106,0.569011162960882,0.8431944863292664,0.0015280922329381414,0.01617500775186121,3.0,1.0,143.0,0.9410880251715763,0.33879709243774414,52,0.8033165595830702,,0.7763654337379973
931,0.7757989773529385,COMPLETE,False,xgb,oof+timing,False,,,,,,,,,,,,,standard,0.0016446763146587364,0.5190653746858546,0.5255590624828912,0.0025233305114715264,0.014111881991964684,3.0,2.0,176.0,0.8892677935813789,0.39729833602905273,52,0.802587483131404,,0.7757989773529385
932,0.774389173831069,COMPLETE,False,xgb,oof+timing,True,,,,,,,,,,,,,standard,0.0068959242910395105,0.586839943063582,0.3165440336919756,0.0019750648075851076,0.00919649265702461,3.0,1.0,193.0,0.9262403553612107,1.4998316764831543,52,0.8012169770404235,,0.774389173831069
933,0.7747673476171207,COMPLETE,False,xgb,oof+hand,False,,,,,,,,,,,,,standard,0.2628836157382807,0.5532298223485043,3.4863858796835387,0.0030505843459233592,0.020129458743031618,3.0,1.0,131.0,0.9607090226372006,0.25437378883361816,34,0.8024977344770297,,0.7747673476171207
934,0.7758550196824662,COMPLETE,False,xgb,oof+timing,False,,,,,,,,,,,,,standard,0.0023611792081622302,0.6272859344652844,0.2293946831365653,0.001356829631916486,0.01720410368881624,3.0,3.0,155.0,0.9193673987250537,0.34577131271362305,52,0.8030383282452993,,0.7758550196824662
935,0.7755525918982464,COMPLETE,False,xgb,oof+timing,False,,,,,,,,,,,,,standard,0.0028880693619635733,0.5337627376932106,0.42113489272028504,0.001736379838413771,0.01119457283138522,3.0,2.0,171.0,0.5511113491495572,0.3885796070098877,52,0.8021032187293462,,0.7755525918982464
936,0.7753452138183132,COMPLETE,False,xgb,all,False,,,,,,,,,,,,,standard,0.005401151734527465,0.6713213387883794,0.08434582491828457,0.0023568674199067334,0.014812964846140815,3.0,1.0,186.0,0.9336342162710131,1.7496776580810547,362,0.8026299928863156,,0.7753452138183132
937,0.7753497407631446,COMPLETE,False,xgb,oof+timing,False,,,,,,,,,,,,,standard,0.0019820270762859822,0.6092756953078945,0.005512744670028713,0.0037259451853652718,0.013326905022232806,3.0,4.0,225.0,0.9012176179536022,0.48148179054260254,52,0.8027612003745903,,0.7753497407631446
938,0.7756728097474049,COMPLETE,False,xgb,oof+timing,False,,,,,,,,,,,,,standard,0.18337792550769896,0.578682014692316,0.9977924502923242,0.0011557721923402102,0.022246984828952817,3.0,2.0,159.0,0.9501965161030331,0.35253214836120605,52,0.8033380509177536,,0.7756728097474049
939,0.7751769315543364,COMPLETE,False,xgb,oof+timing,False,,,,,,,,,,,,,standard,7.21439891951141,0.5950788093065378,0.6310305036904593,0.3066707644928808,0.01884456381407999,3.0,1.0,144.0,0.9420148169320356,0.32593798637390137,52,0.802385128290657,,0.7751769315543364
940,0.7762166038586905,COMPLETE,False,xgb,oof+timing,False,,,,,,,,,,,,,standard,0.34658991816958307,0.5682997666804166,0.36878395883596565,0.0016055549576445003,0.015982843038229562,3.0,2.0,202.0,0.9292976245551766,0.43101978302001953,52,0.803603986479691,,0.7762166038586905
941,0.7754380614590995,COMPLETE,False,xgb,oof+timing,False,,,,,,,,,,,,,standard,0.23293171649959915,0.560001865485124,0.5126091019910892,0.0018786692381847177,0.012046687981615862,3.0,1.0,169.0,0.7943575475365792,0.3830704689025879,52,0.8024579571167476,,0.7754380614590995
942,0.7745984146791988,COMPLETE,False,xgb,oof+ph,False,,,,,,,,,,,,,standard,0.0046623952012679335,0.5821675263382876,0.7671244520322877,0.23058001381978246,0.017349592211814948,3.0,1.0,184.0,0.9159372942606028,0.35605287551879883,42,0.8023677880939688,,0.7745984146791988
943,0.7491019715589041,COMPLETE,False,xgb,oof_minus_roberta,False,,,,,,,,,,,,,standard,0.001503495243075585,0.5435079310911342,0.28561186385209947,0.0021788686022438837,0.015147864725696203,3.0,2.0,164.0,0.9385289337903695,0.1888115406036377,5,0.7756953602783175,,0.7491019715589041
944,0.7619615452423062,COMPLETE,False,lgbm,oof+timing,False,0.0035004881198093655,0.33048401173473574,0.0054320531930108175,0.01626367644351626,8.0,20.0,790.0,141.0,0.5338041068917239,,,,standard,,,,,,,,,,4.352329730987549,52,0.7899289819108118,,0.7619615452423062
945,0.7689329299152909,COMPLETE,False,xgb,oof+timing,False,,,,,,,,,,,,,standard,0.0030592515907910465,0.6185985578264068,2.5223947861490346,0.002636681085082457,0.013827165806636675,9.0,1.0,149.0,0.9687197441080034,1.5831947326660156,52,0.7977179880789826,,0.7689329299152909
946,0.7757077780610899,COMPLETE,False,xgb,oof+timing,False,,,,,,,,,,,,,standard,0.11776338340281876,0.6057036439013694,3.0894944049983795,0.0013545394696009767,0.019216214370722125,3.0,1.0,179.0,0.908842732242329,0.4090549945831299,52,0.8032695834138601,,0.7757077780610899
947,0.7750532780150133,COMPLETE,False,xgb,all_minus_ng,False,,,,,,,,,,,,,standard,0.0022944800804230166,0.5906001157754971,0.19829080400069654,0.0010225748516263654,0.01690743365158054,3.0,3.0,197.0,0.9255560885226647,0.7973906993865967,131,0.8028503710224084,,0.7750532780150133
