number,value,state,params_add_group_dummies,params_family,params_feature_subset,params_isotonic,params_lgbm_alpha,params_lgbm_colsample,params_lgbm_lambda,params_lgbm_lr,params_lgbm_max_depth,params_lgbm_min_child,params_lgbm_n_estimators,params_lgbm_num_leaves,params_lgbm_subsample,params_lr_C,params_lr_class_weight_balanced,params_lr_penalty,params_scaler,params_xgb_alpha,params_xgb_colsample,params_xgb_gamma,params_xgb_lambda,params_xgb_lr,params_xgb_max_depth,params_xgb_min_child,params_xgb_n_estimators,params_xgb_subsample,user_attrs_elapsed_sec,user_attrs_n_features,user_attrs_pooled_auroc,user_attrs_pruned_reason,user_attrs_weighted_auroc
316,0.7746731731764095,COMPLETE,False,xgb,oof+timing,False,,,,,,,,,,,,,standard,0.00865356786270761,0.5750458134960391,0.7664915488547617,0.001545971104120323,0.019866042594557355,3.0,1.0,413.0,0.9442682403450727,0.8112349510192871,52,0.8035457129096082,,0.7746731731764095
317,0.7751096262493715,COMPLETE,False,xgb,oof+timing,False,,,,,,,,,,,,,standard,0.004177696550870307,0.6356893625395034,0.5844766713122768,1.9514570749663052,0.015716139684069964,3.0,1.0,114.0,0.917977187369714,0.29328465461730957,52,0.8020816748486121,,0.7751096262493715
318,0.7755846252607281,COMPLETE,False,xgb,oof+timing,False,,,,,,,,,,,,,standard,0.18633626008925583,0.6040291403224348,0.7040878620544412,0.0012027692788804116,0.01756221703242152,3.0,2.0,160.0,0.8710425021965085,0.37598538398742676,52,0.8030489425475145,,0.7755846252607281
319,0.7701959377822625,COMPLETE,False,lgbm,oof+timing,False,2.0429356960905465,0.39827491705642903,0.003178731631670656,0.014521556452848451,7.0,99.0,392.0,46.0,0.5726213407827562,,,,standard,,,,,,,,,,1.5985653400421143,52,0.799697450350025,,0.7701959377822625
320,0.7751750844057331,COMPLETE,False,xgb,oof+hand,False,,,,,,,,,,,,,standard,0.0019890822478956984,0.5598962815594747,0.9843561469924784,0.0016835642434073286,0.014138441758328813,3.0,1.0,173.0,0.9304392531830268,0.32620811462402344,34,0.8026568964642079,,0.7751750844057331
321,0.7759889149026401,COMPLETE,True,xgb,oof+timing,False,,,,,,,,,,,,,standard,0.0029019918978872156,0.5887034533373728,0.0027813853207325767,0.0020193781848426655,0.012131834646846779,3.0,1.0,190.0,0.9606113321955293,0.4585683345794678,52,0.8047602097764449,,0.7759889149026401
322,0.7726303463357329,COMPLETE,False,xgb,oof+timing,False,,,,,,,,,,,,,standard,0.0015291637930197255,0.6108980918762965,0.5164161960745585,0.0013387222596512385,0.05667047180666778,3.0,1.0,152.0,0.740054463674775,0.3477160930633545,52,0.8016301991821102,,0.7726303463357329
323,0.7706978122119158,COMPLETE,False,lr,oof+timing,False,,,,,,,,,,1.8888725114579923,False,l1,standard,,,,,,,,,,1.1420555114746094,52,0.7976395368254807,,0.7706978122119158
324,0.7757321131313226,COMPLETE,False,xgb,all,False,,,,,,,,,,,,,standard,0.0034307623077335925,0.5794723649865285,0.8697810568636619,0.0011992094621536234,0.017146137720940938,3.0,1.0,131.0,0.9387297121771873,1.1953539848327637,362,0.8026022485716143,,0.7757321131313226
325,0.7764791765776127,COMPLETE,False,xgb,oof+timing,False,,,,,,,,,,,,,standard,0.0023854681453128004,0.627655363280834,1.0266523066144764,0.00153746623745647,0.015162459469939589,3.0,2.0,169.0,0.9243856302661143,0.3834989070892334,52,0.803264223716702,,0.7764791765776127
326,0.7728473080156039,COMPLETE,False,xgb,oof+timing,False,,,,,,,,,,,,,standard,0.0011243407328583015,0.6401010434690826,1.0036886432977776,0.0021331826714662146,0.019938411828302742,3.0,2.0,551.0,0.9100406551826336,1.0543487071990967,52,0.8020912907758666,,0.7728473080156039
327,0.7741313070328187,COMPLETE,False,xgb,oof+timing,False,,,,,,,,,,,,,standard,0.0023928338593766666,0.6262097807496149,0.8303083454155512,0.0017177080091615533,0.015497361591869012,3.0,2.0,464.0,0.9227798285685119,0.8746054172515869,52,0.803122296834111,,0.7741313070328187
328,0.7729486851843311,COMPLETE,False,xgb,oof+timing,False,,,,,,,,,,,,,standard,0.0020418865335390898,0.6618442941677024,0.6923159612508538,0.001569590471002972,0.013359306103361567,5.0,2.0,167.0,0.9024194083669095,0.7102904319763184,52,0.8013466081471811,,0.7729486851843311
329,0.7760493756674856,COMPLETE,False,xgb,oof+timing,False,,,,,,,,,,,,,standard,0.004694531582532304,0.6189919136295307,0.44085835098704185,0.0021378258839542313,0.0227300227299195,3.0,2.0,143.0,0.9268079621502793,0.33870720863342285,52,0.8035690433560616,,0.7760493756674856
330,0.7756864649640747,COMPLETE,False,xgb,oof+timing,False,,,,,,,,,,,,,standard,0.002660460813606381,0.6440507551252688,1.242940819501017,0.0018223053011697588,0.018480835119066875,3.0,3.0,159.0,0.9157916651357279,0.37875819206237793,52,0.8030927659536904,,0.7756864649640747
331,0.7765799870264357,COMPLETE,False,xgb,oof+timing,False,,,,,,,,,,,,,standard,0.019694514862576767,0.5442671106156012,0.5923080015355586,0.0014308999455888787,0.016385438405419346,3.0,2.0,179.0,0.9314053950164,0.40163469314575195,52,0.8035884853947727,,0.7765799870264357
332,0.748980616435055,COMPLETE,False,xgb,oof_minus_roberta,False,,,,,,,,,,,,,standard,0.0016127106024124344,0.49579173225678563,0.5585698261411841,0.001477341447587904,0.014257795923692005,3.0,2.0,201.0,0.9351502594269433,0.22708535194396973,5,0.7759053868424479,,0.748980616435055
333,0.774021427619923,COMPLETE,False,xgb,oof+ph,False,,,,,,,,,,,,,standard,0.0018880190032905004,0.524525461851145,0.4187395213179166,0.0023320352994922735,0.017935659416121727,3.0,2.0,182.0,0.947754786502,0.36307859420776367,42,0.8019478400578091,,0.774021427619923
334,0.7739582851845109,COMPLETE,False,xgb,oof+timing,False,,,,,,,,,,,,,none,0.020824841859572816,0.5112876459299444,0.5915031849671851,0.0028233124233689923,0.011278854824354211,4.0,2.0,195.0,0.9330403245149447,0.5640377998352051,52,0.8018740654028079,,0.7739582851845109
335,0.7737840050623211,COMPLETE,False,xgb,oof+timing,True,,,,,,,,,,,,,standard,0.058858322859088055,0.6064728407990425,1.05901349824424,0.0018514894787825618,0.020945363246141557,3.0,2.0,176.0,0.9434557255298123,1.3651762008666992,52,0.8018984993163234,,0.7737840050623211
336,0.7744264249119444,COMPLETE,False,xgb,all_minus_ng,False,,,,,,,,,,,,,standard,0.02852156682202633,0.5394255256683687,0.49628445255151354,0.001484109606305487,0.016029809108547243,3.0,2.0,125.0,0.9253999355362745,0.5555369853973389,131,0.8015687728489932,,0.7744264249119444
337,0.7748209138433875,COMPLETE,False,xgb,oof+timing,False,,,,,,,,,,,,,standard,0.0037934434743957467,0.9008326079567239,0.3809684463916985,0.03672259581377526,0.012533725953567887,3.0,2.0,152.0,0.9351817110735651,0.37839770317077637,52,0.8020050101608298,,0.7748209138433875
338,0.775433390610813,COMPLETE,False,xgb,oof+hand+graph,False,,,,,,,,,,,,,standard,0.006088132389750316,0.6277873982071542,0.6282930558810028,0.0018569795769587968,0.01407055924321025,3.0,3.0,210.0,0.6349263068818354,0.4483790397644043,49,0.8034431430188946,,0.775433390610813
339,0.7744557882171527,COMPLETE,False,xgb,oof+timing,False,,,,,,,,,,,,,standard,0.014252109342400903,0.5952593379121989,0.3089065707756723,0.002375353960943672,0.018072775057662326,3.0,2.0,348.0,0.9546204865303951,0.6882269382476807,52,0.8035594274288071,,0.7744557882171527
340,0.7681191027528135,COMPLETE,True,lgbm,oof+timing,False,0.004876361032396457,0.5692886917222948,0.15514657049103026,0.0022426457170369642,12.0,16.0,707.0,176.0,0.7547043888872348,,,,standard,,,,,,,,,,15.146508932113647,52,0.7980574355656682,,0.7681191027528135
341,0.775656214775111,COMPLETE,False,xgb,oof+timing,False,,,,,,,,,,,,,standard,0.0021432604401793788,0.6011983348160698,0.47159363045141844,0.0014251098393840444,0.015898883483757648,3.0,2.0,139.0,0.9133856181474576,0.321988582611084,52,0.8026707686215584,,0.775656214775111
342,0.7754724623280009,COMPLETE,False,xgb,oof+timing,False,,,,,,,,,,,,,standard,0.002427539119461784,0.5476754701344347,0.10754425290417086,0.002037274953143334,0.02407991738033322,3.0,4.0,183.0,0.9434291873741019,0.37293386459350586,52,0.8039176338555465,,0.7754724623280009
343,0.7747983524817784,COMPLETE,False,xgb,oof_only,False,,,,,,,,,,,,,standard,0.003349277205380914,0.6182622667133024,4.820676020966593,0.0016884561218119135,0.014331530828027815,3.0,3.0,158.0,0.9299612815594701,0.1658182144165039,6,0.8017499516313604,,0.7747983524817784
344,0.7750969019489865,COMPLETE,False,xgb,oof+timing,False,,,,,,,,,,,,,standard,0.005033328921154571,0.5713592037878465,2.343543483884081,0.0013285152428205646,0.019881847397721298,3.0,5.0,172.0,0.8808470381129027,0.3773231506347656,52,0.8031206679065432,,0.7750969019489865
345,0.7754976908352041,COMPLETE,False,xgb,oof+ng,False,,,,,,,,,,,,,standard,0.20150689763360471,0.5888819812924173,0.38434324197163394,0.002928762753768202,0.01682475996103871,3.0,1.0,193.0,0.9599165180951229,0.90834641456604,237,0.8029049138229007,,0.7754976908352041
346,0.7698801693072261,COMPLETE,False,lr,oof+timing,False,,,,,,,,,,36.249140951829126,True,l2,standard,,,,,,,,,,0.1132206916809082,52,0.797247385650073,,0.7698801693072261
347,0.7709134982104321,COMPLETE,False,xgb,oof+timing,False,,,,,,,,,,,,,standard,0.002998863613668991,0.6084126987705747,1.2020419266869005,0.0015811591245493768,0.012507595854899356,7.0,1.0,150.0,0.9010032898149344,1.1004760265350342,52,0.7998961269672322,,0.7709134982104321
348,0.7669902086123732,COMPLETE,False,xgb,oof+timing,False,,,,,,,,,,,,,standard,0.044575774221815224,0.6301797549649905,0.26281866770714346,0.0011439340921599072,0.014982874262583417,9.0,2.0,172.0,0.9227447838564913,2.0107085704803467,52,0.7963941428809087,,0.7669902086123732
349,0.7758391944248557,COMPLETE,False,xgb,oof+timing,False,,,,,,,,,,,,,standard,0.0017774013062386766,0.5668514896145375,0.5111729576368447,0.0022900716929885557,0.010772259890480503,3.0,1.0,163.0,0.9493367056380659,0.3805093765258789,52,0.8026349847611198,,0.7758391944248557
350,0.775894680017251,COMPLETE,False,xgb,oof+timing,False,,,,,,,,,,,,,standard,0.01735277213448585,0.5400788392460468,0.18404870564652395,0.0018343928635070124,0.018356117701359496,3.0,1.0,208.0,0.936019605948692,0.43827009201049805,52,0.8037250000341549,,0.775894680017251
351,0.7740672300968809,COMPLETE,False,xgb,oof+timing,False,,,,,,,,,,,,,standard,0.002309599650277478,0.6517481515224044,0.07481230261777533,0.0014599338451596992,0.013266963618675492,4.0,1.0,184.0,0.9100463061216422,0.5845766067504883,52,0.8017850523931416,,0.7740672300968809
352,0.7751604810537545,COMPLETE,False,xgb,oof+timing,False,,,,,,,,,,,,,standard,0.001295032167010135,0.5852833541643405,0.3509932031940552,0.0026322608434322355,0.00897996852098765,3.0,1.0,137.0,0.9387083539165717,0.3717508316040039,52,0.8018915106915974,,0.7751604810537545
353,0.774763697072602,COMPLETE,False,xgb,oof+hand,False,,,,,,,,,,,,,standard,0.004075149924746424,0.5990410543234386,0.5956181729421209,0.001013595755529281,0.016277754562804995,3.0,2.0,120.0,0.9285787292250901,0.27266621589660645,34,0.8021433113659315,,0.774763697072602
354,0.7746405545992617,COMPLETE,False,xgb,oof+timing,False,,,,,,,,,,,,,none,0.0032843618077598833,0.5601038058110009,3.7426128084590298,0.0035607724309831093,0.031103964347517703,3.0,10.0,194.0,0.952069997702052,0.4228861331939697,52,0.8033665308771628,,0.7746405545992617
355,0.7757347352057243,COMPLETE,False,xgb,oof+timing,False,,,,,,,,,,,,,robust,0.0027951116431229276,0.5776565442373145,0.4393042076605473,0.0020993677800510598,0.021190961390373454,3.0,1.0,158.0,0.9662948891623877,0.4203770160675049,52,0.8032246039945717,,0.7757347352057243
356,0.7760809682872473,COMPLETE,False,xgb,oof+timing,False,,,,,,,,,,,,,standard,0.0024208067191647076,0.5200478248597007,0.2586650080071791,0.011284502759140525,0.014550489879005889,3.0,7.0,177.0,0.9193945088476744,0.4515507221221924,52,0.8029088547766935,,0.7760809682872473
357,0.7740067668081495,COMPLETE,False,xgb,all,True,,,,,,,,,,,,,standard,0.22162774548163464,0.6764360452657208,0.6871644804676591,0.005643559737893205,0.01752832715024429,3.0,9.0,143.0,0.9416301769838062,4.75106406211853,362,0.8019837290103488,,0.7740067668081495
358,0.7760257837106143,COMPLETE,False,xgb,oof+timing,False,,,,,,,,,,,,,standard,0.17096741431789725,0.6101530538555313,0.15011490878049963,0.0013063265742880258,0.01208478588108007,3.0,1.0,169.0,0.9290754536732428,0.44323229789733887,52,0.8027604121838319,,0.7760257837106143
359,0.7755254249838088,COMPLETE,False,xgb,oof+timing,False,,,,,,,,,,,,,standard,0.008176090803578014,0.5500868955701463,1.1104176175411595,0.001770755349246643,0.019409689407901574,3.0,1.0,191.0,0.956247235649742,0.44718098640441895,52,0.8036250048999192,,0.7755254249838088
360,0.7762382919495193,COMPLETE,True,xgb,oof+timing,False,,,,,,,,,,,,,standard,0.0018526343386482983,0.5901843222982536,0.5276414686214307,0.0012057088055267124,0.015728385134409124,3.0,1.0,218.0,0.8416060942387701,0.5812559127807617,52,0.8055930646779879,,0.7762382919495193
361,0.7668234146683225,COMPLETE,False,xgb,oof+timing,False,,,,,,,,,,,,,standard,0.003508589303935463,0.6189917592168737,0.3388540945480177,0.0015620301900851079,0.013252113863738159,10.0,2.0,151.0,0.9155213361013895,2.4402873516082764,52,0.7962318281306964,,0.7668234146683225
362,0.7558603996336107,COMPLETE,False,xgb,oof+timing,False,,,,,,,,,,,,,standard,0.0014588737898740304,0.5715060403627573,0.24626404390642315,5.728832735967965,0.27509349187487553,3.0,1.0,180.0,0.8942509044173328,0.4336574077606201,52,0.7854529516850626,,0.7558603996336107
363,0.7161756894659487,COMPLETE,False,lgbm,oof_minus_roberta,False,0.3122184540291974,0.37573815335488964,0.6706502815912586,0.006076037170132025,0.0,34.0,101.0,95.0,0.826572286776004,,,,standard,,,,,,,,,,0.6104061603546143,5,0.7401005079836893,,0.7161756894659487
364,0.7745678948415331,COMPLETE,False,xgb,oof+ph,False,,,,,,,,,,,,,standard,0.002205932259832561,0.5982974011406539,2.5968713350287485,9.836837659958709,0.01706211693685951,3.0,1.0,204.0,0.9445236744764928,0.6976046562194824,42,0.802327012358726,,0.7745678948415331
365,0.7756007043343003,COMPLETE,False,xgb,oof+timing,False,,,,,,,,,,,,,standard,0.14211679021952586,0.6369036907123093,1.9665196911607448,0.0021043963294896826,0.014762245342363112,3.0,2.0,103.0,0.9280617926051882,0.2733781337738037,52,0.8024777144317623,,0.7756007043343003
366,0.7754219783588687,COMPLETE,False,xgb,oof+timing,False,,,,,,,,,,,,,standard,0.2689409941560738,0.5326062722692836,0.41819615878766064,0.002913920367700475,0.02621823657762737,3.0,1.0,162.0,0.9044805578623207,0.3818056583404541,52,0.803506461009832,,0.7754219783588687
367,0.7758307626459193,COMPLETE,False,xgb,oof+timing,False,,,,,,,,,,,,,standard,0.011781298672118207,0.5805667259322971,0.05693014735101185,0.0014138237997257232,0.02136746053701603,3.0,1.0,140.0,0.9349129097110088,0.3352172374725342,52,0.8032306467903874,,0.7758307626459193
368,0.7753161452948528,COMPLETE,False,xgb,all_minus_ng,False,,,,,,,,,,,,,robust,0.0025888833728247435,0.5632699243495866,0.1682832523177409,0.0017426546043527171,0.01917659149822931,3.0,1.0,172.0,0.9218217310548829,0.8292348384857178,131,0.8033419393254959,,0.7753161452948528
369,0.7755928812983992,COMPLETE,False,xgb,oof+timing,False,,,,,,,,,,,,,standard,0.00417016915155569,0.6128536784127162,0.572792932941143,0.0010083999606854087,0.013817856066559216,3.0,3.0,190.0,0.7065717842403632,0.4177980422973633,52,0.8027929907351854,,0.7755928812983992
370,0.7761519950763575,COMPLETE,False,xgb,oof+timing,False,,,,,,,,,,,,,standard,0.0029748855785793307,0.5952054239942874,0.0045764232970148255,0.0023682084072319245,0.01678264826660361,3.0,2.0,126.0,0.9699024708494594,0.29294276237487793,52,0.8029526256368189,,0.7761519950763575
371,0.7757155175287846,COMPLETE,False,lr,oof+hand+graph,False,,,,,,,,,,0.02433633686852282,False,l1,standard,,,,,,,,,,0.0639503002166748,49,0.8001544958978875,,0.7757155175287846
372,0.7759395620446405,COMPLETE,False,xgb,oof+timing,False,,,,,,,,,,,,,standard,0.0019012597726712854,0.5541911414233538,0.30906610827738207,0.0013027722195147811,0.011708148901298088,3.0,1.0,156.0,0.9479110064785564,0.34674978256225586,52,0.8027396039478059,,0.7759395620446405
373,0.771927030654987,COMPLETE,False,xgb,oof+timing,True,,,,,,,,,,,,,standard,0.20007811807300693,0.5804291597665868,0.43319901224664376,0.0019858841352036537,0.015389713662391061,3.0,1.0,671.0,0.9369696575306399,4.433290958404541,52,0.8012388361974608,,0.771927030654987
374,0.7756288988055161,COMPLETE,False,xgb,oof+timing,False,,,,,,,,,,,,,standard,0.003247028018471068,0.4769578281284416,0.7260714266066313,0.001565079557385536,0.01866079380447493,3.0,1.0,182.0,0.9615679190431243,0.38463640213012695,52,0.8029519950842119,,0.7756288988055161
375,0.7760601540778309,COMPLETE,False,xgb,oof+timing,False,,,,,,,,,,,,,standard,0.005430240797017504,0.6243196342372452,0.20159342232748192,0.0011894377789796536,0.013317349852920192,3.0,2.0,165.0,0.9265076829480257,0.36076974868774414,52,0.8029134788291437,,0.7760601540778309
376,0.7754686554896074,COMPLETE,False,xgb,oof+timing,False,,,,,,,,,,,,,standard,0.002627399834803985,0.5977074123368776,0.3410967491932161,0.002643967593067493,0.010073356393541677,3.0,1.0,206.0,0.914772384138972,0.4525775909423828,52,0.8025423986200146,,0.7754686554896074
377,0.7727646034024556,COMPLETE,False,xgb,oof_only,False,,,,,,,,,,,,,none,0.002309567767032615,0.7497273287386303,0.5019643582634641,0.0017047302791775632,0.022829272472084106,4.0,1.0,153.0,0.9506007261507846,0.20032262802124023,6,0.8007585127491956,,0.7727646034024556
378,0.7745912465501447,COMPLETE,False,xgb,oof+timing,False,,,,,,,,,,,,,standard,0.2968965885310389,0.5430593026043933,0.664492971576023,0.0020442952769641333,0.016552924642688052,4.0,2.0,175.0,0.9404105347638724,0.5235805511474609,52,0.80266262398372,,0.7745912465501447
379,0.7759225492949473,COMPLETE,True,xgb,oof+timing,False,,,,,,,,,,,,,standard,0.0017320511862209472,0.5680084478461289,0.12150749201191455,0.0013778883973096937,0.014786176544019633,3.0,1.0,138.0,0.9083262136667155,0.34407472610473633,52,0.8046053565654137,,0.7759225492949473
380,0.7708388938332669,COMPLETE,False,xgb,oof+ng,False,,,,,,,,,,,,,robust,0.23588929608458556,0.408194876141207,0.2606721568243138,0.0034787786389022996,0.018065186814030132,3.0,1.0,595.0,0.9247253680364472,2.0595483779907227,237,0.8000523463755784,,0.7708388938332669
381,0.7758340093299196,COMPLETE,False,xgb,oof+timing,False,,,,,,,,,,,,,standard,0.00455934403230554,0.5835619985174396,0.866883860927397,0.0011509921745644612,0.020141985452150384,3.0,1.0,197.0,0.9342614576332811,0.4267587661743164,52,0.8037820650450744,,0.7758340093299196
382,0.7760240983660684,COMPLETE,False,xgb,oof+timing,False,,,,,,,,,,,,,standard,0.0036220161389633933,0.6082027044905758,0.3811667010502521,0.0023728543387751006,0.012882747958376437,3.0,1.0,168.0,0.9542008373929393,0.3947734832763672,52,0.8029020763361698,,0.7760240983660684
383,0.7758703102676657,COMPLETE,False,xgb,oof+timing,False,,,,,,,,,,,,,standard,0.17059782438470555,0.6304706253087601,0.5028267872407282,0.001628259309357194,0.015435140449782787,3.0,2.0,185.0,0.7904174450990268,0.39804720878601074,52,0.8031717426676979,,0.7758703102676657
384,0.7749723544403174,COMPLETE,False,xgb,oof+hand,False,,,,,,,,,,,,,standard,0.002104504648804626,0.5639147200001946,0.6267806595806373,0.001834599683130416,0.011203517143988005,3.0,3.0,148.0,0.7589900536165756,0.2734551429748535,34,0.8018401732001901,,0.7749723544403174
385,0.7752511203862781,COMPLETE,False,xgb,oof+timing,False,,,,,,,,,,,,,standard,0.0028572070458926352,0.6587337180181162,0.29659084671394265,0.001002789968811165,0.017146411682713514,3.0,1.0,230.0,0.9165536125724252,0.49363279342651367,52,0.8033049994519446,,0.7752511203862781
386,0.7623147891579871,COMPLETE,False,lgbm,oof+timing,False,0.015277104994212096,0.4955050787266284,0.016309010451002307,0.051278240022505396,4.0,51.0,535.0,234.0,0.6905737546369279,,,,standard,,,,,,,,,,1.0548062324523926,52,0.791532372097921,,0.7623147891579871
387,0.7709559852130099,COMPLETE,False,xgb,oof+timing,False,,,,,,,,,,,,,standard,0.001521142280018752,0.5268654472674632,0.14717781095906088,0.00139323098820406,0.014383801816925685,6.0,1.0,160.0,0.977005398379662,0.8748915195465088,52,0.7998568750674562,,0.7709559852130099
388,0.774893158750145,COMPLETE,False,xgb,all,False,,,,,,,,,,,,,standard,0.09991877551521926,0.5901758563485798,1.534266598492507,0.00215205352282079,0.019200849255239124,3.0,5.0,217.0,0.9371672326562369,1.6805369853973389,362,0.803157765418246,,0.774893158750145
389,0.7761947725273091,COMPLETE,False,xgb,oof+timing,False,,,,,,,,,,,,,standard,0.1374987250195697,0.6045186504065682,0.43319426807020456,0.0029572063038181017,0.016331018495049955,3.0,1.0,128.0,0.946125920070121,0.30512380599975586,52,0.8028650839165683,,0.7761947725273091
390,0.7713058896965181,COMPLETE,False,lr,oof+timing,False,,,,,,,,,,0.1504935664768855,False,l2,standard,,,,,,,,,,0.07462835311889648,52,0.7981613716536968,,0.7713058896965181
391,0.7759572166997085,COMPLETE,False,xgb,oof+timing,False,,,,,,,,,,,,,standard,0.0033713967525832024,0.5496551168092457,0.23386254587235172,0.0015802277587157983,0.0124458783053339,3.0,1.0,180.0,0.9628585954681117,0.38260841369628906,52,0.8027851088275998,,0.7759572166997085
392,0.7737977770877973,COMPLETE,False,xgb,oof+timing,True,,,,,,,,,,,,,robust,0.03367458355737309,0.5064399040920662,0.09062291930466415,0.0012707503803057341,0.02173036259148527,3.0,2.0,190.0,0.9249451014585198,1.432309627532959,52,0.8022619078020692,,0.7737977770877973
393,0.776434317731137,COMPLETE,False,xgb,oof+timing,False,,,,,,,,,,,,,standard,0.0025824809885762953,0.5768885601677082,0.5617122375263535,0.0019102884235894229,0.013798485063164721,3.0,1.0,168.0,0.9310742560131804,0.37097644805908203,52,0.803107111025496,,0.776434317731137
394,0.7750531011386177,COMPLETE,False,xgb,oof+timing,False,,,,,,,,,,,,,standard,0.0022132997733662952,0.5767063679981085,0.7303224055894666,0.0023660541846356443,0.013733312569634134,3.0,1.0,152.0,0.5991077018087123,0.3530111312866211,52,0.8021342734452332,,0.7750531011386177
