number,value,state,params_add_group_dummies,params_family,params_feature_subset,params_isotonic,params_lgbm_alpha,params_lgbm_colsample,params_lgbm_lambda,params_lgbm_lr,params_lgbm_max_depth,params_lgbm_min_child,params_lgbm_n_estimators,params_lgbm_num_leaves,params_lgbm_subsample,params_lr_C,params_lr_class_weight_balanced,params_lr_penalty,params_scaler,params_xgb_alpha,params_xgb_colsample,params_xgb_gamma,params_xgb_lambda,params_xgb_lr,params_xgb_max_depth,params_xgb_min_child,params_xgb_n_estimators,params_xgb_subsample,user_attrs_elapsed_sec,user_attrs_n_features,user_attrs_pooled_auroc,user_attrs_pruned_reason,user_attrs_weighted_auroc
1989,0.7755918462766473,COMPLETE,True,lr,oof+hand,False,,,,,,,,,,0.036743019469071374,False,l2,robust,,,,,,,,,,0.1982557773590088,34,0.8039128521649446,,0.7755918462766473
1990,0.775436147164253,COMPLETE,True,lgbm,oof+hand,False,2.435135055246353,0.7835764319535199,0.018384105695913987,0.02120831201155579,2.0,63.0,186.0,150.0,0.5863863886638319,,,,robust,,,,,,,,,,0.2751302719116211,34,0.8040377541271507,,0.775436147164253
1991,0.7771619253397469,COMPLETE,True,lr,oof+hand,False,,,,,,,,,,0.09155260640545017,False,l1,robust,,,,,,,,,,0.22458815574645996,34,0.8053348533854843,,0.7771619253397469
1992,0.7776953186426686,COMPLETE,True,lr,oof+hand,False,,,,,,,,,,0.0492727808983627,False,l1,robust,,,,,,,,,,0.12963557243347168,34,0.8054179812374869,,0.7776953186426686
1993,0.773591280619013,COMPLETE,True,lr,oof+hand,True,,,,,,,,,,0.07077637429330634,False,l1,robust,,,,,,,,,,0.3849194049835205,34,0.802327748003434,,0.773591280619013
1994,0.7776324866315191,COMPLETE,True,lr,oof+hand,False,,,,,,,,,,0.03915840365216502,False,l1,robust,,,,,,,,,,0.12132453918457031,34,0.805263180572506,,0.7776324866315191
1995,0.7772524724244286,COMPLETE,True,lr,oof+hand,False,,,,,,,,,,0.028160809424894184,False,l1,robust,,,,,,,,,,0.10409832000732422,34,0.8046261648014394,,0.7772524724244286
1996,0.7776762639751061,COMPLETE,True,lr,oof+hand,False,,,,,,,,,,0.05520693089825315,False,l1,robust,,,,,,,,,,0.1445636749267578,34,0.8054474595718568,,0.7776762639751061
1997,0.7765302291013965,COMPLETE,True,lr,oof+hand,False,,,,,,,,,,0.020015373195453778,False,l1,robust,,,,,,,,,,0.09812641143798828,34,0.802942431703008,,0.7765302291013965
1998,0.7776933386994522,COMPLETE,True,lr,oof+hand,False,,,,,,,,,,0.04285176230311897,False,l1,robust,,,,,,,,,,0.12227034568786621,34,0.8053452575034972,,0.7776933386994522
1999,0.7776189281937417,COMPLETE,True,lr,oof+hand,False,,,,,,,,,,0.06432835131016057,False,l1,robust,,,,,,,,,,0.16272449493408203,34,0.805471788393271,,0.7776189281937417
