number,value,state,params_add_group_dummies,params_family,params_feature_subset,params_isotonic,params_lgbm_alpha,params_lgbm_colsample,params_lgbm_lambda,params_lgbm_lr,params_lgbm_max_depth,params_lgbm_min_child,params_lgbm_n_estimators,params_lgbm_num_leaves,params_lgbm_subsample,params_lr_C,params_lr_class_weight_balanced,params_lr_penalty,params_scaler,params_xgb_alpha,params_xgb_colsample,params_xgb_gamma,params_xgb_lambda,params_xgb_lr,params_xgb_max_depth,params_xgb_min_child,params_xgb_n_estimators,params_xgb_subsample,user_attrs_elapsed_sec,user_attrs_n_features,user_attrs_pooled_auroc,user_attrs_pruned_reason,user_attrs_weighted_auroc
1747,0.777432331009036,COMPLETE,True,lr,oof+hand,False,,,,,,,,,,0.07387602845229763,False,l1,robust,,,,,,,,,,0.18466567993164062,34,0.8054271767963368,,0.777432331009036
1748,0.7754084933715267,COMPLETE,True,lr,oof+hand,False,,,,,,,,,,0.04857482262130206,False,l2,robust,,,,,,,,,,0.20366406440734863,34,0.8038891013500866,,0.7754084933715267
1749,0.77768247821987,COMPLETE,True,lr,oof+hand,False,,,,,,,,,,0.060459327239865815,False,l1,robust,,,,,,,,,,0.16498160362243652,34,0.8054733647747883,,0.77768247821987
1750,0.7776809863317912,COMPLETE,True,lr,oof+hand,False,,,,,,,,,,0.044414256691077174,False,l1,robust,,,,,,,,,,0.12845420837402344,34,0.8053744731076145,,0.7776809863317912
1751,0.7775544471686534,COMPLETE,True,lr,oof+hand,False,,,,,,,,,,0.06623057937904712,False,l1,robust,,,,,,,,,,0.1640791893005371,34,0.8054633810251797,,0.7775544471686534
1752,0.7777097362995778,COMPLETE,True,lr,oof+hand,False,,,,,,,,,,0.04805676893827909,False,l1,robust,,,,,,,,,,0.1334683895111084,34,0.8054128317245309,,0.7777097362995778
1753,0.777179706454617,COMPLETE,True,lr,oof+hand,False,,,,,,,,,,0.0946897794848678,False,l1,robust,,,,,,,,,,0.2404019832611084,34,0.8053210863202347,,0.777179706454617
1754,0.7776648686528245,COMPLETE,True,lr,oof+hand,False,,,,,,,,,,0.041257911593707335,False,l1,robust,,,,,,,,,,0.12009477615356445,34,0.8053170928203913,,0.7776648686528245
1755,0.7768592564073814,COMPLETE,True,lr,oof+hand,False,,,,,,,,,,0.023176372531025814,False,l1,robust,,,,,,,,,,0.10083174705505371,34,0.803829619220841,,0.7768592564073814
1756,0.7775009816950381,COMPLETE,True,lr,oof+hand,False,,,,,,,,,,0.07109833778915274,False,l1,robust,,,,,,,,,,0.1613173484802246,34,0.8054374758222486,,0.7775009816950381
1757,0.7776755223515959,COMPLETE,True,lr,oof+hand,False,,,,,,,,,,0.043956160784553285,False,l1,robust,,,,,,,,,,0.12490248680114746,34,0.8053649097264106,,0.7776755223515959
1758,0.7776920762508411,COMPLETE,True,lr,oof+hand,False,,,,,,,,,,0.05597926422505311,False,l1,robust,,,,,,,,,,0.14805889129638672,34,0.8054542380123805,,0.7776920762508411
1759,0.7700669810295184,COMPLETE,True,lgbm,oof+hand,False,0.13710330284909084,0.3214811143508648,3.3043499747015734,0.005804712398356489,0.0,65.0,766.0,110.0,0.9031461994733191,,,,robust,,,,,,,,,,4.2488086223602295,34,0.8000384216721771,,0.7700669810295184
1760,0.77742004719193,COMPLETE,True,lr,oof+hand,False,,,,,,,,,,0.07475883662362275,False,l1,robust,,,,,,,,,,0.19014453887939453,34,0.8054272293423873,,0.77742004719193
1761,0.7777038121603663,COMPLETE,True,lr,oof+hand,False,,,,,,,,,,0.04671824018009691,False,l1,robust,,,,,,,,,,0.12378644943237305,34,0.8053933896858197,,0.7777038121603663
1762,0.7776428332905819,COMPLETE,True,lr,oof+hand,False,,,,,,,,,,0.06174401584396224,False,l1,robust,,,,,,,,,,0.14986109733581543,34,0.8054733647747881,,0.7776428332905819
1763,0.7776634709644695,COMPLETE,True,lr,oof+hand,False,,,,,,,,,,0.04059785356102898,False,l1,robust,,,,,,,,,,0.11907672882080078,34,0.8052999628079054,,0.7776634709644695
1764,0.7776682279999653,COMPLETE,True,lr,oof+hand,False,,,,,,,,,,0.053985397574088836,False,l1,robust,,,,,,,,,,0.1447618007659912,34,0.8054393674800691,,0.7776682279999653
1765,0.7776534010801143,COMPLETE,True,lr,oof+hand,False,,,,,,,,,,0.03996634388614452,False,l1,robust,,,,,,,,,,0.11922001838684082,34,0.8052871415715662,,0.7776534010801143
1766,0.7733732013625759,COMPLETE,True,lr,oof+hand,True,,,,,,,,,,0.0937164844047267,False,l1,robust,,,,,,,,,,0.5392310619354248,34,0.8023302702138614,,0.7733732013625759
1767,0.777670513750697,COMPLETE,True,lr,oof+hand,False,,,,,,,,,,0.06061159174874631,False,l1,robust,,,,,,,,,,0.16057658195495605,34,0.8054746258800018,,0.777670513750697
1768,0.775429808266996,COMPLETE,True,lr,oof+hand,False,,,,,,,,,,0.04933539924948691,False,l2,robust,,,,,,,,,,0.20542693138122559,34,0.8039130623491468,,0.775429808266996
1769,0.7772585446952708,COMPLETE,True,lr,oof+hand,False,,,,,,,,,,0.08183995885720388,False,l1,robust,,,,,,,,,,0.20271658897399902,34,0.8053764698575361,,0.7772585446952708
1770,0.7776816900453626,COMPLETE,True,lr,oof+hand,False,,,,,,,,,,0.04176112750858173,False,l1,robust,,,,,,,,,,0.11881232261657715,34,0.8053233458004092,,0.7776816900453626
1771,0.7776156022635579,COMPLETE,True,lr,oof+hand,False,,,,,,,,,,0.06451732115784305,False,l1,robust,,,,,,,,,,0.16506409645080566,34,0.8054668490645175,,0.7776156022635579
1772,0.7769743392502964,COMPLETE,True,lr,oof+hand,False,,,,,,,,,,0.024779939213277494,False,l1,robust,,,,,,,,,,0.10178136825561523,34,0.804156770931693,,0.7769743392502964
1773,0.7777191822909091,COMPLETE,True,lr,oof+hand,False,,,,,,,,,,0.049751230358999504,False,l1,robust,,,,,,,,,,0.13133621215820312,34,0.8054249173161622,,0.7777191822909091
1774,0.7776866045221462,COMPLETE,True,lr,oof+hand,False,,,,,,,,,,0.04022611233953575,False,l1,robust,,,,,,,,,,0.11962318420410156,34,0.8052913978016625,,0.7776866045221462
1775,0.7773435123631354,COMPLETE,True,lr,oof+hand,False,,,,,,,,,,0.07845483410668445,False,l1,robust,,,,,,,,,,0.19721531867980957,34,0.805405843099805,,0.7773435123631354
1776,0.7777029722176252,COMPLETE,True,lr,oof+hand,False,,,,,,,,,,0.04876206877004566,False,l1,robust,,,,,,,,,,0.13335585594177246,34,0.8054138826455424,,0.7777029722176252
1777,0.7776849339281297,COMPLETE,True,lr,oof+hand,False,,,,,,,,,,0.059714742424855034,False,l1,robust,,,,,,,,,,0.1592268943786621,34,0.8054744682418502,,0.7776849339281297
1778,0.7776751590301135,COMPLETE,True,lr,oof+hand,False,,,,,,,,,,0.04195993143874406,False,l1,robust,,,,,,,,,,0.11954593658447266,34,0.8053272867542021,,0.7776751590301135
1779,0.7756454040966293,COMPLETE,True,lr,oof+hand,False,,,,,,,,,,0.014228097996040407,False,l1,robust,,,,,,,,,,0.09650635719299316,34,0.8000413117049585,,0.7756454040966293
1780,0.7692244118058464,COMPLETE,True,lgbm,oof+hand,False,0.7757251000528206,0.8242880572116482,0.00480634254908751,0.01851189218431648,4.0,44.0,522.0,228.0,0.7125310480982975,,,,robust,,,,,,,,,,1.0345854759216309,34,0.7999290207948894,,0.7692244118058464
1781,0.7770395848199546,COMPLETE,True,lr,oof+hand,False,,,,,,,,,,0.025340207087436672,False,l1,robust,,,,,,,,,,0.10211467742919922,34,0.8042546116778553,,0.7770395848199546
1782,0.7775703937012499,COMPLETE,True,lr,oof+hand,False,,,,,,,,,,0.06948343934520597,False,l1,robust,,,,,,,,,,0.16605353355407715,34,0.8054508225190935,,0.7775703937012499
1783,0.7776966954465558,COMPLETE,True,lr,oof+hand,False,,,,,,,,,,0.05252614008602957,False,l1,robust,,,,,,,,,,0.13793253898620605,34,0.8054331145000511,,0.7776966954465558
1784,0.7776209710089406,COMPLETE,True,lr,oof+hand,False,,,,,,,,,,0.038154878541488926,False,l1,robust,,,,,,,,,,0.11601638793945312,34,0.8052118956271492,,0.7776209710089406
1785,0.7742262598147135,COMPLETE,True,lr,oof+hand,True,,,,,,,,,,0.0515700302461814,False,l1,robust,,,,,,,,,,0.29517340660095215,34,0.8026160681829144,,0.7742262598147135
1786,0.777185389642934,COMPLETE,True,lr,oof+hand,False,,,,,,,,,,0.08767549646192592,False,l1,robust,,,,,,,,,,0.22366642951965332,34,0.8053536648715884,,0.777185389642934
1787,0.7776231631836924,COMPLETE,True,lr,oof+hand,False,,,,,,,,,,0.037131901593649375,False,l1,robust,,,,,,,,,,0.11141777038574219,34,0.8051818392862229,,0.7776231631836924
1788,0.777566373958811,COMPLETE,True,lr,oof+hand,False,,,,,,,,,,0.06738635370719473,False,l1,robust,,,,,,,,,,0.17237591743469238,34,0.8054616995515615,,0.777566373958811
1789,0.77542000798544,COMPLETE,True,lr,oof+hand,False,,,,,,,,,,0.047569812618045014,False,l2,robust,,,,,,,,,,0.20418262481689453,34,0.8039011869417179,,0.77542000798544
1790,0.7776834843822065,COMPLETE,True,lr,oof+hand,False,,,,,,,,,,0.06093246682080168,False,l1,robust,,,,,,,,,,0.15832781791687012,34,0.8054759920773167,,0.7776834843822065
1791,0.7776378906361224,COMPLETE,True,lr,oof+hand,False,,,,,,,,,,0.039742709619389756,False,l1,robust,,,,,,,,,,0.11616110801696777,34,0.8052763170851486,,0.7776378906361224
1792,0.7777155940802184,COMPLETE,True,lr,oof+hand,False,,,,,,,,,,0.04994538782870699,False,l1,robust,,,,,,,,,,0.13089847564697266,34,0.8054309601119778,,0.7777155940802184
1793,0.7771170833586193,COMPLETE,True,lr,oof+hand,False,,,,,,,,,,0.026300170786809348,False,l1,robust,,,,,,,,,,0.10498356819152832,34,0.8043849258832703,,0.7771170833586193
1794,0.7773752013322845,COMPLETE,True,lr,oof+hand,False,,,,,,,,,,0.07697115072970576,False,l1,robust,,,,,,,,,,0.20605874061584473,34,0.8054227103820382,,0.7773752013322845
1795,0.7776197167169696,COMPLETE,True,lr,oof+hand,False,,,,,,,,,,0.037034162628701385,False,l1,robust,,,,,,,,,,0.1239464282989502,34,0.8051766897732671,,0.7776197167169696
1796,0.7771410746734675,COMPLETE,True,lr,oof+hand,False,,,,,,,,,,0.09813824119190931,False,l1,robust,,,,,,,,,,0.2516193389892578,34,0.8053099465575138,,0.7771410746734675
1797,0.7777053505469502,COMPLETE,True,lr,oof+hand,False,,,,,,,,,,0.04797380365294451,False,l1,robust,,,,,,,,,,0.1460273265838623,34,0.8054079974878784,,0.7777053505469502
1798,0.7776376969292668,COMPLETE,True,lr,oof+hand,False,,,,,,,,,,0.06256915834387194,False,l1,robust,,,,,,,,,,0.1700432300567627,34,0.8054719460314228,,0.7776376969292668
1799,0.7776105566146432,COMPLETE,True,lr,oof+hand,False,,,,,,,,,,0.03656556591212635,False,l1,robust,,,,,,,,,,0.1228797435760498,34,0.8051602428594384,,0.7776105566146432
1800,0.7777248923473827,COMPLETE,True,lr,oof+hand,False,,,,,,,,,,0.0454710975896273,False,l1,robust,,,,,,,,,,0.13658475875854492,34,0.8053842992190712,,0.7777248923473827
1801,0.7758370371124867,COMPLETE,True,lgbm,oof+hand,False,6.329876491702658,0.4766361768351587,1.4571241929535803,0.012885927913934355,1.0,25.0,726.0,123.0,0.8311561116277375,,,,robust,,,,,,,,,,0.562497615814209,34,0.8040938207631094,,0.7758370371124867
1802,0.7767548731003612,COMPLETE,True,lr,oof+hand,False,,,,,,,,,,0.021747419392708005,False,l1,robust,,,,,,,,,,0.11122393608093262,34,0.8034767199452093,,0.7767548731003612
1803,0.7738684199703336,COMPLETE,True,lr,oof+hand,True,,,,,,,,,,0.04296415573239423,False,l1,robust,,,,,,,,,,0.27999377250671387,34,0.8026778097923348,,0.7738684199703336
1804,0.7775726996556803,COMPLETE,True,lr,oof+hand,False,,,,,,,,,,0.06855082816958462,False,l1,robust,,,,,,,,,,0.19094443321228027,34,0.805458704426679,,0.7775726996556803
1805,0.77717005595244,COMPLETE,True,lr,oof+hand,False,,,,,,,,,,0.026952735031268327,False,l1,robust,,,,,,,,,,0.11603593826293945,34,0.8044719946890656,,0.77717005595244
1806,0.7775214217769388,COMPLETE,True,lr,oof+hand,False,,,,,,,,,,0.03442796890377457,False,l1,robust,,,,,,,,,,0.1091909408569336,34,0.8050714400339741,,0.7775214217769388
1807,0.7776734820236582,COMPLETE,True,lr,oof+hand,False,,,,,,,,,,0.05684804788584912,False,l1,robust,,,,,,,,,,0.1477494239807129,34,0.8054638013935844,,0.7776734820236582
1808,0.7748907275092983,COMPLETE,True,lr,oof+hand,False,,,,,,,,,,0.00797744294702294,False,l2,robust,,,,,,,,,,0.14317631721496582,34,0.8022292767046648,,0.7748907275092983
1809,0.777714006383694,COMPLETE,True,lr,oof+hand,False,,,,,,,,,,0.045741312918193826,False,l1,robust,,,,,,,,,,0.12148857116699219,34,0.8053825126533517,,0.777714006383694
1810,0.7773318389643687,COMPLETE,True,lr,oof+hand,False,,,,,,,,,,0.07865457274626043,False,l1,robust,,,,,,,,,,0.2012174129486084,34,0.8054078923957773,,0.7773318389643687
1811,0.7776306478301515,COMPLETE,True,lr,oof+hand,False,,,,,,,,,,0.038433142378460176,False,l1,robust,,,,,,,,,,0.11880993843078613,34,0.8052251372318929,,0.7776306478301515
1812,0.7776505664400025,COMPLETE,True,lr,oof+hand,False,,,,,,,,,,0.06154861853861468,False,l1,robust,,,,,,,,,,0.1612532138824463,34,0.8054716307551193,,0.7776505664400025
1813,0.7776893022983177,COMPLETE,True,lr,oof+hand,False,,,,,,,,,,0.044297820999529135,False,l1,robust,,,,,,,,,,0.12494182586669922,34,0.8053725289037433,,0.7776893022983177
1814,0.7771806666986623,COMPLETE,True,lr,oof+hand,False,,,,,,,,,,0.09621800526818285,False,l1,robust,,,,,,,,,,0.23357057571411133,34,0.8053169877282903,,0.7771806666986623
1815,0.7772201973302003,COMPLETE,True,lr,oof+hand,False,,,,,,,,,,0.02743012833187626,False,l1,robust,,,,,,,,,,0.10376095771789551,34,0.8045377297983293,,0.7772201973302003
1816,0.7776861783007479,COMPLETE,True,lr,oof+hand,False,,,,,,,,,,0.05465799706909569,False,l1,robust,,,,,,,,,,0.14523673057556152,34,0.8054458306442892,,0.7776861783007479
1817,0.777448823414227,COMPLETE,True,lr,oof+hand,False,,,,,,,,,,0.03282343320388095,False,l1,robust,,,,,,,,,,0.10602951049804688,34,0.8049923582278655,,0.777448823414227
1818,0.7774378021601525,COMPLETE,True,lr,oof+hand,False,,,,,,,,,,0.07360261162430078,False,l1,robust,,,,,,,,,,0.1810774803161621,34,0.8054288057239044,,0.7774378021601525
1819,0.7776992193337346,COMPLETE,True,lr,oof+hand,False,,,,,,,,,,0.04687986604727678,False,l1,robust,,,,,,,,,,0.13197898864746094,34,0.8053961220804495,,0.7776992193337346
1820,0.7762470695104854,COMPLETE,True,lr,oof+hand,False,,,,,,,,,,0.01802070422688982,False,l1,robust,,,,,,,,,,0.10152292251586914,34,0.8022076277318299,,0.7762470695104854
1821,0.7775965385899788,COMPLETE,True,lr,oof+hand,False,,,,,,,,,,0.037633619472363704,False,l1,robust,,,,,,,,,,0.11804580688476562,34,0.8051881448122914,,0.7775965385899788
1822,0.7737831831130542,COMPLETE,True,lr,oof+hand,True,,,,,,,,,,0.05950726620697001,False,l1,robust,,,,,,,,,,0.34361696243286133,34,0.802384760468303,,0.7737831831130542
1823,0.7777243419265774,COMPLETE,True,lr,oof+hand,False,,,,,,,,,,0.0454450025803029,False,l1,robust,,,,,,,,,,0.11982011795043945,34,0.8053841415809194,,0.7777243419265774
1824,0.7512709293582686,COMPLETE,True,lgbm,oof+hand,False,0.07965626207384165,0.7541306588936476,0.010205055512188437,0.24873369461659867,10.0,9.0,549.0,175.0,0.852088931953025,,,,robust,,,,,,,,,,2.7963290214538574,34,0.7803471570432254,,0.7512709293582686
1825,0.7776594204020593,COMPLETE,True,lr,oof+hand,False,,,,,,,,,,0.04225200928588996,False,l1,robust,,,,,,,,,,0.12035465240478516,34,0.8053325413592591,,0.7776594204020593
1826,0.777346890964387,COMPLETE,True,lr,oof+hand,False,,,,,,,,,,0.030630123390903704,False,l1,robust,,,,,,,,,,0.11096835136413574,34,0.8048375575628847,,0.777346890964387
1827,0.7775594928276971,COMPLETE,True,lr,oof+hand,False,,,,,,,,,,0.06886671168416285,False,l1,robust,,,,,,,,,,0.16766023635864258,34,0.8054552363873413,,0.7775594928276971
1828,0.7777166799805662,COMPLETE,True,lr,oof+hand,False,,,,,,,,,,0.046378322817133,False,l1,robust,,,,,,,,,,0.12283492088317871,34,0.8053895538241281,,0.7777166799805662
1829,0.7756908825683541,COMPLETE,True,lr,oof+hand,False,,,,,,,,,,0.022787093314471173,False,l2,robust,,,,,,,,,,0.1800081729888916,34,0.8038091262611184,,0.7756908825683541
1830,0.7775666817003037,COMPLETE,True,lr,oof+hand,False,,,,,,,,,,0.035008709599919606,False,l1,robust,,,,,,,,,,0.11246442794799805,34,0.8051004979999397,,0.7775666817003037
1831,0.7776752592183638,COMPLETE,True,lr,oof+hand,False,,,,,,,,,,0.0440593720276112,False,l1,robust,,,,,,,,,,0.12538957595825195,34,0.8053689557723045,,0.7776752592183638
1832,0.7776670769435023,COMPLETE,True,lr,oof+hand,False,,,,,,,,,,0.059409159992228525,False,l1,robust,,,,,,,,,,0.15564608573913574,34,0.8054711052946136,,0.7776670769435023
1833,0.7726389679388028,COMPLETE,True,lr,oof+hand,False,,,,,,,,,,0.006150034788685105,False,l1,robust,,,,,,,,,,0.07900094985961914,34,0.794750554965113,,0.7726389679388028
1834,0.7772632332152778,COMPLETE,True,lr,oof+hand,False,,,,,,,,,,0.08399175839690046,False,l1,robust,,,,,,,,,,0.20354366302490234,34,0.8053734221866029,,0.7772632332152778
1835,0.7772244668046384,COMPLETE,True,lr,oof+hand,False,,,,,,,,,,0.027619674712612282,False,l1,robust,,,,,,,,,,0.10393834114074707,34,0.8045573294751921,,0.7772244668046384
1836,0.7776055406938676,COMPLETE,True,lr,oof+hand,False,,,,,,,,,,0.03795335782351133,False,l1,robust,,,,,,,,,,0.12268352508544922,34,0.8052051697326762,,0.7776055406938676
1837,0.7777173360293433,COMPLETE,True,lr,oof+hand,False,,,,,,,,,,0.04833363008656279,False,l1,robust,,,,,,,,,,0.132720947265625,34,0.8054175608690822,,0.7777173360293433
1838,0.7776860267924005,COMPLETE,True,lr,oof+hand,False,,,,,,,,,,0.044559613326828215,False,l1,robust,,,,,,,,,,0.12815308570861816,34,0.805378571699559,,0.7776860267924005
1839,0.77755701186214,COMPLETE,True,lr,oof+hand,False,,,,,,,,,,0.0666340641334929,False,l1,robust,,,,,,,,,,0.1721024513244629,34,0.8054681627157816,,0.77755701186214
1840,0.7773643458606925,COMPLETE,True,lr,oof+hand,False,,,,,,,,,,0.03141315772569456,False,l1,robust,,,,,,,,,,0.11062836647033691,34,0.8048950429422089,,0.7773643458606925
1841,0.7734368690764275,COMPLETE,True,lr,oof+hand,True,,,,,,,,,,0.10220820724616468,False,l1,robust,,,,,,,,,,0.6022145748138428,34,0.8023991055401087,,0.7734368690764275
1842,0.7776004417341275,COMPLETE,True,lr,oof+hand,False,,,,,,,,,,0.03778206855752513,False,l1,robust,,,,,,,,,,0.11712861061096191,34,0.8051945028844102,,0.7776004417341275
1843,0.7718826942405399,COMPLETE,True,lgbm,oof+hand,False,0.19561182823244727,0.7147549140142495,0.020280038028598506,0.004520998453678034,5.0,15.0,231.0,201.0,0.6788760150162466,,,,robust,,,,,,,,,,1.0333824157714844,34,0.8017132219420116,,0.7718826942405399
1844,0.777707089869477,COMPLETE,True,lr,oof+hand,False,,,,,,,,,,0.050661893105157146,False,l1,robust,,,,,,,,,,0.14261794090270996,34,0.8054350061578717,,0.777707089869477
1845,0.7776868575097774,COMPLETE,True,lr,oof+hand,False,,,,,,,,,,0.05917892897703273,False,l1,robust,,,,,,,,,,0.16062116622924805,34,0.8054695289130965,,0.7776868575097774
1846,0.7773654693062002,COMPLETE,True,lr,oof+hand,False,,,,,,,,,,0.07785656630268627,False,l1,robust,,,,,,,,,,0.19878435134887695,34,0.8054137775534411,,0.7773654693062002
1847,0.777685500584322,COMPLETE,True,lr,oof+hand,False,,,,,,,,,,0.04167782530622275,False,l1,robust,,,,,,,,,,0.1210782527923584,34,0.8053222423333475,,0.777685500584322
1848,0.7771273107127199,COMPLETE,True,lr,oof+hand,False,,,,,,,,,,0.02636543381515655,False,l1,robust,,,,,,,,,,0.10480904579162598,34,0.8043953300012832,,0.7771273107127199
1849,0.7777072888580728,COMPLETE,True,lr,oof+hand,False,,,,,,,,,,0.05033776126836487,False,l1,robust,,,,,,,,,,0.1410510540008545,34,0.8054305922896238,,0.7777072888580728
1850,0.7774955196846532,COMPLETE,True,lr,oof+hand,False,,,,,,,,,,0.033659259642591206,False,l1,robust,,,,,,,,,,0.11081361770629883,34,0.8050332390552093,,0.7774955196846532
1851,0.7752234793243703,COMPLETE,True,lr,oof+hand,False,,,,,,,,,,0.06299160837230051,False,l2,robust,,,,,,,,,,0.2199115753173828,34,0.8038456457662648,,0.7752234793243703
1852,0.7739160479347813,COMPLETE,True,lr,oof+hand,False,,,,,,,,,,9.382287358971825,False,l1,robust,,,,,,,,,,1.3186428546905518,34,0.803057087185353,,0.7739160479347813
1853,0.7777230941861605,COMPLETE,True,lr,oof+hand,False,,,,,,,,,,0.045478237189857176,False,l1,robust,,,,,,,,,,0.13004803657531738,34,0.8053831957520091,,0.7777230941861605
1854,0.7776023542187613,COMPLETE,True,lr,oof+hand,False,,,,,,,,,,0.03741920583250898,False,l1,robust,,,,,,,,,,0.11932039260864258,34,0.8051874091675832,,0.7776023542187613
1855,0.776761766434832,COMPLETE,True,lr,oof+hand,False,,,,,,,,,,0.02199141083201807,False,l1,robust,,,,,,,,,,0.10137343406677246,34,0.8035346256929379,,0.776761766434832
1856,0.777498414182317,COMPLETE,True,lr,oof+hand,False,,,,,,,,,,0.07116560159848943,False,l1,robust,,,,,,,,,,0.17261457443237305,34,0.8054345857894671,,0.777498414182317
1857,0.7776903467403989,COMPLETE,True,lr,oof+hand,False,,,,,,,,,,0.044590151760224656,False,l1,robust,,,,,,,,,,0.13087677955627441,34,0.8053783615153567,,0.7776903467403989
1858,0.777686632702084,COMPLETE,True,lr,oof+hand,False,,,,,,,,,,0.05871537501127,False,l1,robust,,,,,,,,,,0.15576648712158203,34,0.8054670067026691,,0.777686632702084
1859,0.777314619545062,COMPLETE,True,lr,oof+hand,False,,,,,,,,,,0.029884816136885536,False,l1,robust,,,,,,,,,,0.10211372375488281,34,0.8047702986181545,,0.777314619545062
1860,0.7725819170909148,COMPLETE,True,lr,oof+hand,True,,,,,,,,,,0.08986177538632238,False,l1,robust,,,,,,,,,,0.4778449535369873,34,0.80212013855763,,0.7725819170909148
1861,0.7776888219516217,COMPLETE,True,lr,oof+hand,False,,,,,,,,,,0.047123662097125235,False,l1,robust,,,,,,,,,,0.13147425651550293,34,0.8053966475409552,,0.7776888219516217
1862,0.7775944899732984,COMPLETE,True,lr,oof+hand,False,,,,,,,,,,0.03576755047421378,False,l1,robust,,,,,,,,,,0.11983776092529297,34,0.8051307119790176,,0.7775944899732984
1863,0.7776675628970859,COMPLETE,True,lr,oof+hand,False,,,,,,,,,,0.05840623895468767,False,l1,robust,,,,,,,,,,0.163421630859375,34,0.8054641166698878,,0.7776675628970859
1864,0.7774193481850208,COMPLETE,True,lr,oof+hand,False,,,,,,,,,,0.07470474067721443,False,l1,robust,,,,,,,,,,0.18651604652404785,34,0.8054237613030496,,0.7774193481850208
1865,0.7758642413705502,COMPLETE,True,lr,oof+hand,False,,,,,,,,,,0.015157777365416236,False,l1,robust,,,,,,,,,,0.09667563438415527,34,0.8006976644226351,,0.7758642413705502
1866,0.7682295043973278,COMPLETE,True,lgbm,oof+hand,False,0.2735362366459965,0.38258966830689717,1.1696611944277813,0.03220782571176902,3.0,5.0,471.0,244.0,0.8698137621526679,,,,robust,,,,,,,,,,0.7154867649078369,34,0.7998686979288343,,0.7682295043973278
1867,0.7749251984296605,COMPLETE,True,lr,oof+hand,False,,,,,,,,,,0.010984929704533868,False,l1,robust,,,,,,,,,,0.0902869701385498,34,0.7971588981009121,,0.7749251984296605
