number,value,state,params_add_group_dummies,params_family,params_feature_subset,params_isotonic,params_lgbm_alpha,params_lgbm_colsample,params_lgbm_lambda,params_lgbm_lr,params_lgbm_max_depth,params_lgbm_min_child,params_lgbm_n_estimators,params_lgbm_num_leaves,params_lgbm_subsample,params_lr_C,params_lr_class_weight_balanced,params_lr_penalty,params_scaler,params_xgb_alpha,params_xgb_colsample,params_xgb_gamma,params_xgb_lambda,params_xgb_lr,params_xgb_max_depth,params_xgb_min_child,params_xgb_n_estimators,params_xgb_subsample,user_attrs_elapsed_sec,user_attrs_n_features,user_attrs_pooled_auroc,user_attrs_pruned_reason,user_attrs_weighted_auroc
395,0.7427158767635141,COMPLETE,False,xgb,oof_minus_roberta,False,,,,,,,,,,,,,standard,0.4518454900925574,0.6169017199237157,0.5736783622618914,0.0019192389706828537,0.012622291189878499,8.0,2.0,202.0,0.9147906526887422,0.6575827598571777,5,0.7706939220929133,,0.7427158767635141
396,0.775025650084301,COMPLETE,False,xgb,oof+ph,False,,,,,,,,,,,,,standard,0.02319704840740691,0.58834985454286,0.5361480306644875,0.0026012293256764945,0.011472311100508819,3.0,1.0,164.0,0.9432563902890516,0.32797908782958984,42,0.801914946230152,,0.775025650084301
397,0.7761048682312955,COMPLETE,False,xgb,oof+timing,False,,,,,,,,,,,,,standard,0.002493258847479309,0.5710916961359814,0.7844062890005189,0.0019607207513810346,0.014722357595198226,3.0,1.0,134.0,0.9581701489627346,0.3120229244232178,52,0.8029430097095643,,0.7761048682312955
398,0.7753009815584858,COMPLETE,True,xgb,oof+timing,False,,,,,,,,,,,,,standard,0.31864578556108153,0.6000541178029427,1.0055266276198827,0.0030715835090610955,0.015441770951300794,3.0,1.0,285.0,0.8879640894673343,0.6225848197937012,52,0.8049969297342652,,0.7753009815584858
399,0.7752947238516087,COMPLETE,False,xgb,oof+timing,False,,,,,,,,,,,,,standard,0.20827778791896454,0.5819887266811533,0.6452139360465858,0.004008554906874193,0.0030768754621899883,3.0,2.0,144.0,0.9028154642645082,0.33231353759765625,52,0.8012796644787543,,0.7752947238516087
400,0.7716973934970252,COMPLETE,False,xgb,all_minus_ng,False,,,,,,,,,,,,,none,0.0702780410271024,0.6200849426448927,0.4334932998477847,0.0015571656410157532,0.013640959850753994,3.0,1.0,768.0,0.9313286021432481,2.730123281478882,131,0.8015256850875254,,0.7716973934970252
401,0.7697772395387807,COMPLETE,False,xgb,oof+timing,False,,,,,,,,,,,,,standard,0.0017951311968445005,0.6463120112917423,0.5272130527926413,0.0021871734561288354,0.08445344013312053,3.0,1.0,177.0,0.9214713395602117,0.37994837760925293,52,0.7987829914319461,,0.7697772395387807
402,0.7759212954426661,COMPLETE,False,xgb,oof+timing,False,,,,,,,,,,,,,standard,0.0028006024669612406,0.5628866478230604,0.36908013008641827,0.023278140463095686,0.010487231342465285,3.0,1.0,163.0,0.9482750484093168,0.36589837074279785,52,0.8026235297220956,,0.7759212954426661
403,0.7752624565646823,COMPLETE,False,xgb,oof+hand+graph,False,,,,,,,,,,,,,standard,0.0011595318339680184,0.597088611517717,0.6061189176100901,0.0017593755867432983,0.016780329601107574,3.0,1.0,188.0,0.9368867689186884,0.38913488388061523,49,0.8032033753901413,,0.7752624565646823
404,0.7761529251434175,COMPLETE,False,xgb,oof+timing,False,,,,,,,,,,,,,standard,0.002145563653239317,0.5783208417100009,0.4653271657376819,0.0026006446101534664,0.014508095487902509,3.0,2.0,155.0,0.9704698647223564,0.34907031059265137,52,0.8030767919543168,,0.7761529251434175
405,0.7755906561948351,COMPLETE,False,xgb,oof+timing,False,,,,,,,,,,,,,standard,0.254015185604763,0.6083124058871145,4.088560776967101,0.0014978049093608164,0.01182783080637782,3.0,3.0,210.0,0.9118324955435371,0.4581151008605957,52,0.8026562133655504,,0.7755906561948351
406,0.7738102282158104,COMPLETE,False,xgb,oof_only,False,,,,,,,,,,,,,robust,0.0016025066345074835,0.635588692540327,0.8721093135571119,0.007328924727645883,0.016343280256063894,3.0,1.0,113.0,0.9255468400053457,0.13365960121154785,6,0.8006902554295047,,0.7738102282158104
407,0.7416936706777287,COMPLETE,False,lgbm,oof+timing,False,0.05413649755600893,0.6445868226342233,0.08319049103335423,0.14704445009728812,10.0,84.0,271.0,75.0,0.8606239052168498,,,,standard,,,,,,,,,,1.2105872631072998,52,0.7702152275722158,,0.7416936706777287
408,0.7761791672317577,COMPLETE,False,xgb,oof+timing,False,,,,,,,,,,,,,standard,0.004035823811250133,0.5567187602469938,0.29910525281554434,0.0019672528304407583,0.01314267403178558,3.0,2.0,171.0,0.941557205090161,0.38618016242980957,52,0.8030674913033659,,0.7761791672317577
409,0.7754895328406423,COMPLETE,False,xgb,oof+ng,False,,,,,,,,,,,,,standard,0.0019846710092792535,0.5868507464962903,0.38177642116671423,0.0017127621352406772,0.0173717275065243,3.0,1.0,197.0,0.9545498987017076,0.9350852966308594,237,0.802922726934044,,0.7754895328406423
410,0.7757765867336175,COMPLETE,False,xgb,oof+timing,False,,,,,,,,,,,,,standard,0.002415467712727862,0.574558831882263,2.1408415687937348,0.002355647786410362,0.015119508656737675,3.0,4.0,145.0,0.9788058756271955,0.3281984329223633,52,0.8029457946502445,,0.7757765867336175
411,0.7739020462227878,COMPLETE,False,xgb,oof+timing,False,,,,,,,,,,,,,standard,0.18546092099641015,0.5968498405097272,0.7381481857018843,0.0014347674080759695,0.018579626073004285,4.0,1.0,181.0,0.9318542061363103,0.548377513885498,52,0.802449602294707,,0.7739020462227878
412,0.773665394490407,COMPLETE,False,xgb,oof+timing,True,,,,,,,,,,,,,standard,0.15024272085835275,0.6191974864264399,0.538489041295886,0.0031061107469023373,0.013673106121475253,3.0,1.0,164.0,0.9184318939678215,1.2790415287017822,52,0.8005579444741678,,0.773665394490407
413,0.7700065684843372,COMPLETE,False,lr,oof+timing,False,,,,,,,,,,7.302991320259443,True,l1,standard,,,,,,,,,,1.4176955223083496,52,0.7973401819753806,,0.7700065684843372
414,0.7759057843697301,COMPLETE,False,xgb,oof+timing,False,,,,,,,,,,,,,standard,0.11594536435800443,0.5619261159966612,0.4329353686319857,0.004812708292525911,0.016025009024835484,3.0,1.0,130.0,0.9413125839817388,0.30864548683166504,52,0.8027559983155839,,0.7759057843697301
415,0.7758324504311586,COMPLETE,False,xgb,oof+timing,False,,,,,,,,,,,,,standard,0.00290609995841699,0.6049474619162609,0.00357264972345514,0.0012169121997562047,0.020282500788392756,3.0,1.0,191.0,0.9056879982330609,0.4207737445831299,52,0.8036379312283595,,0.7758324504311586
416,0.7745799134980894,COMPLETE,False,xgb,oof+hand,False,,,,,,,,,,,,,standard,0.29633336067797184,0.5900666540200284,0.6424715983197995,0.36887926912562946,0.012449583135122944,3.0,2.0,151.0,0.9635978494969595,0.28092432022094727,34,0.8020047999766275,,0.7745799134980894
417,0.7749448127753878,COMPLETE,True,xgb,oof+timing,False,,,,,,,,,,,,,robust,0.3795378438424216,0.5706673128510253,0.2973909834126913,0.001970473846885614,0.0019201011174779042,3.0,1.0,176.0,0.9274227796193275,0.44321727752685547,52,0.8020236114627317,,0.7749448127753878
418,0.776224789895549,COMPLETE,False,xgb,oof+timing,False,,,,,,,,,,,,,standard,0.002667221473370042,0.5447490864713858,0.3636347317852942,0.001357816916517958,0.017768803710027703,3.0,1.0,163.0,0.9471946639678847,0.366041898727417,52,0.8033855525474694,,0.776224789895549
419,0.7757008150513329,COMPLETE,False,xgb,oof+timing,False,,,,,,,,,,,,,standard,0.2202009702295001,0.6265003910309102,0.22626186901584694,0.0017389562275663723,0.014636428168449135,3.0,2.0,245.0,0.9996828927314209,0.5053906440734863,52,0.8033567573117566,,0.7757008150513329
420,0.7751757247040909,COMPLETE,False,xgb,oof+timing,False,,,,,,,,,,,,,standard,0.001355582735425506,0.6129885032106561,1.3972620521052337,0.00223129624794254,0.023139490529237094,3.0,3.0,214.0,0.9333018141677288,0.44753026962280273,52,0.8036795477004115,,0.7751757247040909
421,0.7744620646782806,COMPLETE,False,xgb,all,False,,,,,,,,,,,,,standard,0.0039044563376830297,0.5857335530713006,0.48279006995910906,0.0016034343532025583,0.015958008841392066,4.0,1.0,141.0,0.9176513844060495,1.680788516998291,362,0.8020477300999437,,0.7744620646782806
422,0.7756742564207053,COMPLETE,False,xgb,oof+timing,False,,,,,,,,,,,,,none,0.001949774436596313,0.5547941481396101,2.8728120887363655,0.001145054946736056,0.009940390092122633,3.0,1.0,196.0,0.9543278854465197,0.41644954681396484,52,0.8025297875678776,,0.7756742564207053
423,0.7760108259139543,COMPLETE,False,xgb,oof+timing,False,,,,,,,,,,,,,standard,0.003004387283775133,0.600789664843598,0.1304691225422166,0.002596494459604777,0.013452399902385037,3.0,2.0,179.0,0.8976992474325527,0.40258002281188965,52,0.802831822266557,,0.7760108259139543
424,0.7758655796031927,COMPLETE,False,xgb,oof+timing,False,,,,,,,,,,,,,standard,0.0022255776551760096,0.5755535714838289,0.6747908975069745,0.06149526406056587,0.011464333574087476,3.0,1.0,154.0,0.9248764641184654,0.3507862091064453,52,0.8026340389322096,,0.7758655796031927
425,0.7754070785177627,COMPLETE,False,xgb,oof+timing,False,,,,,,,,,,,,,standard,0.0034858321605316348,0.6376541480409291,0.31292739862562335,0.001378378137306004,0.01986846966551696,3.0,1.0,170.0,0.9427224103181383,0.39374232292175293,52,0.803094762703612,,0.7754070785177627
426,0.7740912074009607,COMPLETE,False,xgb,oof+timing,False,,,,,,,,,,,,,standard,0.001655841353811964,0.8171907531414708,0.5686070681170828,3.328318895968383,0.017590891645942464,3.0,8.0,123.0,0.9339308669032643,0.3155512809753418,52,0.801535038284527,,0.7740912074009607
427,0.7760392164504917,COMPLETE,False,xgb,oof+timing,False,,,,,,,,,,,,,standard,0.0048231656746647745,0.5938152089649199,0.8249854211588968,0.001988113307550468,0.015012767157182015,3.0,1.0,191.0,0.9095456752373157,0.4239687919616699,52,0.8031649116811237,,0.7760392164504917
428,0.7492601673004678,COMPLETE,False,xgb,oof_minus_roberta,False,,,,,,,,,,,,,standard,0.2622663021313756,0.575062055602076,0.4379588063035524,0.003459574066115602,0.01662362843782657,3.0,2.0,159.0,0.9713999415991736,0.17984342575073242,5,0.7759539393931751,,0.7492601673004678
429,0.7739737244892416,COMPLETE,False,lgbm,oof+ph,False,0.00206689946305132,0.852051100139356,0.5176893940704008,0.0018415056321737036,3.0,16.0,368.0,185.0,0.9550742753939021,,,,standard,,,,,,,,,,0.5787501335144043,42,0.8006597261741231,,0.7739737244892416
430,0.7756281344622667,COMPLETE,False,xgb,oof+timing,False,,,,,,,,,,,,,robust,0.17068016708193814,0.6096752593834878,0.27692040652167993,0.0017032700550508916,0.014177120412907005,3.0,6.0,303.0,0.9488059382119716,0.6423985958099365,52,0.8038463814109729,,0.7756281344622667
431,0.7737155136759212,COMPLETE,False,xgb,oof+timing,True,,,,,,,,,,,,,standard,0.002600264052747904,0.5461290302432318,0.07373355084347405,0.0011517647952173095,0.018771935039691844,3.0,1.0,180.0,0.918835405644349,1.354473352432251,52,0.8015773904012868,,0.7737155136759212
432,0.7740683196632945,COMPLETE,False,xgb,all_minus_ng,False,,,,,,,,,,,,,standard,0.003191169516865731,0.5625895543118248,0.18889888450347572,0.0021947060214226356,0.012528652277097919,3.0,1.0,387.0,0.9356297907531645,1.4519357681274414,131,0.8029635552153374,,0.7740683196632945
433,0.7763658674272781,COMPLETE,False,xgb,oof+timing,False,,,,,,,,,,,,,standard,0.002200083854917664,0.5882269687378835,1.064701104729192,0.8569212420730179,0.015239449099829034,3.0,1.0,204.0,0.9588301488160904,0.4439272880554199,52,0.8036704572336628,,0.7763658674272781
434,0.775500045619797,COMPLETE,False,xgb,oof+timing,False,,,,,,,,,,,,,standard,0.0018992503027781416,0.6187887028396536,1.0051559521716882,0.8258637408417127,0.015497811148482353,3.0,1.0,213.0,0.9867098537253508,0.4592618942260742,52,0.8031193017092285,,0.775500045619797
435,0.7735594214388567,COMPLETE,False,lr,oof+hand+graph,False,,,,,,,,,,0.0033949140816818663,True,l2,standard,,,,,,,,,,0.0555880069732666,49,0.7986898798303351,,0.7735594214388567
436,0.7749912559617302,COMPLETE,False,xgb,oof+timing,False,,,,,,,,,,,,,standard,0.0023693544534809383,0.5915375499605693,1.124823578616808,0.0024525455823926584,0.020707889402646087,3.0,1.0,231.0,0.9618366065809361,0.46656107902526855,52,0.8036642042536448,,0.7749912559617302
437,0.7760700657259115,COMPLETE,True,xgb,oof+timing,False,,,,,,,,,,,,,standard,0.0021135215914900025,0.6049204972494548,0.8802711029561622,0.10492224462045403,0.013708795955150697,3.0,1.0,204.0,0.9257321630816048,0.474780797958374,52,0.8050644514092483,,0.7760700657259115
438,0.7719332094249982,COMPLETE,False,xgb,oof+timing,False,,,,,,,,,,,,,standard,0.00153035922311332,0.586964767139349,0.930667413745004,0.002789278600832868,0.02585086859287738,3.0,1.0,517.0,0.9382914446419266,0.9371762275695801,52,0.8011918074822003,,0.7719332094249982
439,0.7739948043411797,COMPLETE,False,xgb,oof_only,False,,,,,,,,,,,,,standard,0.006333182074727136,0.6288788833919794,1.0629990181524178,0.24742015469369463,0.01096578695266465,3.0,1.0,141.0,0.9796369722693238,0.15171289443969727,6,0.8008693323698489,,0.7739948043411797
440,0.7757627803504019,COMPLETE,False,xgb,oof+timing,False,,,,,,,,,,,,,standard,0.043923153129669275,0.5978465132486773,1.1700445246280755,0.001982249515139962,0.017323111310666762,3.0,1.0,193.0,0.6852399832591599,0.42950868606567383,52,0.8034854425896039,,0.7757627803504019
441,0.768227619983141,COMPLETE,False,xgb,oof+ng,False,,,,,,,,,,,,,standard,0.0027223551150389836,0.579434563339519,0.7657570454363334,0.0015860132571396417,0.012200316421101465,7.0,1.0,223.0,0.9107438883654769,3.4364514350891113,237,0.7971518569301357,,0.768227619983141
442,0.7743177183861584,COMPLETE,False,xgb,oof+timing,False,,,,,,,,,,,,,standard,0.0035355644755537515,0.6110355462157064,1.3333061114602125,0.0018736306489163079,0.015250957195454981,4.0,1.0,165.0,0.8169757411476815,0.5124483108520508,52,0.8021599684639623,,0.7743177183861584
443,0.7754618991950261,COMPLETE,False,xgb,oof+timing,False,,,,,,,,,,,,,robust,0.341895560864359,0.6442135262341856,3.287019976074708,2.825990172180387,0.018051640022428418,3.0,1.0,150.0,0.9528803112200553,0.38221287727355957,52,0.8028856294223413,,0.7754618991950261
444,0.7728335572916346,COMPLETE,False,xgb,oof+timing,False,,,,,,,,,,,,,none,0.0024289011024631988,0.5688315317812771,0.5046614533384904,0.1482432345510504,0.013592907236031177,5.0,1.0,173.0,0.9271923211181591,0.6814589500427246,52,0.8012476113879062,,0.7728335572916346
445,0.7742785322784235,COMPLETE,False,xgb,oof+timing,False,,,,,,,,,,,,,standard,0.05429549762843327,0.6249048760214468,0.9779944943926985,0.0029712981980641977,0.02216929119511773,3.0,2.0,117.0,0.5606833933703446,0.28262853622436523,52,0.8017424900921793,,0.7742785322784235
446,0.7754697330635795,COMPLETE,False,xgb,oof+timing,False,,,,,,,,,,,,,standard,0.5473328778043235,0.5859561556255475,0.6034816923738544,0.0013779994402272843,0.008524072084910694,3.0,1.0,204.0,0.9453073276440072,0.4421806335449219,52,0.8022995307742776,,0.7754697330635795
447,0.7580552294960895,COMPLETE,False,xgb,oof+timing,False,,,,,,,,,,,,,standard,0.0019720936821894038,0.5995440673791309,0.44091769262119196,0.0021586246785771043,0.23167435775445042,3.0,1.0,134.0,0.9671963666011896,0.2916407585144043,52,0.7879435293900044,,0.7580552294960895
448,0.7752583664292093,COMPLETE,False,xgb,oof+timing,False,,,,,,,,,,,,,standard,0.0029794681311237315,0.662023282308427,1.2233627871992225,1.8233696271765891,0.0163234467937407,3.0,1.0,186.0,0.9205893895892743,0.42624950408935547,52,0.8028244132734266,,0.7752583664292093
449,0.7758904706039559,COMPLETE,False,xgb,oof+timing,False,,,,,,,,,,,,,standard,0.001678698546598827,0.61478672004122,0.35607244813341016,0.0016610094228354199,0.018924711468018468,3.0,1.0,154.0,0.9345882038182542,0.35480523109436035,52,0.8030731662768276,,0.7758904706039559
450,0.7741408175695546,COMPLETE,False,xgb,oof+hand,False,,,,,,,,,,,,,standard,0.01703171885503246,0.5747514921717404,0.6810056092087522,3.942659146072567,0.014267663540514083,3.0,1.0,430.0,0.9904779206374552,0.67283034324646,34,0.8032765194925354,,0.7741408175695546
451,0.7761830874739106,COMPLETE,False,xgb,oof+timing,True,,,,,,,,,,,,,standard,0.00437913288720703,0.5540266221779854,0.5415250763993713,0.0025109253086689426,0.016145998207790283,3.0,2.0,170.0,0.8998964588108294,1.2744884490966797,52,0.8027828493474254,,0.7761830874739106
452,0.7662861223416461,COMPLETE,False,lgbm,oof+timing,False,2.3233102645965933,0.9276636366552513,2.619013224985679,0.004606889066082937,0.0,63.0,713.0,140.0,0.602717012318353,,,,standard,,,,,,,,,,4.308867454528809,52,0.795547310729914,,0.7662861223416461
453,0.7762288688595702,COMPLETE,False,xgb,oof+timing,False,,,,,,,,,,,,,standard,0.0010181413919610534,0.5881891602365282,0.3819044639224661,0.0014374509912424005,0.012488739799594044,3.0,1.0,184.0,0.9543100610582143,0.4261598587036133,52,0.8030203574960041,,0.7762288688595702
454,0.7753931429771567,COMPLETE,False,xgb,oof+timing,False,,,,,,,,,,,,,standard,6.138476257347384,0.6040506491786409,0.7546354975520566,1.1199880826139204,0.020358433950262093,3.0,1.0,201.0,0.9157243636149213,0.455838680267334,52,0.8034444566701588,,0.7753931429771567
455,0.7754146600670236,COMPLETE,False,xgb,all,False,,,,,,,,,,,,,robust,0.0024234243474506047,0.5646425290278735,0.4692425310226843,0.5248269223451558,0.014598119671557145,3.0,2.0,147.0,0.9408847111376152,1.4785799980163574,362,0.8024639999125633,,0.7754146600670236
456,0.776451895688896,COMPLETE,False,xgb,oof+timing,False,,,,,,,,,,,,,standard,0.0035283583921474795,0.5383456712283115,0.2896297210688741,0.0018235916727234872,0.01746275729051179,3.0,1.0,164.0,0.9294667396589655,0.38440608978271484,52,0.8034606408537346,,0.776451895688896
457,0.776608501406736,COMPLETE,True,xgb,oof+timing,False,,,,,,,,,,,,,standard,0.0013202180498995868,0.5805720555578247,0.3344307180553696,0.001889530153948763,0.01775006111119638,3.0,1.0,165.0,0.5021327158358493,0.4151027202606201,52,0.805546666515334,,0.776608501406736
458,0.7756075291508009,COMPLETE,True,xgb,oof+timing,False,,,,,,,,,,,,,standard,0.001362387764000677,0.572405638785224,0.5923817585258223,0.0018819652923877982,0.023867934060664977,3.0,1.0,167.0,0.5493549935174009,0.4166228771209717,52,0.8053539276018413,,0.7756075291508009
459,0.7715912213399047,COMPLETE,False,lr,oof+timing,False,,,,,,,,,,0.5639579728567086,False,l1,standard,,,,,,,,,,0.6069574356079102,52,0.7983823803423964,,0.7715912213399047
460,0.7500734458891292,COMPLETE,True,xgb,oof_minus_roberta,False,,,,,,,,,,,,,standard,0.0011940102152069407,0.5487009473354323,0.2738873443899429,0.0021459178982282077,0.018786996439802046,3.0,1.0,139.0,0.6745553450588012,0.20055890083312988,5,0.7811130157302907,,0.7500734458891292
461,0.7736108289391406,COMPLETE,True,xgb,oof+ph,False,,,,,,,,,,,,,standard,0.2931504944858729,0.5874324230366698,0.38270347396305104,0.001622142579414874,0.021495616820221577,3.0,2.0,165.0,0.5118606260586457,0.38389039039611816,42,0.8034972129049316,,0.7736108289391406
462,0.775022583736842,COMPLETE,False,xgb,oof+timing,False,,,,,,,,,,,,,standard,0.0015689990154003372,0.5788555306800471,0.5173849943096341,7.40229063661816,0.018008971309422098,3.0,1.0,179.0,0.5232503002874289,0.4215855598449707,52,0.8027134360146218,,0.775022583736842
463,0.7750417109095612,COMPLETE,True,xgb,oof+timing,False,,,,,,,,,,,,,standard,0.011336083101165545,0.5608159383434594,1.0475110045270728,0.0018624210639796778,0.019982148247819024,4.0,1.0,155.0,0.9096957824295635,0.5084137916564941,52,0.8050734367838959,,0.7750417109095612
464,0.7757886837784912,COMPLETE,True,xgb,oof+timing,False,,,,,,,,,,,,,standard,0.08537217222742777,0.595983874991068,0.9029565471295837,0.002242653516188985,0.01706139430517779,3.0,2.0,133.0,0.6548129678644291,0.34848666191101074,52,0.8043550271804956,,0.7757886837784912
465,0.7762176314300299,COMPLETE,True,xgb,oof+timing,False,,,,,,,,,,,,,standard,0.0029957375894948523,0.5426059231720973,0.6564958313139291,0.0017100140954346373,0.015863722440217547,3.0,1.0,172.0,0.9739070280736174,0.40029215812683105,52,0.8049522130452297,,0.7762176314300299
466,0.774315039956645,COMPLETE,False,xgb,oof+timing,False,,,,,,,,,,,,,standard,0.24254024957219597,0.5712470177158407,0.31987999029015585,0.0014913566455535014,0.01795776836094951,3.0,1.0,150.0,0.5837195386276075,0.3532557487487793,52,0.8020832512301294,,0.774315039956645
467,0.7748967699370053,COMPLETE,True,xgb,all_minus_ng,False,,,,,,,,,,,,,none,0.44957204709670573,0.5831026618888547,0.44421933778119993,0.0019941199471069223,0.00402168360799008,3.0,1.0,187.0,0.9579220054648492,0.8228306770324707,131,0.8027466976646327,,0.7748967699370053
468,0.7764408008870316,COMPLETE,True,xgb,oof+timing,False,,,,,,,,,,,,,robust,0.003628810098865614,0.5594274862985066,0.8160082092676656,0.0023014466350894484,0.02218573428205572,3.0,1.0,113.0,0.9231847808890381,0.3254086971282959,52,0.8051064357036543,,0.7764408008870316
469,0.7759615556915599,COMPLETE,True,xgb,oof+timing,False,,,,,,,,,,,,,robust,0.00548054542570261,0.5344560452486685,0.8084043805837925,0.0024747549213251056,0.026642263519143523,3.0,1.0,109.0,0.9276293060103312,0.30222153663635254,52,0.8052383788366366,,0.7759615556915599
470,0.7747541200033771,COMPLETE,True,xgb,oof+hand+graph,False,,,,,,,,,,,,,robust,0.003836629191280378,0.5528063784856373,0.8289564679358024,0.001333729503937726,0.024393981234480357,3.0,2.0,102.0,0.9447370279565319,0.2866196632385254,49,0.8037548987369295,,0.7747541200033771
471,0.7707714898163999,COMPLETE,True,xgb,oof+timing,True,,,,,,,,,,,,,robust,0.004987695315419658,0.5650495260100739,0.9803789569846615,0.0017316126165043703,0.030000317659347853,3.0,1.0,327.0,0.8902489417189211,2.4362449645996094,52,0.8018821049485454,,0.7707714898163999
472,0.774222449463986,COMPLETE,False,xgb,oof+timing,False,,,,,,,,,,,,,robust,4.164195448639222,0.5524313653047838,0.7376800755292052,0.001547820068969291,0.021272442694054847,3.0,1.0,117.0,0.6270499611372706,0.30939292907714844,52,0.8016368199844821,,0.774222449463986
473,0.7753433404529527,COMPLETE,True,xgb,oof_only,False,,,,,,,,,,,,,robust,0.00128038886335812,0.5363084457709021,0.6726967023853881,0.01566121127742002,0.02188391984558234,3.0,1.0,126.0,0.9197782418639758,0.16806793212890625,6,0.8045513392254271,,0.7753433404529527
