number,value,state,params_add_group_dummies,params_family,params_feature_subset,params_isotonic,params_lgbm_alpha,params_lgbm_colsample,params_lgbm_lambda,params_lgbm_lr,params_lgbm_max_depth,params_lgbm_min_child,params_lgbm_n_estimators,params_lgbm_num_leaves,params_lgbm_subsample,params_lr_C,params_lr_class_weight_balanced,params_lr_penalty,params_scaler,params_xgb_alpha,params_xgb_colsample,params_xgb_gamma,params_xgb_lambda,params_xgb_lr,params_xgb_max_depth,params_xgb_min_child,params_xgb_n_estimators,params_xgb_subsample,user_attrs_elapsed_sec,user_attrs_n_features,user_attrs_pooled_auroc,user_attrs_pruned_reason,user_attrs_weighted_auroc
1503,0.7770846438854252,COMPLETE,True,lr,oof_only,False,,,,,,,,,,0.37743988261171363,True,l1,robust,,,,,,,,,,0.055648088455200195,6,0.8054167201322731,,0.7770846438854252
1504,0.7768571218480932,COMPLETE,True,lr,oof_only,False,,,,,,,,,,0.472199707992596,True,l1,none,,,,,,,,,,0.12979602813720703,6,0.8053739476471088,,0.7768571218480932
1505,0.7770815806618651,COMPLETE,True,lr,oof_only,False,,,,,,,,,,0.3800682999852865,True,l1,robust,,,,,,,,,,0.056498050689697266,6,0.8054130419087331,,0.7770815806618651
1506,0.7769077561064811,COMPLETE,True,lr,oof_only,False,,,,,,,,,,0.6893564545140392,True,l1,robust,,,,,,,,,,0.06412172317504883,6,0.8053137824192054,,0.7769077561064811
1507,0.776873272016212,COMPLETE,True,lr,oof_only,False,,,,,,,,,,0.7465276770288863,True,l1,robust,,,,,,,,,,0.06676983833312988,6,0.8052930792752807,,0.776873272016212
1508,0.7748980965804044,COMPLETE,True,lr,oof+hand,False,,,,,,,,,,0.6407942942546407,True,l1,robust,,,,,,,,,,0.5132837295532227,34,0.8035893786776322,,0.7748980965804044
1509,0.776888074749067,COMPLETE,True,lr,oof_only,False,,,,,,,,,,0.9909229146509014,True,l1,robust,,,,,,,,,,0.07176971435546875,6,0.8052737423286707,,0.776888074749067
1510,0.7734746117128065,COMPLETE,True,lr,oof+ph,False,,,,,,,,,,1.0540418302977026,True,l1,robust,,,,,,,,,,0.16194581985473633,42,0.8021499847143538,,0.7734746117128065
1511,0.7768798325144055,COMPLETE,True,lr,oof_only,False,,,,,,,,,,0.9228810790299544,True,l1,robust,,,,,,,,,,0.07197284698486328,6,0.8052823598809644,,0.7768798325144055
1512,0.7633578910852906,COMPLETE,True,lr,all,False,,,,,,,,,,0.9957015383433497,False,l1,robust,,,,,,,,,,0.6360931396484375,362,0.7909716006462323,,0.7633578910852906
1513,0.7768186625562992,COMPLETE,True,lr,oof_only,False,,,,,,,,,,1.270924209442736,True,l2,robust,,,,,,,,,,0.2504448890686035,6,0.8051976031013941,,0.7768186625562992
1514,0.7768768096158373,COMPLETE,True,lr,oof_only,False,,,,,,,,,,1.155770669230092,True,l1,robust,,,,,,,,,,0.07469654083251953,6,0.805275055979935,,0.7768768096158373
1515,0.7746472798026048,COMPLETE,True,lr,oof_only,True,,,,,,,,,,0.019022272353571106,True,l1,robust,,,,,,,,,,0.09680938720703125,6,0.8014662555043303,,0.7746472798026048
1516,0.7768931281898818,COMPLETE,True,lr,oof_only,False,,,,,,,,,,0.8618470946148797,True,l1,robust,,,,,,,,,,0.06809234619140625,6,0.8052853550058467,,0.7768931281898818
1517,0.7522106436945173,COMPLETE,True,lr,oof_minus_roberta,False,,,,,,,,,,0.8420657390433474,True,l1,robust,,,,,,,,,,0.06199526786804199,5,0.7828617482932779,,0.7522106436945173
1518,0.776884094838719,COMPLETE,True,lr,oof_only,False,,,,,,,,,,1.2142373541974132,True,l1,robust,,,,,,,,,,0.07953619956970215,6,0.8052767899996037,,0.776884094838719
1519,0.7768746898535459,COMPLETE,True,lr,oof_only,False,,,,,,,,,,0.9322364615592473,True,l1,robust,,,,,,,,,,0.07096529006958008,6,0.8052806258612955,,0.7768746898535459
1520,0.7768810733793964,COMPLETE,True,lr,oof_only,False,,,,,,,,,,1.3084750680754875,True,l1,robust,,,,,,,,,,0.08098101615905762,6,0.8052734270523672,,0.7768810733793964
1521,0.7709022250753781,COMPLETE,True,lr,all_minus_ng,False,,,,,,,,,,0.7346682129031973,True,l1,robust,,,,,,,,,,0.4973742961883545,131,0.7990696826838588,,0.7709022250753781
1522,0.7768777326223676,COMPLETE,True,lr,oof_only,False,,,,,,,,,,0.8935368803585175,True,l1,robust,,,,,,,,,,0.06831574440002441,6,0.805282517519116,,0.7768777326223676
1523,0.776906805879937,COMPLETE,True,lr,oof_only,False,,,,,,,,,,0.6776816375428324,True,l1,robust,,,,,,,,,,0.06572151184082031,6,0.8053173555506443,,0.776906805879937
1524,0.7737508983827561,COMPLETE,True,lr,oof+hand+graph,False,,,,,,,,,,0.6648003431705289,True,l1,robust,,,,,,,,,,0.9169442653656006,49,0.8030666505665567,,0.7737508983827561
1525,0.7768752213774945,COMPLETE,True,lr,oof_only,False,,,,,,,,,,0.8127249557314512,True,l1,robust,,,,,,,,,,0.06845712661743164,6,0.8052840413545825,,0.7768752213774945
1526,0.7768760833265108,COMPLETE,True,lr,oof_only,False,,,,,,,,,,1.0352726718419762,True,l1,robust,,,,,,,,,,0.07449531555175781,6,0.8052756339864913,,0.7768760833265108
1527,0.7742641741664684,COMPLETE,True,lgbm,oof_only,False,0.00859892161866187,0.7231475200965438,0.0037788443203719524,0.0038986233825887523,4.0,100.0,327.0,59.0,0.5197176007290384,,,,robust,,,,,,,,,,0.4952120780944824,6,0.8039330298483637,,0.7742641741664684
1528,0.7769530773125825,COMPLETE,True,lr,oof_only,False,,,,,,,,,,0.6157662500485086,True,l1,robust,,,,,,,,,,0.06235170364379883,6,0.8053277596686572,,0.7769530773125825
1529,0.7674031598427834,COMPLETE,True,lr,oof+ng,False,,,,,,,,,,0.5745904085471809,True,l1,robust,,,,,,,,,,4.317803621292114,237,0.795940670464485,,0.7674031598427834
1530,0.7768583979954337,COMPLETE,True,lr,oof_only,False,,,,,,,,,,1.478208979739828,True,l1,robust,,,,,,,,,,0.08256936073303223,6,0.8052638111251129,,0.7768583979954337
1531,0.7768744695753672,COMPLETE,True,lr,oof_only,False,,,,,,,,,,0.7700564150035658,True,l1,robust,,,,,,,,,,0.0637054443359375,6,0.8052903994267017,,0.7768744695753672
1532,0.7769461909461197,COMPLETE,True,lr,oof_only,False,,,,,,,,,,0.547451789150172,True,l1,robust,,,,,,,,,,0.05589461326599121,6,0.8053390570695298,,0.7769461909461197
1533,0.7769588188212477,COMPLETE,True,lr,oof_only,False,,,,,,,,,,0.523632250753045,True,l1,robust,,,,,,,,,,0.05622434616088867,6,0.8053498815559474,,0.7769588188212477
1534,0.7768769987321696,COMPLETE,True,lr,oof_only,False,,,,,,,,,,0.6152133972755329,False,l1,robust,,,,,,,,,,0.06690001487731934,6,0.8054384741972093,,0.7768769987321696
1535,0.7728927849477104,COMPLETE,True,lr,oof_only,True,,,,,,,,,,0.5608672115649497,True,l2,robust,,,,,,,,,,0.10640811920166016,6,0.8026385053465079,,0.7728927849477104
1536,0.7769615186900201,COMPLETE,True,lr,oof_only,False,,,,,,,,,,0.5208696930689023,True,l1,robust,,,,,,,,,,0.0564420223236084,6,0.80535103756906,,0.7769615186900201
1537,0.776953965702272,COMPLETE,True,lr,oof_only,False,,,,,,,,,,0.5192464355807535,True,l1,robust,,,,,,,,,,0.05540919303894043,6,0.805351773213768,,0.776953965702272
1538,0.7768858230558336,COMPLETE,True,lr,oof_only,False,,,,,,,,,,0.7198247977320947,True,l1,robust,,,,,,,,,,0.06203174591064453,6,0.8052989118868941,,0.7768858230558336
1539,0.7736276530440684,COMPLETE,True,lr,oof+ph,False,,,,,,,,,,0.5984126300946289,True,l1,robust,,,,,,,,,,0.13089871406555176,42,0.8023128249250719,,0.7736276530440684
1540,0.7769610561938068,COMPLETE,True,lr,oof_only,False,,,,,,,,,,0.5133764549189204,True,l1,robust,,,,,,,,,,0.05587172508239746,6,0.8053513002993129,,0.7769610561938068
1541,0.7769568241598973,COMPLETE,True,lr,oof_only,False,,,,,,,,,,0.5100803605069281,True,l1,robust,,,,,,,,,,0.05763053894042969,6,0.805354820884701,,0.7769568241598973
1542,0.7653730152854413,COMPLETE,True,lr,all,False,,,,,,,,,,0.5145961314717502,True,l1,robust,,,,,,,,,,0.9925272464752197,362,0.7925177681842702,,0.7653730152854413
1543,0.7768756768341603,COMPLETE,True,lr,oof_only,False,,,,,,,,,,0.7805329094225639,True,l1,robust,,,,,,,,,,0.06458640098571777,6,0.8052902417885499,,0.7768756768341603
1544,0.7769628874343687,COMPLETE,True,lr,oof_only,False,,,,,,,,,,0.5141767373987588,True,l1,robust,,,,,,,,,,0.05842995643615723,6,0.8053517206677174,,0.7769628874343687
1545,0.776960681217304,COMPLETE,True,lr,oof_only,False,,,,,,,,,,0.5057153449550126,True,l1,robust,,,,,,,,,,0.05630826950073242,6,0.8053559768978136,,0.776960681217304
1546,0.776908952864845,COMPLETE,True,lr,oof_only,False,,,,,,,,,,0.6728245953085903,True,l1,robust,,,,,,,,,,0.06139254570007324,6,0.8053168826361892,,0.776908952864845
1547,0.7747752933665895,COMPLETE,True,lr,oof+hand,False,,,,,,,,,,0.7334219255005036,True,l1,robust,,,,,,,,,,0.566277027130127,34,0.8035037286152025,,0.7747752933665895
1548,0.7728734646280204,COMPLETE,True,lgbm,oof_only,False,3.171798729533047,0.7962347569310002,0.790998191651977,0.0069090583913426875,5.0,31.0,200.0,147.0,0.8054563689461396,,,,robust,,,,,,,,,,0.42223572731018066,6,0.8022114110474708,,0.7728734646280204
1549,0.7522204244489928,COMPLETE,True,lr,oof_minus_roberta,False,,,,,,,,,,0.6924804767379464,True,l1,robust,,,,,,,,,,0.05797457695007324,5,0.7828815056082926,,0.7522204244489928
1550,0.776947653847324,COMPLETE,True,lr,oof_only,False,,,,,,,,,,0.5408268724704017,True,l1,robust,,,,,,,,,,0.059877872467041016,6,0.8053414741878562,,0.776947653847324
1551,0.7768810745838387,COMPLETE,True,lr,oof_only,False,,,,,,,,,,0.8443746245784634,True,l1,robust,,,,,,,,,,0.06841826438903809,6,0.8052832531638239,,0.7768810745838387
1552,0.7712405333727946,COMPLETE,True,lr,all_minus_ng,False,,,,,,,,,,0.5426846060461596,True,l1,robust,,,,,,,,,,0.39007019996643066,131,0.7994083419797859,,0.7712405333727946
1553,0.7769005932794366,COMPLETE,True,lr,oof_only,False,,,,,,,,,,0.6986384021891245,True,l1,robust,,,,,,,,,,0.06422185897827148,6,0.8053073192549852,,0.7769005932794366
1554,0.7768843127702253,COMPLETE,True,lr,oof_only,False,,,,,,,,,,0.870482497047759,True,l1,robust,,,,,,,,,,0.06897807121276855,6,0.8052845142690377,,0.7768843127702253
1555,0.7735483721611507,COMPLETE,True,lr,oof+hand+graph,False,,,,,,,,,,0.7427286618143167,True,l1,robust,,,,,,,,,,1.1862468719482422,49,0.8029430622556148,,0.7735483721611507
1556,0.773763332297726,COMPLETE,True,lr,oof_only,True,,,,,,,,,,0.6278761796852009,True,l1,robust,,,,,,,,,,0.13401055335998535,6,0.8030126857726207,,0.773763332297726
1557,0.7768985671242328,COMPLETE,True,lr,oof_only,False,,,,,,,,,,0.976866447609598,True,l1,robust,,,,,,,,,,0.07320666313171387,6,0.8052785240192727,,0.7768985671242328
1558,0.7768886340323263,COMPLETE,True,lr,oof_only,False,,,,,,,,,,0.9661574733229955,True,l1,robust,,,,,,,,,,0.07048869132995605,6,0.8052763170851488,,0.7768886340323263
1559,0.7633688108969992,COMPLETE,True,lr,oof+ng,False,,,,,,,,,,1.1940262407145064,False,l2,robust,,,,,,,,,,116.14768052101135,237,0.7914599636402349,,0.7633688108969992
1560,0.7768756716118744,COMPLETE,True,lr,oof_only,False,,,,,,,,,,0.9104691534877839,True,l1,robust,,,,,,,,,,0.06945085525512695,6,0.8052818869665092,,0.7768756716118744
1561,0.7769148419967747,COMPLETE,True,lr,oof_only,False,,,,,,,,,,0.6645405933854793,True,l1,robust,,,,,,,,,,0.06010127067565918,6,0.8053183013795545,,0.7769148419967747
1562,0.7768734606044421,COMPLETE,True,lr,oof_only,False,,,,,,,,,,1.1882619030677988,True,l1,robust,,,,,,,,,,0.07502317428588867,6,0.8052751610720361,,0.7768734606044421
1563,0.7768793426129833,COMPLETE,True,lr,oof_only,False,,,,,,,,,,0.7400671062415785,True,l1,robust,,,,,,,,,,0.0650479793548584,6,0.805295601485708,,0.7768793426129833
1564,0.7769355707996184,COMPLETE,True,lr,oof_only,False,,,,,,,,,,0.6357871164405287,True,l1,robust,,,,,,,,,,0.061480045318603516,6,0.8053228728859542,,0.7769355707996184
1565,0.776906648938347,COMPLETE,True,lr,oof_only,False,,,,,,,,,,0.6753116423511245,True,l1,robust,,,,,,,,,,0.06141543388366699,6,0.8053163571756834,,0.776906648938347
1566,0.7768900476908104,COMPLETE,True,lr,oof_only,False,,,,,,,,,,0.7080670724088832,True,l1,robust,,,,,,,,,,0.06051325798034668,6,0.8053035359393441,,0.7768900476908104
1567,0.7769372079413948,COMPLETE,True,lr,oof_only,False,,,,,,,,,,0.6342151863300872,True,l1,robust,,,,,,,,,,0.05914020538330078,6,0.8053239238069656,,0.7769372079413948
1568,0.7769303959599284,COMPLETE,True,lr,oof_only,False,,,,,,,,,,0.6316259728122479,True,l1,robust,,,,,,,,,,0.060521602630615234,6,0.8053243441753701,,0.7769303959599284
1569,0.7743081227733994,COMPLETE,True,lgbm,oof_only,False,0.04571380702618604,0.557331786569923,0.4256878389051465,0.0014468865667994365,-1.0,48.0,730.0,34.0,0.6366760080166909,,,,robust,,,,,,,,,,2.132969617843628,6,0.8039711782810778,,0.7743081227733994
1570,0.7748615014040366,COMPLETE,True,lr,oof+hand,False,,,,,,,,,,0.6714190413024278,True,l1,robust,,,,,,,,,,0.5433230400085449,34,0.8035611089024254,,0.7748615014040366
1571,0.7768774879732759,COMPLETE,True,lr,oof_only,False,,,,,,,,,,0.9362922440902929,True,l1,robust,,,,,,,,,,0.06830239295959473,6,0.8052796800323851,,0.7768774879732759
1572,0.7769704115762469,COMPLETE,True,lr,oof_only,False,,,,,,,,,,0.5733521520458235,True,l1,robust,,,,,,,,,,0.05727338790893555,6,0.8053315955303489,,0.7769704115762469
1573,0.7769666753697041,COMPLETE,True,lr,oof_only,False,,,,,,,,,,0.5840317858091196,True,l1,robust,,,,,,,,,,0.06087374687194824,6,0.8053337499184223,,0.7769666753697041
1574,0.7645994010079057,COMPLETE,True,lr,all,False,,,,,,,,,,0.5991827732538011,True,l1,robust,,,,,,,,,,0.9303586483001709,362,0.7918024587978536,,0.7645994010079057
1575,0.7734692664913451,COMPLETE,True,lr,oof_only,True,,,,,,,,,,0.5182423876610794,True,l1,robust,,,,,,,,,,0.11395478248596191,6,0.8029250915063199,,0.7734692664913451
1576,0.7736363355983282,COMPLETE,True,lr,oof+ph,False,,,,,,,,,,0.5898927883801288,True,l1,robust,,,,,,,,,,0.1293811798095703,42,0.8023176066156739,,0.7736363355983282
1577,0.7768790739518289,COMPLETE,True,lr,oof_only,False,,,,,,,,,,0.7319274782412732,True,l1,robust,,,,,,,,,,0.06271195411682129,6,0.8052942878344438,,0.7768790739518289
1578,0.7769452536860495,COMPLETE,True,lr,oof_only,False,,,,,,,,,,0.5404261898509781,True,l1,robust,,,,,,,,,,0.056058406829833984,6,0.8053425251088676,,0.7769452536860495
1579,0.7522449054473122,COMPLETE,True,lr,oof_minus_roberta,False,,,,,,,,,,0.5287499288479598,True,l1,robust,,,,,,,,,,0.05174517631530762,5,0.7829146096201519,,0.7522449054473122
1580,0.7769613073558367,COMPLETE,True,lr,oof_only,False,,,,,,,,,,0.5082966736713584,True,l1,robust,,,,,,,,,,0.05472087860107422,6,0.8053569752727745,,0.7769613073558367
1581,0.7769066295165945,COMPLETE,True,lr,oof_only,False,,,,,,,,,,0.4973014189807524,False,l1,robust,,,,,,,,,,0.0619809627532959,6,0.8054504021506889,,0.7769066295165945
1582,0.776826087390035,COMPLETE,True,lr,oof_only,False,,,,,,,,,,0.5286209842180035,True,l2,robust,,,,,,,,,,0.053580284118652344,6,0.8052334395078831,,0.776826087390035
1583,0.7713877369713151,COMPLETE,True,lr,all_minus_ng,False,,,,,,,,,,0.5339410958834823,True,l1,robust,,,,,,,,,,0.37195324897766113,131,0.7994873186937935,,0.7713877369713151
1584,0.7769572569901075,COMPLETE,True,lr,oof_only,False,,,,,,,,,,0.512810317714879,True,l1,robust,,,,,,,,,,0.05847573280334473,6,0.8053521935821726,,0.7769572569901075
1585,0.776962314745333,COMPLETE,True,lr,oof_only,False,,,,,,,,,,0.5048606158114044,True,l1,robust,,,,,,,,,,0.05733537673950195,6,0.8053562921741169,,0.776962314745333
1586,0.777000574418599,COMPLETE,True,lr,oof_only,False,,,,,,,,,,0.47822648189839234,True,l1,robust,,,,,,,,,,0.05683708190917969,6,0.8053598653055558,,0.777000574418599
1587,0.7769803422895138,COMPLETE,True,lr,oof_only,False,,,,,,,,,,0.4982598741974758,True,l1,robust,,,,,,,,,,0.05942702293395996,6,0.8053582889240387,,0.7769803422895138
1588,0.774304746889259,COMPLETE,True,lr,oof+hand+graph,False,,,,,,,,,,0.4824297265694944,True,l1,robust,,,,,,,,,,0.758467435836792,49,0.8033713651138152,,0.774304746889259
1589,0.7769764876702471,COMPLETE,True,lr,oof_only,False,,,,,,,,,,0.4901032691847848,True,l1,robust,,,,,,,,,,0.05739545822143555,6,0.8053606534963142,,0.7769764876702471
1590,0.7685399576327676,COMPLETE,True,lr,oof+ng,False,,,,,,,,,,0.4528181364397673,True,l1,robust,,,,,,,,,,2.9975624084472656,237,0.7970195459747991,,0.7685399576327676
1591,0.7746561382376085,COMPLETE,True,lgbm,oof_only,False,0.023900602322568597,0.6661365225087307,0.08791245000886747,0.001999100788670966,2.0,23.0,622.0,15.0,0.9199104990498748,,,,robust,,,,,,,,,,0.3760404586791992,6,0.7998369075682392,,0.7746561382376085
1592,0.7770144533023838,COMPLETE,True,lr,oof_only,False,,,,,,,,,,0.4685702221759764,True,l1,robust,,,,,,,,,,0.05525493621826172,6,0.8053649097264106,,0.7770144533023838
1593,0.7734793784274787,COMPLETE,True,lr,oof_only,True,,,,,,,,,,0.47884880439695177,True,l1,robust,,,,,,,,,,0.12889361381530762,6,0.8030848315000543,,0.7734793784274787
1594,0.7769762682244704,COMPLETE,True,lr,oof_only,False,,,,,,,,,,0.4949688984178849,True,l1,robust,,,,,,,,,,0.05687212944030762,6,0.8053590245687466,,0.7769762682244704
1595,0.7770380749122491,COMPLETE,True,lr,oof_only,False,,,,,,,,,,0.4595004008269004,True,l1,robust,,,,,,,,,,0.07169103622436523,6,0.805374525653665,,0.7770380749122491
1596,0.7769920920130946,COMPLETE,True,lr,oof_only,False,,,,,,,,,,0.4769851347786647,True,l1,robust,,,,,,,,,,0.05729866027832031,6,0.8053596551213535,,0.7769920920130946
1597,0.7770390060923328,COMPLETE,True,lr,oof_only,False,,,,,,,,,,0.4581585601642282,True,l1,robust,,,,,,,,,,0.05658268928527832,6,0.8053731069102996,,0.7770390060923328
1598,0.7770388192665086,COMPLETE,True,lr,oof_only,False,,,,,,,,,,0.45526847512716306,True,l1,robust,,,,,,,,,,0.06315326690673828,6,0.8053775207785475,,0.7770388192665086
1599,0.7769777584535567,COMPLETE,True,lr,oof_only,False,,,,,,,,,,0.49761460306165356,True,l1,robust,,,,,,,,,,0.0639042854309082,6,0.8053590245687468,,0.7769777584535567
1600,0.7770561995971443,COMPLETE,True,lr,oof_only,False,,,,,,,,,,0.4348327095872671,True,l1,robust,,,,,,,,,,0.06167197227478027,6,0.8053951762515392,,0.7770561995971443
1601,0.7751156090044473,COMPLETE,True,lr,oof+hand,False,,,,,,,,,,0.4511695129196229,True,l1,robust,,,,,,,,,,0.47128939628601074,34,0.8037880027487889,,0.7751156090044473
1602,0.7769606758818436,COMPLETE,True,lr,oof_only,False,,,,,,,,,,0.42000277760570526,False,l1,robust,,,,,,,,,,0.06823515892028809,6,0.8054838739849023,,0.7769606758818436
1603,0.7769538612840964,COMPLETE,True,lr,oof_only,False,,,,,,,,,,0.43291770367590826,False,l1,robust,,,,,,,,,,0.06863522529602051,6,0.8054817721428794,,0.7769538612840964
1604,0.7768440406482283,COMPLETE,True,lr,oof_only,False,,,,,,,,,,0.4344300161095576,False,l2,robust,,,,,,,,,,0.05590009689331055,6,0.8054189270663972,,0.7768440406482283
1605,0.7658103805637525,COMPLETE,True,lr,all,False,,,,,,,,,,0.4470379602366484,False,l1,robust,,,,,,,,,,0.8426868915557861,362,0.7929318836088166,,0.7658103805637525
1606,0.773812947826371,COMPLETE,True,lr,oof+ph,False,,,,,,,,,,0.43338543997016327,True,l1,robust,,,,,,,,,,0.12338137626647949,42,0.8024622658928945,,0.773812947826371
1607,0.776952954249435,COMPLETE,True,lr,oof_only,False,,,,,,,,,,0.4317854124479214,False,l1,robust,,,,,,,,,,0.061940670013427734,6,0.8054807212218681,,0.776952954249435
1608,0.7769467805912288,COMPLETE,True,lr,oof_only,False,,,,,,,,,,0.4355619784316043,False,l1,robust,,,,,,,,,,0.06360673904418945,6,0.8054793550245531,,0.7769467805912288
1609,0.7769324918004021,COMPLETE,True,lr,oof_only,False,,,,,,,,,,0.44047808089939905,False,l1,robust,,,,,,,,,,0.06406235694885254,6,0.8054759920773167,,0.7769324918004021
1610,0.7520627944684168,COMPLETE,True,lr,oof_minus_roberta,False,,,,,,,,,,0.42560061874908134,False,l1,robust,,,,,,,,,,0.05783581733703613,5,0.7827729454678138,,0.7520627944684168
1611,0.7667157209518805,COMPLETE,True,lgbm,oof_only,False,0.0013277855448904604,0.4619215186349437,0.047255895278032596,0.02365593891490984,0.0,13.0,354.0,48.0,0.764711588795623,,,,robust,,,,,,,,,,1.3437960147857666,6,0.7971665698242955,,0.7667157209518805
1612,0.7769068023801681,COMPLETE,True,lr,oof_only,False,,,,,,,,,,0.49694850434329874,False,l1,robust,,,,,,,,,,0.06800222396850586,6,0.8054502970585877,,0.7769068023801681
1613,0.7736323017737413,COMPLETE,True,lr,oof_only,True,,,,,,,,,,0.428642511131891,False,l1,robust,,,,,,,,,,0.13335037231445312,6,0.80343625948627,,0.7736323017737413
1614,0.7712572400647039,COMPLETE,True,lr,all_minus_ng,False,,,,,,,,,,0.501484909096852,False,l1,robust,,,,,,,,,,0.3902451992034912,131,0.7995214210806137,,0.7712572400647039
1615,0.7769739285209242,COMPLETE,True,lr,oof_only,False,,,,,,,,,,0.41561717218393424,False,l1,robust,,,,,,,,,,0.0622258186340332,6,0.8054879725768468,,0.7769739285209242
1616,0.7769846996897223,COMPLETE,True,lr,oof_only,False,,,,,,,,,,0.4057862164097938,False,l1,robust,,,,,,,,,,0.06251811981201172,6,0.805492228806943,,0.7769846996897223
1617,0.7746206596300462,COMPLETE,True,lr,oof+hand+graph,False,,,,,,,,,,0.40992758278398733,False,l1,robust,,,,,,,,,,0.6631796360015869,49,0.8037203759817048,,0.7746206596300462
1618,0.7768045556519139,COMPLETE,True,lr,oof_only,False,,,,,,,,,,40.5258154541948,False,l1,robust,,,,,,,,,,0.7308588027954102,6,0.8053665912000287,,0.7768045556519139
1619,0.7769706589692894,COMPLETE,True,lr,oof_only,False,,,,,,,,,,0.41153701376137547,False,l1,robust,,,,,,,,,,0.062081098556518555,6,0.805488918405757,,0.7769706589692894
1620,0.7769609351877025,COMPLETE,True,lr,oof_only,False,,,,,,,,,,0.4194532943864482,False,l1,robust,,,,,,,,,,0.06070542335510254,6,0.8054826128796886,,0.7769609351877025
1621,0.7690511010152097,COMPLETE,True,lr,oof+ng,False,,,,,,,,,,0.3996379187327498,False,l1,robust,,,,,,,,,,2.8882761001586914,237,0.7976062226294192,,0.7690511010152097
1622,0.7769388016276025,COMPLETE,True,lr,oof_only,False,,,,,,,,,,0.43800251493566833,False,l1,robust,,,,,,,,,,0.0652461051940918,6,0.8054791973864015,,0.7769388016276025
1623,0.7769735521579056,COMPLETE,True,lr,oof_only,False,,,,,,,,,,0.4166320299806228,False,l1,robust,,,,,,,,,,0.0623018741607666,6,0.8054858181887734,,0.7769735521579056
1624,0.7768228348777833,COMPLETE,True,lr,oof_only,False,,,,,,,,,,0.40088368443161226,False,l2,robust,,,,,,,,,,0.04890322685241699,6,0.8054297515528146,,0.7768228348777833
1625,0.7768933461874546,COMPLETE,True,lr,oof_only,False,,,,,,,,,,0.5334527603898156,False,l1,robust,,,,,,,,,,0.06797409057617188,6,0.8054417320523446,,0.7768933461874546
