number,value,state,params_add_group_dummies,params_family,params_feature_subset,params_isotonic,params_lgbm_alpha,params_lgbm_colsample,params_lgbm_lambda,params_lgbm_lr,params_lgbm_max_depth,params_lgbm_min_child,params_lgbm_n_estimators,params_lgbm_num_leaves,params_lgbm_subsample,params_lr_C,params_lr_class_weight_balanced,params_lr_penalty,params_scaler,params_xgb_alpha,params_xgb_colsample,params_xgb_gamma,params_xgb_lambda,params_xgb_lr,params_xgb_max_depth,params_xgb_min_child,params_xgb_n_estimators,params_xgb_subsample,user_attrs_elapsed_sec,user_attrs_n_features,user_attrs_pooled_auroc,user_attrs_pruned_reason,user_attrs_weighted_auroc
160,0.7764307728569206,COMPLETE,False,xgb,oof+timing,False,,,,,,,,,,,,,standard,0.09248920149233494,0.5924899660488087,0.1061345720895627,0.0013680389998516665,0.019223258642940486,3.0,2.0,169.0,0.966125240645799,0.37776756286621094,52,0.8038015070837856,,0.7764307728569206
161,0.774951841599027,COMPLETE,False,xgb,oof+timing,False,,,,,,,,,,,,,standard,0.0886201436647105,0.6587317272855765,0.10224751456427689,0.0013484554012929818,0.0210670510128145,3.0,2.0,169.0,0.9667626137274459,0.39066600799560547,52,0.8030072209833614,,0.774951841599027
162,0.7759869449695125,COMPLETE,False,xgb,oof+timing,False,,,,,,,,,,,,,standard,0.007276255810882823,0.6225089671148138,0.36412943495198224,0.0021238906694268996,0.018432993927790187,3.0,2.0,170.0,0.7753521702054513,0.3874084949493408,52,0.8032710021572256,,0.7759869449695125
163,0.7748286815883002,COMPLETE,False,xgb,oof+timing,False,,,,,,,,,,,,,standard,8.94751823024367,0.6011154360566613,0.5135129544896538,0.0013302114038154127,0.01610105380499363,3.0,1.0,205.0,0.9766118300317723,0.44730591773986816,52,0.8025646781454565,,0.7748286815883002
164,0.7736308979917296,COMPLETE,False,xgb,oof+timing,False,,,,,,,,,,,,,standard,0.22282477696781616,0.5817840953488436,0.09369413379668884,0.001003594632770855,0.0138053515418435,3.0,2.0,593.0,0.9586465567448014,1.0902025699615479,52,0.8029464777489019,,0.7736308979917296
165,0.7761667057025678,COMPLETE,False,xgb,oof+timing,False,,,,,,,,,,,,,standard,0.8389353902854128,0.5642912820367912,0.23501576384614425,0.0017747537350957055,0.014882542616802042,3.0,1.0,183.0,0.9884359203454703,0.40234851837158203,52,0.8032271787510497,,0.7761667057025678
166,0.7759596561788952,COMPLETE,False,xgb,oof+timing,False,,,,,,,,,,,,,standard,0.11854188877619744,0.566217686109035,0.2504824516167871,0.0026377049435406495,0.017191299863589526,3.0,1.0,132.0,0.9887645124389423,0.3075742721557617,52,0.8029564614985104,,0.7759596561788952
167,0.7759457520973084,COMPLETE,True,xgb,oof+timing,False,,,,,,,,,,,,,standard,0.2977930735510279,0.5400858139123894,0.0036297769947961356,0.0014074457802010847,0.014519144343095251,3.0,1.0,157.0,0.9685652864552793,0.3630962371826172,52,0.8048567894173935,,0.7759457520973084
168,0.774581050439594,COMPLETE,False,xgb,oof+hand,False,,,,,,,,,,,,,none,0.15117014325739977,0.5701932979762845,0.16213447693835348,0.0011378205119901344,0.02134115880402214,3.0,1.0,180.0,0.9165446022355436,0.313251256942749,34,0.8031585536090047,,0.774581050439594
169,0.7742442822361779,COMPLETE,False,lgbm,oof+timing,False,0.519833220386877,0.861561366570154,0.005389276902958049,0.009882266503702213,2.0,85.0,381.0,197.0,0.8069138539660979,,,,standard,,,,,,,,,,0.5211834907531738,52,0.8019467891367977,,0.7742442822361779
170,0.7756076645701631,COMPLETE,False,xgb,oof+timing,False,,,,,,,,,,,,,standard,0.0018895243587674347,0.603882411248588,0.34990510404161745,0.0019097635750238563,0.019745318557395336,3.0,1.0,224.0,0.941409106530988,0.4757072925567627,52,0.803830092135296,,0.7756076645701631
171,0.7672049735801921,COMPLETE,False,xgb,oof+timing,False,,,,,,,,,,,,,standard,0.6849864042369299,0.5833905331836259,0.43262345643957356,0.001668054298468035,0.012944301322381023,10.0,6.0,189.0,0.9808238516911493,1.9225127696990967,52,0.7961636759031063,,0.7672049735801921
172,0.7660335758370131,COMPLETE,False,xgb,oof+timing,False,,,,,,,,,,,,,standard,0.5373859061456908,0.5574090248483766,0.28889336279335887,0.02280193801041849,0.1104932184688339,3.0,2.0,210.0,0.9893458363424015,0.41902875900268555,52,0.7958807679668346,,0.7660335758370131
173,0.7750256888942612,COMPLETE,False,xgb,oof+timing,False,,,,,,,,,,,,,standard,0.7538111766865271,0.8375739208062003,0.20971301844926638,0.0016326503180705404,0.015961808325988903,3.0,1.0,162.0,0.972537167870432,0.39718055725097656,52,0.8023447203777683,,0.7750256888942612
174,0.7751859132488896,COMPLETE,False,xgb,all,False,,,,,,,,,,,,,standard,0.37636758319546565,0.5927384434806565,0.6245324109442558,0.0012954495892867164,0.010531506020237955,3.0,2.0,135.0,0.957701664158048,1.236116886138916,362,0.8017821098143096,,0.7751859132488896
175,0.7759140450736759,COMPLETE,False,xgb,oof+timing,False,,,,,,,,,,,,,standard,1.016322770036822,0.5510855761082188,0.1334184550321389,0.0023368617263368526,0.011998735751074307,3.0,1.0,182.0,0.9907672588870056,0.39452433586120605,52,0.8026461245238409,,0.7759140450736759
176,0.7757831533059175,COMPLETE,False,xgb,oof+timing,False,,,,,,,,,,,,,standard,0.9090047943013801,0.6223715346324169,0.47133935000112404,0.001213897931748175,0.014741726875383736,3.0,1.0,199.0,0.9817848811835495,0.4288957118988037,52,0.8031365893598661,,0.7757831533059175
177,0.7699281005672337,COMPLETE,False,lr,oof+timing,False,,,,,,,,,,13.146115987532466,True,l1,standard,,,,,,,,,,1.5556321144104004,52,0.7972792811027692,,0.7699281005672337
178,0.7763259071233983,COMPLETE,False,xgb,oof+timing,False,,,,,,,,,,,,,standard,0.23626405875556775,0.574029825112856,0.33007360541168457,0.0019461134314709726,0.018265846881012016,3.0,2.0,144.0,0.949629754971112,0.32991814613342285,52,0.8033803504884628,,0.7763259071233983
179,0.7752919133746404,COMPLETE,False,xgb,oof+timing,False,,,,,,,,,,,,,standard,0.22445443599935114,0.5286657369909856,0.3084512739454766,0.0020782775294460754,0.02452916299582598,3.0,1.0,148.0,0.9504617133750595,0.3249852657318115,52,0.8031698510098773,,0.7752919133746404
180,0.7389040010973364,COMPLETE,False,xgb,oof_minus_roberta,False,,,,,,,,,,,,,standard,2.024837271965043,0.5710087625952048,0.0829237579697577,0.16898811924827858,0.019076561064894828,6.0,3.0,482.0,0.8594762467109316,0.9246020317077637,5,0.7675628605775674,,0.7389040010973364
181,0.7765687524449307,COMPLETE,False,xgb,oof+timing,False,,,,,,,,,,,,,standard,0.2751026537172469,0.5936071238066639,0.38666682586491224,0.0015907525553548255,0.016499335951970746,3.0,2.0,168.0,0.9349123469197204,0.3694179058074951,52,0.8035570628565315,,0.7765687524449307
182,0.7765741104790097,COMPLETE,False,xgb,oof+timing,False,,,,,,,,,,,,,standard,0.2885062531294706,0.61125183581834,0.2154794755992727,0.0014992985872804255,0.01681393434913604,3.0,2.0,166.0,0.943634955869913,0.37842822074890137,52,0.8036020948218705,,0.7765741104790097
183,0.7762596870606876,COMPLETE,False,xgb,oof+timing,False,,,,,,,,,,,,,standard,0.28588282069377835,0.5621101959613227,0.1694324517762247,0.001500563248741368,0.017202443844588418,3.0,2.0,168.0,0.9341444174042739,0.3739330768585205,52,0.8033708396533096,,0.7762596870606876
184,0.7756400047458609,COMPLETE,False,xgb,oof+timing,False,,,,,,,,,,,,,standard,0.26277052543133084,0.5829816178050525,0.1833912983640647,0.0016615167148572728,0.028392627219074637,3.0,2.0,165.0,0.9313899793223304,0.3637356758117676,52,0.8037244745736493,,0.7756400047458609
185,0.7761150490069935,COMPLETE,False,xgb,oof+timing,False,,,,,,,,,,,,,standard,0.19980433997674152,0.6123090305771004,0.08439745137762408,0.0027565204007573216,0.01758702876393219,3.0,2.0,153.0,0.9346716341819484,0.34516382217407227,52,0.8032882898078633,,0.7761150490069935
186,0.7760571492218777,COMPLETE,False,xgb,oof+timing,False,,,,,,,,,,,,,standard,0.18726572551418308,0.6504599242111357,0.07784077337586223,0.002295890342706362,0.017625160492096992,3.0,2.0,154.0,0.9223236737677963,0.35727500915527344,52,0.8032382659677202,,0.7760571492218777
187,0.775660993734898,COMPLETE,False,xgb,oof+timing,False,,,,,,,,,,,,,standard,0.22857534476896732,0.6123929771875299,0.013504504993015892,0.0026955554510586072,0.022385711531788394,3.0,2.0,139.0,0.9379531829989282,0.3254857063293457,52,0.8032894983670262,,0.775660993734898
188,0.7739481802621425,COMPLETE,False,xgb,oof+timing,True,,,,,,,,,,,,,standard,0.2780080161596012,0.6288038856519981,0.16233818830542618,0.0019953638923206614,0.018788489766340868,3.0,2.0,170.0,0.9433445085645664,1.305039644241333,52,0.801972431609476,,0.7739481802621425
189,0.7752896988007498,COMPLETE,False,xgb,oof+timing,False,,,,,,,,,,,,,standard,0.19935483676448426,0.5995405232493434,0.4329144026761076,0.0029772586518160686,0.01690656775439535,3.0,2.0,148.0,0.9047166476112305,0.3495752811431885,52,0.8024993108585468,,0.7752896988007498
190,0.775932873815657,COMPLETE,False,xgb,oof+timing,False,,,,,,,,,,,,,standard,0.15676755824657873,0.5937526190977476,0.22057230288020221,0.0015310978535110471,0.020162708844798795,3.0,2.0,130.0,0.9295980188889251,0.31334996223449707,52,0.8032141473305083,,0.775932873815657
191,0.7755575350653358,COMPLETE,False,xgb,oof+timing,False,,,,,,,,,,,,,standard,0.30734874974832693,0.5782807380522841,0.3560485335490623,4.9420784857402795,0.015161948368418382,3.0,2.0,164.0,0.9537242623430631,0.3831217288970947,52,0.8027755454463961,,0.7755575350653358
192,0.774788958810321,COMPLETE,False,xgb,oof+hand+graph,False,,,,,,,,,,,,,standard,0.16982402566994237,0.5444337833114097,0.2183901488602148,0.0011795717724168268,0.01644512882338995,3.0,2.0,175.0,0.9663770869252754,0.3805408477783203,49,0.8022226033562423,,0.774788958810321
193,0.7760394580063443,COMPLETE,False,xgb,oof+timing,False,,,,,,,,,,,,,standard,0.25639320345381245,0.5644561640668793,0.08900879001499871,0.0018060019818826583,0.013869357267416081,3.0,2.0,151.0,0.9479386947472981,0.35654568672180176,52,0.8030226695222291,,0.7760394580063443
194,0.7759808851611998,COMPLETE,False,xgb,oof+timing,False,,,,,,,,,,,,,standard,0.4733556955585497,0.6172972258603077,0.2613364960115975,0.00145476020761661,0.017975480418048743,3.0,2.0,185.0,0.93719906265972,0.418353796005249,52,0.8036035135652358,,0.7759808851611998
195,0.7743345152600432,COMPLETE,False,xgb,oof_only,False,,,,,,,,,,,,,standard,0.014127492405479006,0.6454467276416513,0.002984937936916676,0.0010083428148680406,0.013260963768472215,3.0,2.0,159.0,0.962879313012627,0.17351722717285156,6,0.801334995470005,,0.7743345152600432
196,0.7753751500793514,COMPLETE,False,xgb,oof+timing,False,,,,,,,,,,,,,standard,3.174649617939032,0.5774065588298918,0.39409620165059567,0.0013787951855689957,0.014960126342059128,3.0,1.0,141.0,0.9504274327042881,0.33609437942504883,52,0.8026604695956465,,0.7753751500793514
197,0.7760527324294891,COMPLETE,True,xgb,oof+timing,False,,,,,,,,,,,,,standard,0.20071444706238314,0.5524165047797542,4.3880957895960115,0.0018907390111960421,0.021187729359508932,3.0,1.0,114.0,0.917528787089628,0.30427002906799316,52,0.8048121778204591,,0.7760527324294891
198,0.7758334089343032,COMPLETE,False,xgb,oof+timing,False,,,,,,,,,,,,,standard,0.32499264232806646,0.6037100758734646,0.14644514300890374,0.0011759056473842875,0.016796630515025297,3.0,2.0,200.0,0.9606180757634328,0.4595675468444824,52,0.8035472367450748,,0.7758334089343032
199,0.7732750937385151,COMPLETE,False,xgb,oof+ng,False,,,,,,,,,,,,,standard,0.13643471251119085,0.5642242963058235,0.27672113183038743,0.001527459278925781,0.018522211688602252,4.0,1.0,174.0,0.9780840700888287,1.1641056537628174,237,0.8007790582549688,,0.7732750937385151
200,0.7757550860693675,COMPLETE,False,xgb,oof+timing,False,,,,,,,,,,,,,none,0.1074029157551599,0.5882582011667985,0.525250890262812,0.0022803304743864734,0.015363822358703623,3.0,2.0,127.0,0.9386123030051005,0.30467939376831055,52,0.8026635698126301,,0.7757550860693675
201,0.7763247174585043,COMPLETE,False,xgb,oof+timing,False,,,,,,,,,,,,,standard,0.34023789024887297,0.5580091346515953,0.3844281821242723,0.001346299251747915,0.01564145978977506,3.0,1.0,183.0,0.9699265730952561,0.4050180912017822,52,0.8034872817013738,,0.7763247174585043
202,0.7757589076107679,COMPLETE,False,xgb,oof+timing,False,,,,,,,,,,,,,standard,0.24547356159414663,0.5346843768085547,0.376967094009104,0.0011771061190617885,0.012794168254896175,3.0,1.0,185.0,0.9737469383677113,0.4152247905731201,52,0.8026743417529971,,0.7757589076107679
203,0.7759554251722411,COMPLETE,False,xgb,oof+timing,False,,,,,,,,,,,,,standard,0.43984899440625463,0.5732337562858567,0.15175961242976405,0.6275978656432659,0.01627707358476122,3.0,1.0,161.0,0.9656805588864352,0.36484193801879883,52,0.8031199322618354,,0.7759554251722411
204,0.7721454333007637,COMPLETE,False,xgb,oof+timing,False,,,,,,,,,,,,,standard,0.34332529647518073,0.5568606763926326,0.25524993651726463,0.0016704477690909947,0.014340161697006458,3.0,1.0,800.0,0.9501914496259813,1.480696439743042,52,0.8017936699454351,,0.7721454333007637
205,0.7753396875308372,COMPLETE,False,xgb,oof+timing,False,,,,,,,,,,,,,standard,0.0025179282354100877,0.5944648971496552,0.46474803742648907,0.0014078099873497268,0.01951100687820577,3.0,1.0,207.0,0.9918136784639009,0.4478318691253662,52,0.8033526587198121,,0.7753396875308372
206,0.7750473969212104,COMPLETE,False,xgb,oof+timing,False,,,,,,,,,,,,,standard,0.2929952551299611,0.6116669318136604,0.34971283046034884,0.0010170596021236212,0.023263710821496624,3.0,2.0,192.0,0.9287893313470694,0.43276023864746094,52,0.8034151359739405,,0.7750473969212104
207,0.7469782882645849,COMPLETE,False,lgbm,oof+hand,False,2.1469132867105727,0.706537800908297,1.055352541515796,0.10069943173649479,7.0,28.0,701.0,97.0,0.7680356886969552,,,,standard,,,,,,,,,,2.367586851119995,34,0.7764936398785849,,0.7469782882645849
208,0.771837726716716,COMPLETE,False,xgb,oof+timing,False,,,,,,,,,,,,,standard,0.0014132656268582276,0.5448546494978616,0.10127909753392994,0.040030354021702186,0.017395890703368295,3.0,3.0,772.0,0.9591430758663252,1.3573286533355713,52,0.801231006835926,,0.771837726716716
209,0.7753623962580717,COMPLETE,False,xgb,oof+timing,False,,,,,,,,,,,,,standard,0.1643698566103116,0.6309001117562769,0.18635102131822923,0.0018996461227546201,0.012587855551134454,3.0,1.0,177.0,0.8908242522247036,0.40639662742614746,52,0.8024466597158751,,0.7753623962580717
210,0.7758871727541274,COMPLETE,False,xgb,oof+timing,False,,,,,,,,,,,,,standard,0.20475535663697295,0.5806590152607728,0.3144101366913884,0.0013632391160557735,0.014324008144198576,3.0,5.0,153.0,0.977533871715483,0.35120534896850586,52,0.802991246983988,,0.7758871727541274
211,0.775260953172599,COMPLETE,False,xgb,oof+timing,False,,,,,,,,,,,,,standard,0.38083555446516837,0.5609050706249638,0.3194301118928897,0.0013434211931774266,0.015999112388713193,3.0,1.0,174.0,0.6650074025827688,0.39752912521362305,52,0.8027388157570472,,0.775260953172599
212,0.7761931039929592,COMPLETE,False,xgb,oof+timing,False,,,,,,,,,,,,,standard,0.36906973878328103,0.5731343092611787,0.4417011651379059,0.0015288687722067318,0.016652341963642067,3.0,1.0,189.0,0.9452710648469858,0.4134409427642822,52,0.8037472795595968,,0.7761931039929592
213,0.776211065631432,COMPLETE,False,xgb,oof+timing,False,,,,,,,,,,,,,standard,0.27483589258037794,0.5711893319078595,0.5493408059336538,0.0017127314248568482,0.018157054792066155,3.0,1.0,192.0,0.950053298866212,0.4255969524383545,52,0.8039340807693751,,0.776211065631432
214,0.7762111090068149,COMPLETE,False,xgb,oof+timing,False,,,,,,,,,,,,,standard,0.24438596743367233,0.5959335868645456,0.5409605936220792,0.0017032557802723763,0.01961846619818786,3.0,1.0,142.0,0.9451705295127013,0.3281562328338623,52,0.803435996756017,,0.7762111090068149
215,0.775698252912759,COMPLETE,False,xgb,oof+timing,False,,,,,,,,,,,,,standard,0.2465099048040053,0.5920560374885281,0.7360373912092197,0.0017421626093254636,0.02063718539497457,3.0,1.0,215.0,0.9452028539532481,0.461561918258667,52,0.8038262562736043,,0.775698252912759
216,0.7515117368717659,COMPLETE,False,lr,all,False,,,,,,,,,,0.7133855485590891,False,l2,standard,,,,,,,,,,53.61007332801819,362,0.7748837865272558,,0.7515117368717659
217,0.7754286386172599,COMPLETE,False,xgb,oof+timing,False,,,,,,,,,,,,,standard,0.12627961170120086,0.5703012855165457,0.5844111567089706,0.001593077755962729,0.026660601075210018,3.0,1.0,138.0,0.9551908699520745,0.31024980545043945,52,0.8033484550357666,,0.7754286386172599
218,0.7759748446963477,COMPLETE,False,xgb,oof+timing,False,,,,,,,,,,,,,standard,0.41126533060990134,0.5801338525173773,0.4924856269791485,0.002027406896473646,0.01907354677256318,3.0,1.0,167.0,0.9457992801466375,0.37206149101257324,52,0.8034162394410025,,0.7759748446963477
219,0.7752384244348456,COMPLETE,False,xgb,oof+timing,False,,,,,,,,,,,,,standard,0.2833971174079748,0.5959401453253723,0.5402650165368093,0.0015495818682394048,0.02191519811606506,3.0,1.0,200.0,0.9681056798450164,0.4274125099182129,52,0.8033817166857775,,0.7752384244348456
220,0.7733036856182144,COMPLETE,False,xgb,oof+timing,True,,,,,,,,,,,,,standard,0.0847287540609636,0.5446979431235086,2.3800279162462434,0.0011310499080198174,0.013496488811139398,3.0,1.0,187.0,0.9567356434531562,1.400449514389038,52,0.8011337440963199,,0.7733036856182144
221,0.7763727434877458,COMPLETE,False,xgb,oof+timing,False,,,,,,,,,,,,,standard,0.2192735162255304,0.6110599395498847,0.42593986990757815,0.0024100768319024377,0.017564414202368088,3.0,1.0,152.0,0.9279051561055506,0.3524661064147949,52,0.8034311099733139,,0.7763727434877458
222,0.776401402353924,COMPLETE,False,xgb,oof+timing,False,,,,,,,,,,,,,standard,0.24203237713768477,0.5747899704460634,0.4230310598912801,0.002344051645379516,0.017548503020863283,3.0,1.0,142.0,0.9283863732031092,0.33057546615600586,52,0.8034097762767825,,0.776401402353924
223,0.775512008850574,COMPLETE,False,xgb,oof+timing,False,,,,,,,,,,,,,standard,0.23789423275345925,0.6224328719021325,0.6540231687687019,0.002376647951497698,0.018144952565364983,3.0,1.0,125.0,0.9244970342189957,0.29159116744995117,52,0.802641710655593,,0.775512008850574
224,0.7765313320572403,COMPLETE,False,xgb,oof+timing,False,,,,,,,,,,,,,standard,0.29489521365486016,0.5840330306642795,0.41308200509290277,0.002025381519403903,0.015393356366274799,3.0,1.0,167.0,0.9352787475855122,0.36925363540649414,52,0.8033615915484091,,0.7765313320572403
225,0.7758961385917944,COMPLETE,False,xgb,oof+timing,False,,,,,,,,,,,,,standard,0.35256150170491185,0.574573124138258,0.4422196422897911,0.0022024830068747836,0.020419688467753588,3.0,1.0,171.0,0.93307223814536,0.38080883026123047,52,0.8034396224335064,,0.7758961385917944
226,0.7762625194642357,COMPLETE,False,xgb,oof+timing,False,,,,,,,,,,,,,standard,0.0032078220140132944,0.5880684134538322,0.5613945775558878,0.001934413057285513,0.017160194253083853,3.0,1.0,158.0,0.9370436290466876,0.36510562896728516,52,0.803429270861544,,0.7762625194642357
227,0.7758724801460541,COMPLETE,False,xgb,oof+timing,False,,,,,,,,,,,,,standard,0.004169550532874284,0.6006370192182842,0.5456014261111422,0.004197618730774214,0.017548278795665218,3.0,1.0,156.0,0.9146982041676661,0.35160350799560547,52,0.8030067480689065,,0.7758724801460541
228,0.7487275158494022,COMPLETE,False,xgb,oof_minus_roberta,False,,,,,,,,,,,,,standard,0.00229627033772771,0.5876101415911587,0.7701113617997543,0.0030187806792443166,0.023543164131160914,3.0,1.0,161.0,0.9414447634660663,0.182297945022583,5,0.7759635553204295,,0.7487275158494022
229,0.7760562886472173,COMPLETE,False,xgb,oof+timing,False,,,,,,,,,,,,,standard,0.3015858916801863,0.6061776157963572,0.6160109312662103,0.0020761008683824033,0.019365644161559857,3.0,1.0,142.0,0.929329701401173,0.3321688175201416,52,0.8032513499343121,,0.7760562886472173
230,0.7757236679593316,COMPLETE,False,xgb,oof+timing,False,,,,,,,,,,,,,standard,0.22855157552909613,0.5831161058503559,0.39268121650334004,0.0026194129490426155,0.016360625169331403,3.0,1.0,169.0,0.9136002581005754,0.3805105686187744,52,0.8028461673383629,,0.7757236679593316
231,0.7753089775228817,COMPLETE,False,xgb,oof+timing,False,,,,,,,,,,,,,standard,0.1655853795695843,0.5651750883631037,0.46506805794334005,0.0017951177832305665,0.014838416815532416,3.0,1.0,316.0,0.9405040857113266,0.6321494579315186,52,0.8035809713095411,,0.7753089775228817
232,0.7766913417695956,COMPLETE,False,xgb,oof+timing,False,,,,,,,,,,,,,standard,0.0027643941228270115,0.57433877256139,0.410789707096453,0.0018624987335462866,0.01550712644682883,3.0,1.0,183.0,0.9262773768963724,0.40370917320251465,52,0.8034575406367509,,0.7766913417695956
233,0.7763637081727996,COMPLETE,False,xgb,oof+timing,False,,,,,,,,,,,,,standard,0.002672987391894208,0.5907200479294302,0.4221906818294066,0.002162913768024438,0.01709040266912343,3.0,1.0,193.0,0.9226943170979262,0.42467498779296875,52,0.8037136500872317,,0.7763637081727996
234,0.7761371431058223,COMPLETE,False,xgb,oof+timing,False,,,,,,,,,,,,,standard,0.0031319545948764673,0.594771295882903,0.548017037286075,0.0023672960262470493,0.0184639252884679,3.0,1.0,201.0,0.9223542724337929,0.43201184272766113,52,0.8036133922227431,,0.7761371431058223
235,0.7767229979489071,COMPLETE,False,xgb,oof+timing,False,,,,,,,,,,,,,standard,0.0030216938866628193,0.6087587936801728,0.6890139514115772,0.002063491427257597,0.015045302818705957,3.0,1.0,176.0,0.926672819652016,0.38350367546081543,52,0.8034047318559274,,0.7767229979489071
236,0.7753616786234737,COMPLETE,True,xgb,oof+hand+graph,False,,,,,,,,,,,,,standard,0.00354802730519767,0.6067074226840631,0.6629506005655125,0.003273431368199591,0.012575520700501327,3.0,1.0,174.0,0.9012999604285393,0.38738012313842773,49,0.8040948191380703,,0.7753616786234737
237,0.7754988802822734,COMPLETE,False,xgb,oof+timing,False,,,,,,,,,,,,,standard,0.0027011068137431093,0.616281493029685,0.3794322902649733,0.00210627247633634,0.01503525256740512,3.0,1.0,146.0,0.9081454205633989,0.3345298767089844,52,0.8024813926553022,,0.7754988802822734
