number,value,state,params_add_group_dummies,params_family,params_feature_subset,params_isotonic,params_lgbm_alpha,params_lgbm_colsample,params_lgbm_lambda,params_lgbm_lr,params_lgbm_max_depth,params_lgbm_min_child,params_lgbm_n_estimators,params_lgbm_num_leaves,params_lgbm_subsample,params_lr_C,params_lr_class_weight_balanced,params_lr_penalty,params_scaler,params_xgb_alpha,params_xgb_colsample,params_xgb_gamma,params_xgb_lambda,params_xgb_lr,params_xgb_max_depth,params_xgb_min_child,params_xgb_n_estimators,params_xgb_subsample,user_attrs_elapsed_sec,user_attrs_n_features,user_attrs_pooled_auroc,user_attrs_pruned_reason,user_attrs_weighted_auroc
948,0.7751885849533824,COMPLETE,False,xgb,oof+timing,False,,,,,,,,,,,,,standard,0.43239490786415236,0.5615131386979186,3.9903567351642146,0.0031835231240404716,0.010194490464250439,3.0,2.0,135.0,0.9555324522976624,0.31737780570983887,52,0.8020847750655958,,0.7751885849533824
949,0.7757735030103708,COMPLETE,False,xgb,oof+timing,False,,,,,,,,,,,,,standard,0.007745396000486397,0.5210147816923282,0.4426392701653097,0.0016664102281662842,0.013095971303728486,3.0,1.0,161.0,0.9335434894713146,0.37653374671936035,52,0.8026986180283608,,0.7757735030103708
950,0.7713197203633924,COMPLETE,False,lr,oof+timing,False,,,,,,,,,,1.4887592411270079,True,l1,none,,,,,,,,,,1.6145470142364502,52,0.7981714079493557,,0.7713197203633924
951,0.7578918553946836,COMPLETE,False,xgb,oof+timing,False,,,,,,,,,,,,,standard,0.0059521141844825305,0.5766674951747379,0.5523998755042557,0.0020918780607937664,0.14041937424351272,4.0,2.0,173.0,0.9451090794320317,0.4808933734893799,52,0.7874718760400833,,0.7578918553946836
952,0.7754338760543062,COMPLETE,False,xgb,oof+hand+graph,False,,,,,,,,,,,,,standard,0.012963420311892408,0.5949056812455654,2.3355374339458193,0.001358959559130697,0.01555067117631583,3.0,1.0,189.0,0.9193367354727576,0.4186670780181885,49,0.8030649165468879,,0.7754338760543062
953,0.7718098859319908,COMPLETE,False,xgb,oof+timing,True,,,,,,,,,,,,,standard,0.29405107129682656,0.6452048036764801,1.0970662127469035,0.02032290044123394,0.02036220504730317,3.0,1.0,210.0,0.6202273960500883,1.7057194709777832,52,0.8011159309851767,,0.7718098859319908
954,0.7740103706179617,COMPLETE,False,xgb,oof_only,False,,,,,,,,,,,,,standard,0.002018541160084136,0.5460380407130405,3.6273292691760806,0.0024864571023655983,0.023394494990362055,3.0,4.0,151.0,0.7752180877855256,0.17538905143737793,6,0.8014309445583467,,0.7740103706179617
955,0.7455662983837434,COMPLETE,False,xgb,oof+timing,False,,,,,,,,,,,,,standard,0.0309285424448391,0.624091166017599,0.659967849848706,0.0017920184312343991,0.2943573936481197,3.0,2.0,176.0,0.9295252812286909,0.3738424777984619,52,0.7754594810573063,,0.7455662983837434
956,0.7760171523985222,COMPLETE,False,xgb,oof+timing,False,,,,,,,,,,,,,standard,0.0026766260129201538,0.5714196307469889,0.3728648211229189,0.002142526950507738,0.01803794983268712,3.0,3.0,127.0,0.9514657603692803,0.3045926094055176,52,0.8030665454744557,,0.7760171523985222
957,0.77557940349203,COMPLETE,False,xgb,oof+timing,False,,,,,,,,,,,,,standard,0.2011070374268667,0.5349286976333261,0.2560366829977052,0.005336702920900126,0.0142943080014914,3.0,1.0,163.0,0.8700879239909004,0.4082067012786865,52,0.8026698227926481,,0.77557940349203
958,0.7761168702841301,COMPLETE,False,xgb,oof+timing,False,,,,,,,,,,,,,standard,0.001610632083518407,0.5562030471570987,0.5294744920351506,0.0014747510589345298,0.015986847663622985,3.0,1.0,193.0,0.90855899394046,0.4417610168457031,52,0.8032712123414277,,0.7761168702841301
959,0.7756938068159167,COMPLETE,False,xgb,oof+ng,False,,,,,,,,,,,,,standard,0.003272517872556386,0.6034503916700775,0.14362805698991363,0.0028212528135411964,0.012369019416034086,3.0,2.0,145.0,0.939658164644058,0.7540841102600098,237,0.802362113120507,,0.7756938068159167
960,0.7756300730964268,COMPLETE,True,xgb,oof+timing,False,,,,,,,,,,,,,standard,0.004556723819023586,0.5904589745924006,0.3736452435778864,0.0018224147232365072,0.017529970005030364,3.0,1.0,179.0,0.9170589384209984,0.43230295181274414,52,0.80498079809674,,0.7756300730964268
961,0.7753643136750166,COMPLETE,False,xgb,oof+timing,False,,,,,,,,,,,,,standard,0.002437099623743727,0.510628097838878,0.8504216464948526,0.0037179333120223633,0.014467140346825672,3.0,2.0,156.0,0.5032075791822161,0.37149715423583984,52,0.8021944386731366,,0.7753643136750166
962,0.7749691260650124,COMPLETE,False,xgb,oof+timing,False,,,,,,,,,,,,,standard,0.0018023783726888011,0.5737843560700819,0.6768049668163771,0.0011771545039023898,0.021125248936894558,3.0,3.0,202.0,0.8243229202782368,0.44922423362731934,52,0.8032686375849498,,0.7749691260650124
963,0.7758891661306295,COMPLETE,False,xgb,oof+timing,False,,,,,,,,,,,,,standard,0.00878059054872061,0.6147143435831787,0.28155919238416743,0.001594677838952898,0.011236637070528924,3.0,1.0,170.0,0.9260371370347443,0.4017782211303711,52,0.8026098152028965,,0.7758891661306295
964,0.7745062832810854,COMPLETE,False,xgb,oof+hand,False,,,,,,,,,,,,,standard,0.0015075404711039815,0.5526633566832748,0.5815593429158314,0.0020949773865104942,0.016007212700799196,3.0,1.0,185.0,0.9763441462515396,0.3391144275665283,34,0.8025482837776785,,0.7745062832810854
965,0.7763124683606986,COMPLETE,False,xgb,oof+timing,False,,,,,,,,,,,,,standard,0.3040841822612316,0.5889556584169231,0.4459589414840973,0.12407336805663972,0.013182796008565287,3.0,2.0,221.0,0.9624654904367747,0.4961435794830322,52,0.8034746706492369,,0.7763124683606986
966,0.7761625218910111,COMPLETE,False,xgb,oof+timing,False,,,,,,,,,,,,,standard,0.002197880234582834,0.564981883055554,0.14981538689140897,0.0026034946660780166,0.019438220899261754,3.0,2.0,141.0,0.9376797263078388,0.33785343170166016,52,0.803562632737892,,0.7761625218910111
967,0.7684221475145293,COMPLETE,False,lgbm,oof+timing,False,0.0016911146998135455,0.9550916046726717,0.0013708066489791595,0.0902258559372577,4.0,72.0,132.0,127.0,0.8913507894338103,,,,standard,,,,,,,,,,0.3396565914154053,52,0.7978787264476778,,0.7684221475145293
968,0.7750225748967342,COMPLETE,True,xgb,all,False,,,,,,,,,,,,,standard,0.2354038616394294,0.5316526812658819,0.7600613829471421,0.0010061831730816808,0.017173998024343773,3.0,3.0,162.0,0.8977852592953028,1.4431250095367432,362,0.804166071582644,,0.7750225748967342
969,0.7761942944650346,COMPLETE,False,xgb,oof+timing,False,,,,,,,,,,,,,standard,0.003376213578113356,0.633076361977679,4.382537035402935,0.003136816800445374,0.014838351016638822,3.0,1.0,191.0,0.9239031680642712,0.4382352828979492,52,0.8032089978175523,,0.7761942944650346
970,0.7555411913797099,COMPLETE,False,xgb,oof+timing,True,,,,,,,,,,,,,standard,0.006967158318726961,0.6036421038316425,0.34486022045266534,0.001382755031054648,0.2093355083930223,3.0,1.0,176.0,0.9468063598867513,1.336242914199829,52,0.7849581255268399,,0.7555411913797099
971,0.7738516530510376,COMPLETE,False,xgb,oof+timing,False,,,,,,,,,,,,,none,0.004064865259121087,0.5847652187062836,0.4831905209066986,0.001975471592501403,0.01774098999915157,4.0,5.0,164.0,0.932844053745587,0.5105724334716797,52,0.802121347116793,,0.7738516530510376
972,0.7757727820920012,COMPLETE,False,xgb,oof+timing,False,,,,,,,,,,,,,standard,0.002678519950481257,0.5479330078182817,0.20728229743060475,0.0016665117030973987,0.012341737996304733,3.0,1.0,151.0,0.9168863564371411,0.3542313575744629,52,0.8025039349109969,,0.7757727820920012
973,0.775536119429426,COMPLETE,False,xgb,oof+timing,False,,,,,,,,,,,,,standard,0.005459536976498709,0.5748781692780665,0.6018578544874486,0.004456184759621721,0.015355249307949488,3.0,2.0,204.0,0.677510134928262,0.45836615562438965,52,0.8030652843692418,,0.775536119429426
974,0.7516950598528315,COMPLETE,False,lr,oof_minus_roberta,False,,,,,,,,,,13.839069103968665,False,l2,standard,,,,,,,,,,0.026015520095825195,5,0.7776842808384626,,0.7516950598528315
975,0.7744369275100315,COMPLETE,False,xgb,oof+ph,False,,,,,,,,,,,,,standard,5.021825993553456,0.5632120212012335,1.1770534441343192,0.0022646011045913536,0.019510519608290876,3.0,2.0,126.0,0.9542966427909234,0.2820742130279541,42,0.8013578530020032,,0.7744369275100315
976,0.776117205891907,COMPLETE,True,xgb,oof+timing,False,,,,,,,,,,,,,standard,0.16098577660816996,0.6132326043437386,0.3945221897905895,0.001314164118593102,0.013696790566737952,3.0,1.0,182.0,0.943482859652171,0.4416511058807373,52,0.8050685500011928,,0.776117205891907
977,0.7766489158593731,COMPLETE,False,xgb,oof+timing,False,,,,,,,,,,,,,standard,0.0018519461796446515,0.5972293326070455,0.2653564877635434,0.002604692896990827,0.016635118421172667,3.0,3.0,170.0,0.932107869947038,0.39499711990356445,52,0.8036111327425686,,0.7766489158593731
978,0.7758574529685077,COMPLETE,False,xgb,oof+timing,False,,,,,,,,,,,,,standard,0.019227733766118336,0.6416104124210623,0.005340618450630941,0.003615296383858787,0.022828549799068745,3.0,3.0,196.0,0.9072302303619009,0.4487476348876953,52,0.8039572535776766,,0.7758574529685077
979,0.7752686452496685,COMPLETE,False,xgb,oof+timing,False,,,,,,,,,,,,,standard,0.0015887811261226447,0.6058383841187384,0.13387026221437948,0.003148662102740964,0.01914763058501847,3.0,3.0,239.0,0.9238091991039326,0.5107605457305908,52,0.8037315157444257,,0.7752686452496685
980,0.7755073241502162,COMPLETE,False,xgb,oof+timing,False,,,,,,,,,,,,,standard,0.0014480875490949282,0.6212914347126628,0.2407429316550425,0.0026740679605305063,0.016939741467088557,3.0,3.0,175.0,0.9145708588387241,0.4009582996368408,52,0.8028905162050444,,0.7755073241502162
981,0.7762777724594631,COMPLETE,False,xgb,oof+timing,False,,,,,,,,,,,,,standard,0.0019726341963108526,0.5979907092259853,0.2971474455083959,0.0046888905413281345,0.021337539469093253,3.0,3.0,153.0,0.9283601121252877,0.359119176864624,52,0.8037921013407336,,0.7762777724594631
982,0.7752517666569122,COMPLETE,False,xgb,oof+hand+graph,False,,,,,,,,,,,,,standard,0.0013393745487462808,0.6591917261884921,0.12628745386728413,0.006630008027079852,0.016024072505001836,3.0,3.0,211.0,0.9017625623835148,0.4477083683013916,49,0.8031013835059839,,0.7752517666569122
983,0.7647246469870796,COMPLETE,False,xgb,oof+timing,False,,,,,,,,,,,,,standard,0.010923244974403497,0.6219377329935222,0.28191816171983963,0.003193931020872062,0.01733445136329732,8.0,3.0,438.0,0.6643036962342489,2.9338579177856445,52,0.7943468436585797,,0.7647246469870796
984,0.7767005019276614,COMPLETE,False,xgb,oof+timing,False,,,,,,,,,,,,,standard,0.26791239137864914,0.6041800988527427,0.35540800283263063,0.0025310110695233013,0.014337417197212814,3.0,3.0,189.0,0.9334400256847246,0.43067193031311035,52,0.8036305222352291,,0.7767005019276614
985,0.7755088816834753,COMPLETE,True,xgb,all_minus_ng,False,,,,,,,,,,,,,standard,0.26955245714260584,0.5857578013895306,0.34625000030079267,0.0034279043027754274,0.010619168521926646,3.0,3.0,382.0,0.9366965937867213,1.5439918041229248,131,0.8051686502275296,,0.7755088816834753
986,0.7735861001984509,COMPLETE,False,xgb,oof+timing,False,,,,,,,,,,,,,standard,0.22663700262347666,0.578099282789337,0.22258920087638664,0.004146471864889473,0.01209772847304669,4.0,3.0,226.0,0.9334692855333558,0.68701171875,52,0.8018536775351868,,0.7735861001984509
987,0.7744285457005515,COMPLETE,False,xgb,oof_only,False,,,,,,,,,,,,,standard,0.3557577199293285,0.5969560825709638,0.36040092247400435,0.002976754852498425,0.013841814237123799,3.0,3.0,210.0,0.9397127211604466,0.23113107681274414,6,0.8019124240197245,,0.7744285457005515
988,0.7752701705786111,COMPLETE,False,xgb,oof+timing,False,,,,,,,,,,,,,standard,0.40525221655311633,0.5405034712060935,0.4257771867471615,0.0025522080386937013,0.014459907320530195,3.0,3.0,296.0,0.9294184016681465,0.6234638690948486,52,0.8035295287260327,,0.7752701705786111
989,0.7743798188297478,COMPLETE,False,lgbm,oof+timing,False,0.013416931539256622,0.7421064165267545,8.718163558075279,0.02849350064833294,2.0,56.0,257.0,87.0,0.5727581180899509,,,,standard,,,,,,,,,,0.33467864990234375,52,0.8031562415827795,,0.7743798188297478
990,0.7736739564982901,COMPLETE,False,xgb,oof+ng,True,,,,,,,,,,,,,standard,0.31364529629829646,0.519621964934898,0.17672109763252858,0.0027609980453849074,0.020292041294361237,3.0,3.0,190.0,0.9216929948894133,3.053412437438965,237,0.8016134369919781,,0.7736739564982901
991,0.7749856994131127,COMPLETE,False,xgb,oof+timing,False,,,,,,,,,,,,,standard,0.2669159972392837,0.5579283307532392,0.26223896379746453,0.003962796400747301,0.024697946010098542,3.0,3.0,204.0,0.7496540300962488,0.45029139518737793,52,0.8033443564438221,,0.7749856994131127
992,0.7763182643051024,COMPLETE,False,xgb,oof+timing,False,,,,,,,,,,,,,standard,0.25534016235467494,0.5012758698271904,0.0714383333916041,0.002425958594690965,0.012956117292441472,3.0,3.0,193.0,0.9418591807202603,0.43798398971557617,52,0.8033004804915955,,0.7763182643051024
993,0.7768027129521584,COMPLETE,False,xgb,oof+timing,False,,,,,,,,,,,,,none,0.21122784943597617,0.5863195427427902,0.445737265657687,0.0032722331827370176,0.01838145934064339,3.0,3.0,183.0,0.9309756164590695,0.4088454246520996,52,0.8040752194612075,,0.7768027129521584
994,0.7752496072559786,COMPLETE,True,xgb,oof+timing,False,,,,,,,,,,,,,none,0.1620528424227445,0.5987451990998429,0.460192564004755,0.005097638646374438,0.020279851484471183,3.0,3.0,197.0,0.9177354937766081,0.4537045955657959,52,0.8050012910564625,,0.7752496072559786
995,0.7716706982586445,COMPLETE,False,lr,oof+timing,False,,,,,,,,,,0.48180125203238194,True,l1,standard,,,,,,,,,,0.6165049076080322,52,0.798559828355173,,0.7716706982586445
996,0.7749222999965427,COMPLETE,False,xgb,oof+timing,False,,,,,,,,,,,,,none,0.22066603138689603,0.5897872618521095,0.44758797810285833,0.0035875320655645864,0.023185049611798864,3.0,3.0,219.0,0.9248783227413367,0.5038509368896484,52,0.8034597475708749,,0.7749222999965427
997,0.7755732627257481,COMPLETE,False,xgb,oof+timing,False,,,,,,,,,,,,,none,0.20764742236478487,0.6102276368034464,0.5302340357000489,0.004074622412615123,0.019486184631892334,3.0,3.0,186.0,0.9108919326546098,0.41836023330688477,52,0.8034171327238622,,0.7755732627257481
998,0.7751210384482783,COMPLETE,False,xgb,oof+hand,False,,,,,,,,,,,,,none,0.1777658383917997,0.582770283512584,0.3333474437958023,0.003478587884192085,0.018371732101459263,3.0,3.0,206.0,0.8900481534758828,0.3831911087036133,34,0.8035039387994047,,0.7751210384482783
999,0.77034108316258,COMPLETE,False,xgb,oof+timing,False,,,,,,,,,,,,,none,0.19033198071152388,0.6024432673995451,0.474694555923763,0.0032878543141882746,0.02103734443307014,6.0,3.0,183.0,0.9304963731706971,0.9617581367492676,52,0.7994960413381882,,0.77034108316258
1000,0.7765840380113719,COMPLETE,False,xgb,oof+timing,False,,,,,,,,,,,,,none,0.3192546709800972,0.5940343152655354,0.39010202848863695,0.005027492727079745,0.0173627261886225,3.0,3.0,193.0,0.9473067474660711,0.4304053783416748,52,0.8041089540256737,,0.7765840380113719
1001,0.7748761067477662,COMPLETE,False,xgb,all,False,,,,,,,,,,,,,none,0.44214175446962156,0.5989906355424653,0.4071938463612078,0.004488374771963248,0.016219332709087455,3.0,3.0,217.0,0.9579916633196046,1.6596248149871826,362,0.8027210026459038,,0.7748761067477662
1002,0.7761142992946689,COMPLETE,False,xgb,oof+timing,False,,,,,,,,,,,,,none,0.3298962224526553,0.612975680360001,0.2838966216632347,0.006047707737212994,0.017674693064194575,3.0,3.0,206.0,0.9527731035992142,0.44757699966430664,52,0.8039933527144186,,0.7761142992946689
1003,0.7753564398871523,COMPLETE,True,xgb,oof+timing,False,,,,,,,,,,,,,none,0.35074080292347054,0.5862735355652825,0.5237547797013702,0.004596522599305068,0.016314755391608912,3.0,3.0,192.0,0.8088617550965251,0.453629732131958,52,0.8048055044720367,,0.7753564398871523
1004,0.7749128102821223,COMPLETE,False,xgb,oof+timing,False,,,,,,,,,,,,,none,0.26809048675844044,0.7949926186619833,0.3912788284020604,0.005180836963392206,0.01807449030007976,3.0,3.0,244.0,0.9670570346179268,0.5853703022003174,52,0.8031110519792889,,0.7749128102821223
1005,0.7737693091870413,COMPLETE,False,xgb,oof+timing,False,,,,,,,,,,,,,none,0.29983193737069164,0.5952338400287731,0.2779419051343775,0.004093945801663568,0.014764490764647892,4.0,3.0,221.0,0.9485076818621412,0.6654801368713379,52,0.8024098774804757,,0.7737693091870413
1006,0.7756425921997077,COMPLETE,False,xgb,oof+timing,False,,,,,,,,,,,,,standard,0.6148290419979862,0.5779771317577513,0.5250382778305447,0.0035255606606468676,0.021646233966103153,3.0,3.0,229.0,0.944269909716908,0.49204468727111816,52,0.8040679155601782,,0.7756425921997077
1007,0.776196690945584,COMPLETE,False,xgb,oof+timing,False,,,,,,,,,,,,,none,0.14261986644328045,0.6075908202618294,0.1526812186987197,0.0033133793686207233,0.016329187845825262,3.0,4.0,199.0,0.9572665466903378,0.4455244541168213,52,0.8038172183529062,,0.776196690945584
1008,0.7489199926842242,COMPLETE,False,xgb,oof_minus_roberta,False,,,,,,,,,,,,,standard,0.3931399167104337,0.5881371456882691,0.39972313734899023,0.004025690344383608,0.01898874590375718,3.0,3.0,184.0,0.9412825652247117,0.21928954124450684,5,0.7762441512304762,,0.7489199926842242
1009,0.776039926270236,COMPLETE,False,xgb,oof+timing,False,,,,,,,,,,,,,none,0.2703263392831678,0.614012200191172,0.2258220121587181,0.002967095929152846,0.014079151770720983,3.0,3.0,210.0,0.9207503133671818,0.47298574447631836,52,0.8034304268746566,,0.776039926270236
1010,0.775497366766115,COMPLETE,True,xgb,oof+timing,False,,,,,,,,,,,,,none,0.48224195320404073,0.5949354003912666,0.46160585888855626,0.0028163367076164923,0.011416085936331807,3.0,4.0,181.0,0.8789280362461614,0.44953393936157227,52,0.8042878733278664,,0.775497366766115
1011,0.773098552161697,COMPLETE,False,xgb,oof+ph,True,,,,,,,,,,,,,none,0.2185102085347373,0.571892622023552,0.3399859233915112,0.0035469917354753826,0.015926934029757995,3.0,3.0,196.0,0.9493751790447841,1.4621264934539795,42,0.8011487197207324,,0.773098552161697
1012,0.7627862048145913,COMPLETE,False,lgbm,oof+timing,False,0.666332006359599,0.8855220005671005,0.18791984689847285,0.01013263238387573,9.0,44.0,678.0,252.0,0.9986532229783915,,,,none,,,,,,,,,,4.366828918457031,52,0.7923871912486025,,0.7627862048145913
1013,0.7755107021857259,COMPLETE,False,xgb,oof+timing,False,,,,,,,,,,,,,none,0.3409051995121614,0.5781160897817366,0.5628756893925708,0.003070117356826278,0.02420215210165729,3.0,3.0,175.0,0.9331076899699898,0.4062008857727051,52,0.8037548987369295,,0.7755107021857259
1014,0.7748386369301795,COMPLETE,False,xgb,all_minus_ng,False,,,,,,,,,,,,,none,0.1945544035997037,0.604907870917608,0.21129473068139826,0.005148482354418824,0.013144473896955847,3.0,3.0,195.0,0.9135351823450368,0.8621971607208252,131,0.8023866521261236,,0.7748386369301795
1015,0.7763999229788314,COMPLETE,False,xgb,oof+timing,False,,,,,,,,,,,,,none,0.30581026560814006,0.5887295300067392,0.33324425130784563,0.0026340788803191394,0.01810798467451465,3.0,3.0,169.0,0.9342685863864169,0.4057455062866211,52,0.8036370904915504,,0.7763999229788314
1016,0.7761017283212072,COMPLETE,False,xgb,oof+timing,False,,,,,,,,,,,,,none,0.24032416555348313,0.6241782152787665,0.48650002697405437,0.003017487517940261,0.014906239353009339,3.0,3.0,184.0,0.9672949329731112,0.4336276054382324,52,0.8032394219808326,,0.7761017283212072
1017,0.7705110351685543,COMPLETE,False,xgb,oof+timing,False,,,,,,,,,,,,,none,0.24625348591234134,0.5989288501375735,0.5841894502460303,0.0026664165441052027,0.01737672713240687,7.0,4.0,209.0,0.6884602734941341,1.2953417301177979,52,0.7998966524277379,,0.7705110351685543
1018,0.7269436875563081,COMPLETE,True,lr,oof+hand+graph,False,,,,,,,,,,23.14716416867548,False,l2,none,,,,,,,,,,0.5970485210418701,49,0.7521877810885294,,0.7269436875563081
1019,0.7755993268887205,COMPLETE,False,xgb,oof+timing,False,,,,,,,,,,,,,standard,0.12947976478649523,0.5854317291703757,0.41713456043150976,0.0038222607601778188,0.021359540659681344,3.0,3.0,172.0,0.9436850565706364,0.3938431739807129,52,0.8034381511440905,,0.7755993268887205
1020,0.7757730237026198,COMPLETE,False,xgb,oof+timing,False,,,,,,,,,,,,,none,0.40230466787956665,0.5708786319450064,0.12987238683529295,0.0029309588020421475,0.009955220314843893,3.0,3.0,189.0,0.925140016014919,0.42096734046936035,52,0.8026117068607171,,0.7757730237026198
1021,0.7746725147068859,COMPLETE,False,xgb,oof_only,False,,,,,,,,,,,,,none,0.3782098898378093,0.6130580398769445,0.34074802937624044,0.006974630404621018,0.012832397048465937,3.0,3.0,165.0,0.902456741025222,0.1896042823791504,6,0.8016864760022713,,0.7746725147068859
1022,0.7758445498247059,COMPLETE,False,xgb,oof+ng,False,,,,,,,,,,,,,none,0.20385842245187166,0.5706641886778185,0.2421949333112262,0.00399738209216522,0.014970121718579964,3.0,3.0,201.0,0.9537553625031419,0.9248330593109131,237,0.8027512166249818,,0.7758445498247059
1023,0.7756525078472504,COMPLETE,False,xgb,oof+timing,False,,,,,,,,,,,,,none,0.30417272769117665,0.597430944892578,0.4347860956592793,0.0027578503804879446,0.019426566430543326,3.0,4.0,232.0,0.9305783406487766,0.5094921588897705,52,0.8039671847812346,,0.7756525078472504
1024,0.776301881455798,COMPLETE,False,xgb,oof+timing,False,,,,,,,,,,,,,none,0.1776248240719562,0.5766976523309321,0.6057044443774153,0.008849878864957363,0.01682306127622143,3.0,3.0,181.0,0.9172088900658619,0.39186596870422363,52,0.8035734572243096,,0.776301881455798
1025,0.7753727357256478,COMPLETE,False,xgb,oof+timing,False,,,,,,,,,,,,,none,0.27555318226382264,0.6282125419550352,0.29168237847858314,0.00237558065411873,0.0012797238469103355,3.0,3.0,692.0,0.8556075506408445,1.3420486450195312,52,0.8019122138355221,,0.7753727357256478
1026,0.775608665013713,COMPLETE,True,xgb,oof+timing,False,,,,,,,,,,,,,none,0.5166691607342242,0.6077542285054761,0.515494562572765,0.0033748030841125316,0.013918748791094348,3.0,4.0,163.0,0.9383284390475314,0.3873581886291504,52,0.8046614232013724,,0.775608665013713
