number,value,state,params_add_group_dummies,params_family,params_feature_subset,params_isotonic,params_lgbm_alpha,params_lgbm_colsample,params_lgbm_lambda,params_lgbm_lr,params_lgbm_max_depth,params_lgbm_min_child,params_lgbm_n_estimators,params_lgbm_num_leaves,params_lgbm_subsample,params_lr_C,params_lr_class_weight_balanced,params_lr_penalty,params_scaler,params_xgb_alpha,params_xgb_colsample,params_xgb_gamma,params_xgb_lambda,params_xgb_lr,params_xgb_max_depth,params_xgb_min_child,params_xgb_n_estimators,params_xgb_subsample,user_attrs_elapsed_sec,user_attrs_n_features,user_attrs_pooled_auroc,user_attrs_pruned_reason,user_attrs_weighted_auroc
1120,0.7768241349129127,COMPLETE,True,lr,oof_only,False,,,,,,,,,,3.5091387376557983,True,l1,none,,,,,,,,,,0.38602638244628906,6,0.8052415315996709,,0.7768241349129127
1121,0.7768118151800107,COMPLETE,True,lr,oof_only,False,,,,,,,,,,3.2419750790661555,True,l1,none,,,,,,,,,,0.3631739616394043,6,0.8052399552181538,,0.7768118151800107
1122,0.7768125886623106,COMPLETE,True,lr,oof_only,False,,,,,,,,,,3.1772881132499156,True,l1,none,,,,,,,,,,0.3656730651855469,6,0.8052430554351375,,0.7768125886623106
1123,0.7768104437520009,COMPLETE,True,lr,oof_only,False,,,,,,,,,,3.1048322453983723,True,l1,none,,,,,,,,,,0.3497047424316406,6,0.8052443165403512,,0.7768104437520009
1124,0.7768155841171653,COMPLETE,True,lr,oof_only,False,,,,,,,,,,2.7452842438965677,True,l1,none,,,,,,,,,,0.317793607711792,6,0.8052499389677622,,0.7768155841171653
1125,0.7768195381654606,COMPLETE,True,lr,oof_only,False,,,,,,,,,,2.799380700159181,True,l1,none,,,,,,,,,,0.3312523365020752,6,0.8052496236914589,,0.7768195381654606
1126,0.776805688339605,COMPLETE,True,lr,oof_only,False,,,,,,,,,,3.177403039446935,True,l1,none,,,,,,,,,,0.36275577545166016,6,0.8052435283495927,,0.776805688339605
1127,0.776822542589359,COMPLETE,True,lr,oof_only,False,,,,,,,,,,2.2827783475295846,True,l1,none,,,,,,,,,,0.28555941581726074,6,0.8052641264014163,,0.776822542589359
1128,0.776824374186719,COMPLETE,True,lr,oof_only,False,,,,,,,,,,3.264721241402878,True,l1,none,,,,,,,,,,0.3666074275970459,6,0.8052438436258961,,0.776824374186719
1129,0.7768168698894072,COMPLETE,True,lr,oof_only,False,,,,,,,,,,3.2786631410678653,True,l1,none,,,,,,,,,,0.3646996021270752,6,0.8052425299746317,,0.7768168698894072
1130,0.7768154773782439,COMPLETE,True,lr,oof_only,False,,,,,,,,,,3.3381483678952293,True,l1,none,,,,,,,,,,0.36763525009155273,6,0.8052413214154686,,0.7768154773782439
1131,0.7768094393738909,COMPLETE,True,lr,oof_only,False,,,,,,,,,,3.1917318859857016,True,l1,none,,,,,,,,,,0.35199856758117676,6,0.8052417417838733,,0.7768094393738909
1132,0.7768264717253429,COMPLETE,True,lr,oof_only,False,,,,,,,,,,3.4655553844435465,True,l1,none,,,,,,,,,,0.3741574287414551,6,0.8052402704944573,,0.7768264717253429
1133,0.7768178855589842,COMPLETE,True,lr,oof_only,False,,,,,,,,,,3.4339777813045824,True,l1,none,,,,,,,,,,0.3744513988494873,6,0.8052392721194963,,0.7768178855589842
1134,0.7768050153277857,COMPLETE,True,lr,oof_only,False,,,,,,,,,,2.066967413734075,True,l1,none,,,,,,,,,,0.2691671848297119,6,0.8052647569540232,,0.7768050153277857
1135,0.7729141951911533,COMPLETE,True,lr,oof_only,True,,,,,,,,,,3.6410296227958936,True,l1,none,,,,,,,,,,1.0080485343933105,6,0.8025594235403994,,0.7729141951911533
1136,0.7767998272580386,COMPLETE,True,lr,oof_only,False,,,,,,,,,,8.441075261212072,True,l1,none,,,,,,,,,,0.8282637596130371,6,0.8052084275878115,,0.7767998272580386
1137,0.7768271894069658,COMPLETE,True,lr,oof_only,False,,,,,,,,,,3.435981900789212,True,l1,none,,,,,,,,,,0.3681159019470215,6,0.8052404806786596,,0.7768271894069658
1138,0.7768231993652731,COMPLETE,True,lr,oof_only,False,,,,,,,,,,3.4920208677743707,True,l1,none,,,,,,,,,,0.38028669357299805,6,0.8052416366917721,,0.7768231993652731
1139,0.77683953137164,COMPLETE,True,lr,oof_only,False,,,,,,,,,,1.5133440117405326,True,l1,none,,,,,,,,,,0.22404122352600098,6,0.8052721134011029,,0.77683953137164
1140,0.776843811029416,COMPLETE,True,lr,oof_only,False,,,,,,,,,,1.6662303388394328,True,l1,none,,,,,,,,,,0.248823881149292,6,0.8052773680061601,,0.776843811029416
1141,0.7768219640577712,COMPLETE,True,lr,oof_only,False,,,,,,,,,,1.519011998008817,True,l1,none,,,,,,,,,,0.22815728187561035,6,0.805271377756395,,0.7768219640577712
1142,0.7768279802795742,COMPLETE,True,lr,oof_only,False,,,,,,,,,,1.5244407036205874,True,l1,none,,,,,,,,,,0.22909092903137207,6,0.8052720083090019,,0.7768279802795742
1143,0.7768119257711166,COMPLETE,True,lr,oof_only,False,,,,,,,,,,1.461893374912015,True,l1,none,,,,,,,,,,0.22124481201171875,6,0.8052714303024457,,0.7768119257711166
1144,0.7768239931804698,COMPLETE,True,lr,oof_only,False,,,,,,,,,,1.9416873513303081,True,l1,none,,,,,,,,,,0.2770719528198242,6,0.8052641264014164,,0.7768239931804698
1145,0.7768199490020228,COMPLETE,True,lr,oof_only,False,,,,,,,,,,1.8239728015894359,True,l1,none,,,,,,,,,,0.26040124893188477,6,0.8052702217432826,,0.7768199490020228
1146,0.7768241989150046,COMPLETE,True,lr,oof_only,False,,,,,,,,,,1.5508120897419806,True,l1,none,,,,,,,,,,0.23575091361999512,6,0.8052711675721929,,0.7768241989150046
1147,0.7768314732142299,COMPLETE,True,lr,oof_only,False,,,,,,,,,,1.5782102165061822,True,l1,none,,,,,,,,,,0.24058866500854492,6,0.8052719032169008,,0.7768314732142299
1148,0.7768413148381037,COMPLETE,True,lr,oof_only,False,,,,,,,,,,1.6689346674924617,True,l1,none,,,,,,,,,,0.25902748107910156,6,0.8052763170851487,,0.7768413148381037
1149,0.7768456988706159,COMPLETE,True,lr,oof_only,False,,,,,,,,,,1.6303463286627644,True,l1,none,,,,,,,,,,0.2516796588897705,6,0.805277735828514,,0.7768456988706159
1150,0.7768266339393176,COMPLETE,True,lr,oof_only,False,,,,,,,,,,1.5481159847532777,True,l1,none,,,,,,,,,,0.2407398223876953,6,0.8052711675721927,,0.7768266339393176
1151,0.7768325111313523,COMPLETE,True,lr,oof_only,False,,,,,,,,,,1.3191916775114827,True,l1,none,,,,,,,,,,0.22894525527954102,6,0.805271377756395,,0.7768325111313523
1152,0.7768360192708202,COMPLETE,True,lr,oof_only,False,,,,,,,,,,1.3618233835660958,True,l1,none,,,,,,,,,,0.22167730331420898,6,0.8052694860985745,,0.7768360192708202
1153,0.7768427657830942,COMPLETE,True,lr,oof_only,False,,,,,,,,,,1.2304285547801557,True,l1,none,,,,,,,,,,0.21641325950622559,6,0.805275055979935,,0.7768427657830942
1154,0.7722972202271837,COMPLETE,True,lr,oof_only,True,,,,,,,,,,1.1904531131006244,True,l1,none,,,,,,,,,,0.48711729049682617,6,0.8022405215594869,,0.7722972202271837
1155,0.776834351396265,COMPLETE,True,lr,oof_only,False,,,,,,,,,,1.6999171886432416,True,l1,none,,,,,,,,,,0.25730276107788086,6,0.8052748457957328,,0.776834351396265
1156,0.7768105643526813,COMPLETE,True,lr,oof_only,False,,,,,,,,,,1.1509301163554904,True,l1,none,,,,,,,,,,0.20128893852233887,6,0.8052752661641371,,0.7768105643526813
1157,0.7768219640577712,COMPLETE,True,lr,oof_only,False,,,,,,,,,,1.519026068419842,True,l1,none,,,,,,,,,,0.24155402183532715,6,0.805271377756395,,0.7768219640577712
1158,0.7768194592502176,COMPLETE,True,lr,oof_only,False,,,,,,,,,,1.9451062488311686,True,l1,none,,,,,,,,,,0.26670241355895996,6,0.8052676995328552,,0.7768194592502176
1159,0.7768254580312632,COMPLETE,True,lr,oof_only,False,,,,,,,,,,0.8402852841095861,True,l1,none,,,,,,,,,,0.17102956771850586,6,0.8053232932543587,,0.7768254580312632
1160,0.7768267124465109,COMPLETE,True,lr,oof_only,False,,,,,,,,,,0.8308041596200837,True,l1,none,,,,,,,,,,0.16809630393981934,6,0.8053285478594157,,0.7768267124465109
1161,0.776800399109766,COMPLETE,True,lr,oof_only,False,,,,,,,,,,0.8675433908499876,True,l1,none,,,,,,,,,,0.17574691772460938,6,0.8053129416823963,,0.776800399109766
1162,0.7768347233865315,COMPLETE,True,lr,oof_only,False,,,,,,,,,,1.209333861124519,True,l1,none,,,,,,,,,,0.21337485313415527,6,0.8052685402696642,,0.7768347233865315
1163,0.7768246742371319,COMPLETE,True,lr,oof_only,False,,,,,,,,,,1.0022853124018114,True,l1,none,,,,,,,,,,0.18497586250305176,6,0.8053051123208613,,0.7768246742371319
1164,0.7768848681785996,COMPLETE,True,lr,oof_only,False,,,,,,,,,,0.623216781056023,True,l1,none,,,,,,,,,,0.14665889739990234,6,0.8053634909830452,,0.7768848681785996
1165,0.7768668039404452,COMPLETE,True,lr,oof_only,False,,,,,,,,,,0.6079737847363809,True,l1,none,,,,,,,,,,0.14857101440429688,6,0.805362177331781,,0.7768668039404452
1166,0.7768651214059434,COMPLETE,True,lr,oof_only,False,,,,,,,,,,0.4971307836499956,True,l1,none,,,,,,,,,,0.1399097442626953,6,0.8053840364888182,,0.7768651214059434
1167,0.7768853681466931,COMPLETE,True,lr,oof_only,False,,,,,,,,,,0.5662299039948843,True,l1,none,,,,,,,,,,0.13970160484313965,6,0.8053695337788608,,0.7768853681466931
1168,0.7768677243918815,COMPLETE,True,lr,oof_only,False,,,,,,,,,,0.5723060188066544,True,l1,none,,,,,,,,,,0.1473405361175537,6,0.8053710576143274,,0.7768677243918815
1169,0.7768651027846016,COMPLETE,True,lr,oof_only,False,,,,,,,,,,0.5587042231144261,True,l1,none,,,,,,,,,,0.13314342498779297,6,0.805371110160378,,0.7768651027846016
1170,0.7768665039202859,COMPLETE,True,lr,oof_only,False,,,,,,,,,,0.6079625609804709,True,l1,none,,,,,,,,,,0.14017391204833984,6,0.8053621247857303,,0.7768665039202859
1171,0.7768678604231749,COMPLETE,True,lr,oof_only,False,,,,,,,,,,0.4063805495605836,True,l1,none,,,,,,,,,,0.12363409996032715,6,0.8053639113514497,,0.7768678604231749
1172,0.7768749709310583,COMPLETE,True,lr,oof_only,False,,,,,,,,,,0.5571482845592188,True,l1,none,,,,,,,,,,0.13854694366455078,6,0.8053756291207271,,0.7768749709310583
1173,0.7724686984786849,COMPLETE,True,lr,oof_only,True,,,,,,,,,,0.556062894360797,True,l1,none,,,,,,,,,,0.3435640335083008,6,0.8024064619871887,,0.7724686984786849
1174,0.7768665219572614,COMPLETE,True,lr,oof_only,False,,,,,,,,,,0.40346771718876306,True,l1,none,,,,,,,,,,0.1177060604095459,6,0.8053642791738037,,0.7768665219572614
1175,0.7768610237750639,COMPLETE,True,lr,oof_only,False,,,,,,,,,,0.437568319351753,True,l1,none,,,,,,,,,,0.12791943550109863,6,0.8053674319368379,,0.7768610237750639
1176,0.7768637759612919,COMPLETE,True,lr,oof_only,False,,,,,,,,,,0.40113883288727614,True,l1,none,,,,,,,,,,0.12231278419494629,6,0.8053642791738037,,0.7768637759612919
1177,0.7768704206452927,COMPLETE,True,lr,oof_only,False,,,,,,,,,,0.39516327885996294,True,l1,none,,,,,,,,,,0.12004470825195312,6,0.8053607060423649,,0.7768704206452927
1178,0.7768644389816325,COMPLETE,True,lr,oof_only,False,,,,,,,,,,0.3942599189673586,True,l1,none,,,,,,,,,,0.1235499382019043,6,0.8053614416870729,,0.7768644389816325
1179,0.7768688793300125,COMPLETE,True,lr,oof_only,False,,,,,,,,,,0.4017296106172035,True,l1,none,,,,,,,,,,0.11823129653930664,6,0.8053660657395232,,0.7768688793300125
1180,0.7768815162503258,COMPLETE,True,lr,oof_only,False,,,,,,,,,,0.3594462416791434,True,l1,none,,,,,,,,,,0.1128838062286377,6,0.8053591822068984,,0.7768815162503258
1181,0.7768738968063318,COMPLETE,True,lr,oof_only,False,,,,,,,,,,0.39637168662552846,True,l1,none,,,,,,,,,,0.12404704093933105,6,0.8053592347529489,,0.7768738968063318
1182,0.7768597731621654,COMPLETE,True,lr,oof_only,False,,,,,,,,,,0.3874062292844115,True,l1,none,,,,,,,,,,0.12211751937866211,6,0.8053613365949719,,0.7768597731621654
1183,0.776872280853325,COMPLETE,True,lr,oof_only,False,,,,,,,,,,0.3713765549020808,True,l1,none,,,,,,,,,,0.11741232872009277,6,0.8053571329109261,,0.776872280853325
1184,0.7768909447122379,COMPLETE,True,lr,oof_only,False,,,,,,,,,,0.3277100022288633,True,l1,none,,,,,,,,,,0.10342979431152344,6,0.8053450473192949,,0.7768909447122379
1185,0.7768610635724411,COMPLETE,True,lr,oof_only,False,,,,,,,,,,0.36946904173526585,True,l1,none,,,,,,,,,,0.11614322662353516,6,0.8053563447201676,,0.7768610635724411
1186,0.7768696189850977,COMPLETE,True,lr,oof_only,False,,,,,,,,,,0.4043998501899571,True,l1,none,,,,,,,,,,0.1229395866394043,6,0.8053609162265672,,0.7768696189850977
1187,0.7768586356202832,COMPLETE,True,lr,oof_only,False,,,,,,,,,,0.39318298211886116,True,l1,none,,,,,,,,,,0.12321090698242188,6,0.8053607060423651,,0.7768586356202832
1188,0.7768707533335825,COMPLETE,True,lr,oof_only,False,,,,,,,,,,0.3865546498793574,True,l1,none,,,,,,,,,,0.11761879920959473,6,0.8053591296608479,,0.7768707533335825
1189,0.77687373911507,COMPLETE,True,lr,oof_only,False,,,,,,,,,,0.3890235644731549,True,l1,none,,,,,,,,,,0.12223076820373535,6,0.8053669064763322,,0.77687373911507
1190,0.7767499702432973,COMPLETE,True,lr,oof_only,False,,,,,,,,,,0.2695018876739969,True,l1,none,,,,,,,,,,0.0886850357055664,6,0.8052873517557685,,0.7767499702432973
1191,0.7768467801377875,COMPLETE,True,lr,oof_only,False,,,,,,,,,,0.42336276816461543,True,l1,none,,,,,,,,,,0.1299455165863037,6,0.8053645944501072,,0.7768467801377875
1192,0.7728195834193576,COMPLETE,True,lr,oof_only,True,,,,,,,,,,0.60686718739728,True,l1,none,,,,,,,,,,0.3835906982421875,6,0.8025447106462399,,0.7728195834193576
1193,0.7767557520000252,COMPLETE,True,lr,oof_only,False,,,,,,,,,,0.28906088175748973,True,l1,none,,,,,,,,,,0.10013675689697266,6,0.8053031155709396,,0.7767557520000252
1194,0.7768772003144631,COMPLETE,True,lr,oof_only,False,,,,,,,,,,0.3581713337028684,True,l1,none,,,,,,,,,,0.12593412399291992,6,0.8053577634635329,,0.7768772003144631
1195,0.77686363064834,COMPLETE,True,lr,oof_only,False,,,,,,,,,,0.5126150236670262,True,l1,none,,,,,,,,,,0.12593507766723633,6,0.805374893476019,,0.77686363064834
1196,0.7767257861096675,COMPLETE,True,lr,oof_only,False,,,,,,,,,,0.2371369210060116,True,l1,none,,,,,,,,,,0.0770564079284668,6,0.8052437385337949,,0.7767257861096675
1197,0.7768948576448383,COMPLETE,True,lr,oof_only,False,,,,,,,,,,0.6280967488746404,True,l1,none,,,,,,,,,,0.1458895206451416,6,0.8053658030092702,,0.7768948576448383
1198,0.7768932545534947,COMPLETE,True,lr,oof_only,False,,,,,,,,,,0.6199752936383215,True,l1,none,,,,,,,,,,0.1417381763458252,6,0.8053633333448934,,0.7768932545534947
1199,0.7768770345630247,COMPLETE,True,lr,oof_only,False,,,,,,,,,,0.6715369172632227,True,l1,none,,,,,,,,,,0.15284967422485352,6,0.805367431936838,,0.7768770345630247
1200,0.7768848758574659,COMPLETE,True,lr,oof_only,False,,,,,,,,,,0.6434837324278438,True,l1,none,,,,,,,,,,0.14493536949157715,6,0.80536485718036,,0.7768848758574659
1201,0.7768726632290489,COMPLETE,True,lr,oof_only,False,,,,,,,,,,0.6680904244640933,True,l1,none,,,,,,,,,,0.15114378929138184,6,0.8053650148185117,,0.7768726632290489
1202,0.7768769887249413,COMPLETE,True,lr,oof_only,False,,,,,,,,,,0.6940927584855268,True,l1,none,,,,,,,,,,0.1435837745666504,6,0.8053601805818592,,0.7768769887249413
1203,0.7768741621261043,COMPLETE,True,lr,oof_only,False,,,,,,,,,,0.6852734094861507,True,l1,none,,,,,,,,,,0.14883875846862793,6,0.805362912976489,,0.7768741621261043
1204,0.7768718793843514,COMPLETE,True,lr,oof_only,False,,,,,,,,,,0.6964036740455053,True,l1,none,,,,,,,,,,0.15155029296875,6,0.8053619671475785,,0.7768718793843514
1205,0.7768655130280625,COMPLETE,True,lr,oof_only,False,,,,,,,,,,0.6990142878214681,True,l1,none,,,,,,,,,,0.14920330047607422,6,0.8053586042003422,,0.7768655130280625
1206,0.7768589551806563,COMPLETE,True,lr,oof_only,False,,,,,,,,,,0.30827329737160136,True,l1,none,,,,,,,,,,0.09568023681640625,6,0.8053279698528595,,0.7768589551806563
1207,0.7760702278463978,COMPLETE,True,lr,oof_only,False,,,,,,,,,,0.16500037355487032,True,l1,none,,,,,,,,,,0.07073974609375,6,0.8049466957099197,,0.7760702278463978
1208,0.7768751280940714,COMPLETE,True,lr,oof_only,False,,,,,,,,,,0.6514846774023674,True,l1,none,,,,,,,,,,0.1514296531677246,6,0.8053643842659048,,0.7768751280940714
1209,0.7765508544517625,COMPLETE,True,lr,oof_only,False,,,,,,,,,,0.21120392064000237,True,l1,none,,,,,,,,,,0.07952451705932617,6,0.8051856751479145,,0.7765508544517625
1210,0.7768766580892672,COMPLETE,True,lr,oof_only,False,,,,,,,,,,0.7055596999114089,True,l1,none,,,,,,,,,,0.14788341522216797,6,0.8053611789568201,,0.7768766580892672
1211,0.7768578916354869,COMPLETE,True,lr,oof_only,False,,,,,,,,,,0.7232579502034127,True,l1,none,,,,,,,,,,0.1509566307067871,6,0.8053560819899148,,0.7768578916354869
1212,0.7768837779227431,COMPLETE,True,lr,oof_only,False,,,,,,,,,,0.31455766648261646,True,l1,none,,,,,,,,,,0.09968018531799316,6,0.8053334346421188,,0.7768837779227431
1213,0.7714249251000799,COMPLETE,True,lr,oof_only,True,,,,,,,,,,0.29902317546697194,True,l1,none,,,,,,,,,,0.23700284957885742,6,0.8016981937715485,,0.7714249251000799
1214,0.7768487521977168,COMPLETE,True,lr,oof_only,False,,,,,,,,,,0.744486203913479,True,l1,none,,,,,,,,,,0.15283656120300293,6,0.805350301924352,,0.7768487521977168
1215,0.7767487129903767,COMPLETE,True,lr,oof_only,False,,,,,,,,,,0.24160263784489852,True,l1,none,,,,,,,,,,0.08397650718688965,6,0.8052554037570216,,0.7767487129903767
1216,0.7768907504661224,COMPLETE,True,lr,oof_only,False,,,,,,,,,,0.3266479587664147,True,l1,none,,,,,,,,,,0.10464787483215332,6,0.8053416843720584,,0.7768907504661224
1217,0.7768734429184502,COMPLETE,True,lr,oof_only,False,,,,,,,,,,0.30978563479729193,True,l1,none,,,,,,,,,,0.09812259674072266,6,0.8053303344251352,,0.7768734429184502
1218,0.7768875746947176,COMPLETE,True,lr,oof_only,False,,,,,,,,,,0.32734591524529355,True,l1,none,,,,,,,,,,0.10356998443603516,6,0.8053417894641595,,0.7768875746947176
1219,0.7768922375539994,COMPLETE,True,lr,oof_only,False,,,,,,,,,,0.31615425597310776,True,l1,none,,,,,,,,,,0.09783816337585449,6,0.8053343279249785,,0.7768922375539994
1220,0.7768734429184502,COMPLETE,True,lr,oof_only,False,,,,,,,,,,0.3097905427671712,True,l1,none,,,,,,,,,,0.09847760200500488,6,0.8053304920632869,,0.7768734429184502
1221,0.7768815398139334,COMPLETE,True,lr,oof_only,False,,,,,,,,,,0.31349172498522915,True,l1,none,,,,,,,,,,0.10117673873901367,6,0.8053347482933831,,0.7768815398139334
1222,0.7764983602749442,COMPLETE,True,lr,oof_only,False,,,,,,,,,,0.1989402773391032,True,l1,none,,,,,,,,,,0.0817725658416748,6,0.8051516778531954,,0.7764983602749442
1223,0.7767221697041188,COMPLETE,True,lr,oof_only,False,,,,,,,,,,0.2725241879930897,True,l1,none,,,,,,,,,,0.0921483039855957,6,0.805291345255612,,0.7767221697041188
1224,0.7768466842617995,COMPLETE,True,lr,oof_only,False,,,,,,,,,,0.30176449807997974,True,l1,none,,,,,,,,,,0.09948229789733887,6,0.8053230830701565,,0.7768466842617995
1225,0.7767912703003386,COMPLETE,True,lr,oof_only,False,,,,,,,,,,0.8766983820772764,True,l1,none,,,,,,,,,,0.17532920837402344,6,0.8053121534916379,,0.7767912703003386
1226,0.7768691303688406,COMPLETE,True,lr,oof_only,False,,,,,,,,,,0.5077582177472332,True,l1,none,,,,,,,,,,0.1441817283630371,6,0.805378571699559,,0.7768691303688406
1227,0.7762302599313734,COMPLETE,True,lr,oof_only,False,,,,,,,,,,0.17559257140839088,True,l1,none,,,,,,,,,,0.07976293563842773,6,0.8050196821741622,,0.7762302599313734
1228,0.7768569696112732,COMPLETE,True,lr,oof_only,False,,,,,,,,,,0.5254767283511309,True,l1,none,,,,,,,,,,0.14432072639465332,6,0.8053750511141708,,0.7768569696112732
1229,0.7768619229549716,COMPLETE,True,lr,oof_only,False,,,,,,,,,,0.30726432505375656,True,l1,none,,,,,,,,,,0.09888553619384766,6,0.8053294936883262,,0.7768619229549716
1230,0.7768633797416986,COMPLETE,True,lr,oof_only,False,,,,,,,,,,0.6487173322567124,True,l1,none,,,,,,,,,,0.14738893508911133,6,0.8053664861079278,,0.7768633797416986
1231,0.7753025951875067,COMPLETE,True,lr,oof_only,False,,,,,,,,,,0.11768938212827504,True,l1,none,,,,,,,,,,0.06837868690490723,6,0.8044051035666893,,0.7753025951875067
1232,0.7718848215511863,COMPLETE,True,lr,oof_only,True,,,,,,,,,,0.2414889450170376,True,l1,none,,,,,,,,,,0.21020936965942383,6,0.801984674839259,,0.7718848215511863
1233,0.7768144925629156,COMPLETE,True,lr,oof_only,False,,,,,,,,,,0.9672599749298835,True,l1,none,,,,,,,,,,0.18888282775878906,6,0.8053057954195186,,0.7768144925629156
1234,0.7768835019545131,COMPLETE,True,lr,oof_only,False,,,,,,,,,,0.31408395787222454,True,l1,none,,,,,,,,,,0.10200953483581543,6,0.8053358517604452,,0.7768835019545131
1235,0.7767203150325022,COMPLETE,True,lr,oof_only,False,,,,,,,,,,0.3231698920277417,False,l1,none,,,,,,,,,,0.0872793197631836,6,0.8053176182808971,,0.7767203150325022
1236,0.7767139170327576,COMPLETE,True,lr,oof_only,False,,,,,,,,,,0.48988538037965673,True,l2,none,,,,,,,,,,0.06098341941833496,6,0.8052174655085096,,0.7767139170327576
1237,0.7765756567303673,COMPLETE,True,lr,oof_only,False,,,,,,,,,,0.20933750636342952,True,l1,none,,,,,,,,,,0.07820367813110352,6,0.8051874617136339,,0.7765756567303673
1238,0.7767430895357377,COMPLETE,True,lr,oof_only,False,,,,,,,,,,0.2701576260322691,True,l1,none,,,,,,,,,,0.08964061737060547,6,0.8052901892424993,,0.7767430895357377
1239,0.775614515162198,COMPLETE,True,lr,oof_only,False,,,,,,,,,,0.13293420760607358,True,l1,none,,,,,,,,,,0.07548880577087402,6,0.8046453441098977,,0.775614515162198
1240,0.7768748640638833,COMPLETE,True,lr,oof_only,False,,,,,,,,,,0.49014724987593894,True,l1,none,,,,,,,,,,0.13478446006774902,6,0.8053849823177286,,0.7768748640638833
1241,0.7768538294690549,COMPLETE,True,lr,oof_only,False,,,,,,,,,,0.48198882630207207,True,l1,none,,,,,,,,,,0.13757610321044922,6,0.8053792022521657,,0.7768538294690549
1242,0.7768699031440043,COMPLETE,True,lr,oof_only,False,,,,,,,,,,0.4933726071465597,True,l1,none,,,,,,,,,,0.13820719718933105,6,0.8053859281466387,,0.7768699031440043
1243,0.776826534300359,COMPLETE,True,lr,oof_only,False,,,,,,,,,,0.822303718310746,True,l1,none,,,,,,,,,,0.16691231727600098,6,0.8053304395172364,,0.776826534300359
1244,0.776887543553833,COMPLETE,True,lr,oof_only,False,,,,,,,,,,0.6229756236456798,True,l1,none,,,,,,,,,,0.1590135097503662,6,0.8053650148185116,,0.776887543553833
1245,0.7768621796610614,COMPLETE,True,lr,oof_only,False,,,,,,,,,,0.6489018099981133,True,l1,none,,,,,,,,,,0.15839743614196777,6,0.8053654351869162,,0.7768621796610614
1246,0.7768756709927253,COMPLETE,True,lr,oof_only,False,,,,,,,,,,0.5700579958801093,True,l1,none,,,,,,,,,,0.1503307819366455,6,0.8053723187195412,,0.7768756709927253
1247,0.7768810277330872,COMPLETE,True,lr,oof_only,False,,,,,,,,,,0.5841807649346552,True,l1,none,,,,,,,,,,0.15505313873291016,6,0.8053726339958444,,0.7768810277330872
