number,value,state,params_add_group_dummies,params_family,params_feature_subset,params_isotonic,params_lgbm_alpha,params_lgbm_colsample,params_lgbm_lambda,params_lgbm_lr,params_lgbm_max_depth,params_lgbm_min_child,params_lgbm_n_estimators,params_lgbm_num_leaves,params_lgbm_subsample,params_lr_C,params_lr_class_weight_balanced,params_lr_penalty,params_scaler,params_xgb_alpha,params_xgb_colsample,params_xgb_gamma,params_xgb_lambda,params_xgb_lr,params_xgb_max_depth,params_xgb_min_child,params_xgb_n_estimators,params_xgb_subsample,user_attrs_elapsed_sec,user_attrs_n_features,user_attrs_pooled_auroc,user_attrs_pruned_reason,user_attrs_weighted_auroc
238,0.7762885791824673,COMPLETE,False,xgb,oof+timing,False,,,,,,,,,,,,,standard,0.002929033899925475,0.590519477453984,0.4029066562886558,0.0024862725157890546,0.013680862016678948,3.0,1.0,158.0,0.9242860862726979,0.3637423515319824,52,0.803085724782914,,0.7762885791824673
239,0.7758820177595713,COMPLETE,False,xgb,oof+timing,False,,,,,,,,,,,,,standard,0.004511815249063656,0.5865241251245957,0.3815675551621443,0.002581046440023633,0.011624807144307713,3.0,1.0,162.0,0.9207967155389929,0.36884498596191406,52,0.8026283114126974,,0.7758820177595713
240,0.7748473972504143,COMPLETE,False,xgb,oof_only,False,,,,,,,,,,,,,none,0.0029292629337420756,0.6267055936074779,3.257107913486188,0.0030160038047295397,0.01339025383105329,3.0,1.0,174.0,0.930002985652642,0.17776823043823242,6,0.8019765827474712,,0.7748473972504143
241,0.7763031040350513,COMPLETE,False,xgb,oof+timing,False,,,,,,,,,,,,,standard,0.0020916758005871876,0.5956331361326376,0.46086125813836154,0.0020355438284704484,0.015542788253583892,3.0,1.0,154.0,0.9339347274272506,0.34970641136169434,52,0.8031308618403541,,0.7763031040350513
242,0.7765624772818852,COMPLETE,False,xgb,oof+timing,False,,,,,,,,,,,,,standard,0.001977352222964355,0.5851930540433543,0.31842399376966846,0.002062241821006079,0.015595201127704163,3.0,1.0,168.0,0.922232928570598,0.3768308162689209,52,0.8033571251341107,,0.7765624772818852
243,0.7730084424214286,COMPLETE,False,xgb,oof+timing,False,,,,,,,,,,,,,standard,0.0018897324729337788,0.30350706255740045,0.44606703740527615,0.002223829246036146,0.016250964623408706,3.0,1.0,503.0,0.9142748592526484,0.8529908657073975,52,0.8018514706010627,,0.7730084424214286
244,0.7763628845321471,COMPLETE,False,xgb,oof+timing,False,,,,,,,,,,,,,standard,0.0020777511916852008,0.6068326386166777,0.3562501088184132,0.002682713945058819,0.013981596083015472,3.0,1.0,158.0,0.9304684090664394,0.3524785041809082,52,0.8030094279174855,,0.7763628845321471
245,0.776276082915343,COMPLETE,False,xgb,oof+timing,False,,,,,,,,,,,,,standard,0.001524189660361164,0.601149630046436,0.3508137634206549,0.003847019391299332,0.013828379326118266,3.0,1.0,158.0,0.9231868727941965,0.3661785125732422,52,0.8030061175162995,,0.776276082915343
246,0.7762031932690121,COMPLETE,False,xgb,oof+timing,False,,,,,,,,,,,,,standard,0.0017570613664288776,0.6053159610144836,0.8954588810254349,0.003941456820625734,0.013470099047331903,3.0,1.0,156.0,0.9233390571711869,0.357403039932251,52,0.8029235676708533,,0.7762031932690121
247,0.7758192674227384,COMPLETE,False,xgb,oof+ng,False,,,,,,,,,,,,,standard,0.0015576689407938295,0.586538872702136,0.4216738444852181,0.002595183632205122,0.012184726565809012,3.0,1.0,155.0,0.9025272447434678,0.7808487415313721,237,0.8023578043443603,,0.7758192674227384
248,0.7766610327111106,COMPLETE,False,xgb,oof+timing,False,,,,,,,,,,,,,standard,0.002419358789745875,0.6082576809258736,0.32385216207326484,0.0030172275683066885,0.014180587647455074,3.0,1.0,176.0,0.9223407020957288,0.39360809326171875,52,0.8031527209973913,,0.7766610327111106
249,0.7612774382025085,COMPLETE,False,lgbm,oof+timing,False,0.005327786157234667,0.4876827822307763,0.20939750249449268,0.026478367710425478,10.0,59.0,500.0,169.0,0.9175853035915776,,,,standard,,,,,,,,,,2.514665365219116,52,0.7902593914767994,,0.7612774382025085
250,0.775992555641223,COMPLETE,False,xgb,oof+timing,False,,,,,,,,,,,,,standard,0.0023917983911399938,0.6148255516872805,0.2946233389171481,0.003303744650124943,0.01394838083373183,3.0,1.0,177.0,0.9093837586293892,0.3979024887084961,52,0.8028113293068346,,0.775992555641223
251,0.7755895098237847,COMPLETE,False,xgb,oof+timing,False,,,,,,,,,,,,,standard,0.0020424514769058605,0.6091730941839922,0.30639544075104275,0.002831983664328217,0.011026492170563278,3.0,1.0,181.0,0.8840785047718803,0.4084963798522949,52,0.8024751922213349,,0.7755895098237847
252,0.7735469728601405,COMPLETE,False,xgb,oof+timing,False,,,,,,,,,,,,,standard,0.0013204601654251912,0.6000032818750692,0.39488869850774067,0.0025135139035932777,0.015065197586830977,3.0,1.0,647.0,0.9206220940267144,1.1871287822723389,52,0.802747170579088,,0.7735469728601405
253,0.7762235268783998,COMPLETE,False,xgb,oof+timing,False,,,,,,,,,,,,,standard,0.0011205574779352913,0.5812616599252298,0.26035379127252956,0.002970886983722126,0.012028486750569755,3.0,1.0,166.0,0.9272084109847608,0.37375378608703613,52,0.8028429620292781,,0.7762235268783998
254,0.7743443391915503,COMPLETE,False,lr,oof+hand,False,,,,,,,,,,0.004615309434009004,False,l2,standard,,,,,,,,,,0.04381990432739258,34,0.7994805927993205,,0.7743443391915503
255,0.7716287599523369,COMPLETE,False,xgb,oof+timing,True,,,,,,,,,,,,,standard,0.0022051755807085066,0.6211502336920649,0.4687595246524886,0.00217583397646452,0.01406747078346048,5.0,1.0,146.0,0.893251021382043,2.170851469039917,52,0.7999393198208012,,0.7716287599523369
256,0.7761430751949964,COMPLETE,False,xgb,oof+timing,False,,,,,,,,,,,,,standard,0.0016306678314117165,0.5996230059843427,0.3426444236624385,0.0036795993822992413,0.015180687618448407,3.0,1.0,191.0,0.916144412245032,0.4190661907196045,52,0.8031755785293895,,0.7761430751949964
257,0.7763281507228859,COMPLETE,False,xgb,oof+timing,False,,,,,,,,,,,,,standard,0.0026328248439926316,0.589325343800423,0.22005352347666288,0.002561562996948775,0.01301343601119032,3.0,1.0,177.0,0.9303737004930313,0.39406704902648926,52,0.8029971846877024,,0.7763281507228859
258,0.7747878089242131,COMPLETE,False,xgb,oof+timing,False,,,,,,,,,,,,,standard,0.003937213676972444,0.5791652444183997,0.2195080638946601,0.00243599501988209,0.001190674077943243,3.0,1.0,177.0,0.9351385029926453,0.38773250579833984,52,0.8003178615691113,,0.7747878089242131
259,0.7652409982724142,COMPLETE,False,xgb,all,False,,,,,,,,,,,,,standard,0.0027394591074722105,0.9915146638630661,0.2381515908761198,0.002025729249269139,0.012628718798849692,7.0,1.0,188.0,0.9358307893098097,6.803585767745972,362,0.795253893583528,,0.7652409982724142
260,0.7760611388482164,COMPLETE,False,xgb,oof+timing,False,,,,,,,,,,,,,standard,0.005426044443860778,0.5904865141997505,0.10712069765204314,0.002625687263182482,0.015625074364302573,3.0,1.0,170.0,0.9093468007190263,0.3805205821990967,52,0.8031325958600228,,0.7760611388482164
261,0.7758901649692146,COMPLETE,False,xgb,oof+timing,False,,,,,,,,,,,,,standard,0.0027234948311151952,0.6116886324946682,0.4734259900827307,0.002054650358215456,0.011322860290587919,3.0,1.0,210.0,0.9308786510211836,0.45583009719848633,52,0.8028245183655277,,0.7758901649692146
262,0.7758155238790195,COMPLETE,True,xgb,oof+timing,False,,,,,,,,,,,,,standard,0.003254231995676467,0.5817153789082032,0.2795260558716244,0.0032604185009099773,0.015792044019936564,3.0,1.0,135.0,0.815390590245513,0.340228796005249,52,0.8045646859222719,,0.7758155238790195
263,0.7749665663879737,COMPLETE,False,xgb,oof+timing,False,,,,,,,,,,,,,standard,0.0020889297643731796,0.6359099583882468,0.17690740446731318,0.0018761681527487894,0.010234150260998129,3.0,1.0,149.0,0.9208165906432234,0.36345958709716797,52,0.801913474940736,,0.7749665663879737
264,0.7760808931830282,COMPLETE,False,xgb,oof+timing,False,,,,,,,,,,,,,standard,0.00226618610181705,0.5949320133746059,0.39738500383054487,0.0022660500086498026,0.012476599590794583,3.0,1.0,184.0,0.9401350320883288,0.4065396785736084,52,0.8029208352762235,,0.7760808931830282
265,0.7763863826707557,COMPLETE,False,xgb,oof+timing,False,,,,,,,,,,,,,standard,0.0025656724438286645,0.5707447135006677,0.658945135083665,0.0017324129138562982,0.013807385970829826,3.0,1.0,166.0,0.929731937944131,0.36717915534973145,52,0.803073849375485,,0.7763863826707557
266,0.7680719197530926,COMPLETE,False,xgb,oof+timing,False,,,,,,,,,,,,,standard,0.0019454292094290234,0.5704103472197387,0.6186806099054263,0.0027105449605020803,0.013240854807937552,9.0,1.0,165.0,0.9283506833562447,2.239382266998291,52,0.7969183422814003,,0.7680719197530926
267,0.7498182687619473,COMPLETE,False,xgb,oof_minus_roberta,False,,,,,,,,,,,,,standard,0.0025560491840864474,0.6198514308507774,0.49172762379247276,0.0018953132572847677,0.01699185959913579,3.0,1.0,142.0,0.9135876774506,0.16505908966064453,5,0.7772959655247463,,0.7498182687619473
268,0.7755984184293961,COMPLETE,False,xgb,oof+timing,False,,,,,,,,,,,,,standard,0.0036339471384979564,0.5552081628131611,0.7093347235146583,0.002306823749929464,0.014216163015352697,3.0,7.0,196.0,0.9015407376925239,0.4227309226989746,52,0.8028188959381167,,0.7755984184293961
269,0.7748650129835822,COMPLETE,False,xgb,oof+ph,False,,,,,,,,,,,,,standard,0.0025757230662870434,0.574631992856799,0.6607531388906602,0.07689846575316751,0.016082249352986577,3.0,1.0,162.0,0.9402756547681834,0.3335072994232178,42,0.8023666320808561,,0.7748650129835822
270,0.7765264178972963,COMPLETE,False,xgb,oof+timing,False,,,,,,,,,,,,,standard,0.002961290524577055,0.5933683121509367,0.3531338601629802,0.0015890815026500605,0.013301449497055747,3.0,1.0,180.0,0.9319604411306608,0.41336941719055176,52,0.8032947529720834,,0.7765264178972963
271,0.7645343027848345,COMPLETE,False,lgbm,oof+timing,False,0.23042364824502082,0.9101497357797104,3.150458889981836,0.04534899269899045,4.0,43.0,532.0,225.0,0.6347685697515452,,,,none,,,,,,,,,,1.176769733428955,52,0.7935302780327137,,0.7645343027848345
272,0.7721294401263564,COMPLETE,False,xgb,oof+hand+graph,False,,,,,,,,,,,,,standard,0.0019344519454179564,0.34204022208317003,0.0008344874533328748,0.0014315812918987267,0.01802404172461672,3.0,6.0,368.0,0.948470407378162,0.6162528991699219,49,0.8011589136545432,,0.7721294401263564
273,0.77575453661826,COMPLETE,False,xgb,oof+timing,False,,,,,,,,,,,,,standard,0.00348458173857891,0.6078111023648964,0.316343907779812,0.0016912994896903129,0.010922808877162129,3.0,1.0,181.0,0.9524820601686358,0.4046022891998291,52,0.8026276283140399,,0.77575453661826
274,0.7763988823880597,COMPLETE,False,xgb,oof+timing,False,,,,,,,,,,,,,standard,0.004812330551561941,0.5564326652966164,0.8132432674690746,0.0012807494497278154,0.015346409768318994,3.0,1.0,205.0,0.9336010451822954,0.4485812187194824,52,0.8035969978549652,,0.7763988823880597
275,0.7744661986331446,COMPLETE,False,xgb,oof+timing,False,,,,,,,,,,,,,standard,0.002836420038999175,0.5437094323078637,0.7908214009314306,0.001242650882096046,0.01268583765484911,4.0,1.0,199.0,0.9303047407974088,0.5846552848815918,52,0.8022375264346044,,0.7744661986331446
276,0.7761615828046131,COMPLETE,False,lr,oof_only,False,,,,,,,,,,0.05185691084231979,True,l1,standard,,,,,,,,,,0.03191947937011719,6,0.8008865149283855,,0.7761615828046131
277,0.7745878485985193,COMPLETE,False,xgb,oof+timing,True,,,,,,,,,,,,,standard,0.004443599943399164,0.5652918314268689,0.13355427101386513,0.0011098454150298546,0.017574859206591954,3.0,4.0,193.0,0.942720314785258,1.4343125820159912,52,0.8025459717514534,,0.7745878485985193
278,0.7751904231834991,COMPLETE,False,xgb,oof+timing,False,,,,,,,,,,,,,standard,0.005714499103129505,0.553506826994216,0.5867921017481019,0.0013933565877038998,0.020643861425650126,3.0,1.0,216.0,0.959581151372337,0.4465456008911133,52,0.803622219959239,,0.7751904231834991
279,0.7756269687891629,COMPLETE,False,xgb,oof+ng,False,,,,,,,,,,,,,standard,0.01018169405357999,0.5745757278004786,0.9316940514853278,0.001611881794701208,0.014608394090813326,3.0,1.0,211.0,0.9151349998947891,0.9323546886444092,237,0.8027418108819298,,0.7756269687891629
280,0.7763569883276417,COMPLETE,False,xgb,oof+timing,False,,,,,,,,,,,,,standard,0.003794646562602193,0.5332721874788855,0.2055740051355105,0.0010310762228970159,0.016400511868697388,3.0,1.0,226.0,0.9352268846551327,0.49329614639282227,52,0.8038268342801606,,0.7763569883276417
281,0.7757797914721155,COMPLETE,True,xgb,oof+timing,False,,,,,,,,,,,,,standard,0.0036516840389730736,0.5468579011643744,0.7479572858626178,0.0010165608617407954,0.016843993721502644,3.0,1.0,220.0,0.9348603972988904,0.47444820404052734,52,0.8054148284744526,,0.7757797914721155
282,0.775604219622417,COMPLETE,False,xgb,oof+timing,False,,,,,,,,,,,,,standard,0.003019451935566284,0.5107309653791581,0.2800151952892089,0.0012309663755758387,0.01915980575505791,3.0,1.0,228.0,0.9464997817126466,0.47319626808166504,52,0.8037608889866945,,0.775604219622417
283,0.7757837300873556,COMPLETE,False,xgb,oof+timing,False,,,,,,,,,,,,,standard,0.003970457517901746,0.5351728035646105,0.20398009179800253,0.00100540691361099,0.01203694630112529,3.0,1.0,196.0,0.9249003812681607,0.4308004379272461,52,0.8027145394816837,,0.7757837300873556
284,0.77589587421127,COMPLETE,False,xgb,oof+timing,False,,,,,,,,,,,,,standard,0.002437649058856983,0.522909230364751,0.33377876950078944,0.01623197354175994,0.016410522464269463,3.0,1.0,225.0,0.9392355630136923,0.4731178283691406,52,0.8035464485543163,,0.77589587421127
285,0.7761883287930508,COMPLETE,False,xgb,oof+timing,False,,,,,,,,,,,,,standard,0.0035608637331221355,0.624238783470555,0.5019387989245524,0.0012712359031405423,0.01471356654963267,3.0,1.0,207.0,0.9533114122289813,0.4467294216156006,52,0.8034215465921102,,0.7761883287930508
286,0.7752197436018429,COMPLETE,False,xgb,oof+timing,False,,,,,,,,,,,,,standard,0.005072812471627145,0.6401772276494693,0.3724196164333862,0.001445142945268347,0.021926438645432603,3.0,1.0,180.0,0.9217200791067355,0.4115734100341797,52,0.8031617589180894,,0.7752197436018429
287,0.7755767278564004,COMPLETE,False,xgb,oof+hand,False,,,,,,,,,,,,,standard,0.006741257312625462,0.5652495549720066,0.6145710443427589,0.004556892299396169,0.013150976391497864,3.0,1.0,234.0,0.9071612761613268,0.40595555305480957,34,0.803150303879065,,0.7755767278564004
288,0.7763479744544158,COMPLETE,False,xgb,oof+timing,False,,,,,,,,,,,,,standard,0.003196494082693589,0.5312342999394424,0.19584721500801144,0.001157663035364173,0.018502721404593345,3.0,1.0,172.0,0.930543491579566,0.3827378749847412,52,0.8035988895127857,,0.7763479744544158
289,0.7759615307731546,COMPLETE,False,xgb,oof+timing,False,,,,,,,,,,,,,standard,0.0030009916213816776,0.52786708626672,0.08767778600118942,0.001005047557377132,0.01898892717211976,3.0,1.0,129.0,0.9311217611880513,0.30463409423828125,52,0.8028941944285843,,0.7759615307731546
290,0.7747429624689506,COMPLETE,False,xgb,oof+timing,False,,,,,,,,,,,,,standard,0.0030209409015653846,0.5043451063421345,0.16964204645237121,0.0015762669418436643,0.020936632779454442,3.0,2.0,265.0,0.9190202174612052,0.5308761596679688,52,0.803250877019857,,0.7747429624689506
291,0.7749730605959592,COMPLETE,False,xgb,all,False,,,,,,,,,,,,,none,0.029893916430073657,0.6112485499051764,0.21940429249114368,0.0011572793027368373,0.017093844394050543,3.0,1.0,248.0,0.9431952971362852,1.9563791751861572,362,0.8030075362596648,,0.7749730605959592
292,0.7764380583157882,COMPLETE,False,xgb,oof+timing,False,,,,,,,,,,,,,standard,0.002382996031893153,0.5889246405404719,0.09894430563873058,0.0017920172279382227,0.018118664720031163,3.0,1.0,169.0,0.9317147086903783,0.3763411045074463,52,0.8035882226645198,,0.7764380583157882
293,0.7424847840768092,COMPLETE,False,xgb,oof+timing,False,,,,,,,,,,,,,standard,0.0025039868786233418,0.5943318752805214,0.002815241722400774,0.0013191645462847553,0.1619026081289215,8.0,1.0,169.0,0.8971274776374464,1.231020212173462,52,0.772031639448338,,0.7424847840768092
294,0.7751985569967156,COMPLETE,False,xgb,oof+timing,False,,,,,,,,,,,,,standard,0.0017609067245000476,0.627184019920787,0.08768889289075185,0.001706472969334453,0.009967656450857518,3.0,1.0,203.0,0.9282634922158043,0.438352108001709,52,0.802340831970026,,0.7751985569967156
295,0.7697675409925311,COMPLETE,False,lgbm,oof+timing,True,0.0575741069695256,0.7078670061328518,0.025534720830362616,0.16807403894739645,1.0,72.0,217.0,120.0,0.930263138689696,,,,standard,,,,,,,,,,0.6858820915222168,52,0.798756087854054,,0.7697675409925311
296,0.7709977735864558,COMPLETE,False,xgb,oof+timing,False,,,,,,,,,,,,,standard,0.0041094561131955485,0.6502279384336935,0.1501660934559658,0.00120959055164229,0.01475072884467376,6.0,1.0,174.0,0.909951932862909,1.0039620399475098,52,0.800224539783298,,0.7709977735864558
297,0.7760998984476049,COMPLETE,False,xgb,oof+timing,False,,,,,,,,,,,,,standard,0.0023503989525547777,0.6034862221253093,0.23287024449092986,0.0015124358630491047,0.013398481663078197,3.0,1.0,188.0,0.935318341100265,0.41935300827026367,52,0.8032021668309781,,0.7760998984476049
298,0.7746729981822248,COMPLETE,False,xgb,oof+timing,False,,,,,,,,,,,,,standard,0.0020978570072047644,0.584732979197111,0.08495180594503116,0.0018988248952199031,0.018747252755579306,4.0,1.0,162.0,0.9183434445696081,0.49726009368896484,52,0.8025210123774323,,0.7746729981822248
299,0.7498442719844896,COMPLETE,False,xgb,oof_minus_roberta,False,,,,,,,,,,,,,standard,0.0032285997960822058,0.6133000082623288,0.28067031688320865,0.14291283459712406,0.011481897050575311,3.0,1.0,185.0,0.9312434703085539,0.208817720413208,5,0.7773499303186824,,0.7498442719844896
300,0.7748514307669158,COMPLETE,False,xgb,oof+ph,False,,,,,,,,,,,,,standard,0.0024594561320701864,0.5924332416554026,0.5268066388960368,0.0032239245668441723,0.0167085540682394,3.0,1.0,168.0,0.9413678668886519,0.33582019805908203,42,0.8024537534327021,,0.7748514307669158
301,0.7761818447289331,COMPLETE,True,xgb,oof+timing,False,,,,,,,,,,,,,standard,0.0016980178552159302,0.5340857925194786,2.996236190225599,0.0010098794501236326,0.021709802629808945,3.0,1.0,149.0,0.9236902638246719,0.33490562438964844,52,0.8053813040941885,,0.7761818447289331
302,0.7708145977932211,COMPLETE,False,lr,oof+timing,False,,,,,,,,,,0.33223033643373195,True,l2,standard,,,,,,,,,,0.0919194221496582,52,0.7979533943855386,,0.7708145977932211
303,0.7758742921276323,COMPLETE,False,xgb,oof+timing,False,,,,,,,,,,,,,standard,0.002763316716428056,0.5507374615852596,0.8282423649491386,0.0013406412492197638,0.01568843757968373,3.0,4.0,203.0,0.910213968670354,0.43355870246887207,52,0.8031315974850619,,0.7758742921276323
304,0.7740876605436545,COMPLETE,False,xgb,oof+hand+graph,False,,,,,,,,,,,,,standard,0.0013255939575092944,0.6011590614219073,0.20215601973194477,0.002208986668401925,0.024903632034889118,3.0,1.0,176.0,0.9393564047111717,0.36437392234802246,49,0.8026680362269287,,0.7740876605436545
305,0.7754444200267754,COMPLETE,False,xgb,all_minus_ng,False,,,,,,,,,,,,,standard,0.004697684554623259,0.5814124535685274,0.44817272761136506,0.4918599920938071,0.013657692537015277,3.0,1.0,193.0,0.9555604941721495,0.8065922260284424,131,0.8027814306040598,,0.7754444200267754
306,0.7762072890294742,COMPLETE,False,xgb,oof+timing,False,,,,,,,,,,,,,standard,0.003526921078605097,0.6189956583999175,0.3121888738682268,0.0015809227456501228,0.018385301317055784,3.0,1.0,153.0,0.9276635845351783,0.3386831283569336,52,0.8033132491818842,,0.7762072890294742
307,0.7764608877357735,COMPLETE,False,xgb,oof+timing,False,,,,,,,,,,,,,standard,0.002223597918053534,0.5826844697789989,1.0218545396606893,0.0018876640376181675,0.01563468229924048,3.0,1.0,167.0,0.9467279809735467,0.37030482292175293,52,0.8034385189664445,,0.7764608877357735
308,0.7759923429522114,COMPLETE,False,xgb,oof+timing,False,,,,,,,,,,,,,standard,0.0020672344882423453,0.567900149332215,0.6821197928940705,0.0018425340840308043,0.020296435947040326,3.0,1.0,134.0,0.9362744654960733,0.3052854537963867,52,0.8032484073554802,,0.7759923429522114
309,0.7763374789625651,COMPLETE,False,xgb,oof+timing,False,,,,,,,,,,,,,standard,0.0028072458341497166,0.5570116542778243,0.7825866458450954,0.0012030392818815378,0.016000656003188053,3.0,1.0,167.0,0.9193595888497679,0.3706693649291992,52,0.8031920779892685,,0.7763374789625651
310,0.7751082334437169,COMPLETE,False,xgb,oof+timing,False,,,,,,,,,,,,,standard,0.0039036401264887933,0.51889389587509,0.8673710157856925,0.0011874351004833399,0.017023491461764552,3.0,1.0,163.0,0.5450711632359023,0.36873698234558105,52,0.8023989479019571,,0.7751082334437169
311,0.7730831185133593,COMPLETE,False,xgb,oof+ng,False,,,,,,,,,,,,,standard,0.0029572463640212218,0.5431626629619192,0.7777072631682637,0.0012353071555213822,0.0157588777517019,3.0,1.0,446.0,0.9148188587130438,1.6158270835876465,237,0.8020985946768959,,0.7730831185133593
312,0.7738233549184628,COMPLETE,False,xgb,oof_only,False,,,,,,,,,,,,,standard,0.002170340787010883,0.5563876863610653,1.1054976123536024,0.0014746536470532689,0.01905924700596723,4.0,1.0,148.0,0.9046040679225708,0.20360732078552246,6,0.800903329664568,,0.7738233549184628
313,0.7755492312325687,COMPLETE,False,xgb,oof+timing,False,,,,,,,,,,,,,none,0.001748795658662034,0.5547377496185495,0.9315730008499481,0.0013765363873235441,0.02276281636169898,3.0,1.0,167.0,0.946609382532841,0.37207818031311035,52,0.8033870238368853,,0.7755492312325687
314,0.7760331310763751,COMPLETE,False,xgb,oof+timing,False,,,,,,,,,,,,,standard,0.0031631776376060167,0.534935667955011,0.6592805141353699,0.001017666245010495,0.017233772225400505,3.0,1.0,141.0,0.9214833610202536,0.3377342224121094,52,0.8029688623664449,,0.7760331310763751
315,0.7746432673748035,COMPLETE,False,xgb,oof+timing,True,,,,,,,,,,,,,standard,0.0024158879024421607,0.5725554660979424,0.955125458234982,0.001812347416278745,0.01499810990180712,3.0,1.0,184.0,0.8941789898334231,1.4680914878845215,52,0.8016206358009064,,0.7746432673748035
