number,value,state,params_add_group_dummies,params_family,params_feature_subset,params_isotonic,params_lgbm_alpha,params_lgbm_colsample,params_lgbm_lambda,params_lgbm_lr,params_lgbm_max_depth,params_lgbm_min_child,params_lgbm_n_estimators,params_lgbm_num_leaves,params_lgbm_subsample,params_lr_C,params_lr_class_weight_balanced,params_lr_penalty,params_scaler,params_xgb_alpha,params_xgb_colsample,params_xgb_gamma,params_xgb_lambda,params_xgb_lr,params_xgb_max_depth,params_xgb_min_child,params_xgb_n_estimators,params_xgb_subsample,user_attrs_elapsed_sec,user_attrs_n_features,user_attrs_pooled_auroc,user_attrs_pruned_reason,user_attrs_weighted_auroc
790,0.7734277931562142,COMPLETE,True,xgb,oof+timing,False,,,,,,,,,,,,,standard,0.001686453734176468,0.8865883478552388,3.178992038739578,0.0016554537925335027,0.00951878780664398,3.0,2.0,139.0,0.891455472362706,0.3641631603240967,52,0.8015347755542741,,0.7734277931562142
791,0.7644409351225216,COMPLETE,True,lgbm,oof+timing,False,1.1249192934132421,0.8077585540788759,1.5555210450639547,0.0073877678942236204,-1.0,20.0,354.0,152.0,0.7317829763695028,,,,standard,,,,,,,,,,5.145071268081665,52,0.794510892428461,,0.7644409351225216
792,0.774534598738231,COMPLETE,True,xgb,oof+timing,False,,,,,,,,,,,,,standard,0.0025662812273291,0.6818379780197787,0.6254828580791615,0.002918566131932583,0.01628106449830065,4.0,3.0,175.0,0.913293148921001,0.5241119861602783,52,0.8043991658629748,,0.774534598738231
793,0.7745977350910107,COMPLETE,True,xgb,oof+hand+graph,False,,,,,,,,,,,,,robust,0.001013083679128584,0.5143361122274308,0.5016735999905982,0.0023649305043370117,0.014727191027499604,3.0,2.0,164.0,0.9303514047246562,0.3657419681549072,49,0.8035078797531976,,0.7745977350910107
794,0.7754591189341542,COMPLETE,True,xgb,oof+timing,False,,,,,,,,,,,,,standard,0.004238471731387739,0.5324310030435456,0.8644666045908779,0.0018760026469725347,0.02082249772353533,3.0,2.0,191.0,0.9548272459171809,0.3966546058654785,52,0.8052017016933385,,0.7754591189341542
795,0.7761728156625617,COMPLETE,False,lr,oof_only,False,,,,,,,,,,0.020627938231927254,False,l2,standard,,,,,,,,,,0.029240131378173828,6,0.8012890702218063,,0.7761728156625617
796,0.7757282805567398,COMPLETE,False,xgb,oof+timing,False,,,,,,,,,,,,,standard,0.009087032785072802,0.5513931288402568,1.694691779347555,0.0012171807873942822,0.017261975750384698,3.0,3.0,208.0,0.9208378955855148,0.41385388374328613,52,0.8035044117138599,,0.7757282805567398
797,0.7758813514694934,COMPLETE,False,xgb,oof+timing,False,,,,,,,,,,,,,standard,0.001310648518832857,0.606569325279305,2.8163562660211197,0.0014387098892216586,0.01225025236636435,3.0,2.0,160.0,0.9385591823023607,0.34731101989746094,52,0.802857149462932,,0.7758813514694934
798,0.776000518986342,COMPLETE,False,xgb,oof+timing,False,,,,,,,,,,,,,standard,0.0032289267752710947,0.5915856562780515,0.44994336920279543,0.004437061364972536,0.014921899221361546,3.0,2.0,180.0,0.8739699044928102,0.3773839473724365,52,0.80306234179041,,0.776000518986342
799,0.7748100555083877,COMPLETE,True,xgb,oof+ng,True,,,,,,,,,,,,,standard,0.005983259861960738,0.5697110121008516,0.7696787616614386,0.0022313854365487397,0.01673626298111904,3.0,3.0,125.0,0.8133458191076433,2.143676996231079,237,0.8034425124662877,,0.7748100555083877
800,0.7757680176484216,COMPLETE,False,xgb,oof+timing,False,,,,,,,,,,,,,standard,0.019449338384895563,0.5611363229231826,0.29831455876427054,0.0017020906289764274,0.018747270040307264,3.0,1.0,145.0,0.9027365747934288,0.310070276260376,52,0.8028766440476938,,0.7757680176484216
801,0.7759048197801689,COMPLETE,False,xgb,oof+timing,False,,,,,,,,,,,,,standard,0.002038532814253954,0.5847525385922698,0.6531621200039437,0.0035615816947961315,0.013459946506220639,3.0,1.0,186.0,0.7657933100898979,0.380906343460083,52,0.8029198369012628,,0.7759048197801689
802,0.775983571462453,COMPLETE,False,xgb,oof+timing,False,,,,,,,,,,,,,standard,0.3079436717000114,0.5486492529994731,1.2202004723990436,0.00275565484883881,0.0210927745800774,3.0,2.0,169.0,0.9302631538424341,0.3391411304473877,52,0.8036689333981961,,0.775983571462453
803,0.7719896469741142,COMPLETE,False,xgb,oof+timing,False,,,,,,,,,,,,,standard,0.00232538968247359,0.6069149256056937,0.3699017200946514,0.0019915873299061306,0.024463142384482633,3.0,1.0,515.0,0.9453140698604958,0.8890621662139893,52,0.8014227999205085,,0.7719896469741142
804,0.7739475440625435,COMPLETE,False,xgb,oof+hand,False,,,,,,,,,,,,,standard,0.0029260355361879964,0.5223061121809311,0.5485982140887193,0.0014965595206146987,0.01091479297510516,3.0,8.0,482.0,0.9704351494369634,0.7276535034179688,34,0.8027565763221401,,0.7739475440625435
805,0.7755168539253402,COMPLETE,False,xgb,oof+timing,False,,,,,,,,,,,,,robust,0.007196635587239901,0.6327679652059597,0.24173015360830927,0.0018384756434687087,0.015742785132038143,3.0,4.0,101.0,0.922756009114865,0.2622337341308594,52,0.8024718292740983,,0.7755168539253402
806,0.7758908024909779,COMPLETE,True,xgb,oof+timing,False,,,,,,,,,,,,,standard,0.0016826000548660677,0.5708885850836143,0.9930394305445481,0.0012160929152581267,0.01792010251799403,3.0,1.0,155.0,0.9391354832911591,0.3439977169036865,52,0.8049452769665544,,0.7758908024909779
807,0.7755647242636078,COMPLETE,False,xgb,oof+timing,False,,,,,,,,,,,,,none,0.23721673868751975,0.5923220251425181,0.4734405153532819,0.0024658607940579694,0.013913375836877252,3.0,3.0,225.0,0.911584756432342,0.43918943405151367,52,0.8029402773149347,,0.7755647242636078
808,0.7760542938716162,COMPLETE,False,xgb,oof+timing,False,,,,,,,,,,,,,standard,0.0042440107719352365,0.6646675361371853,0.8451115742908795,0.001574284431504736,0.012252067270426109,3.0,2.0,201.0,0.9486992996146292,0.4200253486633301,52,0.8032133065936993,,0.7760542938716162
809,0.7743439853895463,COMPLETE,False,xgb,all,False,,,,,,,,,,,,,standard,0.0035358679657943692,0.5349427123222324,0.3615232059726734,0.0030561919309741678,0.016510363713307535,3.0,1.0,359.0,0.6089955164292041,2.4596636295318604,362,0.8030301836074608,,0.7743439853895463
810,0.7760065187239861,COMPLETE,False,xgb,oof+timing,False,,,,,,,,,,,,,standard,0.01400622889478127,0.5572796759439371,3.0717675192537297,0.0023071112744883536,0.01871422707432178,3.0,1.0,176.0,0.9573906943516309,0.3449280261993408,52,0.8035321560285612,,0.7760065187239861
811,0.7760764646729087,COMPLETE,False,xgb,oof+timing,False,,,,,,,,,,,,,standard,0.3471390258708654,0.5810201787635328,0.7061574529987062,0.001001911372052156,0.014730796525035224,3.0,2.0,136.0,0.9333640843966645,0.28910088539123535,52,0.802915160302762,,0.7760764646729087
812,0.7420483645018795,COMPLETE,True,lgbm,oof+timing,False,0.034930071731762546,0.7653977207502967,0.7474403150493171,0.28969369385088123,9.0,97.0,134.0,244.0,0.8494954032761345,,,,standard,,,,,,,,,,0.6436619758605957,52,0.7712451827094489,,0.7420483645018795
813,0.7753028723616273,COMPLETE,False,xgb,oof+timing,False,,,,,,,,,,,,,standard,0.001981333531428382,0.5989481192791541,0.5860562310999375,0.002005786528725384,0.022719491261032045,3.0,3.0,158.0,0.9195586667627588,0.3276329040527344,52,0.8034435633872992,,0.7753028723616273
814,0.7748960273628414,COMPLETE,False,xgb,oof+timing,False,,,,,,,,,,,,,standard,0.002653297764661515,0.8182633846970757,0.2210767089649608,0.0013839848094351417,0.019654715196883686,3.0,1.0,189.0,0.9300054345893333,0.3937356472015381,52,0.8029147399343574,,0.7748960273628414
815,0.7744968368803995,COMPLETE,False,xgb,oof+ph,False,,,,,,,,,,,,,standard,0.005248104453455649,0.6157608704842276,0.4477212928460003,0.001738763893340076,0.012911276838293089,3.0,1.0,257.0,0.9052625743748447,0.49273681640625,42,0.8025604744614109,,0.7744968368803995
816,0.7741647203473755,COMPLETE,False,xgb,oof+timing,False,,,,,,,,,,,,,standard,0.0013286691836751495,0.5471204142986192,0.31520070756494123,0.0027299141516527498,0.0163155979797014,4.0,1.0,169.0,0.9420647001379603,0.4633469581604004,52,0.8023532328379608,,0.7741647203473755
817,0.7698738659688171,COMPLETE,False,lr,oof+timing,False,,,,,,,,,,54.17348683050443,True,l1,standard,,,,,,,,,,1.7288906574249268,52,0.7972278385192606,,0.7698738659688171
818,0.7468090864403213,COMPLETE,False,xgb,oof_minus_roberta,True,,,,,,,,,,,,,robust,0.002271805390524867,0.4956894836061719,2.385682557265948,0.0021148461228117916,0.015595620052733393,3.0,10.0,147.0,0.9230602815068557,0.5801172256469727,5,0.773994024252945,,0.7468090864403213
819,0.7763872660662747,COMPLETE,True,xgb,oof+timing,False,,,,,,,,,,,,,standard,0.0032211096509371577,0.5698344580330273,0.5461872758305213,0.0033486098358103244,0.013925742358745523,3.0,2.0,211.0,0.950530143144334,0.4311347007751465,52,0.805311522939031,,0.7763872660662747
820,0.7756385651961994,COMPLETE,False,xgb,oof+timing,False,,,,,,,,,,,,,standard,0.4756243208585111,0.526605744627349,1.086579076792498,0.0013111577876988962,0.01773867808069273,3.0,1.0,115.0,0.935841653305861,0.25551557540893555,52,0.8024635795441588,,0.7756385651961994
821,0.7725475501574545,COMPLETE,False,xgb,all_minus_ng,False,,,,,,,,,,,,,standard,0.004732667793059617,0.5791600494562495,0.4180564575474428,0.0016684479092904708,0.021114400991507278,3.0,1.0,459.0,0.9146795723947212,1.5633790493011475,131,0.8020942333546985,,0.7725475501574545
822,0.7759454606068694,COMPLETE,False,xgb,oof+timing,False,,,,,,,,,,,,,standard,0.184821571066268,0.5468000949765908,1.3486898924872959,0.002443294272145488,0.01145936322773079,3.0,2.0,184.0,0.9608695430500682,0.3646528720855713,52,0.8027858970183586,,0.7759454606068694
823,0.7754594774167592,COMPLETE,False,xgb,oof+hand+graph,False,,,,,,,,,,,,,standard,0.025449631872291923,0.5629577162271205,1.5092527601609782,0.0018412754586582898,0.014837573779194512,3.0,4.0,162.0,0.9281669869639966,0.31478166580200195,49,0.8025725075069916,,0.7754594774167592
824,0.7761930945125399,COMPLETE,False,xgb,oof+timing,False,,,,,,,,,,,,,standard,0.0015618889821949165,0.47816812362601624,0.1999585115298744,0.0011778204916844091,0.017750070719641287,3.0,2.0,199.0,0.9412450600688864,0.37484216690063477,52,0.8033970601325442,,0.7761930945125399
825,0.775425594005184,COMPLETE,True,xgb,oof+timing,False,,,,,,,,,,,,,standard,0.00271138848297661,0.6288550434687523,2.547025125394097,0.004919350478488182,0.026310840823856235,3.0,1.0,175.0,0.9154231946846646,0.36515307426452637,52,0.8053697965091136,,0.775425594005184
826,0.7755366898989985,COMPLETE,False,xgb,oof+timing,False,,,,,,,,,,,,,standard,0.003790828447517891,0.5967895568612749,3.361867652719899,0.0020666234505508927,0.013202258389902695,3.0,1.0,136.0,0.6471667283330561,0.30768609046936035,52,0.8025282111863606,,0.7755366898989985
827,0.7741361689417348,COMPLETE,False,xgb,oof_only,False,,,,,,,,,,,,,standard,0.006603915800915163,0.51008030248871,0.6498138259649697,0.001553725304352408,0.01934407902088817,3.0,3.0,151.0,0.9283815351081286,0.14851593971252441,6,0.8016868438246252,,0.7741361689417348
828,0.7758257672961295,COMPLETE,False,xgb,oof+timing,False,,,,,,,,,,,,,none,0.001950789119128731,0.6114053882924931,4.829726196036743,0.0026443530324143562,0.016103931759685816,3.0,2.0,189.0,0.8300930523925257,0.36899733543395996,52,0.8032503515593513,,0.7758257672961295
829,0.7759710314181046,COMPLETE,False,xgb,oof+timing,False,,,,,,,,,,,,,standard,0.25774882661783527,0.5855360799564058,0.3110449689536223,0.0038370851394847793,0.014446053982441724,3.0,1.0,170.0,0.8972431836814168,0.34926819801330566,52,0.8029357583545855,,0.7759710314181046
830,0.7740089133866953,COMPLETE,False,xgb,oof+timing,False,,,,,,,,,,,,,robust,0.002363542162463666,0.5573822117854003,0.7702791967899305,0.0014260052112695203,0.017093495164853725,4.0,1.0,158.0,0.9513799001095743,0.45057082176208496,52,0.8019121612894717,,0.7740089133866953
831,0.7761021506983931,COMPLETE,True,xgb,oof+timing,False,,,,,,,,,,,,,standard,0.010754566875400566,0.5390200688594619,0.4916568944445704,0.002089518690040157,0.01238584739693309,3.0,2.0,181.0,0.9373632683690478,0.4572489261627197,52,0.8049266756646524,,0.7761021506983931
832,0.7751810566455016,COMPLETE,False,xgb,oof+timing,False,,,,,,,,,,,,,standard,0.0030862260090635772,0.5728963975952657,3.8500498777794085,0.003172973676553409,0.0018975226003486191,3.0,1.0,200.0,0.9243342730816028,0.47135210037231445,52,0.8009277635780834,,0.7751810566455016
833,0.773011945690594,COMPLETE,False,xgb,oof+ng,False,,,,,,,,,,,,,standard,0.00421606481163152,0.9676232934560351,1.8555440969773909,0.0016847577038801049,0.022367555108813275,3.0,1.0,145.0,0.9727599094714342,0.8860719203948975,237,0.8011086796301977,,0.773011945690594
834,0.7727798218570288,COMPLETE,False,lgbm,oof+timing,False,3.0264742461528007,0.4104616026719008,0.0019828648876618997,0.001319931654768201,3.0,86.0,279.0,211.0,0.6573709369042289,,,,standard,,,,,,,,,,0.5277080535888672,52,0.7973298829494687,,0.7727798218570288
835,0.7756147775936121,COMPLETE,False,xgb,oof+timing,False,,,,,,,,,,,,,standard,0.008176784681175001,0.646847968679444,0.924145526091994,0.00242979831088054,0.019895991420566504,3.0,3.0,168.0,0.9442675334494627,0.6306896209716797,52,0.8033248093130098,,0.7756147775936121
836,0.7750756716091804,COMPLETE,False,xgb,oof+timing,False,,,,,,,,,,,,,standard,0.0017574565057126238,0.6026321752509747,0.3721349738891763,0.001928519746946396,0.01035900004482407,3.0,1.0,132.0,0.9096799026288854,0.3203773498535156,52,0.8020243471074398,,0.7750756716091804
837,0.7684940367170644,COMPLETE,False,xgb,oof+timing,True,,,,,,,,,,,,,standard,0.005900004350435419,0.5834292937624157,0.6109385536743427,0.001131744565267548,0.015280937353814921,8.0,2.0,216.0,0.862416418011244,6.580298185348511,52,0.7968762003488427,,0.7684940367170644
838,0.7758691505882463,COMPLETE,True,xgb,oof+hand,False,,,,,,,,,,,,,standard,0.3651153493567131,0.6193626081534713,0.2601760280871533,0.0015052501465692833,0.017304959447843334,3.0,1.0,180.0,0.9342925046796496,0.3585624694824219,34,0.8054065261984624,,0.7758691505882463
839,0.7706538790641562,COMPLETE,False,xgb,oof+timing,False,,,,,,,,,,,,,standard,0.202670103806444,0.5622028685963477,0.13556655892993066,0.0027188812049621825,0.01382553973486317,6.0,3.0,157.0,0.9180942274120703,0.8165006637573242,52,0.799905953078689,,0.7706538790641562
840,0.7565082448106529,COMPLETE,False,lr,all,False,,,,,,,,,,0.790667279070926,False,l1,standard,,,,,,,,,,7.758352756500244,362,0.7805336429767002,,0.7565082448106529
841,0.7587035393918086,COMPLETE,False,xgb,oof+timing,False,,,,,,,,,,,,,standard,0.0027338827484419776,0.5234854887802773,0.6998431598470368,0.002142400644237457,0.019469457698282615,10.0,2.0,732.0,0.7994101678514627,5.135741710662842,52,0.787532724366644,,0.7587035393918086
842,0.7736725294175951,COMPLETE,False,xgb,oof+timing,False,,,,,,,,,,,,,robust,0.003623657607106929,0.5442641073300137,0.4787783021807677,0.0012843776584509858,0.03097903737701826,3.0,1.0,191.0,0.9596341711268042,0.4181509017944336,52,0.8027276234482756,,0.7736725294175951
843,0.7765167142817111,COMPLETE,False,xgb,oof+timing,False,,,,,,,,,,,,,standard,0.0014441370908422056,0.5927728892332655,0.38748862554735747,0.272366537940967,0.01583285971136236,3.0,5.0,167.0,0.9269508872184202,0.3656041622161865,52,0.8035144480095189,,0.7765167142817111
844,0.7756214807460169,COMPLETE,False,xgb,oof+timing,False,,,,,,,,,,,,,standard,0.0010073071047481273,0.6047931449709917,0.3699199828786309,0.26588966954479276,0.012508964787875353,3.0,5.0,167.0,0.9374988146097503,0.37434959411621094,52,0.8027667702559509,,0.7756214807460169
845,0.7763203052535581,COMPLETE,False,xgb,oof+timing,False,,,,,,,,,,,,,standard,0.0014032854900672515,0.6187263612949251,0.22815952962409436,0.001566070579793775,0.015121929504460266,3.0,5.0,175.0,0.9530504943955427,0.39367008209228516,52,0.8034530216764019,,0.7763203052535581
846,0.7761664953471941,COMPLETE,False,xgb,oof+timing,False,,,,,,,,,,,,,standard,0.001655085662511418,0.5951463355186497,1.983673253954982,0.0013014028966833208,0.013590967392042064,3.0,4.0,155.0,0.9455349893506616,0.3600924015045166,52,0.802977690102941,,0.7761664953471941
847,0.7488874372715827,COMPLETE,False,xgb,oof_minus_roberta,False,,,,,,,,,,,,,standard,0.0012793262654255115,0.5921111586945008,0.3285340635711315,0.0017572027307248613,0.01612041106022002,3.0,6.0,166.0,0.9279523352698156,0.1943674087524414,5,0.7757892600706872,,0.7488874372715827
848,0.7760443961187681,COMPLETE,False,xgb,oof+timing,False,,,,,,,,,,,,,standard,0.001183401318464302,0.6365301531651215,0.4340023374575206,0.048013129447072714,0.014703077523724463,3.0,7.0,186.0,0.9337133668141149,0.43057775497436523,52,0.8032323808100562,,0.7760443961187681
849,0.7754668058418492,COMPLETE,False,xgb,oof+timing,False,,,,,,,,,,,,,standard,0.0014657367784390461,0.6099180307487426,0.2603517781883422,0.7439529503653166,0.01163434044647388,3.0,4.0,149.0,0.9204953342297368,0.3506617546081543,52,0.8023561754167926,,0.7754668058418492
850,0.7746168741951605,COMPLETE,False,xgb,oof+ph,False,,,,,,,,,,,,,standard,0.0012937095454361896,0.5821814052224125,0.5024087695765822,0.1807861568529546,0.016729527821935895,3.0,5.0,178.0,0.9039083411471158,0.3611948490142822,42,0.8021260237152937,,0.7746168741951605
851,0.776095181817304,COMPLETE,False,xgb,oof+timing,False,,,,,,,,,,,,,standard,0.0015891233425622412,0.6251937172363813,0.3998616249341115,0.6255007043219546,0.01327245289366183,3.0,3.0,199.0,0.9442796763872087,0.44062352180480957,52,0.8032215563236387,,0.776095181817304
852,0.7764569296734777,COMPLETE,False,xgb,oof+timing,False,,,,,,,,,,,,,standard,0.0011719857939287031,0.5950512629310336,0.187391958450208,0.08740452278846239,0.015611810440374076,3.0,7.0,163.0,0.9319038554554911,0.37405920028686523,52,0.8034469263345356,,0.7764569296734777
853,0.773544078662254,COMPLETE,False,xgb,oof+timing,False,,,,,,,,,,,,,standard,0.001066285396151617,0.6037868768591468,0.10620444256159736,0.049394182126077116,0.009572567991488246,4.0,7.0,159.0,0.9599081746739824,0.5054736137390137,52,0.801537718133106,,0.773544078662254
854,0.775551092508076,COMPLETE,False,xgb,oof+timing,False,,,,,,,,,,,,,standard,0.0010860713129132757,0.5964804038044329,0.1256803356103141,2.343125657373887,0.01217376911110221,3.0,8.0,173.0,0.9500915944993091,0.39922666549682617,52,0.802685744245971,,0.775551092508076
855,0.7748220550219469,COMPLETE,False,xgb,all_minus_ng,False,,,,,,,,,,,,,standard,0.0013083098113015215,0.6143516675848985,0.18731155434525132,1.3590776211884072,0.014674456271698102,3.0,5.0,145.0,0.9386716178699416,0.6120574474334717,131,0.8022944338073722,,0.7748220550219469
856,0.7755521567882754,COMPLETE,False,xgb,oof+hand+graph,False,,,,,,,,,,,,,standard,0.0012185248326859164,0.5886781307624341,0.16454265495172318,0.3438604357726054,0.015614867944832472,3.0,7.0,186.0,0.7342127840349816,0.40366578102111816,49,0.803160970727331,,0.7755521567882754
857,0.7611208322535337,COMPLETE,False,lgbm,oof+timing,True,6.225094625056279,0.6749116156289591,4.087421926218485,0.07249818537803468,10.0,40.0,192.0,191.0,0.6291522942905508,,,,standard,,,,,,,,,,3.495360851287842,52,0.791267119634641,,0.7611208322535337
858,0.7728472358951156,COMPLETE,False,xgb,oof+timing,False,,,,,,,,,,,,,standard,0.0014507534624184227,0.6034688976611534,0.29412797719774786,1.0052916709127124,0.013595893998250922,5.0,6.0,162.0,0.9270868058012934,0.6514945030212402,52,0.8010186682455704,,0.7728472358951156
859,0.7755273183782988,COMPLETE,False,xgb,oof+timing,False,,,,,,,,,,,,,standard,0.0012213737770845432,0.6280442930261051,0.03743323124803882,0.349890758698018,0.011318260006768546,3.0,7.0,203.0,0.914945170942481,0.44509291648864746,52,0.8026473856290546,,0.7755273183782988
860,0.7761183715407987,COMPLETE,False,xgb,oof+timing,False,,,,,,,,,,,,,standard,0.0011578293224419128,0.5867979338260948,0.5194825209378445,0.20027517844860449,0.015459386686435156,3.0,6.0,175.0,0.9385107473264758,0.39536094665527344,52,0.8032483548094297,,0.7761183715407987
861,0.7744407178237797,COMPLETE,False,xgb,oof_only,False,,,,,,,,,,,,,standard,0.0015221973950250278,0.6124293398989461,0.39904374202824405,0.27987189800272155,0.017019814633065497,3.0,8.0,150.0,0.9528976091901693,0.17107462882995605,6,0.8016648795754868,,0.7744407178237797
862,0.7753544052916603,COMPLETE,False,xgb,oof+ng,False,,,,,,,,,,,,,standard,0.0018125091408786697,0.597586940060625,0.19665967952563587,0.0011685382035308,0.01327274549229151,3.0,9.0,194.0,0.7035587773356689,0.9155666828155518,237,0.8023436694567568,,0.7753544052916603
863,0.7714971800531202,COMPLETE,False,lr,oof+timing,False,,,,,,,,,,0.08818949599206369,True,l2,standard,,,,,,,,,,0.07689881324768066,52,0.7984384995244058,,0.7714971800531202
864,0.7745872634285624,COMPLETE,False,xgb,oof+timing,False,,,,,,,,,,,,,standard,0.0014258909855315743,0.5779317066169847,0.5513372293244743,0.007895721593847077,0.01499643286252506,3.0,7.0,166.0,0.5352526266262327,0.38177967071533203,52,0.8020633362769631,,0.7745872634285624
865,0.7764040286432913,COMPLETE,False,xgb,oof+timing,False,,,,,,,,,,,,,standard,0.0017417642524075216,0.5810569270165838,0.3118612116159542,0.10611699936711608,0.017598599948684752,3.0,8.0,183.0,0.929662825841013,0.40506625175476074,52,0.8036198553869633,,0.7764040286432913
866,0.7753285224761806,COMPLETE,False,xgb,oof+timing,False,,,,,,,,,,,,,none,0.0010206661491330925,0.653187470382536,0.41344548149356825,0.15289038901359733,0.012467755270850357,3.0,4.0,142.0,0.9675951735529503,0.3376600742340088,52,0.8023476629566002,,0.7753285224761806
867,0.7761909233651175,COMPLETE,False,xgb,oof+timing,False,,,,,,,,,,,,,standard,0.0014809450416008148,0.5944158294705859,0.6043235953663257,0.03619389555426556,0.014321012553607874,3.0,6.0,161.0,0.9199362624234513,0.37000298500061035,52,0.8030308667061182,,0.7761909233651175
868,0.7752778802165065,COMPLETE,False,xgb,oof+timing,False,,,,,,,,,,,,,standard,0.0012258686777835432,0.6253891309338492,0.278677259523552,0.0062209762486147326,0.016249214063227997,3.0,7.0,214.0,0.9077470506666058,0.4614830017089844,52,0.8030397995347152,,0.7752778802165065
