number,value,state,params_add_group_dummies,params_family,params_feature_subset,params_isotonic,params_lgbm_alpha,params_lgbm_colsample,params_lgbm_lambda,params_lgbm_lr,params_lgbm_max_depth,params_lgbm_min_child,params_lgbm_n_estimators,params_lgbm_num_leaves,params_lgbm_subsample,params_lr_C,params_lr_class_weight_balanced,params_lr_penalty,params_scaler,params_xgb_alpha,params_xgb_colsample,params_xgb_gamma,params_xgb_lambda,params_xgb_lr,params_xgb_max_depth,params_xgb_min_child,params_xgb_n_estimators,params_xgb_subsample,user_attrs_elapsed_sec,user_attrs_n_features,user_attrs_pooled_auroc,user_attrs_pruned_reason,user_attrs_weighted_auroc
632,0.7753016240258427,COMPLETE,False,xgb,oof+timing,False,,,,,,,,,,,,,standard,0.0038006210391907267,0.521582682144231,3.4203381838718396,0.08284102749691069,0.02057814515483689,3.0,1.0,167.0,0.9027009700361001,0.37598180770874023,52,0.8029037578097882,,0.7753016240258427
633,0.7734509050244016,COMPLETE,False,xgb,oof+hand+graph,False,,,,,,,,,,,,,standard,0.02143942715021939,0.39300029771146366,0.7008100425902901,0.0016698457563094275,0.02527155057628391,3.0,1.0,177.0,0.9142459212243028,0.3528025150299072,49,0.8016878947456367,,0.7734509050244016
634,0.7758998653810635,COMPLETE,False,xgb,oof+timing,False,,,,,,,,,,,,,standard,0.0016958138692487908,0.5961665990681833,2.470934541249134,0.002297060158131379,0.01607785474203058,3.0,6.0,155.0,0.962620068644897,0.35516953468322754,52,0.8030028596611641,,0.7758998653810635
635,0.7396334968717341,COMPLETE,False,lgbm,oof+timing,False,1.002223947990222,0.4419847412907252,0.0260685460103023,0.22842473045676887,-1.0,12.0,163.0,84.0,0.9485235000749812,,,,standard,,,,,,,,,,1.674161672592163,52,0.768247325432299,,0.7396334968717341
636,0.7744268463358264,COMPLETE,False,xgb,oof+timing,False,,,,,,,,,,,,,standard,0.0029795678858150995,0.5657279813676499,2.7021227943769013,0.0018950342382172353,0.03215545952548367,3.0,1.0,199.0,0.9324226101583762,0.40842247009277344,52,0.8029865703854873,,0.7744268463358264
637,0.774269988742154,COMPLETE,False,xgb,oof_only,False,,,,,,,,,,,,,standard,0.004672125630707399,0.5357953709465216,1.7900864849652673,0.0014797320143712714,0.018178930361499493,3.0,3.0,221.0,0.9414329304526786,0.227370023727417,6,0.8019318135123851,,0.774269988742154
638,0.768085972874102,COMPLETE,False,xgb,oof+ng,False,,,,,,,,,,,,,standard,0.002502086236514884,0.5830692744441264,2.265908704905783,0.00241031384586377,0.014079767881256727,8.0,1.0,169.0,0.9239365359506937,3.0632615089416504,237,0.7967622279651553,,0.768085972874102
639,0.7755357263213866,COMPLETE,True,xgb,oof+timing,False,,,,,,,,,,,,,standard,0.002042811939931076,0.6035150868710587,0.5541022127172254,0.0038817507383153275,0.015783333869163304,3.0,2.0,184.0,0.8223913911453041,0.43169665336608887,52,0.8050009757801591,,0.7755357263213866
640,0.7706018651191784,COMPLETE,False,lr,oof+timing,False,,,,,,,,,,1.7369913704125601,True,l1,standard,,,,,,,,,,1.1266605854034424,52,0.7977952833193718,,0.7706018651191784
641,0.7755902954649359,COMPLETE,False,xgb,oof+timing,False,,,,,,,,,,,,,none,0.6275503179930216,0.5549147449327629,4.947990110939629,0.001893642783307964,0.020600889968643246,3.0,1.0,736.0,0.9492842887272751,0.8380944728851318,52,0.8041912411408674,,0.7755902954649359
642,0.7762345298967633,COMPLETE,False,xgb,oof+timing,False,,,,,,,,,,,,,standard,0.003500457568304866,0.5767221361631778,2.768549758766937,0.0031737225291770033,0.01777757526631079,3.0,1.0,145.0,0.9199951138133498,0.32727670669555664,52,0.803101488598085,,0.7762345298967633
643,0.7761280113000218,COMPLETE,False,xgb,oof+timing,False,,,,,,,,,,,,,standard,0.00542699084220315,0.6163287348335568,0.7570776152942932,0.0014296119593885694,0.014126213794927954,3.0,2.0,158.0,0.9353379164466434,0.3593597412109375,52,0.8030595568497298,,0.7761280113000218
644,0.7758014320581416,COMPLETE,False,xgb,oof+timing,False,,,,,,,,,,,,,standard,0.010758544783476988,0.5916607187600719,0.45640663063226,0.0016462691355591623,0.01189477806592278,3.0,1.0,194.0,0.9119897891221531,0.4372851848602295,52,0.8025726651451434,,0.7758014320581416
645,0.7683704699618779,COMPLETE,False,xgb,oof+hand,False,,,,,,,,,,,,,standard,0.0014703650927168133,0.5417788470891804,4.3905651433454596,0.002672637644950669,0.07563054451133942,3.0,4.0,170.0,0.5943959258754368,0.27428507804870605,34,0.7983874247632511,,0.7683704699618779
646,0.7739458386583296,COMPLETE,False,xgb,oof+timing,False,,,,,,,,,,,,,standard,0.0030261150007648567,0.5699087344364058,0.9127723048834305,0.0022983326639925317,0.019182932833688715,4.0,1.0,137.0,0.9672959636581864,0.4333202838897705,52,0.8020725318358128,,0.7739458386583296
647,0.7741059230187192,COMPLETE,True,xgb,oof+timing,True,,,,,,,,,,,,,standard,0.0025168692968130877,0.5865795005044153,0.6229032146418938,0.001954989118148033,0.02248538792638763,3.0,5.0,184.0,0.9266133272848583,1.4813110828399658,52,0.8041748993191399,,0.7741059230187192
648,0.7753672374144179,COMPLETE,False,xgb,oof+timing,False,,,,,,,,,,,,,standard,0.004295884566517939,0.558887316097781,0.31709894543661815,0.0015735751381216498,0.016204628855796138,3.0,1.0,155.0,0.5608741572963417,0.36145734786987305,52,0.802611706860717,,0.7753672374144179
649,0.7755878492650431,COMPLETE,False,xgb,all,False,,,,,,,,,,,,,standard,0.0036105522970444376,0.6026036901077613,0.37466179102867525,0.0019811356121774487,0.01308155199201394,3.0,2.0,208.0,0.9429184414438335,1.719282865524292,362,0.8028539441538471,,0.7755878492650431
650,0.7760867692035046,COMPLETE,False,xgb,oof+timing,False,,,,,,,,,,,,,standard,0.006621033458229866,0.5464193130491735,1.0131470668871885,0.001391677337554856,0.014868865491641639,3.0,3.0,168.0,0.954915282210352,0.396756649017334,52,0.8032625422430837,,0.7760867692035046
651,0.7749185958566225,COMPLETE,False,xgb,oof+timing,False,,,,,,,,,,,,,standard,0.001903436374820162,0.6233504734958051,0.45436321603416463,0.0027399528807158027,0.01796546227065042,3.0,1.0,181.0,0.6241613896359788,0.4155871868133545,52,0.8026591033983317,,0.7749185958566225
652,0.7758294816113204,COMPLETE,False,xgb,oof+timing,False,,,,,,,,,,,,,standard,0.0011340054591550256,0.5165793338418708,3.55645520887294,0.0022734457217168406,0.016542130413523315,3.0,1.0,149.0,0.9332953666277182,0.35354137420654297,52,0.8028837903105714,,0.7758294816113204
653,0.7742474496685641,COMPLETE,False,xgb,oof+timing,False,,,,,,,,,,,,,standard,0.0029417774862303104,0.5706204804332926,0.8187850265016098,0.0017364074125724512,0.01413128338962142,4.0,2.0,195.0,0.9180715351040935,0.5775275230407715,52,0.802387440316882,,0.7742474496685641
654,0.7756253674050669,COMPLETE,False,xgb,oof+timing,False,,,,,,,,,,,,,standard,0.017178147895910274,0.5297959809319319,0.2621369272845418,0.003356847464653538,0.010035817162362409,3.0,1.0,163.0,0.9026151237881073,0.3812711238861084,52,0.8024059365266829,,0.7756253674050669
655,0.775123077636455,COMPLETE,True,xgb,oof+timing,False,,,,,,,,,,,,,standard,0.4319369221910003,0.6074464830473724,0.6786983893018127,0.001431040803013246,0.020854527289786588,3.0,1.0,135.0,0.9430241640656336,0.33930516242980957,52,0.8044077834152683,,0.775123077636455
656,0.7492809342625087,COMPLETE,False,lgbm,oof_minus_roberta,False,0.1043316100408977,0.606365982793476,0.07299580826859865,0.0016132065529956244,3.0,67.0,758.0,17.0,0.879423378004079,,,,standard,,,,,,,,,,0.676659345626831,5,0.7769821605107392,,0.7492809342625087
657,0.7749531195824346,COMPLETE,False,xgb,oof+timing,False,,,,,,,,,,,,,standard,0.0022881239986923363,0.7311134003521925,1.1541386368914472,0.0019114399024737336,0.01245618250504769,3.0,3.0,411.0,0.9282427169266383,0.841266393661499,52,0.8034768250373103,,0.7749531195824346
658,0.7742506020490033,COMPLETE,False,xgb,oof+ph,False,,,,,,,,,,,,,standard,0.005776595749128456,0.5854539134985691,0.5371526791076566,0.00241738878820135,0.018799347799546652,3.0,1.0,177.0,0.9526675890345675,0.35998010635375977,42,0.8022137756197465,,0.7742506020490033
659,0.7764901899730511,COMPLETE,False,xgb,oof+timing,False,,,,,,,,,,,,,standard,0.0015972707466717657,0.5618139970307995,0.3540984612668347,0.0016203783975316038,0.015335137644558343,3.0,2.0,162.0,0.9352263188376427,0.3705153465270996,52,0.8033990043364154,,0.7764901899730511
660,0.7757381859318693,COMPLETE,False,xgb,oof+timing,False,,,,,,,,,,,,,standard,0.0012498645229929344,0.5513672564631469,0.3968068030331563,0.00280928705441216,0.011311399640666764,3.0,2.0,151.0,0.9331361785942868,0.34322524070739746,52,0.8025291570152708,,0.7757381859318693
661,0.7762891335152363,COMPLETE,False,xgb,oof+timing,False,,,,,,,,,,,,,standard,0.001903291718756991,0.541453579695178,0.5523658473443328,0.0021100487066379914,0.013286281101604023,3.0,1.0,161.0,0.9168920871547598,0.36855244636535645,52,0.8029385432952659,,0.7762891335152363
662,0.7758096563775988,COMPLETE,False,xgb,oof+timing,False,,,,,,,,,,,,,standard,0.0014741915245869584,0.5603407443495634,0.4674590381493293,0.0016673821696041636,0.014918082373251674,3.0,1.0,144.0,0.8746551715388279,0.3393893241882324,52,0.8026635172665797,,0.7758096563775988
663,0.7744095123555036,COMPLETE,False,xgb,all_minus_ng,False,,,,,,,,,,,,,none,0.001585745851309975,0.5325210856656543,0.33905855772646964,0.002040613315860236,0.015408640718318196,3.0,1.0,126.0,0.9252318558933382,0.5610342025756836,131,0.8015284700282057,,0.7744095123555036
664,0.7729209471887807,COMPLETE,True,lr,oof+hand+graph,False,,,,,,,,,,0.33990481685035817,False,l2,standard,,,,,,,,,,0.43746423721313477,49,0.8025603168232592,,0.7729209471887807
665,0.7734704892573439,COMPLETE,False,xgb,oof+timing,False,,,,,,,,,,,,,standard,0.0012019382120306934,0.5666088922524719,0.6193792660221817,0.004246727444389965,0.013316510668981854,3.0,2.0,669.0,0.9386486587854248,1.218332290649414,52,0.8026999316796251,,0.7734704892573439
666,0.7682541240004117,COMPLETE,False,xgb,oof+timing,True,,,,,,,,,,,,,standard,0.0016885058423948612,0.5530791741325662,0.49723773756607337,0.0025047914889911793,0.01648043486773876,7.0,1.0,190.0,0.9060732057123165,4.831096410751343,52,0.7977404252425763,,0.7682541240004117
667,0.7758879039296224,COMPLETE,False,xgb,oof+timing,False,,,,,,,,,,,,,standard,0.001759082439993618,0.4982864916608794,2.8174020887110762,0.0017150650815093,0.012125421420858097,3.0,1.0,173.0,0.9352516925945312,0.37653350830078125,52,0.8027184804354764,,0.7758879039296224
668,0.7743684828901324,COMPLETE,False,xgb,oof_only,False,,,,,,,,,,,,,standard,0.002281610822708989,0.5749233626954282,0.37509140892829756,0.00212599798160884,0.014473782622816723,3.0,3.0,212.0,0.9214229713117408,0.2214500904083252,6,0.801724571888935,,0.7743684828901324
669,0.7759689124668079,COMPLETE,False,xgb,oof+timing,False,,,,,,,,,,,,,standard,0.0012938346684322705,0.5246698915962925,0.7593671682597882,0.0031675653101505296,0.017183580334876335,3.0,4.0,157.0,0.9440347866538673,0.3450925350189209,52,0.8032770449530412,,0.7759689124668079
670,0.7757950472040436,COMPLETE,False,xgb,oof+ng,False,,,,,,,,,,,,,standard,0.002109694814230049,0.5622708047822836,3.0667243049456703,0.001322918023023039,0.015445472198402307,3.0,2.0,177.0,0.8912318382963673,0.8313519954681396,237,0.8027038726334178,,0.7757950472040436
671,0.7757562771016675,COMPLETE,False,xgb,oof+timing,False,,,,,,,,,,,,,standard,0.001500115488933984,0.5422433517043151,0.2924791997039271,0.0016916147277431695,0.013276297264611525,3.0,1.0,138.0,0.9283925129615126,0.3594968318939209,52,0.8024210697892473,,0.7757562771016675
672,0.775809524398188,COMPLETE,True,xgb,oof+timing,False,,,,,,,,,,,,,standard,0.002888723007839753,0.5806156040332834,0.656735911399972,0.0023806028936064327,0.01703485554581617,3.0,1.0,197.0,0.9132050457828239,0.5007452964782715,52,0.8050848918229202,,0.775809524398188
673,0.7759292083340023,COMPLETE,False,xgb,oof+timing,False,,,,,,,,,,,,,standard,0.004020384189754774,0.5588369016561404,1.6340806053668067,0.0019476944943445872,0.011547940397688328,3.0,1.0,162.0,0.9333349165737795,0.4072122573852539,52,0.8026170140118248,,0.7759292083340023
674,0.7745799380708129,COMPLETE,False,xgb,oof+timing,False,,,,,,,,,,,,,standard,0.0026800658003541425,0.5912119051975022,0.42837303266418225,0.0015084630307492118,0.014610212645163108,3.0,1.0,499.0,0.9448267348332982,1.0346384048461914,52,0.8031544024710096,,0.7745799380708129
675,0.7765050856802188,COMPLETE,False,xgb,oof+timing,False,,,,,,,,,,,,,standard,0.0019184307545078623,0.5146523493214288,0.5514361082303615,0.0028636142250615016,0.018364293625608378,3.0,2.0,184.0,0.9243465112974767,0.44219398498535156,52,0.8037544258224745,,0.7765050856802188
676,0.7723954862720341,COMPLETE,False,xgb,oof+timing,False,,,,,,,,,,,,,standard,0.0010289570114947535,0.4825085113407122,0.2625508697369111,0.0030995456981369736,0.019827811099988425,4.0,2.0,248.0,0.9090755616890375,0.8907346725463867,52,0.8018771130737411,,0.7723954862720341
677,0.7684789320322077,COMPLETE,False,xgb,oof+timing,False,,,,,,,,,,,,,standard,0.0017733943477928362,0.5281145843877655,1.4077309544820087,0.004631429592008113,0.02792674060864178,6.0,2.0,223.0,0.920070155668048,0.9207563400268555,52,0.7980332643824058,,0.7684789320322077
678,0.7760612991355761,COMPLETE,False,xgb,oof+timing,False,,,,,,,,,,,,,standard,0.0014677318673047737,0.505774575498201,0.5046746994208157,0.003775512269376767,0.023287506989145678,3.0,2.0,200.0,0.8991385224036558,0.3809521198272705,52,0.804315460004416,,0.7760612991355761
679,0.7547089427513676,COMPLETE,False,lgbm,oof+hand,False,0.0010050592560648945,0.6875798360729976,0.0021302654942720596,0.037739258346039646,11.0,56.0,576.0,134.0,0.5393877840555683,,,,standard,,,,,,,,,,2.6807751655578613,34,0.7834333442313842,,0.7547089427513676
680,0.7755773911168219,COMPLETE,True,xgb,oof+timing,False,,,,,,,,,,,,,standard,0.0019390235390913983,0.5299853803208243,0.9035477542511875,0.0035387066075834375,0.018338136641657465,3.0,2.0,185.0,0.9236363213399239,0.4868299961090088,52,0.8051974980092929,,0.7755773911168219
681,0.7758604272281668,COMPLETE,False,xgb,oof+timing,False,,,,,,,,,,,,,standard,0.008051798255358868,0.5112318925940258,0.37081040274613647,0.003013871044160264,0.02128753047100032,3.0,2.0,210.0,0.9121602236650164,0.5006389617919922,52,0.8038652979891783,,0.7758604272281668
682,0.7750773594968392,COMPLETE,False,xgb,all,False,,,,,,,,,,,,,none,0.0014137952708556847,0.500165043716247,0.674506991455404,0.0027781264486262435,0.017959224572649007,3.0,2.0,186.0,0.9383554794215323,1.645975112915039,362,0.8026156478145099,,0.7750773594968392
683,0.776375852507229,COMPLETE,False,xgb,oof+timing,False,,,,,,,,,,,,,standard,0.0017304947757454552,0.5128451571216869,0.2370455743376076,0.00249838050870367,0.016589823305809794,3.0,2.0,172.0,0.9494859883029332,0.4121429920196533,52,0.8034601153932289,,0.776375852507229
684,0.7761532520647063,COMPLETE,False,xgb,oof+timing,False,,,,,,,,,,,,,standard,0.005056209749275352,0.5237716719172087,0.8300282673528379,0.0024103694129469708,0.01981846594177188,3.0,2.0,194.0,0.929079418291987,0.4488496780395508,52,0.8037114431531077,,0.7761532520647063
685,0.768173471445077,COMPLETE,False,lr,oof+timing,True,,,,,,,,,,26.037793604844197,True,l1,standard,,,,,,,,,,5.7413694858551025,52,0.795579731643116,,0.768173471445077
686,0.7746644413540129,COMPLETE,False,xgb,oof+timing,False,,,,,,,,,,,,,standard,0.002146728791084546,0.49287468444847155,0.5734654179126861,0.002833808547603747,0.024710392003715456,3.0,3.0,149.0,0.6714175020671007,0.36496615409851074,52,0.802624317912854,,0.7746644413540129
687,0.7762501075655421,COMPLETE,False,xgb,oof+timing,False,,,,,,,,,,,,,standard,0.0033590934887771547,0.5440478326902671,0.3954987116569564,0.0012576062895905333,0.0165067943662158,3.0,2.0,180.0,0.9172135794040468,0.44550275802612305,52,0.8033457226411368,,0.7762501075655421
688,0.7710662734407133,COMPLETE,True,xgb,oof+timing,False,,,,,,,,,,,,,standard,0.002258150728637928,0.5364868568041506,3.891004314383017,0.005413683255203747,0.018846541077906953,10.0,2.0,163.0,0.9387135550362905,1.1965303421020508,52,0.8015807008024727,,0.7710662734407133
689,0.7490148172155372,COMPLETE,False,xgb,oof_minus_roberta,False,,,,,,,,,,,,,standard,0.00706366304189128,0.5181066645970083,0.4743938757663969,0.0020880653555905475,0.01617679109533183,3.0,3.0,202.0,0.924999774554994,0.25989246368408203,5,0.7761826198052579,,0.7490148172155372
690,0.7735098254243156,COMPLETE,False,xgb,oof+ph,False,,,,,,,,,,,,,standard,0.004132783324779682,0.48579594704303136,0.2995860801492634,0.003972346658278629,0.021983364472359743,3.0,2.0,176.0,0.952625583477931,0.38106489181518555,42,0.8016145404590402,,0.7735098254243156
691,0.7628211239711079,COMPLETE,False,xgb,oof+timing,False,,,,,,,,,,,,,standard,0.0016687951613229917,0.6339842685732845,0.18097506769850813,0.00167221877355488,0.10193058507525124,3.0,2.0,285.0,0.9038797939010824,0.5865316390991211,52,0.792381253544888,,0.7628211239711079
692,0.7760217367014498,COMPLETE,False,xgb,oof+timing,False,,,,,,,,,,,,,standard,0.00526428090621287,0.5506942355343456,1.009098571301987,0.0014365931197584658,0.01497898638095519,3.0,3.0,130.0,0.9363879383168359,0.3368642330169678,52,0.8029291375522137,,0.7760217367014498
693,0.771590978129782,COMPLETE,False,xgb,all_minus_ng,False,,,,,,,,,,,,,standard,0.010122710879547806,0.6191675476926214,0.7382630677124611,0.002247982708833577,0.01784786495528356,5.0,3.0,155.0,0.9440965237570562,1.292236089706421,131,0.8006965084095226,,0.771590978129782
694,0.7761553971882917,COMPLETE,False,xgb,oof+timing,False,,,,,,,,,,,,,standard,0.0013592920461748949,0.5715895108238851,0.607615630384003,0.05840406931830087,0.01969438283529324,3.0,2.0,189.0,0.9230299945303356,0.45364928245544434,52,0.8038199507475359,,0.7761553971882917
695,0.776255654578149,COMPLETE,False,xgb,oof+timing,False,,,,,,,,,,,,,standard,0.0026938860127462146,0.5467593966227003,1.3006768802172108,0.001776047655417513,0.01506932332018071,3.0,2.0,169.0,0.9123493492562127,0.4154050350189209,52,0.8030896657367066,,0.776255654578149
696,0.7753123940682004,COMPLETE,True,xgb,oof+hand+graph,False,,,,,,,,,,,,,standard,0.002042746560097358,0.6081375820011213,0.44002596498841684,0.002928630608251308,0.017196055250352275,3.0,1.0,144.0,0.9308207113717609,0.38258934020996094,49,0.8042811474333935,,0.7753123940682004
697,0.7763139813337655,COMPLETE,False,xgb,oof+timing,False,,,,,,,,,,,,,standard,0.0032616628855027994,0.5131734455127244,0.337034932983368,0.001260398536775634,0.015682770052733067,3.0,1.0,181.0,0.9556342441906773,0.44550156593322754,52,0.8033581235090715,,0.7763139813337655
698,0.7762054430960064,COMPLETE,False,xgb,oof+timing,False,,,,,,,,,,,,,standard,0.004422705591589172,0.5599309236526334,4.551036364452595,0.001984970356781451,0.013729791153904772,3.0,3.0,213.0,0.943656826678022,0.506558895111084,52,0.8035720910269948,,0.7762054430960064
699,0.7755854870070221,COMPLETE,False,xgb,oof+timing,False,,,,,,,,,,,,,standard,0.002538688742832449,0.5953513288497884,0.5483075346777303,0.03211661676747532,0.0217529498351964,3.0,1.0,158.0,0.9217154648050604,0.39803457260131836,52,0.8033384187401075,,0.7755854870070221
700,0.7743328631352677,COMPLETE,False,xgb,oof_only,False,,,,,,,,,,,,,standard,0.0010195822999901933,0.5358090197794736,3.241710490658975,0.003437678803687562,0.018573015246035975,3.0,4.0,197.0,0.9315664071490825,0.2503805160522461,6,0.8021320665111092,,0.7743328631352677
701,0.7674838433542227,COMPLETE,False,lgbm,oof+timing,False,0.0032151442487222534,0.5012378872002774,5.541208028867964,0.018929414851288042,8.0,50.0,440.0,39.0,0.5939891811098692,,,,standard,,,,,,,,,,2.133441686630249,52,0.7969295871362224,,0.7674838433542227
702,0.7756707667104384,COMPLETE,False,xgb,oof+timing,False,,,,,,,,,,,,,none,0.012581608370136598,0.581221487171497,0.23134371383588578,0.0024529936799228104,0.016658526760051206,3.0,2.0,115.0,0.8951863314359898,0.3083641529083252,52,0.8025642052310014,,0.7756707667104384
703,0.7741355739206689,COMPLETE,False,xgb,oof+timing,False,,,,,,,,,,,,,standard,0.003522543654358695,0.5667924295160046,2.9414656512339294,0.0016156465679128618,0.01271251569710331,4.0,1.0,167.0,0.8837189714094653,0.5550100803375244,52,0.8019492588011745,,0.7741355739206689
704,0.7739855451387136,COMPLETE,True,xgb,oof+ng,True,,,,,,,,,,,,,standard,0.32371623369632924,0.635885314299762,0.37274970549346703,0.0014594753131055823,0.014811419288504955,3.0,1.0,142.0,0.9142511308337163,2.8493528366088867,237,0.8030148927067448,,0.7739855451387136
705,0.7756096539048725,COMPLETE,False,xgb,oof+timing,False,,,,,,,,,,,,,standard,0.008653491046011718,0.5977773482717929,0.9461893785842597,0.001997975861947119,0.019449385523606193,3.0,2.0,188.0,0.6881595135645832,0.4630882740020752,52,0.8038057107678312,,0.7756096539048725
706,0.77601875270226,COMPLETE,False,xgb,oof+timing,False,,,,,,,,,,,,,standard,0.006242624956351339,0.5548994520593847,0.15539982060312652,0.0024584585081659682,0.017299313023104442,3.0,1.0,228.0,0.9480373644046092,0.5420932769775391,52,0.8039010293035661,,0.77601875270226
707,0.773012758488238,COMPLETE,False,lr,oof+timing,False,,,,,,,,,,0.00801371777197958,False,l2,standard,,,,,,,,,,0.18438386917114258,52,0.7989657465958303,,0.773012758488238
708,0.7763924296834638,COMPLETE,False,xgb,oof+timing,False,,,,,,,,,,,,,standard,0.0017974503205512703,0.5775194520628305,0.6853454438988629,0.0011612240728586403,0.014893551669549641,3.0,1.0,173.0,0.9366593479133947,0.6120216846466064,52,0.8033778282780355,,0.7763924296834638
709,0.7747141918873361,COMPLETE,False,xgb,oof+hand,False,,,,,,,,,,,,,standard,0.002962986774603936,0.6141499239714382,0.4780418618249954,0.0018073425245539543,0.024928627858374693,3.0,2.0,154.0,0.8437042809238544,0.26511096954345703,34,0.8030337567388997,,0.7747141918873361
710,0.7761163367960086,COMPLETE,False,xgb,oof+timing,False,,,,,,,,,,,,,standard,0.002265216255990607,0.5378234993284584,0.7925566635710478,0.0027659547179466736,0.013167670211341978,3.0,1.0,129.0,0.9266412923972535,0.281109094619751,52,0.8026567388260561,,0.7761163367960086
