number,value,state,params_add_group_dummies,params_family,params_feature_subset,params_isotonic,params_lgbm_alpha,params_lgbm_colsample,params_lgbm_lambda,params_lgbm_lr,params_lgbm_max_depth,params_lgbm_min_child,params_lgbm_n_estimators,params_lgbm_num_leaves,params_lgbm_subsample,params_lr_C,params_lr_class_weight_balanced,params_lr_penalty,params_scaler,params_xgb_alpha,params_xgb_colsample,params_xgb_gamma,params_xgb_lambda,params_xgb_lr,params_xgb_max_depth,params_xgb_min_child,params_xgb_n_estimators,params_xgb_subsample,user_attrs_elapsed_sec,user_attrs_n_features,user_attrs_pooled_auroc,user_attrs_pruned_reason,user_attrs_weighted_auroc
1376,0.7768693530447075,COMPLETE,True,lr,oof_only,False,,,,,,,,,,0.3837724299856538,True,l1,none,,,,,,,,,,0.11751651763916016,6,0.8053557667136113,,0.7768693530447075
1377,0.7768768298534012,COMPLETE,True,lr,oof_only,False,,,,,,,,,,0.6108004115201365,True,l1,none,,,,,,,,,,0.14058518409729004,6,0.8053625451541349,,0.7768768298534012
1378,0.7768129096385994,COMPLETE,True,lr,oof_only,False,,,,,,,,,,1.1391297866814225,True,l1,none,,,,,,,,,,0.19600725173950195,6,0.8052798902165875,,0.7768129096385994
1379,0.7766846329833501,COMPLETE,True,lr,oof_only,False,,,,,,,,,,0.22540852219774896,True,l1,none,,,,,,,,,,0.0769033432006836,6,0.8052241914029827,,0.7766846329833501
1380,0.7768726020190072,COMPLETE,True,lr,oof_only,False,,,,,,,,,,0.3085607781558099,True,l1,none,,,,,,,,,,0.09384894371032715,6,0.8053299666027811,,0.7768726020190072
1381,0.7628152030608398,COMPLETE,True,lr,oof_only,False,,,,,,,,,,0.0027699423326227393,True,l1,none,,,,,,,,,,0.02787947654724121,6,0.7833154308939039,,0.7628152030608398
1382,0.7729567714151794,COMPLETE,True,lr,oof_only,True,,,,,,,,,,0.4290115201190565,True,l1,none,,,,,,,,,,0.2871725559234619,6,0.8027108087120934,,0.7729567714151794
1383,0.7768743657220178,COMPLETE,True,lr,oof_only,False,,,,,,,,,,0.5570367505913767,True,l1,none,,,,,,,,,,0.13227033615112305,6,0.8053767851338396,,0.7768743657220178
1384,0.7768784177007523,COMPLETE,True,lr,oof_only,False,,,,,,,,,,0.3496071502995543,True,l1,none,,,,,,,,,,0.10959410667419434,6,0.8053546632465494,,0.7768784177007523
1385,0.7768556525970307,COMPLETE,True,lr,oof_only,False,,,,,,,,,,0.7317310162226877,True,l1,none,,,,,,,,,,0.1582188606262207,6,0.8053561870820158,,0.7768556525970307
1386,0.775957297030262,COMPLETE,True,lr,oof_only,False,,,,,,,,,,0.15413137894790854,True,l1,none,,,,,,,,,,0.07961678504943848,6,0.8048650916933837,,0.775957297030262
1387,0.7767524029663401,COMPLETE,True,lr,oof_only,False,,,,,,,,,,0.26692336679477924,True,l1,none,,,,,,,,,,0.09330987930297852,6,0.8052875619399708,,0.7767524029663401
1388,0.776846055297975,COMPLETE,True,lr,oof_only,False,,,,,,,,,,0.4713876561243989,True,l1,none,,,,,,,,,,0.13637924194335938,6,0.8053731069102996,,0.776846055297975
1389,0.7768858847727885,COMPLETE,True,lr,oof_only,False,,,,,,,,,,0.320877129636288,True,l1,none,,,,,,,,,,0.10390472412109375,6,0.8053389519774288,,0.7768858847727885
1390,0.776703003617507,COMPLETE,True,lr,oof_only,False,,,,,,,,,,0.22720794828459276,True,l1,none,,,,,,,,,,0.08606648445129395,6,0.8052280798107249,,0.776703003617507
1391,0.7768124441392006,COMPLETE,True,lr,oof_only,False,,,,,,,,,,0.9355144715901079,True,l1,none,,,,,,,,,,0.1814432144165039,6,0.8053038512156476,,0.7768124441392006
1392,0.776864629761761,COMPLETE,True,lr,oof_only,False,,,,,,,,,,0.41368888071206017,True,l1,none,,,,,,,,,,0.12203621864318848,6,0.8053641740817027,,0.776864629761761
1393,0.7768658730216167,COMPLETE,True,lr,oof_only,False,,,,,,,,,,0.5802235395953209,False,l1,none,,,,,,,,,,0.1146848201751709,6,0.8054330619540006,,0.7768658730216167
1394,0.7767920361141103,COMPLETE,True,lr,oof_only,False,,,,,,,,,,0.29425053933738515,True,l1,none,,,,,,,,,,0.08609962463378906,6,0.8053142553336605,,0.7767920361141103
1395,0.7766973063294175,COMPLETE,True,lr,oof_only,False,,,,,,,,,,0.212675373374404,True,l2,none,,,,,,,,,,0.0463407039642334,6,0.8052129465481607,,0.7766973063294175
1396,0.7768709152645777,COMPLETE,True,lr,oof_only,False,,,,,,,,,,0.3591236960918406,True,l1,none,,,,,,,,,,0.10750460624694824,6,0.8053573430951285,,0.7768709152645777
1397,0.776866927142666,COMPLETE,True,lr,oof_only,False,,,,,,,,,,0.6556366142524271,True,l1,none,,,,,,,,,,0.14278459548950195,6,0.8053640164435509,,0.776866927142666
1398,0.7768681162952458,COMPLETE,True,lr,oof_only,False,,,,,,,,,,0.4874660385184374,True,l1,none,,,,,,,,,,0.1252889633178711,6,0.8053833008441103,,0.7768681162952458
1399,0.7767519342056863,COMPLETE,True,lr,oof_only,False,,,,,,,,,,0.27975186318692435,True,l1,none,,,,,,,,,,0.08560705184936523,6,0.805293657281837,,0.7767519342056863
1400,0.776867077711929,COMPLETE,True,lr,oof_only,False,,,,,,,,,,0.4058790003520002,True,l1,none,,,,,,,,,,0.1198720932006836,6,0.8053628078843877,,0.776867077711929
1401,0.7768213793682212,COMPLETE,True,lr,oof_only,False,,,,,,,,,,0.8055942951206035,True,l1,none,,,,,,,,,,0.15459609031677246,6,0.805334643201282,,0.7768213793682212
1402,0.7726788778143392,COMPLETE,True,lr,oof_only,True,,,,,,,,,,30.532817879749672,True,l1,none,,,,,,,,,,4.968926668167114,6,0.8025296824757764,,0.7726788778143392
1403,0.7762550365508545,COMPLETE,True,lr,oof_only,False,,,,,,,,,,0.1812617482948657,True,l1,none,,,,,,,,,,0.07463359832763672,6,0.80504527210079,,0.7762550365508545
1404,0.7702661185979495,COMPLETE,True,lr,oof_only,False,,,,,,,,,,0.004408337509283158,True,l1,none,,,,,,,,,,0.03562593460083008,6,0.7919644582717624,,0.7702661185979495
1405,0.7768861712150649,COMPLETE,True,lr,oof_only,False,,,,,,,,,,0.3181126996254497,True,l1,none,,,,,,,,,,0.0957803726196289,6,0.8053350635696865,,0.7768861712150649
1406,0.7768492392686955,COMPLETE,True,lr,oof_only,False,,,,,,,,,,0.5177057320166275,True,l1,none,,,,,,,,,,0.12958741188049316,6,0.8053765749496372,,0.7768492392686955
1407,0.7767664840907567,COMPLETE,True,lr,oof_only,False,,,,,,,,,,0.25476598213005175,True,l1,none,,,,,,,,,,0.0882568359375,6,0.8052765272693511,,0.7767664840907567
1408,0.5,COMPLETE,True,lr,oof_only,False,,,,,,,,,,0.0015341822778915384,True,l1,none,,,,,,,,,,0.032286882400512695,6,0.5,,0.5
1409,0.7768605320118072,COMPLETE,True,lr,oof_only,False,,,,,,,,,,0.38261459314394364,True,l1,none,,,,,,,,,,0.12437248229980469,6,0.8053518783058692,,0.7768605320118072
1410,0.7768811441759935,COMPLETE,True,lr,oof_only,False,,,,,,,,,,0.6439762550268331,True,l1,none,,,,,,,,,,0.154008150100708,6,0.8053669064763322,,0.7768811441759935
1411,0.7768813669649273,COMPLETE,True,lr,oof_only,False,,,,,,,,,,0.3214129741959766,True,l1,none,,,,,,,,,,0.10474705696105957,6,0.805337323049861,,0.7768813669649273
1412,0.7756530392658273,COMPLETE,True,lr,oof_only,False,,,,,,,,,,0.13472144743492662,True,l1,none,,,,,,,,,,0.07657313346862793,6,0.8046748224442678,,0.7756530392658273
1413,0.7768068121796752,COMPLETE,True,lr,oof_only,False,,,,,,,,,,0.4877469459785434,False,l2,none,,,,,,,,,,0.04615974426269531,6,0.8054409964076368,,0.7768068121796752
1414,0.7765537136207757,COMPLETE,True,lr,oof_only,False,,,,,,,,,,0.20733554207310628,True,l1,none,,,,,,,,,,0.07802009582519531,6,0.8051777406942784,,0.7765537136207757
1415,0.7768180393436716,COMPLETE,True,lr,oof_only,False,,,,,,,,,,1.0569236198765781,True,l1,none,,,,,,,,,,0.1943809986114502,6,0.8052945505646966,,0.7768180393436716
1416,0.7768732572974201,COMPLETE,True,lr,oof_only,False,,,,,,,,,,0.38907432775840406,True,l1,none,,,,,,,,,,0.12125253677368164,6,0.8053670115684335,,0.7768732572974201
1417,0.7767217670892438,COMPLETE,True,lr,oof_only,False,,,,,,,,,,0.27342040075258606,True,l1,none,,,,,,,,,,0.08556795120239258,6,0.8052925012687243,,0.7767217670892438
1418,0.7768410448175512,COMPLETE,True,lr,oof_only,False,,,,,,,,,,0.7656628961524783,True,l1,none,,,,,,,,,,0.1593914031982422,6,0.8053471491613178,,0.7768410448175512
1419,0.7768784486038106,COMPLETE,True,lr,oof_only,False,,,,,,,,,,0.5410000762589825,True,l1,none,,,,,,,,,,0.14410996437072754,6,0.8053768902259407,,0.7768784486038106
1420,0.7720284332862599,COMPLETE,True,lr,oof_only,True,,,,,,,,,,0.35590690789217144,True,l1,none,,,,,,,,,,0.27245664596557617,6,0.8021629110427944,,0.7720284332862599
1421,0.7768553454661002,COMPLETE,True,lr,oof_only,False,,,,,,,,,,0.4426113894595938,True,l1,none,,,,,,,,,,0.12528586387634277,6,0.8053722661734904,,0.7768553454661002
1422,0.776778626439909,COMPLETE,True,lr,oof_only,False,,,,,,,,,,0.2513270009026878,True,l1,none,,,,,,,,,,0.08497214317321777,6,0.8052709048419399,,0.776778626439909
1423,0.7768511168445272,COMPLETE,True,lr,oof_only,False,,,,,,,,,,0.30406664513959114,True,l1,none,,,,,,,,,,0.09627199172973633,6,0.8053260256489883,,0.7768511168445272
1424,0.7768671465847955,COMPLETE,True,lr,oof_only,False,,,,,,,,,,0.703648286692001,True,l1,none,,,,,,,,,,0.15474629402160645,6,0.8053598653055558,,0.7768671465847955
1425,0.7768879027680382,COMPLETE,True,lr,oof_only,False,,,,,,,,,,0.6143587052992312,True,l1,none,,,,,,,,,,0.14445853233337402,6,0.805364489358006,,0.7768879027680382
1426,0.7761253875534946,COMPLETE,True,lr,oof_only,False,,,,,,,,,,0.1689334510194221,True,l1,none,,,,,,,,,,0.07828760147094727,6,0.8049757536758853,,0.7761253875534946
1427,0.7768598678849378,COMPLETE,True,lr,oof_only,False,,,,,,,,,,0.43762969563271537,True,l1,none,,,,,,,,,,0.12900209426879883,6,0.8053671692065851,,0.7768598678849378
1428,0.7766037449447577,COMPLETE,True,lr,oof_only,False,,,,,,,,,,0.21557252992659867,True,l1,none,,,,,,,,,,0.08041000366210938,6,0.8051995473052651,,0.7766037449447577
1429,0.7768882044134705,COMPLETE,True,lr,oof_only,False,,,,,,,,,,0.3432003302840409,True,l1,none,,,,,,,,,,0.1094355583190918,6,0.8053517732137678,,0.7768882044134705
1430,0.7768864332338604,COMPLETE,True,lr,oof_only,False,,,,,,,,,,0.3210856718044222,True,l1,none,,,,,,,,,,0.10390114784240723,6,0.8053392672537322,,0.7768864332338604
1431,0.7767442778014452,COMPLETE,True,lr,oof_only,False,,,,,,,,,,0.2814977571341789,True,l1,none,,,,,,,,,,0.08642721176147461,6,0.8052955489396575,,0.7767442778014452
1432,0.7768885614224024,COMPLETE,True,lr,oof_only,False,,,,,,,,,,0.34625865487368807,True,l1,none,,,,,,,,,,0.11498284339904785,6,0.805356659996471,,0.7768885614224024
1433,0.7766859375971134,COMPLETE,True,lr,oof_only,False,,,,,,,,,,0.22321601872614474,True,l1,none,,,,,,,,,,0.08597278594970703,6,0.8052274492581181,,0.7766859375971134
1434,0.7768775245723631,COMPLETE,True,lr,oof_only,False,,,,,,,,,,0.3492154411177869,True,l1,none,,,,,,,,,,0.10985279083251953,6,0.8053557141675607,,0.7768775245723631
1435,0.7767220083185243,COMPLETE,True,lr,oof_only,False,,,,,,,,,,0.29372983424633575,True,l2,none,,,,,,,,,,0.04718208312988281,6,0.8051983387461019,,0.7767220083185243
1436,0.7759590515184686,COMPLETE,True,lr,oof_only,False,,,,,,,,,,0.18537959764051676,False,l1,none,,,,,,,,,,0.06538152694702148,6,0.8048599947264783,,0.7759590515184686
1437,0.7768840069010803,COMPLETE,True,lr,oof_only,False,,,,,,,,,,0.3293491971654397,True,l1,none,,,,,,,,,,0.10460352897644043,6,0.8053439963982836,,0.7768840069010803
1438,0.7767666173564712,COMPLETE,True,lr,oof_only,False,,,,,,,,,,0.2483002177716416,True,l1,none,,,,,,,,,,0.08556365966796875,6,0.805270642111687,,0.7767666173564712
1439,0.774992776525683,COMPLETE,True,lr,oof_only,False,,,,,,,,,,0.08854402717424757,True,l1,none,,,,,,,,,,0.059098005294799805,6,0.8041890342067433,,0.774992776525683
1440,0.7726665761874939,COMPLETE,True,lr,oof_only,True,,,,,,,,,,0.4170353632514123,True,l1,none,,,,,,,,,,0.28942203521728516,6,0.8024289516968328,,0.7726665761874939
1441,0.7768733289383712,COMPLETE,True,lr,oof_only,False,,,,,,,,,,0.3511989309529693,True,l1,none,,,,,,,,,,0.11602163314819336,6,0.8053558718057124,,0.7768733289383712
1442,0.7767679179962201,COMPLETE,True,lr,oof_only,False,,,,,,,,,,0.2555570940901464,True,l1,none,,,,,,,,,,0.08447742462158203,6,0.8052755814404406,,0.7767679179962201
1443,0.7768656749260715,COMPLETE,True,lr,oof_only,False,,,,,,,,,,0.40568892112615806,True,l1,none,,,,,,,,,,0.12216353416442871,6,0.8053632282527923,,0.7768656749260715
1444,0.7768531643622875,COMPLETE,True,lr,oof_only,False,,,,,,,,,,0.4817607601385975,True,l1,none,,,,,,,,,,0.12933039665222168,6,0.8053787293377107,,0.7768531643622875
1445,0.7768213601632623,COMPLETE,True,lr,oof_only,False,,,,,,,,,,0.2980065871538088,True,l1,none,,,,,,,,,,0.08852553367614746,6,0.8053217694188922,,0.7768213601632623
1446,0.776602119647109,COMPLETE,True,lr,oof_only,False,,,,,,,,,,0.21560574637564472,True,l1,none,,,,,,,,,,0.08104419708251953,6,0.8051997049434169,,0.776602119647109
1447,0.7761000474337278,COMPLETE,True,lr,oof_only,False,,,,,,,,,,0.16703319718564158,True,l1,none,,,,,,,,,,0.07720422744750977,6,0.804968081952502,,0.7761000474337278
1448,0.7752221123913413,COMPLETE,True,lr,oof+hand,False,,,,,,,,,,0.3507482016701157,True,l1,none,,,,,,,,,,0.39087963104248047,34,0.8041498873990682,,0.7752221123913413
1449,0.7768749409989754,COMPLETE,True,lr,oof_only,False,,,,,,,,,,0.5147564210109773,True,l1,none,,,,,,,,,,0.13718438148498535,6,0.8053762596733337,,0.7768749409989754
1450,0.7767588229188265,COMPLETE,True,lr,oof_only,False,,,,,,,,,,0.26638853268282003,True,l1,none,,,,,,,,,,0.08754253387451172,6,0.8052882975846787,,0.7767588229188265
1451,0.7768515057310765,COMPLETE,True,lr,oof_only,False,,,,,,,,,,0.44237002774572237,True,l1,none,,,,,,,,,,0.12686800956726074,6,0.8053722661734906,,0.7768515057310765
1452,0.7768772342329441,COMPLETE,True,lr,oof_only,False,,,,,,,,,,0.31063739946478264,True,l1,none,,,,,,,,,,0.09891057014465332,6,0.8053311226158937,,0.7768772342329441
1453,0.7714275472451648,COMPLETE,True,lr,all,False,,,,,,,,,,0.20902192505670258,False,l1,none,,,,,,,,,,2.1319823265075684,362,0.7987156273951147,,0.7714275472451648
1454,0.7767487395061589,COMPLETE,True,lr,oof_only,False,,,,,,,,,,0.3866007010008823,True,l2,none,,,,,,,,,,0.11142444610595703,6,0.8052204080873415,,0.7767487395061589
1455,0.7768771980986693,COMPLETE,True,lr,oof_only,False,,,,,,,,,,0.5776960314598991,True,l1,none,,,,,,,,,,0.14363336563110352,6,0.805373422186603,,0.7768771980986693
1456,0.7516356811524254,COMPLETE,True,lr,oof_minus_roberta,False,,,,,,,,,,0.2683641480873024,True,l1,none,,,,,,,,,,0.07716131210327148,5,0.7823568858393964,,0.7516356811524254
1457,0.7756462503189713,COMPLETE,True,lr,oof_only,False,,,,,,,,,,0.13401043447131733,True,l1,none,,,,,,,,,,0.0701146125793457,6,0.8046657319775192,,0.7756462503189713
1458,0.7721072100057382,COMPLETE,True,lr,oof_only,True,,,,,,,,,,0.3573232582348249,True,l1,none,,,,,,,,,,0.264768123626709,6,0.8022511358617022,,0.7721072100057382
1459,0.7768514475162139,COMPLETE,True,lr,oof_only,False,,,,,,,,,,0.4792238310427921,True,l1,none,,,,,,,,,,0.13247418403625488,6,0.8053753138444234,,0.7768514475162139
1460,0.774566682608651,COMPLETE,True,lr,all_minus_ng,False,,,,,,,,,,0.3090033629927688,True,l1,none,,,,,,,,,,0.8222665786743164,131,0.8027474858553914,,0.774566682608651
1461,0.7767290715157855,COMPLETE,True,lr,oof_only,False,,,,,,,,,,0.2343882603856463,True,l1,none,,,,,,,,,,0.08289432525634766,6,0.8052439487179972,,0.7767290715157855
1462,0.7740103228216754,COMPLETE,True,lr,oof+hand+graph,False,,,,,,,,,,0.414515394652618,True,l1,none,,,,,,,,,,0.6307218074798584,49,0.8033809810410697,,0.7740103228216754
1463,0.7768738427986895,COMPLETE,True,lr,oof_only,False,,,,,,,,,,0.5469017616236729,True,l1,none,,,,,,,,,,0.13123011589050293,6,0.8053726339958445,,0.7768738427986895
1464,0.7763347100341562,COMPLETE,True,lr,oof_only,False,,,,,,,,,,0.1858596562143373,True,l1,none,,,,,,,,,,0.07633852958679199,6,0.8050773777376886,,0.7763347100341562
1465,0.7767712196775478,COMPLETE,True,lr,oof_only,False,,,,,,,,,,0.2918703269392262,True,l1,none,,,,,,,,,,0.09311628341674805,6,0.8053078972615416,,0.7767712196775478
1466,0.7768531636351896,COMPLETE,True,lr,oof_only,False,,,,,,,,,,0.39261689268380506,True,l1,none,,,,,,,,,,0.12013959884643555,6,0.8053586567463926,,0.7768531636351896
1467,0.7767246602979547,COMPLETE,True,lr,oof_only,False,,,,,,,,,,0.23487118924552047,True,l1,none,,,,,,,,,,0.08324313163757324,6,0.8052422672443791,,0.7767246602979547
1468,0.7768702075591337,COMPLETE,True,lr,oof_only,False,,,,,,,,,,0.5892800940148579,True,l1,none,,,,,,,,,,0.14001870155334473,6,0.8053695337788608,,0.7768702075591337
1469,0.7768924985187745,COMPLETE,True,lr,oof_only,False,,,,,,,,,,0.31924525418904326,True,l1,none,,,,,,,,,,0.10143709182739258,6,0.8053378485103668,,0.7768924985187745
1470,0.7762316585784114,COMPLETE,True,lr,oof_only,False,,,,,,,,,,0.17909273511122392,True,l1,none,,,,,,,,,,0.07794070243835449,6,0.8050394394891767,,0.7762316585784114
1471,0.7702294713095833,COMPLETE,True,lr,oof+ng,False,,,,,,,,,,0.30905262262562244,True,l1,none,,,,,,,,,,12.14081621170044,237,0.7989017455062355,,0.7702294713095833
1472,0.7764113142059876,COMPLETE,True,lr,oof_only,False,,,,,,,,,,0.24361067388498156,False,l1,none,,,,,,,,,,0.07139825820922852,6,0.8051493658269702,,0.7764113142059876
1473,0.7767781305231725,COMPLETE,True,lr,oof_only,False,,,,,,,,,,16.74874585831062,True,l1,none,,,,,,,,,,1.5585615634918213,6,0.8051891957333028,,0.7767781305231725
1474,0.7767401464894672,COMPLETE,True,lr,oof_only,False,,,,,,,,,,0.35805488426191084,True,l2,none,,,,,,,,,,0.050125837326049805,6,0.8052088479562162,,0.7767401464894672
1475,0.7767616260358894,COMPLETE,True,lr,oof_only,False,,,,,,,,,,0.2881502967103516,True,l1,none,,,,,,,,,,0.09193229675292969,6,0.8053045343143052,,0.7767616260358894
1476,0.7759733767888722,COMPLETE,True,lr,oof_only,False,,,,,,,,,,0.155173952128443,True,l1,none,,,,,,,,,,0.07443022727966309,6,0.8048746550745876,,0.7759733767888722
1477,0.7765668897986658,COMPLETE,True,lr,oof_only,False,,,,,,,,,,0.21161223175360402,True,l1,none,,,,,,,,,,0.07987046241760254,6,0.8051898262859096,,0.7765668897986658
1478,0.7711016680700119,COMPLETE,True,lr,oof+hand,True,,,,,,,,,,0.38719263312685837,True,l1,none,,,,,,,,,,1.0466115474700928,34,0.8010637002109093,,0.7711016680700119
1479,0.7750309219996498,COMPLETE,True,lr,oof+ph,False,,,,,,,,,,0.10729868572638415,True,l1,none,,,,,,,,,,0.33861279487609863,42,0.8043052660706054,,0.7750309219996498
1480,0.776865856754813,COMPLETE,True,lr,oof_only,False,,,,,,,,,,0.45188899659256315,True,l1,none,,,,,,,,,,0.12947463989257812,6,0.8053720559892881,,0.776865856754813
1481,0.7768896628996655,COMPLETE,True,lr,oof_only,False,,,,,,,,,,0.32065126430707086,True,l1,none,,,,,,,,,,0.10441398620605469,6,0.8053395825300356,,0.7768896628996655
1482,0.7712279311599755,COMPLETE,True,lr,all,False,,,,,,,,,,0.26078993494560687,True,l1,none,,,,,,,,,,1.5052893161773682,362,0.7984449101425752,,0.7712279311599755
1483,0.776872212497185,COMPLETE,True,lr,oof_only,False,,,,,,,,,,0.35070982456679295,True,l1,none,,,,,,,,,,0.11269807815551758,6,0.8053582363779881,,0.776872212497185
1484,0.7768605398889689,COMPLETE,True,lr,oof_only,False,,,,,,,,,,0.45808018592551397,True,l1,none,,,,,,,,,,0.12848758697509766,6,0.8053693235946584,,0.7768605398889689
1485,0.7765620876547058,COMPLETE,True,lr,oof_only,False,,,,,,,,,,0.20851256651336708,True,l1,none,,,,,,,,,,0.08125877380371094,6,0.8051849920492571,,0.7765620876547058
1486,0.7516014224207178,COMPLETE,True,lr,oof_minus_roberta,False,,,,,,,,,,0.25984734289459205,True,l1,none,,,,,,,,,,0.07812356948852539,5,0.7823267244063687,,0.7516014224207178
1487,0.7768771773862583,COMPLETE,True,lr,oof_only,False,,,,,,,,,,0.3239422310929178,True,l1,none,,,,,,,,,,0.09816479682922363,6,0.8053371654117093,,0.7768771773862583
1488,0.7768511549878774,COMPLETE,True,lr,oof_only,False,,,,,,,,,,0.42510240641406843,True,l1,none,,,,,,,,,,0.12522554397583008,6,0.8053637537132979,,0.7768511549878774
1489,0.7768611115250301,COMPLETE,True,lr,oof_only,False,,,,,,,,,,0.5196646618714355,True,l1,none,,,,,,,,,,0.13271117210388184,6,0.8053757867588787,,0.7768611115250301
1490,0.7768847527635302,COMPLETE,True,lr,oof_only,False,,,,,,,,,,0.31500697134221256,True,l1,none,,,,,,,,,,0.09875035285949707,6,0.8053346432012819,,0.7768847527635302
1491,0.7759210660976761,COMPLETE,True,lr,oof_only,False,,,,,,,,,,0.15159258880677487,True,l1,none,,,,,,,,,,0.07421231269836426,6,0.8048485396874541,,0.7759210660976761
1492,0.6518948593925284,COMPLETE,True,lr,all_minus_ng,False,,,,,,,,,,0.24678042177539164,False,l2,none,,,,,,,,,,116.7066764831543,131,0.6736910752529855,,0.6518948593925284
1493,0.7740339976239019,COMPLETE,True,lr,oof+hand+graph,False,,,,,,,,,,0.3866990615121266,True,l1,none,,,,,,,,,,0.6366395950317383,49,0.8033714702059164,,0.7740339976239019
1494,0.7765384685357353,COMPLETE,True,lr,oof_only,False,,,,,,,,,,0.20499173939506862,True,l1,none,,,,,,,,,,0.07711267471313477,6,0.8051680722209735,,0.7765384685357353
1495,0.776872055500374,COMPLETE,True,lr,oof_only,False,,,,,,,,,,0.5378631594958512,True,l1,none,,,,,,,,,,0.1334702968597412,6,0.8053738425550075,,0.776872055500374
1496,0.7747443740695702,COMPLETE,True,lr,oof_only,False,,,,,,,,,,0.06321157917780092,True,l1,none,,,,,,,,,,0.053603410720825195,6,0.8037332497640945,,0.7747443740695702
1497,0.7729756662710766,COMPLETE,True,lr,oof_only,True,,,,,,,,,,0.8188427918063943,True,l1,none,,,,,,,,,,0.397197961807251,6,0.8027019809755973,,0.7729756662710766
1498,0.7768523517385023,COMPLETE,True,lr,oof_only,False,,,,,,,,,,0.3046239853360383,True,l1,none,,,,,,,,,,0.09202313423156738,6,0.8053254476424322,,0.7768523517385023
1499,0.7693633648003864,COMPLETE,True,lr,oof+ng,False,,,,,,,,,,0.4258154836679236,True,l1,none,,,,,,,,,,16.748300313949585,237,0.797899377045552,,0.7693633648003864
1500,0.7767678043757258,COMPLETE,True,lr,oof_only,False,,,,,,,,,,0.25747896256283426,True,l1,none,,,,,,,,,,0.08302903175354004,6,0.8052807309533966,,0.7767678043757258
1501,0.7768692844436307,COMPLETE,True,lr,oof_only,False,,,,,,,,,,0.6465833590984197,True,l1,none,,,,,,,,,,0.14864754676818848,6,0.805364489358006,,0.7768692844436307
1502,0.7771574094595421,COMPLETE,True,lr,oof_only,False,,,,,,,,,,0.32598703715089417,True,l1,robust,,,,,,,,,,0.052768707275390625,6,0.8054570754991113,,0.7771574094595421
