number,value,state,params_add_group_dummies,params_family,params_feature_subset,params_isotonic,params_lgbm_alpha,params_lgbm_colsample,params_lgbm_lambda,params_lgbm_lr,params_lgbm_max_depth,params_lgbm_min_child,params_lgbm_n_estimators,params_lgbm_num_leaves,params_lgbm_subsample,params_lr_C,params_lr_class_weight_balanced,params_lr_penalty,params_scaler,params_xgb_alpha,params_xgb_colsample,params_xgb_gamma,params_xgb_lambda,params_xgb_lr,params_xgb_max_depth,params_xgb_min_child,params_xgb_n_estimators,params_xgb_subsample,user_attrs_elapsed_sec,user_attrs_n_features,user_attrs_pooled_auroc,user_attrs_pruned_reason,user_attrs_weighted_auroc
0,0.7496607522880467,COMPLETE,True,xgb,oof_minus_roberta,False,,,,,,,,,,,,,standard,0.006290644294586149,0.5564532903055841,2.571172192068058,1.382623217936987,0.0022158645374549917,7.0,5.0,304.0,0.6460723242676091,1.8174962997436523,5,0.780089523757278,,0.7496607522880467
1,0.7375432045042061,COMPLETE,False,lgbm,oof+ph,False,4.869640941520899,0.9576492590949324,0.24637685958997463,0.25221951700214285,6.0,90.0,464.0,59.0,0.8875664116805573,,,,robust,,,,,,,,,,1.6925773620605469,42,0.7672211536107072,,0.7375432045042061
2,0.771552368179123,COMPLETE,False,xgb,oof+ph,False,,,,,,,,,,,,,robust,0.021066486017042207,0.3811083416675908,0.3177917514301182,0.3113095956122124,0.00152551885793314,9.0,9.0,611.0,0.6792328642721364,4.08034086227417,42,0.7981530693777066,,0.771552368179123
3,0.7666836777386477,COMPLETE,False,lgbm,oof+hand,False,0.00441453687649448,0.4601587158441357,0.014421346497969485,0.01038886879004847,11.0,12.0,456.0,75.0,0.8777755692715243,,,,standard,,,,,,,,,,4.012538433074951,34,0.7959709369896136,,0.7666836777386477
4,0.7662498264073919,COMPLETE,False,lr,all,False,,,,,,,,,,0.012898495377182663,False,l1,none,,,,,,,,,,0.7550206184387207,362,0.7875558971749457,,0.7662498264073919
5,0.7628322567818335,COMPLETE,False,xgb,oof_only,True,,,,,,,,,,,,,none,0.3420730367009226,0.8097514440283016,2.6788734203737925,0.3382387201936217,0.07702365744928269,8.0,4.0,269.0,0.6188187719961998,1.175415277481079,6,0.791812547639563,,0.7628322567818335
6,0.7688590949782933,COMPLETE,True,xgb,oof+ph,True,,,,,,,,,,,,,none,0.002357279455676982,0.6886405681196236,4.486078789766633,0.009277034327414719,0.04313804987283086,5.0,6.0,715.0,0.9086111001006079,3.183211326599121,42,0.8001757770483686,,0.7688590949782933
7,0.7459288611023306,COMPLETE,False,lr,oof_minus_roberta,True,,,,,,,,,,2.8805537835688413,False,l2,standard,,,,,,,,,,0.2754371166229248,5,0.772505131910029,,0.7459288611023306
8,0.7732734644759357,COMPLETE,True,xgb,all_minus_ng,False,,,,,,,,,,,,,standard,4.565176372646331,0.42397747558493426,1.8507935012772219,6.542056762893131,0.0011487713537358833,5.0,10.0,606.0,0.822736147953584,3.850184917449951,131,0.7994467005967024,,0.7732734644759357
9,0.771415060859971,COMPLETE,True,xgb,oof_only,False,,,,,,,,,,,,,standard,1.7276056747028232,0.7917388587909764,4.050566973395904,0.014940577239079744,0.06838702131186529,10.0,4.0,463.0,0.848507870497634,0.3654637336730957,6,0.8025425562581663,,0.771415060859971
10,0.7660873295144754,COMPLETE,True,lr,all_minus_ng,True,,,,,,,,,,34.540130684562214,True,l2,standard,,,,,,,,,,265.09578561782837,131,0.7950306254146539,,0.7660873295144754
11,0.7711182718784898,COMPLETE,True,xgb,all_minus_ng,False,,,,,,,,,,,,,robust,0.050072666570984393,0.3060179240021019,0.13184042202903745,6.95292469279077,0.0010668930019016151,3.0,10.0,636.0,0.7542509361376658,2.6146368980407715,131,0.7960097159749345,,0.7711182718784898
12,0.7739556202153538,COMPLETE,False,xgb,oof+timing,False,,,,,,,,,,,,,robust,9.5744401197653,0.3753062769998461,0.13165749329116275,9.312556702774527,0.0059393249894608615,5.0,10.0,552.0,0.7581049501878238,1.855440616607666,52,0.800365363198827,,0.7739556202153538
13,0.7739261436299991,COMPLETE,True,xgb,oof+timing,False,,,,,,,,,,,,,robust,6.209353418870909,0.48470614185337857,1.433542825520988,7.5349332296701474,0.007916519283061927,5.0,8.0,481.0,0.7692148346315127,1.6772944927215576,52,0.8035146581937211,,0.7739261436299991
14,0.7731531133604285,COMPLETE,False,xgb,oof+timing,False,,,,,,,,,,,,,robust,6.110985891974205,0.5481855643599386,1.2747500206281297,9.384660332547663,0.008958637848337102,5.0,7.0,448.0,0.5157413738318061,1.4648222923278809,52,0.8015664082767175,,0.7731531133604285
15,0.7675048061290588,COMPLETE,True,lgbm,oof+timing,False,7.282449103372351,0.82824448783755,4.980132424705428,0.001202979202900109,-1.0,5.0,157.0,254.0,0.5334831945668878,,,,robust,,,,,,,,,,1.6471829414367676,52,0.7946876047965297,,0.7675048061290588
16,0.7754816170073046,COMPLETE,False,xgb,oof+timing,False,,,,,,,,,,,,,robust,0.4609338851965146,0.48917481306638283,1.250055140364301,0.0014908308932316486,0.008791634528464268,3.0,8.0,439.0,0.9919074133253796,0.8866934776306152,52,0.8032747854728667,,0.7754816170073046
17,0.7740752694410811,COMPLETE,False,xgb,oof+ng,False,,,,,,,,,,,,,robust,0.5205577940254907,0.6291955611546597,0.8022977698297354,0.0010052057882164599,0.005484332300262382,3.0,8.0,108.0,0.9848142116345383,0.6728348731994629,237,0.8004484910508297,,0.7740752694410811
18,0.773262001279528,COMPLETE,False,lr,oof+ng,True,,,,,,,,,,0.007665738318759278,True,l1,robust,,,,,,,,,,0.26578497886657715,237,0.7934428939506148,,0.773262001279528
19,0.724566178228687,COMPLETE,False,lgbm,oof+ng,False,0.001039990192249746,0.31007574420529366,0.0012345181757780562,0.2920129465212997,-1.0,65.0,794.0,209.0,0.5770081878728344,,,,robust,,,,,,,,,,8.328993320465088,237,0.7497144384881744,,0.724566178228687
20,0.7566541846101988,COMPLETE,False,xgb,oof+hand+graph,False,,,,,,,,,,,,,robust,0.4854552302639351,0.9524853804806545,1.0022777884233156,0.001330530240614794,0.272994364830057,3.0,1.0,119.0,0.9926099914210286,0.3052639961242676,49,0.7876018749691949,,0.7566541846101988
21,0.7741674865931282,COMPLETE,False,xgb,oof+timing,False,,,,,,,,,,,,,robust,0.5418412041937138,0.6457077570723372,0.6285736140940118,0.0010588183288713453,0.0043805756032920225,3.0,8.0,103.0,0.985990506226191,0.3024101257324219,52,0.8002041519156766,,0.7741674865931282
22,0.773507580741558,COMPLETE,False,xgb,oof+ng,False,,,,,,,,,,,,,robust,0.3579272387665052,0.6645408858363662,0.8370124738889466,0.001074816312838854,0.0039133523627625545,3.0,8.0,104.0,0.9976392098254232,0.6647434234619141,237,0.7995375001720884,,0.773507580741558
23,0.7730773176223923,COMPLETE,False,xgb,oof+timing,False,,,,,,,,,,,,,robust,0.9280305207115997,0.588947900388161,2.0709025673897123,0.004018340485025782,0.018710968882144168,4.0,7.0,228.0,0.9269058490618016,0.6919362545013428,52,0.8019782116750389,,0.7730773176223923
24,0.7734581047474247,COMPLETE,False,xgb,all,False,,,,,,,,,,,,,robust,0.1288057394208636,0.7470565580006044,0.6812573630141837,0.0038471226558671537,0.015753804765153992,4.0,8.0,191.0,0.9305697112473028,2.508136749267578,362,0.801818524227355,,0.7734581047474247
25,0.7727192314490382,COMPLETE,False,xgb,oof+hand+graph,False,,,,,,,,,,,,,none,0.12283909955243763,0.6250528805637612,1.6437543789256017,0.020349351466474187,0.0036190121364664805,4.0,7.0,363.0,0.9999303990469145,1.009509563446045,49,0.8006850008244475,,0.7727192314490382
26,0.7703685421832296,COMPLETE,False,xgb,oof+hand,True,,,,,,,,,,,,,robust,1.6594223051998191,0.4967231285420876,0.6543322754295678,0.0028248647883887903,0.018284200430380433,3.0,9.0,796.0,0.8802860626563408,4.565976619720459,34,0.7997875142807029,,0.7703685421832296
27,0.7721008852782931,COMPLETE,False,xgb,oof+ng,False,,,,,,,,,,,,,robust,0.18854234804276523,0.7217402184733612,3.6623788227337997,0.047848648514186416,0.0029037663576576955,6.0,6.0,168.0,0.9451909649449304,2.003439426422119,237,0.8001948512647257,,0.7721008852782931
28,0.7707372368035018,COMPLETE,False,lgbm,oof+timing,False,0.10949721143214121,0.6516115610243013,8.966166158884114,0.022671478119312635,12.0,44.0,104.0,149.0,0.7248135484492502,,,,robust,,,,,,,,,,0.836984395980835,52,0.7993343571405827,,0.7707372368035018
29,0.751905309296022,COMPLETE,False,lr,oof_minus_roberta,False,,,,,,,,,,0.2234517144308134,False,l2,none,,,,,,,,,,0.16925430297851562,5,0.7768585196537467,,0.751905309296022
30,0.7730694972853092,COMPLETE,False,xgb,oof+timing,False,,,,,,,,,,,,,robust,0.038638811992676256,0.8823913105709237,3.2141193240538852,0.0010099567313387365,0.01054875357517102,4.0,9.0,338.0,0.9562215438166309,1.1228697299957275,52,0.8019731147081336,,0.7730694972853092
31,0.7749252728001796,COMPLETE,False,xgb,oof+timing,False,,,,,,,,,,,,,robust,1.1821192582595321,0.3815365527572498,0.04299472839647153,0.0026992451917652377,0.00553654413667159,3.0,10.0,563.0,0.8301475622417681,1.147883415222168,52,0.801850577318203,,0.7749252728001796
32,0.7751001897467121,COMPLETE,False,xgb,oof+timing,False,,,,,,,,,,,,,robust,0.9667960275515548,0.4616120055430424,0.5292141893411852,0.002057673644909154,0.004202078389442374,3.0,8.0,394.0,0.8715821027160371,0.8623528480529785,52,0.8016710274634034,,0.7751001897467121
33,0.7748350701741846,COMPLETE,False,xgb,oof+timing,False,,,,,,,,,,,,,robust,2.3892674149417306,0.46078720064851014,0.13657550585581313,0.0029054402215722788,0.004576205348580496,3.0,9.0,393.0,0.8279151321311816,0.8649556636810303,52,0.8012575951375146,,0.7748350701741846
34,0.7739453901171918,COMPLETE,False,xgb,oof+timing,False,,,,,,,,,,,,,robust,2.3354757290393175,0.45607556216118844,0.015921438910755883,0.006764980638490032,0.001986883849832724,4.0,9.0,402.0,0.8300596637728488,1.162149429321289,52,0.8001365251485923,,0.7739453901171918
35,0.7726150857778225,COMPLETE,False,lgbm,oof+timing,False,0.15794287893343129,0.5885131323895855,0.27278010120619384,0.0010605876046185948,5.0,99.0,797.0,24.0,0.9859259258592981,,,,robust,,,,,,,,,,3.306145429611206,52,0.8008364385421918,,0.7726150857778225
36,0.7740243059518314,COMPLETE,False,xgb,oof+timing,False,,,,,,,,,,,,,robust,1.1396692480318633,0.3368803334453341,1.1701495939604407,0.0025488454915419414,0.012779716803225883,3.0,10.0,525.0,0.7994591027543189,0.9820108413696289,52,0.802623582268146,,0.7740243059518314
37,0.7665019213970826,COMPLETE,False,xgb,oof+ph,False,,,,,,,,,,,,,none,2.0266308555908945,0.4277655055578315,0.485522120910862,0.006413862335402416,0.02710258570177019,4.0,9.0,404.0,0.8768405652840092,0.9929313659667969,42,0.7964423801553324,,0.7665019213970826
38,0.770760480795439,COMPLETE,False,xgb,oof+hand,True,,,,,,,,,,,,,robust,3.1471274492014585,0.5057869387298272,0.3611486351947195,0.028828894756239638,0.007461361466622611,6.0,10.0,531.0,0.7110336992532487,6.517602205276489,34,0.8000652727040187,,0.770760480795439
39,0.7730522598637841,COMPLETE,False,lr,all,False,,,,,,,,,,0.0011905470536637114,True,l1,standard,,,,,,,,,,0.26932501792907715,362,0.7949076151102684,,0.7730522598637841
40,0.7726018061863346,COMPLETE,False,xgb,oof_only,False,,,,,,,,,,,,,robust,0.920706963257133,0.3817111467914659,0.006320258623182862,0.00225210365485122,0.003152142147798173,3.0,7.0,412.0,0.8670685710635342,0.4393901824951172,6,0.7980407784676373,,0.7726018061863346
41,0.7755727568671386,COMPLETE,False,xgb,oof+timing,False,,,,,,,,,,,,,robust,0.6131066846682133,0.5356399036121402,0.558611402984885,0.002205911963413058,0.005244363731631051,3.0,8.0,341.0,0.8984334855170483,0.7622842788696289,52,0.8023052582937897,,0.7755727568671386
42,0.7738211140398973,COMPLETE,False,xgb,oof+timing,False,,,,,,,,,,,,,robust,0.23182793991813458,0.5322407671771885,0.4193976899000457,0.00199221129598506,0.006033730369021021,4.0,9.0,348.0,0.8051458472301667,1.0755903720855713,52,0.8017727566173081,,0.7738211140398973
43,0.7751640681791012,COMPLETE,False,xgb,oof+timing,False,,,,,,,,,,,,,robust,0.8999669426223559,0.5722301975053397,1.063866230772473,0.004764395133003393,0.002411226734187642,3.0,8.0,293.0,0.9012657782847537,0.6686034202575684,52,0.8014477067484789,,0.7751640681791012
44,0.7438093091918804,COMPLETE,False,xgb,oof_minus_roberta,True,,,,,,,,,,,,,standard,0.821531179018353,0.5497685145645455,1.009117699946306,0.009640589601974212,0.002447845597632751,3.0,6.0,285.0,0.8880107263830581,1.1663174629211426,5,0.770471021746393,,0.7438093091918804
45,0.7725744269224768,COMPLETE,True,xgb,oof+timing,False,,,,,,,,,,,,,robust,0.2504330629927088,0.6005353024009855,2.3844617976741302,0.005105746552317125,0.0019376731892361836,7.0,7.0,305.0,0.8947344157636146,2.0564072132110596,52,0.8019249299797603,,0.7725744269224768
46,0.7698416784760745,COMPLETE,False,xgb,oof+ph,False,,,,,,,,,,,,,none,0.7137789778693769,0.4207223251972521,1.5398538361483478,0.322011644725322,0.0015348251972681678,8.0,5.0,326.0,0.9501557382649514,2.2939982414245605,42,0.7959606379637019,,0.7698416784760745
47,0.7706015869370383,COMPLETE,False,lgbm,oof+timing,False,0.6917358650932378,0.7743606466860529,0.0018058139795640172,0.0343643298018019,4.0,40.0,289.0,130.0,0.6912224091790039,,,,robust,,,,,,,,,,0.7309002876281738,52,0.7999429454982905,,0.7706015869370383
48,,PRUNED,True,lr,all_minus_ng,False,,,,,,,,,,88.45011500155012,True,l1,standard,,,,,,,,,,810.7537128925323,131,,trial_timeout,
49,0.771696928905005,COMPLETE,False,xgb,oof_only,True,,,,,,,,,,,,,robust,0.006515821552162405,0.5828096028083979,0.919870882369084,0.10157793758845235,0.0024214127943900468,4.0,8.0,490.0,0.8556787759295886,2.6641640663146973,6,0.7989497200504064,,0.771696928905005
50,0.7752949600776261,COMPLETE,False,xgb,oof+timing,False,,,,,,,,,,,,,robust,1.1441296533463052,0.5178997303150403,1.3045777994229402,0.0017690844449462,0.011201785216669535,3.0,1.0,249.0,0.9191958140208206,0.6326587200164795,52,0.8025518043630668,,0.7752949600776261
51,0.7751344407849338,COMPLETE,False,xgb,oof+timing,False,,,,,,,,,,,,,robust,1.2247342967154868,0.5362423697116159,1.2489933863701026,0.0017363876040135235,0.011134654662342086,3.0,1.0,239.0,0.9114173193059848,0.5978355407714844,52,0.8023890692444497,,0.7751344407849338
52,0.77520134524237,COMPLETE,False,xgb,oof+timing,False,,,,,,,,,,,,,robust,1.4025894529545697,0.5336893529870387,1.890925881759173,0.0017014058257198907,0.012033262347720597,3.0,1.0,252.0,0.9084062073243856,0.6292285919189453,52,0.8025595286325005,,0.77520134524237
53,0.7727261091785171,COMPLETE,False,xgb,oof+timing,False,,,,,,,,,,,,,robust,3.894534465116353,0.5232374829286089,1.9009261803077517,1.1599609144036018,0.025182450409669713,4.0,1.0,234.0,0.9048579164804169,0.7241702079772949,52,0.8019883005167483,,0.7727261091785171
54,0.7755515400158643,COMPLETE,False,xgb,oof+timing,False,,,,,,,,,,,,,robust,0.360747601186509,0.5709843015038085,1.321226244183396,0.0017380466719282104,0.011680432746551667,3.0,2.0,253.0,0.9135830472394505,0.6262555122375488,52,0.802754999940623,,0.7755515400158643
55,0.7679696628467233,COMPLETE,True,xgb,oof+hand+graph,False,,,,,,,,,,,,,robust,0.3849083081511764,0.5821426332411869,2.1902770947139194,0.008576855777598305,0.01413869462462937,10.0,2.0,263.0,0.9673661975062485,2.649073362350464,49,0.7988965959932796,,0.7679696628467233
56,0.770026492473008,COMPLETE,False,xgb,oof+timing,False,,,,,,,,,,,,,robust,0.2943101264746698,0.5721436497790325,1.714543880521889,0.001685755070314505,0.008079299177583047,9.0,2.0,193.0,0.9227685434596185,2.371171474456787,52,0.7986225157935037,,0.770026492473008
57,0.7714193687602223,COMPLETE,False,xgb,oof+timing,False,,,,,,,,,,,,,robust,0.07417745454487128,0.48709481112717035,2.6648952829446317,0.0038217285063922865,0.03535427311276952,3.0,2.0,288.0,0.5828257258665432,0.6645147800445557,52,0.8007740663801646,,0.7714193687602223
58,0.7690784121699425,COMPLETE,False,lgbm,all,False,0.010997290882651934,0.3402867912732558,0.03921325508318129,0.005769566752730085,8.0,70.0,632.0,157.0,0.6183429010982501,,,,standard,,,,,,,,,,8.000874042510986,362,0.7977944425825627,,0.7690784121699425
59,0.7706852397252365,COMPLETE,False,lr,oof+hand,True,,,,,,,,,,1.0720268683027572,False,l2,robust,,,,,,,,,,1.0467686653137207,34,0.7972852188064837,,0.7706852397252365
60,0.7718727250471574,COMPLETE,True,xgb,all_minus_ng,False,,,,,,,,,,,,,none,0.6591355192742097,0.6134768844203352,1.3843429803812342,0.01374433338929022,0.02317367594897532,4.0,2.0,258.0,0.9385557237086984,1.612396478652954,131,0.8028245709115784,,0.7718727250471574
61,0.7750238053202,COMPLETE,False,xgb,oof+timing,False,,,,,,,,,,,,,robust,1.4716838480387417,0.5408182739612561,1.1443494740247862,0.001610668056358493,0.010464778062969627,3.0,1.0,230.0,0.9089743817649859,0.5721056461334229,52,0.8023336857071485,,0.7750238053202
62,0.7758129951615627,COMPLETE,False,xgb,oof+timing,False,,,,,,,,,,,,,robust,0.4943608611057678,0.5169546156684026,1.3067994545466608,0.001540599340881105,0.011500419014834003,3.0,3.0,172.0,0.9685604209956753,0.44219207763671875,52,0.8026502231157854,,0.7758129951615627
63,0.7756364787943467,COMPLETE,False,xgb,oof+timing,False,,,,,,,,,,,,,robust,0.4631220049290253,0.5093361368385747,1.474542944463645,0.0016817909062147695,0.007241734453478102,3.0,4.0,160.0,0.9680155588416719,0.42504358291625977,52,0.8020806239276007,,0.7756364787943467
64,0.7756923286226088,COMPLETE,False,xgb,oof+timing,False,,,,,,,,,,,,,robust,0.4272180982789134,0.5141698719650583,1.8801333409175855,0.0015454666496180819,0.006962653515104181,3.0,3.0,171.0,0.9731938316214699,0.45438075065612793,52,0.8021323292413621,,0.7756923286226088
65,0.7736410642938222,COMPLETE,False,xgb,oof+timing,False,,,,,,,,,,,,,robust,0.5023543176681412,0.505163634214458,1.465754629309602,0.00127859760327938,0.006989675797528671,5.0,3.0,157.0,0.9704308274790284,0.717980146408081,52,0.8011876563442053,,0.7736410642938222
66,0.7474942971765147,COMPLETE,False,xgb,oof_minus_roberta,False,,,,,,,,,,,,,robust,0.17079684458555733,0.43709304114701836,2.136890312077988,0.003301906646311613,0.008367730847774377,3.0,3.0,153.0,0.9609049717087824,0.21825718879699707,5,0.77343635301824,,0.7474942971765147
67,0.77362508367434,COMPLETE,False,xgb,oof+timing,False,,,,,,,,,,,,,robust,0.3861643248631747,0.48086114085278797,1.7100181855172307,0.0012969681983139392,0.009513149889371767,4.0,3.0,184.0,0.9725374273453228,0.6341989040374756,52,0.8011666379239769,,0.77362508367434
68,0.7756533413929998,COMPLETE,False,xgb,oof+timing,False,,,,,,,,,,,,,robust,0.08536417111718683,0.651673239854515,1.3523858551527406,0.002400558157801463,0.015865705974354653,3.0,4.0,135.0,0.9358763002041326,0.3823676109313965,52,0.8027989284388999,,0.7756533413929998
69,0.7734708057657865,COMPLETE,False,xgb,oof+hand+graph,False,,,,,,,,,,,,,robust,0.08538933092897881,0.6538450218629679,1.5454586720615922,2.5659498718032876,0.017338142254955082,4.0,4.0,137.0,0.9855020756501447,0.485532283782959,49,0.8016052398080892,,0.7734708057657865
70,0.775379288560706,COMPLETE,False,xgb,oof+ph,False,,,,,,,,,,,,,robust,0.02708333496818024,0.6777551585482563,0.8491929748968174,0.005231055441317739,0.00660192933804405,3.0,4.0,204.0,0.9450058239839579,0.500774621963501,42,0.8021312783203508,,0.775379288560706
71,0.7752898037930632,COMPLETE,False,xgb,oof+ph,False,,,,,,,,,,,,,robust,0.02036959883934514,0.7146116373870345,0.8257907537065352,0.0032871403528455657,0.006559896685284206,3.0,4.0,207.0,0.9492906396445773,0.49654221534729004,42,0.8021235015048663,,0.7752898037930632
72,0.7752969289852334,COMPLETE,False,xgb,oof+timing,False,,,,,,,,,,,,,robust,0.01614514008921384,0.6723235362073268,1.3105050439629793,0.005137660709532394,0.014991994294306503,3.0,5.0,134.0,0.9770660880744936,0.3865354061126709,52,0.8025647832375576,,0.7752969289852334
73,0.7754096849299502,COMPLETE,False,xgb,oof+ph,False,,,,,,,,,,,,,robust,0.039123872938015225,0.6917805663822378,0.7729244820523838,0.002443998270204383,0.00499975051826055,3.0,3.0,218.0,0.9334220880815025,0.5413107872009277,42,0.8020631786388114,,0.7754096849299502
74,0.7744314375049981,COMPLETE,False,xgb,oof+ph,False,,,,,,,,,,,,,robust,0.049218682844959956,0.7748375595374624,1.064244976816891,0.002498036746353185,0.004733687150588625,3.0,3.0,170.0,0.9973084788561706,0.4354870319366455,42,0.8012616411834086,,0.7744314375049981
75,0.7738568344883383,COMPLETE,False,xgb,oof_only,False,,,,,,,,,,,,,robust,0.146892965000007,0.6436974493575108,4.925524933848109,0.0010270125354425042,0.005315722949000412,4.0,3.0,139.0,0.9376915840679239,0.24041271209716797,6,0.8003574812912414,,0.7738568344883383
76,0.7670537421846149,COMPLETE,False,lgbm,oof+ph,False,0.022026683775528223,0.9815666919882242,1.077470688799035,0.08571374116014081,2.0,25.0,332.0,102.0,0.8228040519214526,,,,robust,,,,,,,,,,0.3924596309661865,42,0.796425775603352,,0.7670537421846149
77,0.7709771405928404,COMPLETE,False,lr,oof+ng,True,,,,,,,,,,0.09488568967525067,False,l1,none,,,,,,,,,,3.6696507930755615,237,0.7924150406554047,,0.7709771405928404
78,0.7554541481690419,COMPLETE,False,xgb,oof+timing,False,,,,,,,,,,,,,robust,0.09809591707689932,0.7100425511675651,0.7042224718992541,0.0014303756945292572,0.21119893256237435,3.0,4.0,218.0,0.9618880884139347,0.5637490749359131,52,0.7849666379870323,,0.7554541481690419
79,0.7748401254036755,COMPLETE,True,xgb,oof+timing,False,,,,,,,,,,,,,robust,0.19662805245379025,0.5582999320265869,1.7508391766216764,0.0031337905244159235,0.003578602599720992,3.0,3.0,101.0,0.9343708358314265,0.30047106742858887,52,0.801903438645077,,0.7748401254036755
80,0.7721696270590082,COMPLETE,False,xgb,oof+hand,False,,,,,,,,,,,,,standard,0.06907807855863554,0.6185602140336475,2.015909633778235,0.21196557103377428,0.021038170847751503,5.0,5.0,169.0,0.9840803995951949,0.5389304161071777,34,0.8010529282705423,,0.7721696270590082
